"date","location","attendance","inning","inning_top_bot","score","batting","fielding","description"
"03/01/2019","Conway, S.C.",NA,"1","top","0-0","Illinois","Coastal Carolina","Troike struck out swinging (3-2 KFBBBS)."
"03/01/2019","Conway, S.C.",NA,"1","top","0-0","Illinois","Coastal Carolina","Comia struck out swinging (1-2 SBSS)."
"03/01/2019","Conway, S.C.",NA,"1","top","0-0","Illinois","Coastal Carolina","Massey lined out to cf (1-0 B)."
"03/01/2019","Conway, S.C.",NA,"1","bot","0-0","Coastal Carolina","Illinois","Wood, C. doubled down the lf line (1-1 BK)."
"03/01/2019","Conway, S.C.",NA,"1","bot","0-0","Coastal Carolina","Illinois","Wood, C. advanced to third on a passed ball."
"03/01/2019","Conway, S.C.",NA,"1","bot","0-1","Coastal Carolina","Illinois","Pearcey, C. flied out to lf, SF, RBI (1-2 SBF) Wood, C. scored, unearned."
"03/01/2019","Conway, S.C.",NA,"1","bot","0-1","Coastal Carolina","Illinois","Biermann, Z. out at first 2b to p (2-2 KSFFBFB)."
"03/01/2019","Conway, S.C.",NA,"1","bot","0-1","Coastal Carolina","Illinois","Skeels, K. grounded out to ss (0-0)."
"03/01/2019","Conway, S.C.",NA,"2","top","1-1","Illinois","Coastal Carolina","Taylor homered to left field, RBI (1-0 B)."
"03/01/2019","Conway, S.C.",NA,"2","top","1-1","Illinois","Coastal Carolina","Yalowitz grounded out to 2b (2-0 BB)."
"03/01/2019","Conway, S.C.",NA,"2","top","1-1","Illinois","Coastal Carolina","McDonald struck out swinging (3-2 BFBSBFFFS)."
"03/01/2019","Conway, S.C.",NA,"2","top","1-1","Illinois","Coastal Carolina","Korte grounded out to 1b unassisted (2-1 BBS)."
"03/01/2019","Conway, S.C.",NA,"2","bot","1-1","Coastal Carolina","Illinois","Chavers, P. popped up to 2b (2-1 BBF)."
"03/01/2019","Conway, S.C.",NA,"2","bot","1-1","Coastal Carolina","Illinois","Rivers, K. hit by pitch (2-2 KBSFB)."
"03/01/2019","Conway, S.C.",NA,"2","bot","1-1","Coastal Carolina","Illinois","Rivers, K. stole second."
"03/01/2019","Conway, S.C.",NA,"2","bot","1-1","Coastal Carolina","Illinois","Koenig, M. grounded out to ss (2-2 KKBFB)."
"03/01/2019","Conway, S.C.",NA,"2","bot","1-1","Coastal Carolina","Illinois","Weisz, K. struck out swinging (1-2 FKFBS)."
"03/01/2019","Conway, S.C.",NA,"3","top","1-1","Illinois","Coastal Carolina","Van Scoy grounded out to ss (3-2 KSFBBB)."
"03/01/2019","Conway, S.C.",NA,"3","top","1-1","Illinois","Coastal Carolina","Sarver struck out looking (1-2 KKBFK)."
"03/01/2019","Conway, S.C.",NA,"3","top","1-1","Illinois","Coastal Carolina","Troike doubled down the lf line (0-0)."
"03/01/2019","Conway, S.C.",NA,"3","top","1-1","Illinois","Coastal Carolina","Comia hit by pitch (1-2 SBF)."
"03/01/2019","Conway, S.C.",NA,"3","top","1-1","Illinois","Coastal Carolina","Massey lined out to cf (1-1 BF)."
"03/01/2019","Conway, S.C.",NA,"3","bot","1-1","Coastal Carolina","Illinois","McKeon, S. singled to right field (0-0)."
"03/01/2019","Conway, S.C.",NA,"3","bot","1-1","Coastal Carolina","Illinois","Wood, C. flied out to cf (1-2 KKFB)."
"03/01/2019","Conway, S.C.",NA,"3","bot","1-1","Coastal Carolina","Illinois","Pearcey, C. grounded out to c, SAC, bunt (1-0 B) McKeon, S. advanced to second."
"03/01/2019","Conway, S.C.",NA,"3","bot","1-1","Coastal Carolina","Illinois","Biermann, Z. hit by pitch (1-1 KB)."
"03/01/2019","Conway, S.C.",NA,"3","bot","1-2","Coastal Carolina","Illinois","Skeels, K. singled up the middle, RBI (0-0) Biermann, Z. advanced to second McKeon, S. scored."
"03/01/2019","Conway, S.C.",NA,"3","bot","1-2","Coastal Carolina","Illinois","Chavers, P. grounded out to 2b (0-1 K)."
"03/01/2019","Conway, S.C.",NA,"4","top","1-2","Illinois","Coastal Carolina","Taylor grounded out to ss (0-0)."
"03/01/2019","Conway, S.C.",NA,"4","top","1-2","Illinois","Coastal Carolina","Yalowitz flied out to cf to right center (1-2 BSF)."
"03/01/2019","Conway, S.C.",NA,"4","top","1-2","Illinois","Coastal Carolina","McDonald grounded out to 3b (0-2 SK)."
"03/01/2019","Conway, S.C.",NA,"4","bot","1-2","Coastal Carolina","Illinois","Rivers, K. walked (3-1 FBBBB)."
"03/01/2019","Conway, S.C.",NA,"4","bot","1-2","Coastal Carolina","Illinois","Koenig, M. struck out swinging (1-2 FFFBS)."
"03/01/2019","Conway, S.C.",NA,"4","bot","1-4","Coastal Carolina","Illinois","Weisz, K. homered to left field, 2 RBI (0-0) Rivers, K. scored."
"03/01/2019","Conway, S.C.",NA,"4","bot","1-4","Coastal Carolina","Illinois","McKeon, S. doubled to left field (0-1 K)."
"03/01/2019","Conway, S.C.",NA,"4","bot","1-4","Coastal Carolina","Illinois","Wood, C. grounded out to 2b (1-2 FSB) McKeon, S. advanced to third."
"03/01/2019","Conway, S.C.",NA,"4","bot","1-4","Coastal Carolina","Illinois","Pearcey, C. grounded out to ss (1-0 B)."
"03/01/2019","Conway, S.C.",NA,"5","top","1-4","Illinois","Coastal Carolina","Korte fouled out to 1b (1-0 B)."
"03/01/2019","Conway, S.C.",NA,"5","top","1-4","Illinois","Coastal Carolina","Van Scoy hit by pitch (0-1 K)."
"03/01/2019","Conway, S.C.",NA,"5","top","1-4","Illinois","Coastal Carolina","Sarver singled through the right side (3-1 KBBB) Van Scoy advanced to second."
"03/01/2019","Conway, S.C.",NA,"5","top","1-4","Illinois","Coastal Carolina","Troike fouled out to 1b (3-2 KBBBK)."
"03/01/2019","Conway, S.C.",NA,"5","top","1-4","Illinois","Coastal Carolina","Comia flied out to rf down the rf line (2-1 BSB)."
"03/01/2019","Conway, S.C.",NA,"5","bot","1-4","Coastal Carolina","Illinois","Biermann, Z. singled to left field (0-2 KK)."
"03/01/2019","Conway, S.C.",NA,"5","bot","1-4","Coastal Carolina","Illinois","Skeels, K. hit by pitch (2-2 KFBB) Biermann, Z. advanced to second."
"03/01/2019","Conway, S.C.",NA,"5","bot","1-4","Coastal Carolina","Illinois","Skeels, K. advanced to second on a wild pitch Biermann, Z. advanced to third on a wild pitch."
"03/01/2019","Conway, S.C.",NA,"5","bot","1-4","Coastal Carolina","Illinois","Chavers, P. struck out swinging (2-2 FFBBS)."
"03/01/2019","Conway, S.C.",NA,"5","bot","1-4","Coastal Carolina","Illinois","Rivers, K. intentionally walked (0-0)."
"03/01/2019","Conway, S.C.",NA,"5","bot","1-4","Coastal Carolina","Illinois","Schmitt to p for Fisher."
"03/01/2019","Conway, S.C.",NA,"5","bot","1-4","Coastal Carolina","Illinois","Johnson, J. pinch hit for Koenig, M.."
"03/01/2019","Conway, S.C.",NA,"5","bot","1-5","Coastal Carolina","Illinois","Johnson, J. walked, RBI (3-2 BKBKBB) Rivers, K. advanced to second Skeels, K. advanced to third Biermann, Z. scored."
"03/01/2019","Conway, S.C.",NA,"5","bot","1-6","Coastal Carolina","Illinois","Weisz, K. flied out to cf to left center, SF, RBI (3-2 BFBBKF) Skeels, K. scored."
"03/01/2019","Conway, S.C.",NA,"5","bot","1-6","Coastal Carolina","Illinois","McKeon, S. walked (3-1 KBBBB) Johnson, J. advanced to second Rivers, K. advanced to third."
"03/01/2019","Conway, S.C.",NA,"5","bot","1-6","Coastal Carolina","Illinois","Wood, C. reached on a fielders choice (1-2 SFFBF) McKeon, S. out at second 2b to ss."
"03/01/2019","Conway, S.C.",NA,"6","top","1-6","Illinois","Coastal Carolina","Johnson, J. to dh."
"03/01/2019","Conway, S.C.",NA,"6","top","1-6","Illinois","Coastal Carolina","Kitchen, A. to p for McCambley, Z."
"03/01/2019","Conway, S.C.",NA,"6","top","1-6","Illinois","Coastal Carolina","Massey singled to right field (2-1 KBB)."
"03/01/2019","Conway, S.C.",NA,"6","top","1-6","Illinois","Coastal Carolina","Taylor reached on a fielding error by 2b (1-2 FKB) Massey advanced to second."
"03/01/2019","Conway, S.C.",NA,"6","top","1-6","Illinois","Coastal Carolina","Yalowitz fouled out to 3b (1-0 B)."
"03/01/2019","Conway, S.C.",NA,"6","top","2-6","Illinois","Coastal Carolina","McDonald singled through the left side, RBI (1-0 B) Taylor advanced to second Massey scored."
"03/01/2019","Conway, S.C.",NA,"6","top","2-6","Illinois","Coastal Carolina","Haff pinch hit for Korte."
"03/01/2019","Conway, S.C.",NA,"6","top","2-6","Illinois","Coastal Carolina","Taylor stole third."
"03/01/2019","Conway, S.C.",NA,"6","top","2-6","Illinois","Coastal Carolina","McDonald out at second c to 2b, caught stealing."
"03/01/2019","Conway, S.C.",NA,"6","top","3-6","Illinois","Coastal Carolina","Taylor scored on a balk, unearned."
"03/01/2019","Conway, S.C.",NA,"6","top","3-6","Illinois","Coastal Carolina","Haff grounded out to 3b (1-2 KBS)."
"03/01/2019","Conway, S.C.",NA,"6","bot","3-6","Coastal Carolina","Illinois","Craan to c for Haff."
"03/01/2019","Conway, S.C.",NA,"6","bot","3-6","Coastal Carolina","Illinois","Lavender to p for Schmitt."
"03/01/2019","Conway, S.C.",NA,"6","bot","3-6","Coastal Carolina","Illinois","Pearcey, C. struck out swinging (1-2 KBKS)."
"03/01/2019","Conway, S.C.",NA,"6","bot","3-6","Coastal Carolina","Illinois","Biermann, Z. singled up the middle (0-1 S)."
"03/01/2019","Conway, S.C.",NA,"6","bot","3-6","Coastal Carolina","Illinois","Skeels, K. walked (3-0 BBBB) Biermann, Z. advanced to second."
"03/01/2019","Conway, S.C.",NA,"6","bot","3-6","Coastal Carolina","Illinois","Chavers, P. walked (3-2 BBBKFB) Skeels, K. advanced to second Biermann, Z. advanced to third."
"03/01/2019","Conway, S.C.",NA,"6","bot","3-7","Coastal Carolina","Illinois","Chavers, P. advanced to second on a wild pitch Skeels, K. advanced to third on a wild pitch Biermann, Z. scored on a wild pitch."
"03/01/2019","Conway, S.C.",NA,"6","bot","3-10","Coastal Carolina","Illinois","Rivers, K. homered to left center, 3 RBI (2-0 BB) Chavers, P. scored Skeels, K. scored."
"03/01/2019","Conway, S.C.",NA,"6","bot","3-10","Coastal Carolina","Illinois","Johnson, J. struck out swinging (2-2 KKFBBS)."
"03/01/2019","Conway, S.C.",NA,"6","bot","3-10","Coastal Carolina","Illinois","Engel to p for Lavender."
"03/01/2019","Conway, S.C.",NA,"6","bot","3-10","Coastal Carolina","Illinois","Weisz, K. fouled out to 1b (1-1 KB)."
"03/01/2019","Conway, S.C.",NA,"7","top","3-10","Illinois","Coastal Carolina","Van Scoy singled to center field (1-0 B)."
"03/01/2019","Conway, S.C.",NA,"7","top","3-10","Illinois","Coastal Carolina","Dyke pinch hit for Sarver."
"03/01/2019","Conway, S.C.",NA,"7","top","3-10","Illinois","Coastal Carolina","Dyke struck out looking (0-2 KSK)."
"03/01/2019","Conway, S.C.",NA,"7","top","3-10","Illinois","Coastal Carolina","Troike flied out to rf (2-1 KBB)."
"03/01/2019","Conway, S.C.",NA,"7","top","3-10","Illinois","Coastal Carolina","Comia flied out to cf (2-2 BFBF)."
"03/01/2019","Conway, S.C.",NA,"7","bot","3-10","Coastal Carolina","Illinois","McDonald to 1b."
"03/01/2019","Conway, S.C.",NA,"7","bot","3-10","Coastal Carolina","Illinois","Dyke to lf."
"03/01/2019","Conway, S.C.",NA,"7","bot","3-10","Coastal Carolina","Illinois","McKeon, S. singled through the right side."
"03/01/2019","Conway, S.C.",NA,"7","bot","3-10","Coastal Carolina","Illinois","McKeon, S. out at second c to ss."
"03/01/2019","Conway, S.C.",NA,"7","bot","3-10","Coastal Carolina","Illinois","Wood, C. walked (3-1 BBBKB)."
"03/01/2019","Conway, S.C.",NA,"7","bot","3-10","Coastal Carolina","Illinois","Wright, J. pinch hit for Pearcey, C.."
"03/01/2019","Conway, S.C.",NA,"7","bot","3-10","Coastal Carolina","Illinois","Wood, C. advanced to second on a passed ball."
"03/01/2019","Conway, S.C.",NA,"7","bot","3-10","Coastal Carolina","Illinois","Wright, J. struck out looking (1-2 KBKK)."
"03/01/2019","Conway, S.C.",NA,"7","bot","3-10","Coastal Carolina","Illinois","Biermann, Z. flied out to cf (1-0 B)."
"03/01/2019","Conway, S.C.",NA,"8","top","3-10","Illinois","Coastal Carolina","Hyde, M. to lf for Wright, J.."
"03/01/2019","Conway, S.C.",NA,"8","top","3-10","Illinois","Coastal Carolina","Riopelle, B. to c for Skeels, K.."
"03/01/2019","Conway, S.C.",NA,"8","top","3-10","Illinois","Coastal Carolina","Dodge pinch hit for Massey."
"03/01/2019","Conway, S.C.",NA,"8","top","3-10","Illinois","Coastal Carolina","Dodge grounded out to 3b (1-0 B)."
"03/01/2019","Conway, S.C.",NA,"8","top","3-10","Illinois","Coastal Carolina","Taylor flied out to cf (2-1 BFB)."
"03/01/2019","Conway, S.C.",NA,"8","top","3-10","Illinois","Coastal Carolina","Yalowitz grounded out to 3b (0-2 KFF)."
"03/01/2019","Conway, S.C.",NA,"8","bot","3-10","Coastal Carolina","Illinois","Larson to p for Engel."
"03/01/2019","Conway, S.C.",NA,"8","bot","3-10","Coastal Carolina","Illinois","Riopelle, B. grounded out to p (1-0 B)."
"03/01/2019","Conway, S.C.",NA,"8","bot","3-10","Coastal Carolina","Illinois","Chavers, P. flied out to cf (1-0 B)."
"03/01/2019","Conway, S.C.",NA,"8","bot","3-10","Coastal Carolina","Illinois","Buis, T. pinch hit for Rivers, K.."
"03/01/2019","Conway, S.C.",NA,"8","bot","3-10","Coastal Carolina","Illinois","Buis, T. hit by pitch (2-2 BSBF)."
"03/01/2019","Conway, S.C.",NA,"8","bot","3-10","Coastal Carolina","Illinois","Lucky, N. pinch hit for Johnson, J.."
"03/01/2019","Conway, S.C.",NA,"8","bot","3-11","Coastal Carolina","Illinois","Lucky, N. doubled to center field, RBI (2-0 BB) Buis, T. scored."
"03/01/2019","Conway, S.C.",NA,"8","bot","3-11","Coastal Carolina","Illinois","Weisz, K. flied out to cf (2-2 KBBSF)."
"03/01/2019","Conway, S.C.",NA,"9","top","3-11","Illinois","Coastal Carolina","Buis, T. to rf."
"03/01/2019","Conway, S.C.",NA,"9","top","3-11","Illinois","Coastal Carolina","Lucky, N. to dh."
"03/01/2019","Conway, S.C.",NA,"9","top","3-11","Illinois","Coastal Carolina","Gentry, D. to p for Kitchen, A.."
"03/01/2019","Conway, S.C.",NA,"9","top","3-11","Illinois","Coastal Carolina","Campbell pinch hit for McDonald."
"03/01/2019","Conway, S.C.",NA,"9","top","3-11","Illinois","Coastal Carolina","Campbell struck out looking (0-2 KKK)."
"03/01/2019","Conway, S.C.",NA,"9","top","3-11","Illinois","Coastal Carolina","Craan flied out to cf (0-0)."
"03/01/2019","Conway, S.C.",NA,"9","top","3-11","Illinois","Coastal Carolina","Michalak pinch hit for Van Scoy."
"03/01/2019","Conway, S.C.",NA,"9","top","3-11","Illinois","Coastal Carolina","Michalak grounded out to 1b unassisted (1-2 SBS)."
