"date","location","attendance","inning","inning_top_bot","score","batting","fielding","description"
"04/24/2019","Niles, Ohio",NA,"1","top","0-0","St. Bonaventure","Youngstown St.","Fuller flied out to cf to right center (2-2 KBFFFB)."
"04/24/2019","Niles, Ohio",NA,"1","top","0-0","St. Bonaventure","Youngstown St.","Schutz walked (3-1 BFBBB)."
"04/24/2019","Niles, Ohio",NA,"1","top","0-0","St. Bonaventure","Youngstown St.","Kelder grounded out to ss (0-1 F) Schutz advanced to second."
"04/24/2019","Niles, Ohio",NA,"1","top","0-0","St. Bonaventure","Youngstown St.","Schutz advanced to third on a wild pitch."
"04/24/2019","Niles, Ohio",NA,"1","top","0-0","St. Bonaventure","Youngstown St.","Henshaw lined out to 3b (1-2 KBF)."
"04/24/2019","Niles, Ohio",NA,"1","bot","0-0","Youngstown St.","St. Bonaventure","NASONTI, L. walked (3-1 BBBKB)."
"04/24/2019","Niles, Ohio",NA,"1","bot","0-0","Youngstown St.","St. Bonaventure","GLASSER, P. walked (3-2 BBKBKB) NASONTI, L. advanced to second."
"04/24/2019","Niles, Ohio",NA,"1","bot","0-0","Youngstown St.","St. Bonaventure","GLASSER, P. advanced to second on a passed ball NASONTI, L. advanced to third on a passed ball."
"04/24/2019","Niles, Ohio",NA,"1","bot","0-2","Youngstown St.","St. Bonaventure","GLENN, B. singled up the middle, 2 RBI (3-2 BBSFB) GLASSER, P. scored NASONTI, L. scored."
"04/24/2019","Niles, Ohio",NA,"1","bot","0-4","Youngstown St.","St. Bonaventure","WEHLER, J. homered to left field, 2 RBI (0-0) GLENN, B. scored."
"04/24/2019","Niles, Ohio",NA,"1","bot","0-4","Youngstown St.","St. Bonaventure","WIERSMA, T. walked (3-0 BBBB)."
"04/24/2019","Niles, Ohio",NA,"1","bot","0-4","Youngstown St.","St. Bonaventure","Moffat to p for Germanowski."
"04/24/2019","Niles, Ohio",NA,"1","bot","0-4","Youngstown St.","St. Bonaventure","DEUSANIO, S reached on a fielders choice (2-2 KKBFB) WIERSMA, T. out at second 1b to ss."
"04/24/2019","Niles, Ohio",NA,"1","bot","0-4","Youngstown St.","St. Bonaventure","DEUSANIO, S out at second c to 2b, caught stealing."
"04/24/2019","Niles, Ohio",NA,"1","bot","0-4","Youngstown St.","St. Bonaventure","SWARMER, D. walked (3-1 KBBBB)."
"04/24/2019","Niles, Ohio",NA,"1","bot","0-4","Youngstown St.","St. Bonaventure","CHARLES, W. struck out looking (0-2 KFFFK)."
"04/24/2019","Niles, Ohio",NA,"2","top","0-4","St. Bonaventure","Youngstown St.","COLES, C. to p for CLIFT, G.."
"04/24/2019","Niles, Ohio",NA,"2","top","0-4","St. Bonaventure","Youngstown St.","Palczewski walked (3-0 BBBB)."
"04/24/2019","Niles, Ohio",NA,"2","top","0-4","St. Bonaventure","Youngstown St.","Higgins struck out looking (3-2 BBBKSFK)."
"04/24/2019","Niles, Ohio",NA,"2","top","0-4","St. Bonaventure","Youngstown St.","Hayward flied out to rf (0-0)."
"04/24/2019","Niles, Ohio",NA,"2","top","0-4","St. Bonaventure","Youngstown St.","Koziol fouled out to 2b (2-0 BB)."
"04/24/2019","Niles, Ohio",NA,"2","bot","0-4","Youngstown St.","St. Bonaventure","DENNIS, C. struck out swinging (0-2 KFFS)."
"04/24/2019","Niles, Ohio",NA,"2","bot","0-4","Youngstown St.","St. Bonaventure","NASONTI, L. flied out to lf (2-2 SBFB)."
"04/24/2019","Niles, Ohio",NA,"2","bot","0-4","Youngstown St.","St. Bonaventure","GLASSER, P. hit by pitch (3-2 BBKSBF)."
"04/24/2019","Niles, Ohio",NA,"2","bot","0-6","Youngstown St.","St. Bonaventure","GLENN, B. homered to left field, 2 RBI (1-0 B) GLASSER, P. scored."
"04/24/2019","Niles, Ohio",NA,"2","bot","0-6","Youngstown St.","St. Bonaventure","WEHLER, J. singled through the left side (0-0)."
"04/24/2019","Niles, Ohio",NA,"2","bot","0-6","Youngstown St.","St. Bonaventure","WEHLER, J. stole second."
"04/24/2019","Niles, Ohio",NA,"2","bot","0-6","Youngstown St.","St. Bonaventure","WEHLER, J. stole third."
"04/24/2019","Niles, Ohio",NA,"2","bot","0-6","Youngstown St.","St. Bonaventure","WIERSMA, T. grounded out to 2b (2-2 BBKK)."
"04/24/2019","Niles, Ohio",NA,"3","top","0-6","St. Bonaventure","Youngstown St.","Myers grounded out to 3b (0-1 K)."
"04/24/2019","Niles, Ohio",NA,"3","top","0-6","St. Bonaventure","Youngstown St.","Fuller lined out to 3b (2-0 BB)."
"04/24/2019","Niles, Ohio",NA,"3","top","0-6","St. Bonaventure","Youngstown St.","Schutz singled to left field (0-2 KK)."
"04/24/2019","Niles, Ohio",NA,"3","top","0-6","St. Bonaventure","Youngstown St.","Kelder struck out swinging (1-2 BSFS)."
"04/24/2019","Niles, Ohio",NA,"3","bot","0-6","Youngstown St.","St. Bonaventure","Vincent to p for Moffat."
"04/24/2019","Niles, Ohio",NA,"3","bot","0-6","Youngstown St.","St. Bonaventure","DEUSANIO, S flied out to rf (1-2 KBS)."
"04/24/2019","Niles, Ohio",NA,"3","bot","0-6","Youngstown St.","St. Bonaventure","SWARMER, D. walked (3-2 BFBKBB)."
"04/24/2019","Niles, Ohio",NA,"3","bot","0-6","Youngstown St.","St. Bonaventure","CHARLES, W. singled through the left side (0-0) SWARMER, D. advanced to second."
"04/24/2019","Niles, Ohio",NA,"3","bot","0-6","Youngstown St.","St. Bonaventure","DENNIS, C. struck out swinging (2-2 BBKSS)."
"04/24/2019","Niles, Ohio",NA,"3","bot","0-6","Youngstown St.","St. Bonaventure","NASONTI, L. walked (3-1 BFBBB) CHARLES, W. advanced to second SWARMER, D. advanced to third."
"04/24/2019","Niles, Ohio",NA,"3","bot","0-6","Youngstown St.","St. Bonaventure","GLASSER, P. lined out to ss (0-1 F)."
"04/24/2019","Niles, Ohio",NA,"4","top","0-6","St. Bonaventure","Youngstown St.","Henshaw flied out to cf (1-0 B)."
"04/24/2019","Niles, Ohio",NA,"4","top","0-6","St. Bonaventure","Youngstown St.","Palczewski struck out looking (3-2 BBBKFK)."
"04/24/2019","Niles, Ohio",NA,"4","top","0-6","St. Bonaventure","Youngstown St.","Higgins flied out to rf (0-0)."
"04/24/2019","Niles, Ohio",NA,"4","bot","0-6","Youngstown St.","St. Bonaventure","GLENN, B. flied out to lf (0-0)."
"04/24/2019","Niles, Ohio",NA,"4","bot","0-6","Youngstown St.","St. Bonaventure","WEHLER, J. singled to left field (3-2 KFBBB)."
"04/24/2019","Niles, Ohio",NA,"4","bot","0-6","Youngstown St.","St. Bonaventure","WEHLER, J. stole second."
"04/24/2019","Niles, Ohio",NA,"4","bot","0-6","Youngstown St.","St. Bonaventure","WIERSMA, T. flied out to cf WEHLER, J. advanced to third."
"04/24/2019","Niles, Ohio",NA,"4","bot","0-6","Youngstown St.","St. Bonaventure","DEUSANIO, S struck out swinging, out at first c to 1b (1-2 KBSS)."
"04/24/2019","Niles, Ohio",NA,"5","top","0-6","St. Bonaventure","Youngstown St.","Hayward singled to right field (1-2 KSB)."
"04/24/2019","Niles, Ohio",NA,"5","top","0-6","St. Bonaventure","Youngstown St.","Koziol struck out looking (2-2 BKBFK)."
"04/24/2019","Niles, Ohio",NA,"5","top","0-6","St. Bonaventure","Youngstown St.","Myers struck out looking (3-2 BSBBFK)."
"04/24/2019","Niles, Ohio",NA,"5","top","0-6","St. Bonaventure","Youngstown St.","Fuller struck out swinging (3-2 BBKFFFBS)."
"04/24/2019","Niles, Ohio",NA,"5","bot","0-6","Youngstown St.","St. Bonaventure","OBrien to p for Vincent."
"04/24/2019","Niles, Ohio",NA,"5","bot","0-6","Youngstown St.","St. Bonaventure","SWARMER, D. walked (3-2 KBSBBB)."
"04/24/2019","Niles, Ohio",NA,"5","bot","0-6","Youngstown St.","St. Bonaventure","CHARLES, W. walked, advanced to second on a throwing error by c (3-2 KSFFBBBFB) SWARMER, D. advanced to second, advanced to third on the error."
"04/24/2019","Niles, Ohio",NA,"5","bot","0-7","Youngstown St.","St. Bonaventure","DENNIS, C. singled to pitcher, RBI (0-0) CHARLES, W. advanced to third SWARMER, D. scored."
"04/24/2019","Niles, Ohio",NA,"5","bot","0-7","Youngstown St.","St. Bonaventure","NASONTI, L. struck out swinging (1-2 FBFS) DENNIS, C. stole second."
"04/24/2019","Niles, Ohio",NA,"5","bot","0-7","Youngstown St.","St. Bonaventure","GLASSER, P. struck out swinging (3-2 KBBBKS)."
"04/24/2019","Niles, Ohio",NA,"5","bot","0-7","Youngstown St.","St. Bonaventure","Pittman to p for OBrien."
"04/24/2019","Niles, Ohio",NA,"5","bot","0-9","Youngstown St.","St. Bonaventure","GLENN, B. doubled to right center, 2 RBI (1-1 BF) DENNIS, C. scored CHARLES, W. scored."
"04/24/2019","Niles, Ohio",NA,"5","bot","0-9","Youngstown St.","St. Bonaventure","Stauffer to c for Koziol."
"04/24/2019","Niles, Ohio",NA,"5","bot","0-9","Youngstown St.","St. Bonaventure","Kevin Koziol was thrown out."
"04/24/2019","Niles, Ohio",NA,"5","bot","0-9","Youngstown St.","St. Bonaventure","WEHLER, J. popped up to 1b (0-0)."
"04/24/2019","Niles, Ohio",NA,"6","top","0-9","St. Bonaventure","Youngstown St.","Schutz flied out to lf to left center (3-2 BBBKK)."
"04/24/2019","Niles, Ohio",NA,"6","top","0-9","St. Bonaventure","Youngstown St.","Kelder flied out to lf to left center (2-2 KBBS)."
"04/24/2019","Niles, Ohio",NA,"6","top","0-9","St. Bonaventure","Youngstown St.","Henshaw struck out swinging (0-2 FKS)."
"04/24/2019","Niles, Ohio",NA,"6","bot","0-9","Youngstown St.","St. Bonaventure","WIERSMA, T. singled to second base (2-2 KFBBF)."
"04/24/2019","Niles, Ohio",NA,"6","bot","0-9","Youngstown St.","St. Bonaventure","DEUSANIO, S grounded out to p (1-2 KSB) WIERSMA, T. advanced to second."
"04/24/2019","Niles, Ohio",NA,"6","bot","0-9","Youngstown St.","St. Bonaventure","WIERSMA, T. advanced to third on a wild pitch."
"04/24/2019","Niles, Ohio",NA,"6","bot","0-10","Youngstown St.","St. Bonaventure","SWARMER, D. grounded out to ss, RBI (2-2 SKBB) WIERSMA, T. scored."
"04/24/2019","Niles, Ohio",NA,"6","bot","0-10","Youngstown St.","St. Bonaventure","CHARLES, W. grounded out to ss (0-0)."
"04/24/2019","Niles, Ohio",NA,"7","top","0-10","St. Bonaventure","Youngstown St.","LOPATKA, Z. to p for COLES, C.."
"04/24/2019","Niles, Ohio",NA,"7","top","0-10","St. Bonaventure","Youngstown St.","PERRY, T. to 1b for WIERSMA, T.."
"04/24/2019","Niles, Ohio",NA,"7","top","0-10","St. Bonaventure","Youngstown St.","RITTER, J. to c for SWARMER, D.."
"04/24/2019","Niles, Ohio",NA,"7","top","0-10","St. Bonaventure","Youngstown St.","Palczewski struck out swinging, reached first on a wild pitch (2-2 BBFFS)."
"04/24/2019","Niles, Ohio",NA,"7","top","0-10","St. Bonaventure","Youngstown St.","Ferlenda pinch hit for Higgins."
"04/24/2019","Niles, Ohio",NA,"7","top","0-10","St. Bonaventure","Youngstown St.","Ferlenda popped up to ss (1-0 B)."
"04/24/2019","Niles, Ohio",NA,"7","top","0-10","St. Bonaventure","Youngstown St.","Hayward flied out to cf to right center (3-2 BSBFFBF)."
"04/24/2019","Niles, Ohio",NA,"7","top","0-10","St. Bonaventure","Youngstown St.","Stauffer flied out to cf (0-0)."
"04/24/2019","Niles, Ohio",NA,"7","bot","0-10","Youngstown St.","St. Bonaventure","Ferlenda to 2b."
"04/24/2019","Niles, Ohio",NA,"7","bot","0-10","Youngstown St.","St. Bonaventure","DENNIS, C. grounded out to ss (2-2 BKKB)."
"04/24/2019","Niles, Ohio",NA,"7","bot","0-10","Youngstown St.","St. Bonaventure","NASONTI, L. hit by pitch (0-2 KF)."
"04/24/2019","Niles, Ohio",NA,"7","bot","0-10","Youngstown St.","St. Bonaventure","Wetter to p for Pittman."
"04/24/2019","Niles, Ohio",NA,"7","bot","0-10","Youngstown St.","St. Bonaventure","GLASSER, P. lined out to ss (0-2 KF)."
"04/24/2019","Niles, Ohio",NA,"7","bot","0-10","Youngstown St.","St. Bonaventure","GLENN, B. grounded out to 3b (2-1 BKB) NASONTI, L. advanced to second."
"04/24/2019","Niles, Ohio",NA,"8","top","0-10","St. Bonaventure","Youngstown St.","Myers flied out to cf (0-1 F)."
"04/24/2019","Niles, Ohio",NA,"8","top","0-10","St. Bonaventure","Youngstown St.","Fuller popped up to 2b (0-1 F)."
"04/24/2019","Niles, Ohio",NA,"8","top","0-10","St. Bonaventure","Youngstown St.","Schutz grounded out to ss (1-1 BK)."
"04/24/2019","Niles, Ohio",NA,"8","bot","0-10","Youngstown St.","St. Bonaventure","Krauza to p for Wetter."
"04/24/2019","Niles, Ohio",NA,"8","bot","0-10","Youngstown St.","St. Bonaventure","WEHLER, J. walked (3-2 BBKFBB)."
"04/24/2019","Niles, Ohio",NA,"8","bot","0-10","Youngstown St.","St. Bonaventure","PERRY, T. struck out swinging (1-2 KSBS)."
"04/24/2019","Niles, Ohio",NA,"8","bot","0-10","Youngstown St.","St. Bonaventure","DEUSANIO, S walked (3-0 BBBB) WEHLER, J. advanced to second."
"04/24/2019","Niles, Ohio",NA,"8","bot","0-10","Youngstown St.","St. Bonaventure","DEUSANIO, S advanced to second on a wild pitch WEHLER, J. advanced to third on a wild pitch."
"04/24/2019","Niles, Ohio",NA,"8","bot","0-10","Youngstown St.","St. Bonaventure","RITTER, J. struck out looking (2-2 SKBFBK)."
"04/24/2019","Niles, Ohio",NA,"8","bot","0-10","Youngstown St.","St. Bonaventure","CHARLES, W. struck out swinging (2-2 KBKFBS)."
"04/24/2019","Niles, Ohio",NA,"9","top","0-10","St. Bonaventure","Youngstown St.","KERSH, G. to p for LOPATKA, Z.."
"04/24/2019","Niles, Ohio",NA,"9","top","0-10","St. Bonaventure","Youngstown St.","Kelder doubled to left field (3-1 BBKB)."
"04/24/2019","Niles, Ohio",NA,"9","top","0-10","St. Bonaventure","Youngstown St.","Henshaw grounded out to ss (0-1 F)."
"04/24/2019","Niles, Ohio",NA,"9","top","0-10","St. Bonaventure","Youngstown St.","Palczewski flied out to lf (2-2 KKBB)."
"04/24/2019","Niles, Ohio",NA,"9","top","0-10","St. Bonaventure","Youngstown St.","Ferlenda flied out to cf (2-2 SBFB)."
