"date","location","attendance","inning","inning_top_bot","score","batting","fielding","description"
"05/22/2019","Harrisonburg, Va.",NA,"1","top","0-0","UNCW","Northeastern","Jones, G. doubled down the lf line (2-2 BBFSFF)."
"05/22/2019","Harrisonburg, Va.",NA,"1","top","0-0","UNCW","Northeastern","Meadows, J. popped up to p, bunt (0-0)."
"05/22/2019","Harrisonburg, Va.",NA,"1","top","1-0","UNCW","Northeastern","Weiss singled to left center, RBI (0-1 K)3a Jones, G. scored."
"05/22/2019","Harrisonburg, Va.",NA,"1","top","2-0","UNCW","Northeastern","Brown, K. doubled to right center, RBI (2-2 KBFFB)3a Weiss scored."
"05/22/2019","Harrisonburg, Va.",NA,"1","top","2-0","UNCW","Northeastern","Angeli struck out swinging (1-2 BFFS)."
"05/22/2019","Harrisonburg, Va.",NA,"1","top","2-0","UNCW","Northeastern","Bridges, N. struck out swinging (3-2 BKBFBFK)."
"05/22/2019","Harrisonburg, Va.",NA,"1","bot","2-0","Northeastern","UNCW","Walsh doubled to left center (1-1 KB)."
"05/22/2019","Harrisonburg, Va.",NA,"1","bot","2-0","Northeastern","UNCW","Fair grounded out to 2b (0-2 KF)3a Walsh advanced to third."
"05/22/2019","Harrisonburg, Va.",NA,"1","bot","2-2","Northeastern","UNCW","Farrell homered to right field, 2 RBI (1-2 KBS)3a Walsh scored."
"05/22/2019","Harrisonburg, Va.",NA,"1","bot","2-2","Northeastern","UNCW","Holzwasser grounded out to p unassisted, bunt (0-1 K)."
"05/22/2019","Harrisonburg, Va.",NA,"1","bot","2-2","Northeastern","UNCW","DiLoreto flied out to rf (0-0)."
"05/22/2019","Harrisonburg, Va.",NA,"2","top","2-2","UNCW","Northeastern","Baldwin, B. flied out to cf to center field (1-0 B)."
"05/22/2019","Harrisonburg, Va.",NA,"2","top","2-2","UNCW","Northeastern","Suggs doubled down the lf line (2-1 BBK)."
"05/22/2019","Harrisonburg, Va.",NA,"2","top","2-2","UNCW","Northeastern","Thorburn, C. flied out to lf (2-2 BBKFF)."
"05/22/2019","Harrisonburg, Va.",NA,"2","top","2-2","UNCW","Northeastern","Jones, G. grounded out to p (2-1 KBB)."
"05/22/2019","Harrisonburg, Va.",NA,"2","bot","2-2","Northeastern","UNCW","Costello popped up to ss (1-1 FB)."
"05/22/2019","Harrisonburg, Va.",NA,"2","bot","2-2","Northeastern","UNCW","Smith out at first 1b to p (2-2 BKBF)."
"05/22/2019","Harrisonburg, Va.",NA,"2","bot","2-2","Northeastern","UNCW","Geaslen grounded out to ss (0-1 K)."
"05/22/2019","Harrisonburg, Va.",NA,"3","top","2-2","UNCW","Northeastern","Meadows, J. flied out to cf (0-1 K)."
"05/22/2019","Harrisonburg, Va.",NA,"3","top","2-2","UNCW","Northeastern","Weiss flied out to cf (2-1 FBB)."
"05/22/2019","Harrisonburg, Va.",NA,"3","top","3-2","UNCW","Northeastern","Brown, K. homered to left field, RBI (0-2 KF)."
"05/22/2019","Harrisonburg, Va.",NA,"3","top","3-2","UNCW","Northeastern","Angeli singled up the middle (1-2 FFBF)."
"05/22/2019","Harrisonburg, Va.",NA,"3","top","3-2","UNCW","Northeastern","Bridges, N. struck out swinging (1-2 BSSS)."
"05/22/2019","Harrisonburg, Va.",NA,"3","bot","3-2","Northeastern","UNCW","Rosen flied out to rf (3-2 BSFBB)."
"05/22/2019","Harrisonburg, Va.",NA,"3","bot","3-2","Northeastern","UNCW","Walsh flied out to lf (0-0)."
"05/22/2019","Harrisonburg, Va.",NA,"3","bot","3-2","Northeastern","UNCW","Fair singled to right field (0-0)."
"05/22/2019","Harrisonburg, Va.",NA,"3","bot","3-2","Northeastern","UNCW","Farrell struck out swinging (2-2 BKKBS)."
"05/22/2019","Harrisonburg, Va.",NA,"4","top","3-2","UNCW","Northeastern","Baldwin, B. struck out swinging (0-2 FFS)."
"05/22/2019","Harrisonburg, Va.",NA,"4","top","3-2","UNCW","Northeastern","Suggs flied out to cf (1-0 B)."
"05/22/2019","Harrisonburg, Va.",NA,"4","top","3-2","UNCW","Northeastern","Thorburn, C. struck out swinging (3-2 FBFBBS)."
"05/22/2019","Harrisonburg, Va.",NA,"4","bot","3-2","Northeastern","UNCW","Holzwasser struck out looking (1-2 KKFBFK)."
"05/22/2019","Harrisonburg, Va.",NA,"4","bot","3-2","Northeastern","UNCW","DiLoreto singled up the middle (1-2 KKB)."
"05/22/2019","Harrisonburg, Va.",NA,"4","bot","3-2","Northeastern","UNCW","Costello singled through the left side (1-0 B)3a DiLoreto advanced to second."
"05/22/2019","Harrisonburg, Va.",NA,"4","bot","3-2","Northeastern","UNCW","Smith walked (3-2 BKSFBBFB)3a Costello advanced to second3a DiLoreto advanced to third."
"05/22/2019","Harrisonburg, Va.",NA,"4","bot","3-2","Northeastern","UNCW","Geaslen struck out looking (2-2 SBBFK)."
"05/22/2019","Harrisonburg, Va.",NA,"4","bot","3-3","Northeastern","UNCW","Rosen walked, RBI (3-0 BBBB)3a Smith advanced to second3a Costello advanced to third3a DiLoreto scored."
"05/22/2019","Harrisonburg, Va.",NA,"4","bot","3-3","Northeastern","UNCW","Walsh struck out swinging (2-2 KBFBS)."
"05/22/2019","Harrisonburg, Va.",NA,"5","top","3-3","UNCW","Northeastern","Jones, G. reached on an error by ss (2-1 KBB)."
"05/22/2019","Harrisonburg, Va.",NA,"5","top","3-3","UNCW","Northeastern","Meadows, J. walked (3-1 BBFBB)3a Jones, G. advanced to second."
"05/22/2019","Harrisonburg, Va.",NA,"5","top","3-3","UNCW","Northeastern","Weiss grounded out to 3b, SAC, bunt (0-0)3a Meadows, J. advanced to second3a Jones, G. advanced to third."
"05/22/2019","Harrisonburg, Va.",NA,"5","top","3-3","UNCW","Northeastern","Brown, K. intentionally walked (3-0 BBBB)."
"05/22/2019","Harrisonburg, Va.",NA,"5","top","5-3","UNCW","Northeastern","Angeli singled up the middle, 2 RBI (2-2 FBKB)3a Brown, K. advanced to third3a Meadows, J. scored3a Jones, G. scored, unearned."
"05/22/2019","Harrisonburg, Va.",NA,"5","top","6-3","UNCW","Northeastern","Bridges, N. flied out to lf, SF, RBI (2-2 SBBF)3a Angeli advanced to second3a Brown, K. scored, unearned."
"05/22/2019","Harrisonburg, Va.",NA,"5","top","6-3","UNCW","Northeastern","Dufault to p for Mellen."
"05/22/2019","Harrisonburg, Va.",NA,"5","top","6-3","UNCW","Northeastern","Baldwin, B. walked (3-0 BBBB)."
"05/22/2019","Harrisonburg, Va.",NA,"5","top","6-3","UNCW","Northeastern","Suggs struck out swinging (0-2 KKS)."
"05/22/2019","Harrisonburg, Va.",NA,"5","bot","6-3","Northeastern","UNCW","Fair singled through the left side (1-2 BSS)."
"05/22/2019","Harrisonburg, Va.",NA,"5","bot","6-3","Northeastern","UNCW","Walke to p for Gesell, L.."
"05/22/2019","Harrisonburg, Va.",NA,"5","bot","6-3","Northeastern","UNCW","Fair advanced to second on a passed ball."
"05/22/2019","Harrisonburg, Va.",NA,"5","bot","6-4","Northeastern","UNCW","Farrell tripled down the rf line, RBI (1-1 KB)3a Fair scored."
"05/22/2019","Harrisonburg, Va.",NA,"5","bot","6-5","Northeastern","UNCW","Holzwasser grounded out to 2b, RBI (0-0)3a Farrell scored."
"05/22/2019","Harrisonburg, Va.",NA,"5","bot","6-5","Northeastern","UNCW","DiLoreto grounded out to 3b (2-2 BSSBFF)."
"05/22/2019","Harrisonburg, Va.",NA,"5","bot","6-5","Northeastern","UNCW","Costello grounded out to ss (1-2 KBS)."
"05/22/2019","Harrisonburg, Va.",NA,"6","top","6-5","UNCW","Northeastern","Thorburn, C. grounded out to ss (2-2 SFBB)."
"05/22/2019","Harrisonburg, Va.",NA,"6","top","6-5","UNCW","Northeastern","Jones, G. singled up the middle (1-0 B)."
"05/22/2019","Harrisonburg, Va.",NA,"6","top","6-5","UNCW","Northeastern","Jones, G. stole second."
"05/22/2019","Harrisonburg, Va.",NA,"6","top","6-5","UNCW","Northeastern","Meadows, J. flied out to cf (1-1 BK)3a Jones, G. advanced to third."
"05/22/2019","Harrisonburg, Va.",NA,"6","top","6-5","UNCW","Northeastern","Weiss grounded out to 2b (0-1 F)."
"05/22/2019","Harrisonburg, Va.",NA,"6","bot","6-5","Northeastern","UNCW","Smith grounded out to 1b unassisted (1-0 B)."
"05/22/2019","Harrisonburg, Va.",NA,"6","bot","6-5","Northeastern","UNCW","Geaslen struck out swinging, out at first c to 1b (0-2 FFS)."
"05/22/2019","Harrisonburg, Va.",NA,"6","bot","6-5","Northeastern","UNCW","Rosen grounded out to 2b (2-2 BKSFBF)."
"05/22/2019","Harrisonburg, Va.",NA,"7","top","6-5","UNCW","Northeastern","Brown, K. grounded out to 3b (0-0)."
"05/22/2019","Harrisonburg, Va.",NA,"7","top","6-5","UNCW","Northeastern","Angeli grounded out to 3b (0-2 KK)."
"05/22/2019","Harrisonburg, Va.",NA,"7","top","6-5","UNCW","Northeastern","Bridges, N. struck out swinging (0-2 KKFS)."
"05/22/2019","Harrisonburg, Va.",NA,"7","bot","6-5","Northeastern","UNCW","Walsh grounded out to 2b (1-2 BFK)."
"05/22/2019","Harrisonburg, Va.",NA,"7","bot","6-5","Northeastern","UNCW","Fair lined out to 1b (0-1 F)."
"05/22/2019","Harrisonburg, Va.",NA,"7","bot","6-5","Northeastern","UNCW","Farrell singled to right center (0-1 K)."
"05/22/2019","Harrisonburg, Va.",NA,"7","bot","6-5","Northeastern","UNCW","Holzwasser grounded out to 2b (2-0 BB)."
"05/22/2019","Harrisonburg, Va.",NA,"8","top","6-5","UNCW","Northeastern","Baldwin, B. flied out to cf (0-0)."
"05/22/2019","Harrisonburg, Va.",NA,"8","top","6-5","UNCW","Northeastern","Liles pinch hit for Suggs."
"05/22/2019","Harrisonburg, Va.",NA,"8","top","6-5","UNCW","Northeastern","Liles grounded out to 2b (0-2 KS)."
"05/22/2019","Harrisonburg, Va.",NA,"8","top","6-5","UNCW","Northeastern","Thorburn, C. lined out to cf (1-0 B)."
"05/22/2019","Harrisonburg, Va.",NA,"8","bot","6-5","Northeastern","UNCW","Bridges, Z. to c for Liles."
"05/22/2019","Harrisonburg, Va.",NA,"8","bot","6-5","Northeastern","UNCW","Ryan to p for Walke."
"05/22/2019","Harrisonburg, Va.",NA,"8","bot","6-5","Northeastern","UNCW","DiLoreto hit by pitch (1-1 SB)."
"05/22/2019","Harrisonburg, Va.",NA,"8","bot","6-5","Northeastern","UNCW","Costello grounded out to 3b, SAC, bunt (0-0)3a DiLoreto advanced to second."
"05/22/2019","Harrisonburg, Va.",NA,"8","bot","6-5","Northeastern","UNCW","Smith grounded out to ss (2-1 BBK)3a DiLoreto advanced to third."
"05/22/2019","Harrisonburg, Va.",NA,"8","bot","6-6","Northeastern","UNCW","DiLoreto scored on a wild pitch."
"05/22/2019","Harrisonburg, Va.",NA,"8","bot","6-6","Northeastern","UNCW","Geaslen grounded out to 3b (2-2 BFBS)."
"05/22/2019","Harrisonburg, Va.",NA,"9","top","6-6","UNCW","Northeastern","Jones, G. walked (3-0 BBBB)."
"05/22/2019","Harrisonburg, Va.",NA,"9","top","6-6","UNCW","Northeastern","Meadows, J. grounded out to p, SAC, bunt (0-1 F)3a Jones, G. advanced to second."
"05/22/2019","Harrisonburg, Va.",NA,"9","top","6-6","UNCW","Northeastern","Jones, G. out at third c to 3b, caught stealing."
"05/22/2019","Harrisonburg, Va.",NA,"9","top","6-6","UNCW","Northeastern","Weiss walked (3-2 BFKFFBBB)."
"05/22/2019","Harrisonburg, Va.",NA,"9","top","6-6","UNCW","Northeastern","Brown, K. singled to third base (0-0)3a Weiss advanced to second."
"05/22/2019","Harrisonburg, Va.",NA,"9","top","6-6","UNCW","Northeastern","Angeli grounded out to ss (0-2 FF)."
"05/22/2019","Harrisonburg, Va.",NA,"9","bot","6-6","Northeastern","UNCW","Morgan, B. to p for Ryan."
"05/22/2019","Harrisonburg, Va.",NA,"9","bot","6-6","Northeastern","UNCW","Rosen walked (3-1 BBKBB)."
"05/22/2019","Harrisonburg, Va.",NA,"9","bot","6-6","Northeastern","UNCW","Walsh reached on a fielders choice (1-1 FB)3a Rosen out at second p to ss."
"05/22/2019","Harrisonburg, Va.",NA,"9","bot","6-6","Northeastern","UNCW","Fair flied out to rf (1-0 B)."
"05/22/2019","Harrisonburg, Va.",NA,"9","bot","6-6","Northeastern","UNCW","Farrell flied out to rf (0-2 SKFF)."
"05/22/2019","Harrisonburg, Va.",NA,"10","top","6-6","UNCW","Northeastern","Bridges, N. grounded out to c, bunt (0-0)."
"05/22/2019","Harrisonburg, Va.",NA,"10","top","6-6","UNCW","Northeastern","Baldwin, B. fouled out to 1b (1-1 FB)."
"05/22/2019","Harrisonburg, Va.",NA,"10","top","6-6","UNCW","Northeastern","Bridges, Z. struck out swinging (1-2 KSBS)."
"05/22/2019","Harrisonburg, Va.",NA,"10","bot","6-6","Northeastern","UNCW","Holzwasser struck out looking (2-2 BBKFK)."
"05/22/2019","Harrisonburg, Va.",NA,"10","bot","6-6","Northeastern","UNCW","DiLoreto singled through the right side (2-2 KFBB)."
"05/22/2019","Harrisonburg, Va.",NA,"10","bot","6-6","Northeastern","UNCW","Costello reached on a fielders choice (0-0)3a DiLoreto out at second ss to 2b."
"05/22/2019","Harrisonburg, Va.",NA,"10","bot","6-6","Northeastern","UNCW","Smith struck out swinging (3-2 BKSBBS)."
"05/22/2019","Harrisonburg, Va.",NA,"11","top","6-6","UNCW","Northeastern","Thorburn, C. singled through the right side (1-1 BK)."
"05/22/2019","Harrisonburg, Va.",NA,"11","top","6-6","UNCW","Northeastern","Jones, G. walked (3-2 BBBKFB)3a Thorburn, C. advanced to second."
"05/22/2019","Harrisonburg, Va.",NA,"11","top","6-6","UNCW","Northeastern","Thorburn, C. out at second c to ss, picked off."
"05/22/2019","Harrisonburg, Va.",NA,"11","top","6-6","UNCW","Northeastern","Misiaszek to p for Dufault."
"05/22/2019","Harrisonburg, Va.",NA,"11","top","6-6","UNCW","Northeastern","Meadows, J. flied out to rf (1-1 BF)."
"05/22/2019","Harrisonburg, Va.",NA,"11","top","6-6","UNCW","Northeastern","Jones, G. stole second."
"05/22/2019","Harrisonburg, Va.",NA,"11","top","7-6","UNCW","Northeastern","Weiss doubled down the rf line, RBI (3-2 SBBSB)3a Jones, G. scored."
"05/22/2019","Harrisonburg, Va.",NA,"11","top","7-6","UNCW","Northeastern","Brown, K. intentionally walked (3-0 BBBB)."
"05/22/2019","Harrisonburg, Va.",NA,"11","top","8-6","UNCW","Northeastern","Angeli singled through the left side, RBI (2-1 FBB)3a Brown, K. advanced to second3a Weiss scored."
"05/22/2019","Harrisonburg, Va.",NA,"11","top","8-6","UNCW","Northeastern","Bridges, N. popped up to ss (1-0 B)."
"05/22/2019","Harrisonburg, Va.",NA,"11","bot","8-6","Northeastern","UNCW","Geaslen grounded out to 2b (2-2 FSBB)."
"05/22/2019","Harrisonburg, Va.",NA,"11","bot","8-6","Northeastern","UNCW","Rosen flied out to lf (0-1 K)."
"05/22/2019","Harrisonburg, Va.",NA,"11","bot","8-6","Northeastern","UNCW","Walsh struck out swinging (1-2 BKSS)."
