"date","location","attendance","inning","inning_top_bot","score","batting","fielding","description"
"03/06/2020","Elon, N.C.",NA,"1","top","0-0","Illinois","Elon","Jackson struck out looking (1-2 BSKK)."
"03/06/2020","Elon, N.C.",NA,"1","top","0-0","Illinois","Elon","Doligale singled to left field (1-1 KB)."
"03/06/2020","Elon, N.C.",NA,"1","top","0-0","Illinois","Elon","Comia walked (3-0 BBBB)3a Doligale advanced to second."
"03/06/2020","Elon, N.C.",NA,"1","top","0-0","Illinois","Elon","Sarver hit into double play p to ss to 1b (0-1 S)3a Comia out on the play."
"03/06/2020","Elon, N.C.",NA,"1","bot","0-0","Elon","Illinois","Iadisernia singled through the left side (2-1 BKB)."
"03/06/2020","Elon, N.C.",NA,"1","bot","0-0","Elon","Illinois","Pico struck out looking (3-2 SBKBFBK)."
"03/06/2020","Elon, N.C.",NA,"1","bot","0-0","Elon","Illinois","Satterfield singled to left field (3-2 BKSBFFBFFF)3a Iadisernia advanced to second."
"03/06/2020","Elon, N.C.",NA,"1","bot","0-0","Elon","Illinois","Galason singled to second base (1-2 KFFB)3a Satterfield advanced to second3a Iadisernia advanced to third."
"03/06/2020","Elon, N.C.",NA,"1","bot","0-2","Elon","Illinois","Oldham singled through the right side, 2 RBI (0-1 K)3a Galason advanced to third3a Satterfield scored3a Iadisernia scored."
"03/06/2020","Elon, N.C.",NA,"1","bot","0-2","Elon","Illinois","Cicci popped up to 3b (0-0)."
"03/06/2020","Elon, N.C.",NA,"1","bot","0-3","Elon","Illinois","Oldham advanced to second on a passed ball3a Galason scored on a passed ball, unearned."
"03/06/2020","Elon, N.C.",NA,"1","bot","0-3","Elon","Illinois","Sponseller grounded out to 1b unassisted (2-1 BBF)."
"03/06/2020","Elon, N.C.",NA,"2","top","0-3","Illinois","Elon","Steinbach struck out swinging (2-2 BBKFS)."
"03/06/2020","Elon, N.C.",NA,"2","top","0-3","Illinois","Elon","Aide grounded out to 3b (3-2 BBKFBF)."
"03/06/2020","Elon, N.C.",NA,"2","top","0-3","Illinois","Elon","McDonald lined out to rf down the rf line (2-2 BKBF)."
"03/06/2020","Elon, N.C.",NA,"2","bot","0-3","Elon","Illinois","Roberts grounded out to 2b (2-2 BKBFF)."
"03/06/2020","Elon, N.C.",NA,"2","bot","0-3","Elon","Illinois","Spurlin fouled out to 2b (1-2 SKB)."
"03/06/2020","Elon, N.C.",NA,"2","bot","0-3","Elon","Illinois","Iadisernia doubled to right field (3-2 BBKKB)."
"03/06/2020","Elon, N.C.",NA,"2","bot","0-3","Elon","Illinois","Pico struck out swinging (3-2 KBBBSS)."
"03/06/2020","Elon, N.C.",NA,"3","top","0-3","Illinois","Elon","Campbell flied out to rf (0-2 FKF)."
"03/06/2020","Elon, N.C.",NA,"3","top","0-3","Illinois","Elon","Harding singled up the middle (0-1 K)."
"03/06/2020","Elon, N.C.",NA,"3","top","0-3","Illinois","Elon","Jackson grounded out to p (0-1 F)3a Harding advanced to second."
"03/06/2020","Elon, N.C.",NA,"3","top","0-3","Illinois","Elon","Harding advanced to third on a wild pitch."
"03/06/2020","Elon, N.C.",NA,"3","top","0-3","Illinois","Elon","Doligale struck out looking (3-2 KBBBFFK)."
"03/06/2020","Elon, N.C.",NA,"3","bot","0-3","Elon","Illinois","Satterfield grounded out to ss (1-1 BK)."
"03/06/2020","Elon, N.C.",NA,"3","bot","0-3","Elon","Illinois","Galason struck out swinging (3-2 BBBKFS)."
"03/06/2020","Elon, N.C.",NA,"3","bot","0-3","Elon","Illinois","Oldham singled up the middle (3-1 BKBB)."
"03/06/2020","Elon, N.C.",NA,"3","bot","0-3","Elon","Illinois","Cicci flied out to cf (1-1 KB)."
"03/06/2020","Elon, N.C.",NA,"4","top","0-3","Illinois","Elon","Comia singled to shortstop (1-2 KBK)."
"03/06/2020","Elon, N.C.",NA,"4","top","0-3","Illinois","Elon","Sarver singled down the rf line (1-0 B)3a Comia advanced to third."
"03/06/2020","Elon, N.C.",NA,"4","top","0-3","Illinois","Elon","Steinbach struck out swinging (1-2 BFFS)."
"03/06/2020","Elon, N.C.",NA,"4","top","1-3","Illinois","Elon","Aide singled through the left side, RBI (1-1 KB)3a Sarver advanced to second3a Comia scored."
"03/06/2020","Elon, N.C.",NA,"4","top","3-3","Illinois","Elon","McDonald doubled down the rf line, 2 RBI (3-2 BBBKF)3a Aide scored3a Sarver scored."
"03/06/2020","Elon, N.C.",NA,"4","top","3-3","Illinois","Elon","Campbell walked (3-2 BBBKKB)3a McDonald advanced to third on a passed ball."
"03/06/2020","Elon, N.C.",NA,"4","top","3-3","Illinois","Elon","Harding reached on a fielders choice (1-2 SFB)3a Campbell out at second ss unassisted."
"03/06/2020","Elon, N.C.",NA,"4","top","3-3","Illinois","Elon","Jackson grounded out to ss (1-1 KB)."
"03/06/2020","Elon, N.C.",NA,"4","bot","3-3","Elon","Illinois","Rybarczyk to p for Weber."
"03/06/2020","Elon, N.C.",NA,"4","bot","3-3","Elon","Illinois","Sponseller grounded out to 1b unassisted (3-1 BBBK)."
"03/06/2020","Elon, N.C.",NA,"4","bot","3-3","Elon","Illinois","Roberts singled through the right side (0-0)."
"03/06/2020","Elon, N.C.",NA,"4","bot","3-3","Elon","Illinois","Spurlin doubled down the lf line (0-0)3a Roberts advanced to third."
"03/06/2020","Elon, N.C.",NA,"4","bot","3-4","Elon","Illinois","Iadisernia grounded out to 2b, RBI (1-2 SBK)3a Spurlin advanced to third3a Roberts scored."
"03/06/2020","Elon, N.C.",NA,"4","bot","3-5","Elon","Illinois","Pico doubled to center field, out at third lf to ss to 3b, RBI (1-0 B)3a Spurlin scored."
"03/06/2020","Elon, N.C.",NA,"5","top","3-5","Illinois","Elon","Doligale grounded out to 2b (2-2 BKKB)."
"03/06/2020","Elon, N.C.",NA,"5","top","3-5","Illinois","Elon","Comia struck out swinging (1-2 BFFS)."
"03/06/2020","Elon, N.C.",NA,"5","top","3-5","Illinois","Elon","Sarver singled to center field (3-1 BBBK)."
"03/06/2020","Elon, N.C.",NA,"5","top","3-5","Illinois","Elon","Steinbach flied out to cf to right center (1-0 B)."
"03/06/2020","Elon, N.C.",NA,"5","bot","3-5","Elon","Illinois","Satterfield doubled to left field (2-0 BB)."
"03/06/2020","Elon, N.C.",NA,"5","bot","3-5","Elon","Illinois","Galason flied out to cf to left center (1-2 BKS)."
"03/06/2020","Elon, N.C.",NA,"5","bot","3-5","Elon","Illinois","Oldham grounded out to 1b unassisted (0-2 KS)3a Satterfield advanced to third."
"03/06/2020","Elon, N.C.",NA,"5","bot","3-5","Elon","Illinois","Cicci flied out to lf down the lf line (2-2 BFSB)."
"03/06/2020","Elon, N.C.",NA,"6","top","3-5","Illinois","Elon","Aide doubled to left field (1-0 B)."
"03/06/2020","Elon, N.C.",NA,"6","top","3-5","Illinois","Elon","McDonald walked (3-1 BBFBB)."
"03/06/2020","Elon, N.C.",NA,"6","top","3-5","Illinois","Elon","Greenler to p for Wetherbee."
"03/06/2020","Elon, N.C.",NA,"6","top","3-5","Illinois","Elon","Campbell out at first c to 2b, bunt, SAC (1-1 BS)3a McDonald advanced to second3a Aide advanced to third."
"03/06/2020","Elon, N.C.",NA,"6","top","4-5","Illinois","Elon","Harding reached on a fielders choice to first base, RBI (0-0)3a McDonald advanced to third3a Aide scored."
"03/06/2020","Elon, N.C.",NA,"6","top","5-5","Illinois","Elon","Jackson flied out to cf, SAC, RBI (3-2 FBFBBF)3a McDonald scored."
"03/06/2020","Elon, N.C.",NA,"6","top","6-5","Illinois","Elon","Doligale tripled down the rf line, RBI (2-1 BKB)3a Harding scored."
"03/06/2020","Elon, N.C.",NA,"6","top","6-5","Illinois","Elon","Comia walked (3-1 KBBBB)."
"03/06/2020","Elon, N.C.",NA,"6","top","6-5","Illinois","Elon","Sarver grounded out to 1b unassisted (0-1 S)."
"03/06/2020","Elon, N.C.",NA,"6","bot","6-5","Elon","Illinois","Sponseller walked (3-2 FBBBSB)."
"03/06/2020","Elon, N.C.",NA,"6","bot","6-5","Elon","Illinois","Stanley pinch ran for Sponseller."
"03/06/2020","Elon, N.C.",NA,"6","bot","6-5","Elon","Illinois","Stanley stole second."
"03/06/2020","Elon, N.C.",NA,"6","bot","6-6","Elon","Illinois","Roberts doubled to center field, RBI (3-1 BBBK)3a Stanley scored."
"03/06/2020","Elon, N.C.",NA,"6","bot","6-6","Elon","Illinois","Spurlin out at first p to 2b, bunt, SAC (3-1 BBBK)3a Roberts advanced to third."
"03/06/2020","Elon, N.C.",NA,"6","bot","6-7","Elon","Illinois","Iadisernia singled through the left side, RBI (0-0)3a Roberts scored."
"03/06/2020","Elon, N.C.",NA,"6","bot","6-7","Elon","Illinois","Iadisernia advanced to second on a wild pitch."
"03/06/2020","Elon, N.C.",NA,"6","bot","6-8","Elon","Illinois","Pico singled down the lf line, RBI (1-1 FB)3a Iadisernia scored."
"03/06/2020","Elon, N.C.",NA,"6","bot","6-8","Elon","Illinois","Kutt to p for Rybarczyk."
"03/06/2020","Elon, N.C.",NA,"6","bot","6-8","Elon","Illinois","Satterfield singled up the middle (2-2 BFBFF)3a Pico advanced to second."
"03/06/2020","Elon, N.C.",NA,"6","bot","6-10","Elon","Illinois","Galason doubled to right center, 2 RBI (0-0)3a Satterfield scored3a Pico scored."
"03/06/2020","Elon, N.C.",NA,"6","bot","6-10","Elon","Illinois","Cranston pinch ran for Galason."
"03/06/2020","Elon, N.C.",NA,"6","bot","6-10","Elon","Illinois","Oldham struck out swinging (1-2 BFKS)."
"03/06/2020","Elon, N.C.",NA,"6","bot","6-10","Elon","Illinois","Cicci struck out looking (1-2 FFBK)."
"03/06/2020","Elon, N.C.",NA,"7","top","6-10","Illinois","Elon","Iadisernia to rf."
"03/06/2020","Elon, N.C.",NA,"7","top","6-10","Illinois","Elon","Cranston to cf."
"03/06/2020","Elon, N.C.",NA,"7","top","6-10","Illinois","Elon","Stanley to lf."
"03/06/2020","Elon, N.C.",NA,"7","top","6-10","Illinois","Elon","McGowan pinch hit for Steinbach."
"03/06/2020","Elon, N.C.",NA,"7","top","6-10","Illinois","Elon","McGowan flied out to rf (3-2 KBSBBF)."
"03/06/2020","Elon, N.C.",NA,"7","top","6-10","Illinois","Elon","Aide grounded out to ss (1-2 BKSF)."
"03/06/2020","Elon, N.C.",NA,"7","top","6-10","Illinois","Elon","McDonald fouled out to 1b (2-2 BSFBF)."
"03/06/2020","Elon, N.C.",NA,"7","bot","6-10","Elon","Illinois","Stanley reached on an error by ss (2-1 BFB)."
"03/06/2020","Elon, N.C.",NA,"7","bot","6-10","Elon","Illinois","Stanley stole second."
"03/06/2020","Elon, N.C.",NA,"7","bot","6-10","Elon","Illinois","Roberts flied out to lf (0-1 K)3a Stanley advanced to third."
"03/06/2020","Elon, N.C.",NA,"7","bot","6-10","Elon","Illinois","Spurlin struck out swinging (3-2 BBBKKS)."
"03/06/2020","Elon, N.C.",NA,"7","bot","6-10","Elon","Illinois","Iadisernia lined out to rf (3-1 FBBB)."
"03/06/2020","Elon, N.C.",NA,"8","top","6-10","Illinois","Elon","Campbell grounded out to 3b (2-1 BBK)."
"03/06/2020","Elon, N.C.",NA,"8","top","6-10","Illinois","Elon","Harding fouled out to lf (2-1 BBK)."
"03/06/2020","Elon, N.C.",NA,"8","top","6-10","Illinois","Elon","Jackson fouled out to rf (1-0 B)."
"03/06/2020","Elon, N.C.",NA,"8","bot","6-10","Elon","Illinois","Vera to p for Kutt."
"03/06/2020","Elon, N.C.",NA,"8","bot","6-10","Elon","Illinois","Pico walked (3-2 BKKBBFB)."
"03/06/2020","Elon, N.C.",NA,"8","bot","6-10","Elon","Illinois","Satterfield reached on a fielders choice3a Pico out at second 2b to ss."
"03/06/2020","Elon, N.C.",NA,"8","bot","6-10","Elon","Illinois","Cranston singled, bunt (0-1 F)3a Satterfield advanced to second."
"03/06/2020","Elon, N.C.",NA,"8","bot","6-10","Elon","Illinois","Borucki pinch hit for Oldham."
"03/06/2020","Elon, N.C.",NA,"8","bot","6-10","Elon","Illinois","Borucki struck out swinging (1-2 KKBS)."
"03/06/2020","Elon, N.C.",NA,"8","bot","6-10","Elon","Illinois","Cicci grounded out to ss (2-1 FBB)."
"03/06/2020","Elon, N.C.",NA,"9","top","6-10","Illinois","Elon","Borucki to c."
"03/06/2020","Elon, N.C.",NA,"9","top","6-10","Illinois","Elon","Doligale singled up the middle (2-2 BKBK)."
"03/06/2020","Elon, N.C.",NA,"9","top","6-10","Illinois","Elon","Comia singled to right center (1-2 SKB)3a Doligale advanced to second."
"03/06/2020","Elon, N.C.",NA,"9","top","6-10","Illinois","Elon","Comia advanced to second on a wild pitch3a Doligale advanced to third on a wild pitch."
"03/06/2020","Elon, N.C.",NA,"9","top","6-10","Illinois","Elon","Sarver struck out swinging (2-2 KBSBS)."
"03/06/2020","Elon, N.C.",NA,"9","top","6-10","Illinois","Elon","Lorenz to p for Greenler."
"03/06/2020","Elon, N.C.",NA,"9","top","6-10","Illinois","Elon","McGowan walked (3-2 BBKBKB)."
"03/06/2020","Elon, N.C.",NA,"9","top","6-10","Illinois","Elon","Sprake to p for Lorenz."
"03/06/2020","Elon, N.C.",NA,"9","top","6-10","Illinois","Elon","Aide struck out swinging (0-2 FSS)."
"03/06/2020","Elon, N.C.",NA,"9","top","6-10","Illinois","Elon","McDonald struck out looking (0-2 KKK)."
