"date","location","attendance","inning","inning_top_bot","score","batting","fielding","description"
"02/19/2021","New Orleans",NA,"1","top","0-0","Louisiana","Tulane","Robertson, T grounded out to 3b (2-2 BKKB)."
"02/19/2021","New Orleans",NA,"1","top","0-0","Louisiana","Tulane","Kimple, Conn flied out to cf (3-2 KSBBBFF)."
"02/19/2021","New Orleans",NA,"1","top","0-0","Louisiana","Tulane","Fitzgerald,B grounded out to ss (2-1 SBB)."
"02/19/2021","New Orleans",NA,"1","bot","0-0","Tulane","Louisiana","E. GROFF fouled out to 1b (1-1 SB)."
"02/19/2021","New Orleans",NA,"1","bot","0-0","Tulane","Louisiana","C. BURNS walked (3-2 BFBSFBFB)."
"02/19/2021","New Orleans",NA,"1","bot","0-0","Tulane","Louisiana","MINDER grounded into double play ss to 2b to 1b (0-1 F)3a C. BURNS out on the play."
"02/19/2021","New Orleans",NA,"2","top","0-0","Louisiana","Tulane","Brandon, Jon struck out looking (2-2 SBKBFK)."
"02/19/2021","New Orleans",NA,"2","top","0-0","Louisiana","Tulane","Breaux, Bren grounded out to 3b (0-0)."
"02/19/2021","New Orleans",NA,"2","top","0-0","Louisiana","Tulane","Osborn, Drak grounded out to 3b (0-0)."
"02/19/2021","New Orleans",NA,"2","bot","0-0","Tulane","Louisiana","AVILES struck out swinging (2-2 BKBSS)."
"02/19/2021","New Orleans",NA,"2","bot","0-0","Tulane","Louisiana","STEVENS struck out swinging, out at first c to 1b (2-2 BKBKS)."
"02/19/2021","New Orleans",NA,"2","bot","0-0","Tulane","Louisiana","BURCHFIELD grounded out to ss (2-2 SBBSF)."
"02/19/2021","New Orleans",NA,"3","top","0-0","Louisiana","Tulane","Fitzgerald,K struck out swinging, out at first c to 1b (1-2 BKSS)."
"02/19/2021","New Orleans",NA,"3","top","0-0","Louisiana","Tulane","Riola, Sam singled to right field (0-0)."
"02/19/2021","New Orleans",NA,"3","top","0-0","Louisiana","Tulane","Roccaforte, struck out swinging (1-2 BSSS)."
"02/19/2021","New Orleans",NA,"3","top","0-0","Louisiana","Tulane","Robertson, T singled up the middle (0-2 SFFFF)3a Riola, Sam advanced to third."
"02/19/2021","New Orleans",NA,"3","top","0-0","Louisiana","Tulane","Robertson, T advanced to second on a wild pitch."
"02/19/2021","New Orleans",NA,"3","top","0-0","Louisiana","Tulane","Kimple, Conn walked (3-1 BFBBB)."
"02/19/2021","New Orleans",NA,"3","top","0-0","Louisiana","Tulane","Fitzgerald,B grounded out to c (3-2 BFSBFB)."
"02/19/2021","New Orleans",NA,"3","top","0-0","Louisiana","Tulane","H: 2 LOB: 3"
"02/19/2021","New Orleans",NA,"3","bot","0-0","Tulane","Louisiana","HASTINGS walked (3-1 BBFBB)."
"02/19/2021","New Orleans",NA,"3","bot","0-0","Tulane","Louisiana","BAUMGARDT struck out swinging (0-2 KKS)."
"02/19/2021","New Orleans",NA,"3","bot","0-0","Tulane","Louisiana","HART flied out to rf (1-0 B)."
"02/19/2021","New Orleans",NA,"3","bot","0-0","Tulane","Louisiana","E. GROFF lined out to lf (3-1 BBBK)."
"02/19/2021","New Orleans",NA,"3","top","0-0","Louisiana","Tulane","LOB: 1"
"02/19/2021","New Orleans",NA,"4","top","0-0","Louisiana","Tulane","Brandon, Jon grounded out to p (1-1 SB)."
"02/19/2021","New Orleans",NA,"4","top","0-0","Louisiana","Tulane","Breaux, Bren struck out swinging, grounded out to c unassisted (0-2 KSS)."
"02/19/2021","New Orleans",NA,"4","top","0-0","Louisiana","Tulane","Osborn, Drak struck out swinging (0-2 KKS)."
"02/19/2021","New Orleans",NA,"4","bot","0-0","Tulane","Louisiana","C. BURNS flied out to cf (0-0)."
"02/19/2021","New Orleans",NA,"4","bot","0-0","Tulane","Louisiana","MINDER singled to center field (1-0 B)."
"02/19/2021","New Orleans",NA,"4","bot","0-0","Tulane","Louisiana","AVILES struck out swinging (1-2 KBSS)3a MINDER out at second c to ss, caught stealing."
"02/19/2021","New Orleans",NA,"4","bot","0-0","Tulane","Louisiana","H: 1"
"02/19/2021","New Orleans",NA,"5","top","0-0","Louisiana","Tulane","Fitzgerald,K grounded out to p (1-2 SKB)."
"02/19/2021","New Orleans",NA,"5","top","0-0","Louisiana","Tulane","Riola, Sam grounded out to ss (1-2 BKS)."
"02/19/2021","New Orleans",NA,"5","top","0-0","Louisiana","Tulane","Roccaforte, singled to left field (3-2 BKSBB)."
"02/19/2021","New Orleans",NA,"5","top","0-0","Louisiana","Tulane","Robertson, T singled to third base (0-2 KF)3a Roccaforte, advanced to second."
"02/19/2021","New Orleans",NA,"5","top","0-0","Louisiana","Tulane","Kimple, Conn hit by pitch (0-0)3a Robertson, T advanced to second3a Roccaforte, advanced to third."
"02/19/2021","New Orleans",NA,"5","top","0-0","Louisiana","Tulane","Fitzgerald,B struck out looking (3-2 BBBKKK)."
"02/19/2021","New Orleans",NA,"5","top","0-0","Louisiana","Tulane","H: 2 LOB: 3"
"02/19/2021","New Orleans",NA,"5","bot","0-0","Tulane","Louisiana","STEVENS flied out to cf (1-2 SBK)."
"02/19/2021","New Orleans",NA,"5","bot","0-0","Tulane","Louisiana","BURCHFIELD struck out looking (2-2 SBBSFK)."
"02/19/2021","New Orleans",NA,"5","bot","0-0","Tulane","Louisiana","HASTINGS reached on catchers interference (0-1 F)."
"02/19/2021","New Orleans",NA,"5","bot","0-0","Tulane","Louisiana","BAUMGARDT grounded out to 1b unassisted (1-0 B)."
"02/19/2021","New Orleans",NA,"5","top","0-0","Louisiana","Tulane","E: 1 LOB: 1"
"02/19/2021","New Orleans",NA,"6","top","0-0","Louisiana","Tulane","Brandon, Jon struck out swinging (2-2 SKBBS)."
"02/19/2021","New Orleans",NA,"6","top","0-0","Louisiana","Tulane","Breaux, Bren singled to second base (3-1 BBBK)."
"02/19/2021","New Orleans",NA,"6","top","0-0","Louisiana","Tulane","SLAGEL to p for OLTHOFF."
"02/19/2021","New Orleans",NA,"6","top","0-0","Louisiana","Tulane","Breaux, Bren stole second."
"02/19/2021","New Orleans",NA,"6","top","0-0","Louisiana","Tulane","Osborn, Drak grounded out to p (3-2 BSKBFB)."
"02/19/2021","New Orleans",NA,"6","top","0-0","Louisiana","Tulane","Fitzgerald,K hit by pitch (0-1 F)."
"02/19/2021","New Orleans",NA,"6","top","0-0","Louisiana","Tulane","Riola, Sam reached on a fielders choice (1-1 FB)3a Fitzgerald,K out at second ss to 2b."
"02/19/2021","New Orleans",NA,"6","top","0-0","Louisiana","Tulane","H: 1 LOB: 2"
"02/19/2021","New Orleans",NA,"6","bot","0-0","Tulane","Louisiana","Talley, Bran to p for Durke, Hayde."
"02/19/2021","New Orleans",NA,"6","bot","0-0","Tulane","Louisiana","HART flied out to rf (0-0)."
"02/19/2021","New Orleans",NA,"6","bot","0-0","Tulane","Louisiana","E. GROFF flied out to rf (2-2 KBFFB)."
"02/19/2021","New Orleans",NA,"6","bot","0-0","Tulane","Louisiana","C. BURNS struck out swinging (0-2 KSS)."
"02/19/2021","New Orleans",NA,"7","top","0-0","Louisiana","Tulane","Roccaforte, grounded out to ss (2-2 BBKF)."
"02/19/2021","New Orleans",NA,"7","top","0-0","Louisiana","Tulane","Robertson, T struck out looking (1-2 SBFFFK)."
"02/19/2021","New Orleans",NA,"7","top","1-0","Louisiana","Tulane","Kimple, Conn homered to left field, RBI (0-0)."
"02/19/2021","New Orleans",NA,"7","top","1-0","Louisiana","Tulane","Fitzgerald,B struck out swinging (3-2 SBSBBS)."
"02/19/2021","New Orleans",NA,"7","bot","1-0","Tulane","Louisiana","MINDER doubled down the lf line (1-0 B)."
"02/19/2021","New Orleans",NA,"7","bot","1-0","Tulane","Louisiana","AVILES struck out looking (3-2 KBBBKK)."
"02/19/2021","New Orleans",NA,"7","bot","1-0","Tulane","Louisiana","STEVENS struck out swinging (0-2 KSS)."
"02/19/2021","New Orleans",NA,"7","bot","1-0","Tulane","Louisiana","Cooke, Conno to p for Talley, Bran."
"02/19/2021","New Orleans",NA,"7","bot","1-0","Tulane","Louisiana","BURCHFIELD walked (3-2 BBFBFB)."
"02/19/2021","New Orleans",NA,"7","bot","1-0","Tulane","Louisiana","BURCHFIELD advanced to second on a wild pitch3a MINDER advanced to third."
"02/19/2021","New Orleans",NA,"7","bot","1-0","Tulane","Louisiana","HASTINGS walked (3-0 BBBB)."
"02/19/2021","New Orleans",NA,"7","bot","1-1","Tulane","Louisiana","BAUMGARDT walked, RBI (3-0 BBBB)3a HASTINGS advanced to second3a BURCHFIELD advanced to third3a MINDER scored."
"02/19/2021","New Orleans",NA,"7","bot","1-1","Tulane","Louisiana","HART grounded out to 3b (0-0)."
"02/19/2021","New Orleans",NA,"8","top","1-1","Louisiana","Tulane","Brandon, Jon flied out to cf (1-1 BF)."
"02/19/2021","New Orleans",NA,"8","top","1-1","Louisiana","Tulane","Breaux, Bren grounded out to ss (0-1 F)."
"02/19/2021","New Orleans",NA,"8","top","1-1","Louisiana","Tulane","Osborn, Drak out at first 1b to p (1-0 B)."
"02/19/2021","New Orleans",NA,"8","bot","1-1","Tulane","Louisiana","E. GROFF struck out swinging (0-2 KKS)."
"02/19/2021","New Orleans",NA,"8","bot","1-1","Tulane","Louisiana","C. BURNS doubled down the lf line (2-1 BKB)."
"02/19/2021","New Orleans",NA,"8","bot","1-1","Tulane","Louisiana","MINDER out at first 1b to p (0-2 KS)3a C. BURNS advanced to third."
"02/19/2021","New Orleans",NA,"8","bot","1-1","Tulane","Louisiana","AVILES struck out looking (0-2 KSK)."
"02/19/2021","New Orleans",NA,"8","bot","1-1","Tulane","Louisiana","H: 1 LOB: 1"
"02/19/2021","New Orleans",NA,"9","top","1-1","Louisiana","Tulane","Fitzgerald,K grounded out to 2b (1-2 FBFF)."
"02/19/2021","New Orleans",NA,"9","top","1-1","Louisiana","Tulane","Riola, Sam struck out looking (3-2 SSBBBK)."
"02/19/2021","New Orleans",NA,"9","top","1-1","Louisiana","Tulane","Roccaforte, struck out swinging (2-2 FSBBS)."
"02/19/2021","New Orleans",NA,"9","bot","1-1","Tulane","Louisiana","STEVENS struck out looking (2-2 SSBBK)."
"02/19/2021","New Orleans",NA,"9","bot","1-1","Tulane","Louisiana","BURCHFIELD struck out swinging (1-2 BKSS)."
"02/19/2021","New Orleans",NA,"9","bot","1-1","Tulane","Louisiana","HASTINGS struck out swinging (2-2 KBSFBS)."
"02/19/2021","New Orleans",NA,"10","top","1-1","Louisiana","Tulane","Robertson, T grounded out to p (0-0)."
"02/19/2021","New Orleans",NA,"10","top","1-1","Louisiana","Tulane","Kimple, Conn singled through the left side (1-2 BKFFF)."
"02/19/2021","New Orleans",NA,"10","top","1-1","Louisiana","Tulane","CAMPBELL to p for SLAGEL."
"02/19/2021","New Orleans",NA,"10","top","1-1","Louisiana","Tulane","Kimple, Conn failed pickoff attempt, advanced to second on a throwing error by p."
"02/19/2021","New Orleans",NA,"10","top","1-1","Louisiana","Tulane","No play."
"02/19/2021","New Orleans",NA,"10","top","1-1","Louisiana","Tulane","Fitzgerald,B reached on a fielding error by p (1-1 KB)3a Kimple, Conn advanced to third."
"02/19/2021","New Orleans",NA,"10","top","1-1","Louisiana","Tulane","Catalano, An pinch ran for Fitzgerald,B."
"02/19/2021","New Orleans",NA,"10","top","1-1","Louisiana","Tulane","R. PRICE to p for CAMPBELL."
"02/19/2021","New Orleans",NA,"10","top","1-1","Louisiana","Tulane","Brandon, Jon hit by pitch (0-0)3a Catalano, An advanced to second."
"02/19/2021","New Orleans",NA,"10","top","2-1","Louisiana","Tulane","Breaux, Bren walked, RBI (3-2 BKBBFB)3a Brandon, Jon advanced to second3a Catalano, An advanced to third3a Kimple, Conn scored, unearned."
"02/19/2021","New Orleans",NA,"10","top","2-1","Louisiana","Tulane","Osborn, Drak hit into double play 3b to 1b (2-0 BB)3a Breaux, Bren advanced to second3a Brandon, Jon out on the play."
"02/19/2021","New Orleans",NA,"10","bot","2-1","Tulane","Louisiana","BAUMGARDT walked (3-1 BKBBB)."
"02/19/2021","New Orleans",NA,"10","bot","2-1","Tulane","Louisiana","BAUMGARDT advanced to second on a wild pitch."
"02/19/2021","New Orleans",NA,"10","bot","2-1","Tulane","Louisiana","HART walked (3-1 BBBKB)."
"02/19/2021","New Orleans",NA,"10","bot","2-1","Tulane","Louisiana","Wilson, Jeff to p for Cooke, Conno."
"02/19/2021","New Orleans",NA,"10","bot","2-1","Tulane","Louisiana","E. GROFF reached on a fielders choice, bunt (1-1 BK)3a HART advanced to second3a BAUMGARDT out at third c to 3b."
"02/19/2021","New Orleans",NA,"10","bot","2-1","Tulane","Louisiana","C. BURNS flied out to cf (0-0)."
"02/19/2021","New Orleans",NA,"10","bot","2-1","Tulane","Louisiana","MINDER walked (3-1 BBBFB)3a E. GROFF advanced to second3a HART advanced to third."
"02/19/2021","New Orleans",NA,"10","bot","2-3","Tulane","Louisiana","AVILES singled to left field, 2 RBI (1-1 BS)3a MINDER advanced to second3a E. GROFF scored3a HART scored."
