"date","location","attendance","inning","inning_top_bot","score","batting","fielding","description"
"03/28/2021","Macomb, Ill.",NA,"1","top","0-0","South Dakota St.","Western Ill.","Bellows struck out swinging, out at first c to 1b (0-2 KKS)."
"03/28/2021","Macomb, Ill.",NA,"1","top","0-0","South Dakota St.","Western Ill.","Ira flied out to lf (1-1 KB)."
"03/28/2021","Macomb, Ill.",NA,"1","top","0-0","South Dakota St.","Western Ill.","Andersen struck out swinging (1-2 KSBS)."
"03/28/2021","Macomb, Ill.",NA,"1","bot","0-0","Western Ill.","South Dakota St.","Raisbeck, K. struck out looking (3-2 KBBFBK)."
"03/28/2021","Macomb, Ill.",NA,"1","bot","0-0","Western Ill.","South Dakota St.","Schwartz, L. grounded out to p (2-1 BKB)."
"03/28/2021","Macomb, Ill.",NA,"1","bot","0-0","Western Ill.","South Dakota St.","Bauer, T. singled through the right side (1-2 FFBF)."
"03/28/2021","Macomb, Ill.",NA,"1","bot","0-0","Western Ill.","South Dakota St.","Dorethy, A. singled through the right side (1-2 BSS)3a Bauer, T. advanced to second."
"03/28/2021","Macomb, Ill.",NA,"1","bot","0-0","Western Ill.","South Dakota St.","VanDerGinst grounded out to 2b (1-2 KFB)."
"03/28/2021","Macomb, Ill.",NA,"1","bot","0-0","Western Ill.","South Dakota St.","H: 2 LOB: 2"
"03/28/2021","Macomb, Ill.",NA,"2","top","0-0","South Dakota St.","Western Ill.","Beazley struck out looking (3-2 BBBKSFK)."
"03/28/2021","Macomb, Ill.",NA,"2","top","0-0","South Dakota St.","Western Ill.","Frazier singled to center field (1-0 B)."
"03/28/2021","Macomb, Ill.",NA,"2","top","0-0","South Dakota St.","Western Ill.","Frazier stole second."
"03/28/2021","Macomb, Ill.",NA,"2","top","0-0","South Dakota St.","Western Ill.","Hackman struck out looking (3-2 KBKBBK)."
"03/28/2021","Macomb, Ill.",NA,"2","top","0-0","South Dakota St.","Western Ill.","Badger walked (3-2 BFBSFBB)."
"03/28/2021","Macomb, Ill.",NA,"2","top","0-0","South Dakota St.","Western Ill.","Sagedahl reached on an error by 3b (0-1 K)3a Badger advanced to second3a Frazier advanced to third."
"03/28/2021","Macomb, Ill.",NA,"2","top","0-0","South Dakota St.","Western Ill.","Stout grounded out to 1b unassisted (2-2 FBBF)."
"03/28/2021","Macomb, Ill.",NA,"2","top","0-0","South Dakota St.","Western Ill.","H: 1 E: 1 LOB: 3"
"03/28/2021","Macomb, Ill.",NA,"2","bot","0-0","Western Ill.","South Dakota St.","Allred, T. struck out swinging (2-2 BKBFS)."
"03/28/2021","Macomb, Ill.",NA,"2","bot","0-0","Western Ill.","South Dakota St.","Botaletto, D struck out swinging (1-2 SFBS)."
"03/28/2021","Macomb, Ill.",NA,"2","bot","0-0","Western Ill.","South Dakota St.","Juran, A. flied out to rf to right center (2-1 BKB)."
"03/28/2021","Macomb, Ill.",NA,"3","top","0-0","South Dakota St.","Western Ill.","Bellows struck out swinging, out at first c to 1b (1-2 BKKS)."
"03/28/2021","Macomb, Ill.",NA,"3","top","0-0","South Dakota St.","Western Ill.","Ira lined out to cf (0-0)."
"03/28/2021","Macomb, Ill.",NA,"3","top","0-0","South Dakota St.","Western Ill.","Andersen doubled to left center (1-1 BF)."
"03/28/2021","Macomb, Ill.",NA,"3","top","0-0","South Dakota St.","Western Ill.","Beazley struck out looking (1-2 SBSK)."
"03/28/2021","Macomb, Ill.",NA,"3","top","0-0","South Dakota St.","Western Ill.","H: 1 LOB: 1"
"03/28/2021","Macomb, Ill.",NA,"3","bot","0-0","Western Ill.","South Dakota St.","Sears, D. flied out to cf (0-1 K)."
"03/28/2021","Macomb, Ill.",NA,"3","bot","0-0","Western Ill.","South Dakota St.","Raisbeck, K. grounded out to 2b (0-1 K)."
"03/28/2021","Macomb, Ill.",NA,"3","bot","0-0","Western Ill.","South Dakota St.","Schwartz, L. singled to third base (0-0)."
"03/28/2021","Macomb, Ill.",NA,"3","bot","0-0","Western Ill.","South Dakota St.","Schwartz, L. stole second."
"03/28/2021","Macomb, Ill.",NA,"3","bot","0-0","Western Ill.","South Dakota St.","Bauer, T. struck out swinging, out at first c to 1b (3-2 KBKBBS)."
"03/28/2021","Macomb, Ill.",NA,"3","top","0-0","South Dakota St.","Western Ill.","H: 1 LOB: 1"
"03/28/2021","Macomb, Ill.",NA,"4","top","0-0","South Dakota St.","Western Ill.","Frazier flied out to lf (0-0)."
"03/28/2021","Macomb, Ill.",NA,"4","top","0-0","South Dakota St.","Western Ill.","Hackman struck out swinging (1-2 KBKS)."
"03/28/2021","Macomb, Ill.",NA,"4","top","0-0","South Dakota St.","Western Ill.","Badger flied out to cf to right center (3-2 KBFBB)."
"03/28/2021","Macomb, Ill.",NA,"4","bot","0-0","Western Ill.","South Dakota St.","Dorethy, A. out at first 1b to p (3-2 BBSBK)."
"03/28/2021","Macomb, Ill.",NA,"4","bot","0-0","Western Ill.","South Dakota St.","VanDerGinst struck out swinging (3-2 FBBKBS)."
"03/28/2021","Macomb, Ill.",NA,"4","bot","0-0","Western Ill.","South Dakota St.","Allred, T. lined out to cf (1-1 BK)."
"03/28/2021","Macomb, Ill.",NA,"5","top","0-0","South Dakota St.","Western Ill.","Sagedahl grounded out to 3b (2-2 BBKK)."
"03/28/2021","Macomb, Ill.",NA,"5","top","0-0","South Dakota St.","Western Ill.","Stout struck out swinging (0-2 KKS)."
"03/28/2021","Macomb, Ill.",NA,"5","top","0-0","South Dakota St.","Western Ill.","Bellows struck out swinging, out at first c to 1b (0-2 SFS)."
"03/28/2021","Macomb, Ill.",NA,"5","bot","0-0","Western Ill.","South Dakota St.","Botaletto, D grounded out to 2b (0-2 KF)."
"03/28/2021","Macomb, Ill.",NA,"5","bot","0-0","Western Ill.","South Dakota St.","Juran, A. hit by pitch (3-2 FBBFB)."
"03/28/2021","Macomb, Ill.",NA,"5","bot","0-0","Western Ill.","South Dakota St.","Sears, D. struck out looking (1-2 KBKK)."
"03/28/2021","Macomb, Ill.",NA,"5","bot","0-0","Western Ill.","South Dakota St.","Raisbeck, K. lined out to cf (2-1 BBK)."
"03/28/2021","Macomb, Ill.",NA,"5","bot","0-0","Western Ill.","South Dakota St.","LOB: 1"
"03/28/2021","Macomb, Ill.",NA,"6","top","0-0","South Dakota St.","Western Ill.","Ira flied out to cf (2-2 BBKFF)."
"03/28/2021","Macomb, Ill.",NA,"6","top","0-0","South Dakota St.","Western Ill.","Andersen walked (3-2 BFBBKB)."
"03/28/2021","Macomb, Ill.",NA,"6","top","0-0","South Dakota St.","Western Ill.","Beazley struck out swinging (1-2 KBKS)."
"03/28/2021","Macomb, Ill.",NA,"6","top","0-0","South Dakota St.","Western Ill.","Frazier flied out to rf (1-1 SB)."
"03/28/2021","Macomb, Ill.",NA,"6","top","0-0","South Dakota St.","Western Ill.","LOB: 1"
"03/28/2021","Macomb, Ill.",NA,"6","bot","0-0","Western Ill.","South Dakota St.","Schwartz, L. grounded out to c (0-0)."
"03/28/2021","Macomb, Ill.",NA,"6","bot","0-0","Western Ill.","South Dakota St.","Bauer, T. flied out to lf (0-1 F)."
"03/28/2021","Macomb, Ill.",NA,"6","bot","0-0","Western Ill.","South Dakota St.","Dorethy, A. out at first 1b to p (0-0)."
"03/28/2021","Macomb, Ill.",NA,"7","top","0-0","South Dakota St.","Western Ill.","Hackman hit by pitch (3-1 KBBB)."
"03/28/2021","Macomb, Ill.",NA,"7","top","0-0","South Dakota St.","Western Ill.","Badger doubled to center field (0-0)3a Hackman advanced to third."
"03/28/2021","Macomb, Ill.",NA,"7","top","3-0","South Dakota St.","Western Ill.","Sagedahl homered to right center, 3 RBI (0-0)3a Badger scored3a Hackman scored."
"03/28/2021","Macomb, Ill.",NA,"7","top","3-0","South Dakota St.","Western Ill.","Gray, J. to p for Raymond, B.."
"03/28/2021","Macomb, Ill.",NA,"7","top","3-0","South Dakota St.","Western Ill.","Stout popped up to 3b (2-2 KFBB)."
"03/28/2021","Macomb, Ill.",NA,"7","top","3-0","South Dakota St.","Western Ill.","Bellows flied out to rf (0-2 KF)."
"03/28/2021","Macomb, Ill.",NA,"7","top","3-0","South Dakota St.","Western Ill.","Ira lined out to 3b (3-1 BBSB)."
"03/28/2021","Macomb, Ill.",NA,"7","bot","3-0","Western Ill.","South Dakota St.","VanDerGinst tripled to center field (0-1 K)."
"03/28/2021","Macomb, Ill.",NA,"7","bot","3-1","Western Ill.","South Dakota St.","Allred, T. singled up the middle, RBI (0-2 KF)3a VanDerGinst scored."
"03/28/2021","Macomb, Ill.",NA,"7","bot","3-1","Western Ill.","South Dakota St.","Botaletto, D grounded out to c, SAC, bunt (1-0 B)3a Allred, T. advanced to second."
"03/28/2021","Macomb, Ill.",NA,"7","bot","3-1","Western Ill.","South Dakota St.","Juran, A. fouled out to rf (2-2 BBKF)3a Allred, T. advanced to third."
"03/28/2021","Macomb, Ill.",NA,"7","bot","3-1","Western Ill.","South Dakota St.","Barnett to p for Bishop."
"03/28/2021","Macomb, Ill.",NA,"7","bot","3-1","Western Ill.","South Dakota St.","Sears, D. walked (3-1 BBBKB)."
"03/28/2021","Macomb, Ill.",NA,"7","bot","3-2","Western Ill.","South Dakota St.","Sears, D. advanced to second3a Allred, T. scored on a wild pitch."
"03/28/2021","Macomb, Ill.",NA,"7","bot","3-2","Western Ill.","South Dakota St.","Sears, D. advanced to third on a passed ball."
"03/28/2021","Macomb, Ill.",NA,"7","bot","3-2","Western Ill.","South Dakota St.","Raisbeck, K. walked."
"03/28/2021","Macomb, Ill.",NA,"7","bot","3-2","Western Ill.","South Dakota St.","Raisbeck, K. stole second."
"03/28/2021","Macomb, Ill.",NA,"7","bot","3-2","Western Ill.","South Dakota St.","Schwartz, L. walked (3-1 BBBKB)."
"03/28/2021","Macomb, Ill.",NA,"7","bot","3-3","Western Ill.","South Dakota St.","Schwartz, L. advanced to second3a Raisbeck, K. advanced to third3a Sears, D. scored on a wild pitch, unearned."
"03/28/2021","Macomb, Ill.",NA,"7","bot","3-4","Western Ill.","South Dakota St.","Schwartz, L. advanced to third3a Raisbeck, K. scored on a wild pitch."
"03/28/2021","Macomb, Ill.",NA,"7","bot","3-5","Western Ill.","South Dakota St.","Bauer, T. singled to catcher, RBI (2-1 BBF)3a Schwartz, L. scored."
"03/28/2021","Macomb, Ill.",NA,"7","bot","3-5","Western Ill.","South Dakota St.","Dorethy, A. struck out swinging (1-2 KKBFFS)."
"03/28/2021","Macomb, Ill.",NA,"8","top","3-5","South Dakota St.","Western Ill.","Andersen flied out to cf (0-1 F)."
"03/28/2021","Macomb, Ill.",NA,"8","top","3-5","South Dakota St.","Western Ill.","Beazley struck out swinging (2-2 KBBFS)."
"03/28/2021","Macomb, Ill.",NA,"8","top","3-5","South Dakota St.","Western Ill.","Frazier doubled to left center (1-2 FBS)."
"03/28/2021","Macomb, Ill.",NA,"8","top","3-5","South Dakota St.","Western Ill.","McDonald pinch hit for Hackman."
"03/28/2021","Macomb, Ill.",NA,"8","top","5-5","South Dakota St.","Western Ill.","McDonald homered to right center, 2 RBI (0-2 KK)3a Frazier scored."
"03/28/2021","Macomb, Ill.",NA,"8","top","5-5","South Dakota St.","Western Ill.","Badger fouled out to rf (2-2 KBKBF)."
"03/28/2021","Macomb, Ill.",NA,"8","bot","5-5","Western Ill.","South Dakota St.","McDonald to c."
"03/28/2021","Macomb, Ill.",NA,"8","bot","5-5","Western Ill.","South Dakota St.","Sullivan to p for Barnett."
"03/28/2021","Macomb, Ill.",NA,"8","bot","5-5","Western Ill.","South Dakota St.","VanDerGinst doubled to right field (0-0)."
"03/28/2021","Macomb, Ill.",NA,"8","bot","5-5","Western Ill.","South Dakota St.","Allred, T. walked (3-0 BBBB)."
"03/28/2021","Macomb, Ill.",NA,"8","bot","5-5","Western Ill.","South Dakota St.","McSherry to p for Sullivan."
"03/28/2021","Macomb, Ill.",NA,"8","bot","5-5","Western Ill.","South Dakota St.","Botaletto, D struck out swinging (1-2 BKKS)."
"03/28/2021","Macomb, Ill.",NA,"8","bot","5-5","Western Ill.","South Dakota St.","Juran, A. flied out to cf (0-0)."
"03/28/2021","Macomb, Ill.",NA,"8","bot","5-5","Western Ill.","South Dakota St.","Sears, D. flied out to lf (2-0 BB)."
"03/28/2021","Macomb, Ill.",NA,"9","top","5-5","South Dakota St.","Western Ill.","Edwards, A. to p for Gray, J.."
"03/28/2021","Macomb, Ill.",NA,"9","top","5-5","South Dakota St.","Western Ill.","Sagedahl flied out to cf (1-0 B)."
"03/28/2021","Macomb, Ill.",NA,"9","top","5-5","South Dakota St.","Western Ill.","Stout flied out to cf (3-1 BFBB)."
"03/28/2021","Macomb, Ill.",NA,"9","top","5-5","South Dakota St.","Western Ill.","Bellows struck out looking (2-2 KBBFK)."
"03/28/2021","Macomb, Ill.",NA,"9","bot","5-5","Western Ill.","South Dakota St.","Badger to 1b."
"03/28/2021","Macomb, Ill.",NA,"9","bot","5-5","Western Ill.","South Dakota St.","Beazley to p for McSherry."
"03/28/2021","Macomb, Ill.",NA,"9","bot","5-5","Western Ill.","South Dakota St.","Anderson to cf for Beazley."
"03/28/2021","Macomb, Ill.",NA,"9","bot","5-5","Western Ill.","South Dakota St.","Badger to 1b."
"03/28/2021","Macomb, Ill.",NA,"9","bot","5-5","Western Ill.","South Dakota St.","No play."
"03/28/2021","Macomb, Ill.",NA,"9","bot","5-5","Western Ill.","South Dakota St.","Raisbeck, K. doubled down the rf line (1-2 BKS)."
"03/28/2021","Macomb, Ill.",NA,"9","bot","5-5","Western Ill.","South Dakota St.","Schwartz, L. out at first p to 2b, SAC, bunt (1-0 B)3a Raisbeck, K. advanced to third."
"03/28/2021","Macomb, Ill.",NA,"9","bot","5-5","Western Ill.","South Dakota St.","Bauer, T. intentionally walked."
"03/28/2021","Macomb, Ill.",NA,"9","bot","5-5","Western Ill.","South Dakota St.","Dorethy, A. grounded out to 1b unassisted (2-0 BB)3a Bauer, T. advanced to second."
"03/28/2021","Macomb, Ill.",NA,"9","bot","5-6","Western Ill.","South Dakota St.","VanDerGinst singled through the right side, RBI (1-1 KB)3a Bauer, T. advanced to third3a Raisbeck, K. scored."
"03/28/2021","Macomb, Ill.",NA,"9","bot","5-6","Western Ill.","South Dakota St.","R: 1 H: 2 LOB: 2"
