"date","location","attendance","inning","inning_top_bot","score","batting","fielding","description"
"03/09/2022","Orlando, Fla.",NA,"1","top","0-0","Florida A&M","UCF","Z. Burnham flied out to rf (1-2 KSB)."
"03/09/2022","Orlando, Fla.",NA,"1","top","0-0","Florida A&M","UCF","J. Pierini singled to right field (1-1 KB)."
"03/09/2022","Orlando, Fla.",NA,"1","top","0-0","Florida A&M","UCF","L. Bryant singled to right field (2-1 KBB)3a J. Pierini advanced to third."
"03/09/2022","Orlando, Fla.",NA,"1","top","0-0","Florida A&M","UCF","G. Rowell struck out swinging (1-2 KBKS)."
"03/09/2022","Orlando, Fla.",NA,"1","top","0-0","Florida A&M","UCF","G. Long popped up to 1b (0-2 KF)."
"03/09/2022","Orlando, Fla.",NA,"1","top","0-2","Florida A&M","UCF","H: 2 LOB: 2"
"03/09/2022","Orlando, Fla.",NA,"1","bot","0-0","UCF","Florida A&M","G. Pena tripled down the lf line (3-1 BFBB)."
"03/09/2022","Orlando, Fla.",NA,"1","bot","0-2","UCF","Florida A&M","A. Freeland homered to left center, 2 RBI (1-0 B)3a G. Pena scored."
"03/09/2022","Orlando, Fla.",NA,"1","bot","0-2","UCF","Florida A&M","B. McCabe singled to third base."
"03/09/2022","Orlando, Fla.",NA,"1","bot","0-2","UCF","Florida A&M","R. Wash popped up to 1b (2-0 BB)."
"03/09/2022","Orlando, Fla.",NA,"1","bot","0-2","UCF","Florida A&M","T. Taylor struck out looking (3-2 KSBBBK)3a B. McCabe stole second."
"03/09/2022","Orlando, Fla.",NA,"1","bot","0-2","UCF","Florida A&M","B. McCabe out at third c to 3b, caught stealing."
"03/09/2022","Orlando, Fla.",NA,"1","top","0-2","Florida A&M","UCF","R: 2 H: 3"
"03/09/2022","Orlando, Fla.",NA,"2","top","0-2","Florida A&M","UCF","E. Jenkins struck out swinging (1-2 KBSFS)."
"03/09/2022","Orlando, Fla.",NA,"2","top","0-2","Florida A&M","UCF","Haidermota struck out swinging (0-2 KKS)."
"03/09/2022","Orlando, Fla.",NA,"2","top","0-2","Florida A&M","UCF","R. Robinson grounded out to ss (2-2 BKKFBF)."
"03/09/2022","Orlando, Fla.",NA,"2","bot","0-2","UCF","Florida A&M","M. Brooks grounded out to ss (2-2 KBFBF)."
"03/09/2022","Orlando, Fla.",NA,"2","bot","0-2","UCF","Florida A&M","T. Josten doubled down the rf line (0-1 K)."
"03/09/2022","Orlando, Fla.",NA,"2","bot","0-2","UCF","Florida A&M","N. Orlando walked (3-1 BBFBB)."
"03/09/2022","Orlando, Fla.",NA,"2","bot","0-2","UCF","Florida A&M","N. Orlando advanced to second on a wild pitch3a T. Josten advanced to third on a wild pitch."
"03/09/2022","Orlando, Fla.",NA,"2","bot","0-2","UCF","Florida A&M","L. Boedicker walked (3-1 KBBBB)."
"03/09/2022","Orlando, Fla.",NA,"2","bot","0-2","UCF","Florida A&M","T. Langley to p for K. Wilson."
"03/09/2022","Orlando, Fla.",NA,"2","bot","0-2","UCF","Florida A&M","G. Pena grounded into double play 3b to 1b (0-0)3a N. Orlando out on the play."
"03/09/2022","Orlando, Fla.",NA,"2","bot","0-2","UCF","Florida A&M","H: 1 LOB: 2"
"03/09/2022","Orlando, Fla.",NA,"3","top","0-2","Florida A&M","UCF","E. Badger struck out swinging (1-2 BKSS)."
"03/09/2022","Orlando, Fla.",NA,"3","top","0-2","Florida A&M","UCF","Z. Burnham popped up to 2b (1-0 B)."
"03/09/2022","Orlando, Fla.",NA,"3","top","0-2","Florida A&M","UCF","J. Pierini walked (3-0 BBBB)."
"03/09/2022","Orlando, Fla.",NA,"3","top","0-2","Florida A&M","UCF","J. Pierini advanced to second on a passed ball."
"03/09/2022","Orlando, Fla.",NA,"3","top","1-2","Florida A&M","UCF","L. Bryant singled to center field, RBI (3-2 FBBBSFF)3a J. Pierini scored, unearned."
"03/09/2022","Orlando, Fla.",NA,"3","top","1-2","Florida A&M","UCF","L. Bryant stole second."
"03/09/2022","Orlando, Fla.",NA,"3","top","1-2","Florida A&M","UCF","G. Rowell lined out to cf (0-2 FS)."
"03/09/2022","Orlando, Fla.",NA,"3","bot","1-2","UCF","Florida A&M","A. Freeland doubled down the rf line (1-0 B)."
"03/09/2022","Orlando, Fla.",NA,"3","bot","1-2","UCF","Florida A&M","A. Freeland advanced to third on a wild pitch."
"03/09/2022","Orlando, Fla.",NA,"3","bot","1-2","UCF","Florida A&M","B. McCabe struck out swinging (1-2 KSBS)."
"03/09/2022","Orlando, Fla.",NA,"3","bot","1-2","UCF","Florida A&M","R. Wash struck out swinging (1-2 FBFS)."
"03/09/2022","Orlando, Fla.",NA,"3","bot","1-3","UCF","Florida A&M","T. Taylor singled up the middle, RBI (3-2 BSBKB)3a A. Freeland scored."
"03/09/2022","Orlando, Fla.",NA,"3","bot","1-3","UCF","Florida A&M","T. Taylor stole second."
"03/09/2022","Orlando, Fla.",NA,"3","bot","1-3","UCF","Florida A&M","M. Brooks walked (3-2 KBBBKB)."
"03/09/2022","Orlando, Fla.",NA,"3","bot","1-5","UCF","Florida A&M","T. Josten tripled to right center, 2 RBI3a M. Brooks scored3a T. Taylor scored."
"03/09/2022","Orlando, Fla.",NA,"3","bot","1-5","UCF","Florida A&M","N. Orlando struck out looking (1-2 KBKK)."
"03/09/2022","Orlando, Fla.",NA,"4","top","1-5","Florida A&M","UCF","J. Balzer to p for W. Saxton."
"03/09/2022","Orlando, Fla.",NA,"4","top","1-5","Florida A&M","UCF","G. Long singled to shortstop (0-0)."
"03/09/2022","Orlando, Fla.",NA,"4","top","1-5","Florida A&M","UCF","E. Jenkins walked (3-0 BBBB)3a G. Long advanced to second."
"03/09/2022","Orlando, Fla.",NA,"4","top","1-5","Florida A&M","UCF","Haidermota grounded into double play 3b to 2b to 1b (0-1 K)3a E. Jenkins out on the play3a G. Long advanced to third."
"03/09/2022","Orlando, Fla.",NA,"4","top","2-5","Florida A&M","UCF","G. Long scored on a passed ball, unearned."
"03/09/2022","Orlando, Fla.",NA,"4","top","2-5","Florida A&M","UCF","R. Robinson struck out swinging (3-2 SBBFFBS)."
"03/09/2022","Orlando, Fla.",NA,"4","bot","2-5","UCF","Florida A&M","R. Wagner to p for T. Langley."
"03/09/2022","Orlando, Fla.",NA,"4","bot","2-5","UCF","Florida A&M","L. Boedicker singled up the middle (3-2 KSBFBB)."
"03/09/2022","Orlando, Fla.",NA,"4","bot","2-5","UCF","Florida A&M","L. Boedicker advanced to second on a wild pitch."
"03/09/2022","Orlando, Fla.",NA,"4","bot","2-5","UCF","Florida A&M","G. Pena walked (3-2 KKFBBBB)."
"03/09/2022","Orlando, Fla.",NA,"4","bot","2-5","UCF","Florida A&M","A. Freeland reached on a fielder's choice (0-1 K)3a G. Pena out at second 2b to ss3a L. Boedicker advanced to third."
"03/09/2022","Orlando, Fla.",NA,"4","bot","2-7","UCF","Florida A&M","A. Freeland stole second, scored, unearned3a L. Boedicker scored on a throwing error by p, unearned."
"03/09/2022","Orlando, Fla.",NA,"4","bot","2-7","UCF","Florida A&M","B. McCabe struck out swinging (2-2 BBSSS)."
"03/09/2022","Orlando, Fla.",NA,"4","bot","2-7","UCF","Florida A&M","R. Wash struck out swinging (1-2 BKFS)."
"03/09/2022","Orlando, Fla.",NA,"5","top","2-7","Florida A&M","UCF","C. Crain to p for J. Balzer."
"03/09/2022","Orlando, Fla.",NA,"5","top","2-7","Florida A&M","UCF","E. Badger singled to center field (2-2 BKBK)."
"03/09/2022","Orlando, Fla.",NA,"5","top","2-7","Florida A&M","UCF","Z. Burnham lined out to cf (0-0)."
"03/09/2022","Orlando, Fla.",NA,"5","top","2-7","Florida A&M","UCF","J. Pierini doubled down the rf line (1-1 KB)3a E. Badger advanced to third."
"03/09/2022","Orlando, Fla.",NA,"5","top","3-7","Florida A&M","UCF","L. Bryant grounded out to 2b, RBI (1-2 KBK)3a J. Pierini advanced to third3a E. Badger scored."
"03/09/2022","Orlando, Fla.",NA,"5","top","4-7","Florida A&M","UCF","G. Rowell doubled to left center, RBI (0-0)3a J. Pierini scored."
"03/09/2022","Orlando, Fla.",NA,"5","top","4-7","Florida A&M","UCF","G. Long popped up to 2b (1-0 B)."
"03/09/2022","Orlando, Fla.",NA,"5","bot","4-7","UCF","Florida A&M","T. Taylor reached on an error by ss (0-1 F)."
"03/09/2022","Orlando, Fla.",NA,"5","bot","4-7","UCF","Florida A&M","T. Taylor advanced to second on a wild pitch, advanced to third."
"03/09/2022","Orlando, Fla.",NA,"5","bot","4-7","UCF","Florida A&M","M. Brooks grounded out to ss (3-1 BBBK)."
"03/09/2022","Orlando, Fla.",NA,"5","bot","4-8","UCF","Florida A&M","T. Taylor scored on a wild pitch, unearned."
"03/09/2022","Orlando, Fla.",NA,"5","bot","4-8","UCF","Florida A&M","T. Josten grounded out to 2b (2-2 BKBS)."
"03/09/2022","Orlando, Fla.",NA,"5","bot","4-8","UCF","Florida A&M","N. Orlando hit by pitch (1-0 B)."
"03/09/2022","Orlando, Fla.",NA,"5","bot","4-9","UCF","Florida A&M","L. Boedicker doubled to right center, RBI (2-1 BBK)3a N. Orlando scored, unearned."
"03/09/2022","Orlando, Fla.",NA,"5","bot","4-9","UCF","Florida A&M","G. Pena flied out to rf (1-1 BK)."
"03/09/2022","Orlando, Fla.",NA,"6","top","4-9","Florida A&M","UCF","E. Jenkins struck out swinging (2-2 BSFBS)."
"03/09/2022","Orlando, Fla.",NA,"6","top","4-9","Florida A&M","UCF","Haidermota struck out swinging (0-2 FKS)."
"03/09/2022","Orlando, Fla.",NA,"6","top","4-9","Florida A&M","UCF","B. Poppell pinch hit for R. Robinson."
"03/09/2022","Orlando, Fla.",NA,"6","top","4-9","Florida A&M","UCF","B. Poppell lined out to 2b (0-1 K)."
"03/09/2022","Orlando, Fla.",NA,"6","bot","4-9","UCF","Florida A&M","J. Niles to ss for B. Poppell."
"03/09/2022","Orlando, Fla.",NA,"6","bot","4-9","UCF","Florida A&M","T. Turner to p for R. Wagner."
"03/09/2022","Orlando, Fla.",NA,"6","bot","4-9","UCF","Florida A&M","T. Dunbar to c for E. Badger."
"03/09/2022","Orlando, Fla.",NA,"6","bot","4-9","UCF","Florida A&M","A. Freeland walked (3-2 BSBBFB)."
"03/09/2022","Orlando, Fla.",NA,"6","bot","4-9","UCF","Florida A&M","A. Freeland advanced to second on a passed ball."
"03/09/2022","Orlando, Fla.",NA,"6","bot","4-9","UCF","Florida A&M","B. McCabe walked (3-1 BBFBB)."
"03/09/2022","Orlando, Fla.",NA,"6","bot","4-9","UCF","Florida A&M","Z. Morea to p for T. Turner."
"03/09/2022","Orlando, Fla.",NA,"6","bot","4-10","UCF","Florida A&M","R. Wash singled to right field, RBI (1-0 B)3a B. McCabe advanced to second3a A. Freeland scored."
"03/09/2022","Orlando, Fla.",NA,"6","bot","4-10","UCF","Florida A&M","T. Taylor walked (3-2 BBBFKB)3a R. Wash advanced to second3a B. McCabe advanced to third."
"03/09/2022","Orlando, Fla.",NA,"6","bot","4-11","UCF","Florida A&M","M. Brooks walked, RBI (3-0 BBBB)3a T. Taylor advanced to second3a R. Wash advanced to third3a B. McCabe scored."
"03/09/2022","Orlando, Fla.",NA,"6","bot","4-11","UCF","Florida A&M","J. McCollum to p for Z. Morea."
"03/09/2022","Orlando, Fla.",NA,"6","bot","4-12","UCF","Florida A&M","T. Josten walked, RBI (3-0 BBBB)3a M. Brooks advanced to second3a T. Taylor advanced to third3a R. Wash scored."
"03/09/2022","Orlando, Fla.",NA,"6","bot","4-14","UCF","Florida A&M","N. Orlando doubled down the lf line, 2 RBI (1-0 B)3a T. Josten advanced to third3a M. Brooks scored3a T. Taylor scored."
"03/09/2022","Orlando, Fla.",NA,"6","bot","4-15","UCF","Florida A&M","L. Boedicker singled to left field, RBI (3-2 BBKFB)3a N. Orlando advanced to third3a T. Josten scored."
"03/09/2022","Orlando, Fla.",NA,"6","bot","4-15","UCF","Florida A&M","C. Russo pinch hit for G. Pena."
"03/09/2022","Orlando, Fla.",NA,"6","bot","4-16","UCF","Florida A&M","C. Russo singled to center field, advanced to second on an error by cf, RBI (1-1 KB)3a L. Boedicker advanced to third3a N. Orlando scored."
"03/09/2022","Orlando, Fla.",NA,"6","bot","4-16","UCF","Florida A&M","J. Montes pinch hit for A. Freeland."
"03/09/2022","Orlando, Fla.",NA,"6","bot","4-16","UCF","Florida A&M","J. Montes struck out swinging (2-2 KBKFFBS)."
"03/09/2022","Orlando, Fla.",NA,"6","bot","4-16","UCF","Florida A&M","B. Napier pinch hit for B. McCabe."
"03/09/2022","Orlando, Fla.",NA,"6","bot","4-16","UCF","Florida A&M","B. Napier struck out swinging, out at first c to 1b (3-2 BBBKSS)."
"03/09/2022","Orlando, Fla.",NA,"6","bot","4-16","UCF","Florida A&M","A. Sundean pinch hit for R. Wash."
"03/09/2022","Orlando, Fla.",NA,"6","bot","4-16","UCF","Florida A&M","A. Sundean hit by pitch (1-1 KB)."
"03/09/2022","Orlando, Fla.",NA,"6","bot","4-16","UCF","Florida A&M","T. Taylor struck out looking (2-2 BSSBK)."
"03/09/2022","Orlando, Fla.",NA,"6","bot","4-16","UCF","Florida A&M","R: 7 H: 4 E: 1 LOB: 3"
"03/09/2022","Orlando, Fla.",NA,"7","top","4-16","Florida A&M","UCF","C. Russo to 1b."
"03/09/2022","Orlando, Fla.",NA,"7","top","4-16","Florida A&M","UCF","J. Montes to 2b."
"03/09/2022","Orlando, Fla.",NA,"7","top","4-16","Florida A&M","UCF","R. Taylor to ss for B. Napier."
"03/09/2022","Orlando, Fla.",NA,"7","top","4-16","Florida A&M","UCF","A. Sundean to c."
"03/09/2022","Orlando, Fla.",NA,"7","top","4-16","Florida A&M","UCF","T. Taylor to cf."
"03/09/2022","Orlando, Fla.",NA,"7","top","4-16","Florida A&M","UCF","B. Rushing to 3b for M. Brooks."
"03/09/2022","Orlando, Fla.",NA,"7","top","4-16","Florida A&M","UCF","T. Josten to rf."
"03/09/2022","Orlando, Fla.",NA,"7","top","4-16","Florida A&M","UCF","J. Ambos to lf for N. Orlando."
"03/09/2022","Orlando, Fla.",NA,"7","top","4-16","Florida A&M","UCF","B. Napier to dh for R. Taylor."
"03/09/2022","Orlando, Fla.",NA,"7","top","4-16","Florida A&M","UCF","R. Taylor to ss for J. Ambos."
"03/09/2022","Orlando, Fla.",NA,"7","top","4-16","Florida A&M","UCF","J. Ambos to lf for L. Boedicker."
"03/09/2022","Orlando, Fla.",NA,"7","top","4-16","Florida A&M","UCF","L. Boedicker to dh."
"03/09/2022","Orlando, Fla.",NA,"7","top","4-16","Florida A&M","UCF","T. Dunbar struck out swinging (1-2 KBSS)."
"03/09/2022","Orlando, Fla.",NA,"7","top","4-16","Florida A&M","UCF","W. Brown pinch hit for Z. Burnham."
"03/09/2022","Orlando, Fla.",NA,"7","top","4-16","Florida A&M","UCF","W. Brown lined out to lf (2-2 BBSF)."
"03/09/2022","Orlando, Fla.",NA,"7","top","4-16","Florida A&M","UCF","J. Pierini grounded out to ss (1-2 KBS)."
"03/09/2022","Orlando, Fla.",NA,"7","bot","4-16","UCF","Florida A&M","W. Brown to cf."
"03/09/2022","Orlando, Fla.",NA,"7","bot","4-16","UCF","Florida A&M","B. Krizen to p for J. McCollum."
"03/09/2022","Orlando, Fla.",NA,"7","bot","4-16","UCF","Florida A&M","B. Rushing grounded out to ss (2-2 BBKK)."
"03/09/2022","Orlando, Fla.",NA,"7","bot","4-16","UCF","Florida A&M","T. Josten walked (3-1 BBKBB)."
"03/09/2022","Orlando, Fla.",NA,"7","bot","4-16","UCF","Florida A&M","R. Taylor singled to right field3a T. Josten advanced to second."
"03/09/2022","Orlando, Fla.",NA,"7","bot","4-16","UCF","Florida A&M","L. Boedicker out at first 1b to p (2-0 BB)3a R. Taylor advanced to second3a T. Josten advanced to third."
"03/09/2022","Orlando, Fla.",NA,"7","bot","4-18","UCF","Florida A&M","C. Russo singled, 2 RBI (2-0 BB)3a R. Taylor scored3a T. Josten scored."
"03/09/2022","Orlando, Fla.",NA,"7","bot","4-18","UCF","Florida A&M","J. Montes singled to right field (0-0)3a C. Russo advanced to second."
"03/09/2022","Orlando, Fla.",NA,"7","bot","4-18","UCF","Florida A&M","B. Napier struck out swinging (2-2 BBSFS)."
"03/09/2022","Orlando, Fla.",NA,"7","bot","4-18","UCF","Florida A&M","R: 2 H: 3 LOB: 2"
"03/09/2022","Orlando, Fla.",NA,"8","top","4-18","Florida A&M","UCF","J. Ambos to lf for L. Boedicker."
"03/09/2022","Orlando, Fla.",NA,"8","top","4-18","Florida A&M","UCF","L. Bryant struck out swinging (1-2 BSFS)."
"03/09/2022","Orlando, Fla.",NA,"8","top","4-18","Florida A&M","UCF","G. Rowell struck out swinging (1-2 SSBFS)."
"03/09/2022","Orlando, Fla.",NA,"8","top","4-18","Florida A&M","UCF","G. Long struck out swinging (1-2 BKFS)."
"03/09/2022","Orlando, Fla.",NA,"8","bot","4-18","UCF","Florida A&M","D. Tease to p for B. Krizen."
"03/09/2022","Orlando, Fla.",NA,"8","bot","4-18","UCF","Florida A&M","A. Sundean singled to left field (0-1 F)."
"03/09/2022","Orlando, Fla.",NA,"8","bot","4-18","UCF","Florida A&M","T. Taylor reached on a fielder's choice (0-1 K)3a A. Sundean out at second 2b to ss."
"03/09/2022","Orlando, Fla.",NA,"8","bot","4-18","UCF","Florida A&M","B. Rushing singled to left field (1-2 SBS)3a T. Taylor advanced to second."
"03/09/2022","Orlando, Fla.",NA,"8","bot","4-18","UCF","Florida A&M","T. Josten struck out looking (3-2 BFBFBFK)."
"03/09/2022","Orlando, Fla.",NA,"8","bot","4-18","UCF","Florida A&M","R. Taylor hit by pitch (0-0)3a B. Rushing advanced to second3a T. Taylor advanced to third."
"03/09/2022","Orlando, Fla.",NA,"8","bot","4-18","UCF","Florida A&M","J. Ambos grounded out to 2b (0-2 SF)."
"03/09/2022","Orlando, Fla.",NA,"8","bot","4-18","UCF","Florida A&M","H: 2 LOB: 3"
"03/09/2022","Orlando, Fla.",NA,"9","top","4-18","Florida A&M","UCF","J. Marlowe to p for C. Crain."
"03/09/2022","Orlando, Fla.",NA,"9","top","4-18","Florida A&M","UCF","E. Jenkins popped up to 2b (2-2 BSSFB)."
"03/09/2022","Orlando, Fla.",NA,"9","top","4-18","Florida A&M","UCF","Haidermota fouled out to 1b (2-2 FFBFFB)."
"03/09/2022","Orlando, Fla.",NA,"9","top","4-18","Florida A&M","UCF","J. Niles out at first ss to 2b (1-0 B)."
