"date","location","attendance","inning","inning_top_bot","score","batting","fielding","description"
"03/11/2022","Albuquerque, NM",NA,"1","top","0-0","Fresno St.","New Mexico","NEWTON, B. struck out swinging (1-2 FBSFFS)."
"03/11/2022","Albuquerque, NM",NA,"1","top","0-0","Fresno St.","New Mexico","KACHEL, A. grounded out to 1b unassisted (1-1 KB)."
"03/11/2022","Albuquerque, NM",NA,"1","top","0-0","Fresno St.","New Mexico","MORGAN, Z. grounded out to ss (0-1 K)."
"03/11/2022","Albuquerque, NM",NA,"1","bot","0-0","New Mexico","Fresno St.","RUSSELL, L. struck out swinging (2-2 BKSBS)."
"03/11/2022","Albuquerque, NM",NA,"1","bot","0-0","New Mexico","Fresno St.","LANDERS, K. flied out to lf (2-1 BFB)."
"03/11/2022","Albuquerque, NM",NA,"1","bot","0-0","New Mexico","Fresno St.","RUNION, B. reached on a fielding error by 2b (1-2 KFB)."
"03/11/2022","Albuquerque, NM",NA,"1","bot","0-0","New Mexico","Fresno St.","ASHBY, L. reached on a fielder's choice to shortstop (0-1 K); RUNION, B. out at second ss to 2b."
"03/11/2022","Albuquerque, NM",NA,"1","bot","0-0","New Mexico","Fresno St.","E: 1 LOB: 1"
"03/11/2022","Albuquerque, NM",NA,"2","top","0-0","Fresno St.","New Mexico","LUNA, I. popped up to ss (0-0)."
"03/11/2022","Albuquerque, NM",NA,"2","top","0-0","Fresno St.","New Mexico","LAUCK, J. singled to third base (1-1 KB)."
"03/11/2022","Albuquerque, NM",NA,"2","top","0-0","Fresno St.","New Mexico","GROTTO, M. reached on a fielder's choice to second base (0-1 K); LAUCK, J. out at second 2b unassisted."
"03/11/2022","Albuquerque, NM",NA,"2","top","0-0","Fresno St.","New Mexico","ALLEN, P. struck out swinging (2-2 KBBFFFFS)."
"03/11/2022","Albuquerque, NM",NA,"2","top","0-1","Fresno St.","New Mexico","H: 1 LOB: 1"
"03/11/2022","Albuquerque, NM",NA,"2","bot","0-0","New Mexico","Fresno St.","DAVID, J. grounded out to ss (0-0)."
"03/11/2022","Albuquerque, NM",NA,"2","bot","0-0","New Mexico","Fresno St.","CANO, W. struck out swinging (0-2 KKS)."
"03/11/2022","Albuquerque, NM",NA,"2","bot","0-0","New Mexico","Fresno St.","HOLTZ, C. singled through the left side (1-0 B)."
"03/11/2022","Albuquerque, NM",NA,"2","bot","0-1","New Mexico","Fresno St.","WEISSENBORN tripled to right field, RBI (1-1 BK); HOLTZ, C. scored."
"03/11/2022","Albuquerque, NM",NA,"2","bot","0-1","New Mexico","Fresno St.","SCHNEIDER, A lined out to p (2-0 BB)."
"03/11/2022","Albuquerque, NM",NA,"2","top","0-1","Fresno St.","New Mexico","R: 1 H: 2 LOB: 1"
"03/11/2022","Albuquerque, NM",NA,"3","top","0-1","Fresno St.","New Mexico","WINK, B. grounded out to ss (1-2 FBF)."
"03/11/2022","Albuquerque, NM",NA,"3","top","0-1","Fresno St.","New Mexico","THIMJON, N. lined out to ss (0-1 F)."
"03/11/2022","Albuquerque, NM",NA,"3","top","0-1","Fresno St.","New Mexico","NEWTON, B. struck out looking (2-2 BKBKK)."
"03/11/2022","Albuquerque, NM",NA,"3","bot","0-1","New Mexico","Fresno St.","RUSSELL, L. singled to shortstop (0-0)."
"03/11/2022","Albuquerque, NM",NA,"3","bot","0-1","New Mexico","Fresno St.","LANDERS, K. struck out looking (0-2 FKK)."
"03/11/2022","Albuquerque, NM",NA,"3","bot","0-1","New Mexico","Fresno St.","RUNION, B. singled to left field (1-1 BS); RUSSELL, L. advanced to second."
"03/11/2022","Albuquerque, NM",NA,"3","bot","0-2","New Mexico","Fresno St.","ASHBY, L. singled up the middle, RBI (0-1 K); RUNION, B. advanced to third; RUSSELL, L. scored."
"03/11/2022","Albuquerque, NM",NA,"3","bot","0-3","New Mexico","Fresno St.","DAVID, J. doubled to right field, RBI (2-0 BB); ASHBY, L. advanced to third; RUNION, B. scored."
"03/11/2022","Albuquerque, NM",NA,"3","bot","0-4","New Mexico","Fresno St.","CANO, W. flied out to rf, SF, RBI (0-1 K); DAVID, J. advanced to third; ASHBY, L. scored."
"03/11/2022","Albuquerque, NM",NA,"3","bot","0-5","New Mexico","Fresno St.","HOLTZ, C. reached on an error by rf, advanced to second (1-1 BK); DAVID, J. scored, unearned."
"03/11/2022","Albuquerque, NM",NA,"3","bot","0-5","New Mexico","Fresno St.","WEISSENBORN struck out swinging (1-2 BKSS)."
"03/11/2022","Albuquerque, NM",NA,"3","bot","0-5","New Mexico","Fresno St.","R: 4 H: 4 E: 1 LOB: 1"
"03/11/2022","Albuquerque, NM",NA,"4","top","0-5","Fresno St.","New Mexico","KACHEL, A. walked (3-2 BKBBKFB)."
"03/11/2022","Albuquerque, NM",NA,"4","top","0-5","Fresno St.","New Mexico","MORGAN, Z. grounded into double play ss to 2b to 1b (0-2 FS); KACHEL, A. out on the play."
"03/11/2022","Albuquerque, NM",NA,"4","top","0-5","Fresno St.","New Mexico","LUNA, I. doubled to right field (0-2 KS)."
"03/11/2022","Albuquerque, NM",NA,"4","top","1-5","Fresno St.","New Mexico","LAUCK, J. singled to center field, RBI (2-0 BB); LUNA, I. scored."
"03/11/2022","Albuquerque, NM",NA,"4","top","1-5","Fresno St.","New Mexico","LAUCK, J. stole second."
"03/11/2022","Albuquerque, NM",NA,"4","top","1-5","Fresno St.","New Mexico","GROTTO, M. popped up to ss (1-2 KKB)."
"03/11/2022","Albuquerque, NM",NA,"4","bot","1-5","New Mexico","Fresno St.","SCHNEIDER, A flied out to lf (1-2 BKSF)."
"03/11/2022","Albuquerque, NM",NA,"4","bot","1-5","New Mexico","Fresno St.","RUSSELL, L. tripled to right field (2-2 FFBB)."
"03/11/2022","Albuquerque, NM",NA,"4","bot","1-5","New Mexico","Fresno St.","LANDERS, K. grounded out to 3b (1-2 BKK)."
"03/11/2022","Albuquerque, NM",NA,"4","bot","1-5","New Mexico","Fresno St.","RUNION, B. flied out to cf (3-2 BBSBK)."
"03/11/2022","Albuquerque, NM",NA,"5","top","2-5","Fresno St.","New Mexico","ALLEN, P. homered to right field, RBI (1-2 KBKFF)."
"03/11/2022","Albuquerque, NM",NA,"5","top","2-5","Fresno St.","New Mexico","WINK, B. singled through the right side (3-2 FBSBB)."
"03/11/2022","Albuquerque, NM",NA,"5","top","2-5","Fresno St.","New Mexico","THIMJON, N. flied out to cf (2-1 BBK)."
"03/11/2022","Albuquerque, NM",NA,"5","top","2-5","Fresno St.","New Mexico","NEWTON, B. reached on a fielder's choice to second base (0-2 KK); WINK, B. out at second 2b to ss."
"03/11/2022","Albuquerque, NM",NA,"5","top","2-5","Fresno St.","New Mexico","NEWTON, B. stole second."
"03/11/2022","Albuquerque, NM",NA,"5","top","2-5","Fresno St.","New Mexico","KACHEL, A. flied out to cf (1-2 FKFB)."
"03/11/2022","Albuquerque, NM",NA,"5","bot","2-5","New Mexico","Fresno St.","ASHBY, L. grounded out to 2b (1-1 KB)."
"03/11/2022","Albuquerque, NM",NA,"5","bot","2-5","New Mexico","Fresno St.","DAVID, J. grounded out to 3b (2-1 FBB)."
"03/11/2022","Albuquerque, NM",NA,"5","bot","2-5","New Mexico","Fresno St.","CANO, W. singled up the middle (1-2 SSFB)."
"03/11/2022","Albuquerque, NM",NA,"5","bot","2-5","New Mexico","Fresno St.","HOLTZ, C. walked (3-1 BKBBB); CANO, W. advanced to second."
"03/11/2022","Albuquerque, NM",NA,"5","bot","2-5","New Mexico","Fresno St.","WEISSENBORN grounded out to ss (3-1 FBBB)."
"03/11/2022","Albuquerque, NM",NA,"6","top","2-5","Fresno St.","New Mexico","MORGAN, Z. singled through the right side (3-2 BKBKBF)."
"03/11/2022","Albuquerque, NM",NA,"6","top","2-5","Fresno St.","New Mexico","LUNA, I. doubled down the lf line (1-2 BSK); MORGAN, Z. advanced to third."
"03/11/2022","Albuquerque, NM",NA,"6","top","2-5","Fresno St.","New Mexico","LAUCK, J. flied out to cf (0-2 SS)."
"03/11/2022","Albuquerque, NM",NA,"6","top","3-5","Fresno St.","New Mexico","GROTTO, M. grounded out to ss, RBI (0-0); MORGAN, Z. scored."
"03/11/2022","Albuquerque, NM",NA,"6","top","3-5","Fresno St.","New Mexico","ALLEN, P. grounded out to 3b (3-2 KBBBK)."
"03/11/2022","Albuquerque, NM",NA,"6","bot","3-5","New Mexico","Fresno St.","SCHNEIDER, A singled to right field (1-1 KB)."
"03/11/2022","Albuquerque, NM",NA,"6","bot","3-5","New Mexico","Fresno St.","RUSSELL, L. struck out swinging (1-2 FBSFS)."
"03/11/2022","Albuquerque, NM",NA,"6","bot","3-5","New Mexico","Fresno St.","SCHNEIDER, A out at second c to ss, caught stealing."
"03/11/2022","Albuquerque, NM",NA,"6","bot","3-5","New Mexico","Fresno St.","LANDERS, K. struck out swinging (0-2 KKS)."
"03/11/2022","Albuquerque, NM",NA,"7","top","3-5","Fresno St.","New Mexico","MCBROOM, B. to p for EGLOFF, R.."
"03/11/2022","Albuquerque, NM",NA,"7","top","3-5","Fresno St.","New Mexico","WINK, B. flied out to cf (2-2 BFBSF)."
"03/11/2022","Albuquerque, NM",NA,"7","top","3-5","Fresno St.","New Mexico","THIMJON, N. lined out to cf (0-0)."
"03/11/2022","Albuquerque, NM",NA,"7","top","3-5","Fresno St.","New Mexico","NEWTON, B. grounded out to 1b unassisted, bunt (0-0)."
"03/11/2022","Albuquerque, NM",NA,"7","bot","3-5","New Mexico","Fresno St.","PRUHSMEIER,K to p for DIXON, J.."
"03/11/2022","Albuquerque, NM",NA,"7","bot","3-5","New Mexico","Fresno St.","RUNION, B. grounded out to ss (3-1 SBBB)."
"03/11/2022","Albuquerque, NM",NA,"7","bot","3-6","New Mexico","Fresno St.","ASHBY, L. homered down the rf line, RBI (3-2 BBKFFB)."
"03/11/2022","Albuquerque, NM",NA,"7","bot","3-6","New Mexico","Fresno St.","DAVID, J. doubled to left center (1-1 BK)."
"03/11/2022","Albuquerque, NM",NA,"7","bot","3-6","New Mexico","Fresno St.","CANO, W. flied out to lf (1-1 SB)."
"03/11/2022","Albuquerque, NM",NA,"7","bot","3-6","New Mexico","Fresno St.","HOLTZ, C. grounded out to 3b (1-2 KKBF)."
"03/11/2022","Albuquerque, NM",NA,"7","bot","3-6","New Mexico","Fresno St.","R: 1 H: 2 LOB: 1"
"03/11/2022","Albuquerque, NM",NA,"8","top","3-6","Fresno St.","New Mexico","KACHEL, A. singled to left center (2-1 SBB)."
"03/11/2022","Albuquerque, NM",NA,"8","top","3-6","Fresno St.","New Mexico","MORGAN, Z. reached on a fielder's choice to shortstop (2-2 BKKB); KACHEL, A. out at second ss to 2b."
"03/11/2022","Albuquerque, NM",NA,"8","top","3-6","Fresno St.","New Mexico","LUNA, I. singled to left center (0-0); MORGAN, Z. advanced to second."
"03/11/2022","Albuquerque, NM",NA,"8","top","3-6","Fresno St.","New Mexico","LAUCK, J. struck out swinging (3-2 FBBBFS)."
"03/11/2022","Albuquerque, NM",NA,"8","top","3-6","Fresno St.","New Mexico","GROTTO, M. grounded out to 3b (0-1 K)."
"03/11/2022","Albuquerque, NM",NA,"8","top","3-7","Fresno St.","New Mexico","H: 2 LOB: 2"
"03/11/2022","Albuquerque, NM",NA,"8","bot","3-6","New Mexico","Fresno St.","OTTINO, M. to p for PRUHSMEIER,K."
"03/11/2022","Albuquerque, NM",NA,"8","bot","3-6","New Mexico","Fresno St.","WEISSENBORN singled to right field (2-1 KBB)."
"03/11/2022","Albuquerque, NM",NA,"8","bot","3-6","New Mexico","Fresno St.","SCHNEIDER, A out at first p to 2b, SAC, bunt (0-0); WEISSENBORN advanced to second."
"03/11/2022","Albuquerque, NM",NA,"8","bot","3-7","New Mexico","Fresno St.","RUSSELL, L. reached on a fielding error by rf, advanced to second (1-1 KB); WEISSENBORN scored, unearned."
"03/11/2022","Albuquerque, NM",NA,"8","bot","3-7","New Mexico","Fresno St.","LANDERS, K. lined out to lf (0-2 KKF)."
"03/11/2022","Albuquerque, NM",NA,"8","bot","3-7","New Mexico","Fresno St.","RUNION, B. grounded out to ss (1-0 B)."
"03/11/2022","Albuquerque, NM",NA,"8","top","3-7","Fresno St.","New Mexico","R: 1 H: 1 E: 1 LOB: 1"
"03/11/2022","Albuquerque, NM",NA,"9","top","3-7","Fresno St.","New Mexico","ALLEN, P. singled to right field (0-2 KK)."
"03/11/2022","Albuquerque, NM",NA,"9","top","3-7","Fresno St.","New Mexico","WINK, B. grounded out to 3b (2-1 BBF); ALLEN, P. advanced to second."
"03/11/2022","Albuquerque, NM",NA,"9","top","3-7","Fresno St.","New Mexico","THIMJON, N. grounded out to 3b (0-0)."
"03/11/2022","Albuquerque, NM",NA,"9","top","3-7","Fresno St.","New Mexico","NEWTON, B. flied out to rf (0-0)."
"03/11/2022","Albuquerque, NM",NA,"9","top","3-7","Fresno St.","New Mexico","H: 1 LOB: 1"
