"date","location","attendance","inning","inning_top_bot","score","batting","fielding","description"
"03/25/2022","Andover, Mass.",NA,"1","top","0-0","Sacred Heart","Merrimack","Jordan, J. singled to center field."
"03/25/2022","Andover, Mass.",NA,"1","top","0-0","Sacred Heart","Merrimack","Mongelli, S. reached on a fielder's choice, out at first ss to 1b3a Jordan, J. advanced to second."
"03/25/2022","Andover, Mass.",NA,"1","top","0-0","Sacred Heart","Merrimack","Donnelly, R. reached on a fielder's choice, out at first p to 1b3a Jordan, J. advanced to third."
"03/25/2022","Andover, Mass.",NA,"1","top","0-0","Sacred Heart","Merrimack","Emerson, J. struck out swinging."
"03/25/2022","Andover, Mass.",NA,"1","top","0-0","Sacred Heart","Merrimack","H: 1 LOB: 1"
"03/25/2022","Andover, Mass.",NA,"1","bot","0-0","Merrimack","Sacred Heart","Haba, A reached on an error by ss."
"03/25/2022","Andover, Mass.",NA,"1","bot","0-0","Merrimack","Sacred Heart","Nelson, B grounded out to 2b3a Haba, A out at second ss unassisted."
"03/25/2022","Andover, Mass.",NA,"1","bot","0-0","Merrimack","Sacred Heart","Golankiewicz walked."
"03/25/2022","Andover, Mass.",NA,"1","bot","0-0","Merrimack","Sacred Heart","Skurbe, B singled3a Golankiewicz advanced to second."
"03/25/2022","Andover, Mass.",NA,"1","bot","0-0","Merrimack","Sacred Heart","Santarpia, S flied out to lf."
"03/25/2022","Andover, Mass.",NA,"1","top","0-0","Sacred Heart","Merrimack","H: 1 E: 1 LOB: 2"
"03/25/2022","Andover, Mass.",NA,"2","top","0-0","Sacred Heart","Merrimack","Sutherland flied out to cf."
"03/25/2022","Andover, Mass.",NA,"2","top","0-0","Sacred Heart","Merrimack","Farruggio, R struck out swinging."
"03/25/2022","Andover, Mass.",NA,"2","top","0-0","Sacred Heart","Merrimack","Hernandez, M struck out swinging."
"03/25/2022","Andover, Mass.",NA,"2","bot","0-0","Merrimack","Sacred Heart","Crowley, T flied out to rf."
"03/25/2022","Andover, Mass.",NA,"2","bot","0-0","Merrimack","Sacred Heart","Dolbashian flied out to cf."
"03/25/2022","Andover, Mass.",NA,"2","bot","0-0","Merrimack","Sacred Heart","Stadnicki, K doubled."
"03/25/2022","Andover, Mass.",NA,"2","bot","0-0","Merrimack","Sacred Heart","Elliott, S struck out swinging."
"03/25/2022","Andover, Mass.",NA,"2","bot","0-0","Merrimack","Sacred Heart","H: 1 LOB: 1"
"03/25/2022","Andover, Mass.",NA,"3","top","1-0","Sacred Heart","Merrimack","Schoen, S. homered, RBI."
"03/25/2022","Andover, Mass.",NA,"3","top","1-0","Sacred Heart","Merrimack","Fagan, T. grounded out to ss."
"03/25/2022","Andover, Mass.",NA,"3","top","1-0","Sacred Heart","Merrimack","Jordan, J. doubled."
"03/25/2022","Andover, Mass.",NA,"3","top","1-0","Sacred Heart","Merrimack","Mongelli, S. walked."
"03/25/2022","Andover, Mass.",NA,"3","top","2-0","Sacred Heart","Merrimack","Donnelly, R. doubled, RBI3a Mongelli, S. advanced to third3a Jordan, J. scored."
"03/25/2022","Andover, Mass.",NA,"3","top","2-0","Sacred Heart","Merrimack","Emerson, J. flied out to 1b."
"03/25/2022","Andover, Mass.",NA,"3","top","2-0","Sacred Heart","Merrimack","Sutherland flied out to cf."
"03/25/2022","Andover, Mass.",NA,"3","bot","2-0","Merrimack","Sacred Heart","Haba, A struck out swinging."
"03/25/2022","Andover, Mass.",NA,"3","bot","2-0","Merrimack","Sacred Heart","Nelson, B reached on an error by 3b."
"03/25/2022","Andover, Mass.",NA,"3","bot","2-0","Merrimack","Sacred Heart","Nelson, B advanced to second."
"03/25/2022","Andover, Mass.",NA,"3","bot","2-0","Merrimack","Sacred Heart","Golankiewicz flied out to 3b."
"03/25/2022","Andover, Mass.",NA,"3","bot","2-1","Merrimack","Sacred Heart","Skurbe, B reached on an error by 2b3a Nelson, B scored, unearned."
"03/25/2022","Andover, Mass.",NA,"3","bot","2-1","Merrimack","Sacred Heart","Santarpia, S struck out swinging."
"03/25/2022","Andover, Mass.",NA,"4","top","2-1","Sacred Heart","Merrimack","Farruggio, R struck out swinging."
"03/25/2022","Andover, Mass.",NA,"4","top","2-1","Sacred Heart","Merrimack","McGuire, T. pinch hit for Hernandez, M."
"03/25/2022","Andover, Mass.",NA,"4","top","2-1","Sacred Heart","Merrimack","McGuire, T. walked."
"03/25/2022","Andover, Mass.",NA,"4","top","2-1","Sacred Heart","Merrimack","Schoen, S. flied out to 2b."
"03/25/2022","Andover, Mass.",NA,"4","top","2-1","Sacred Heart","Merrimack","Fagan, T. singled3a McGuire, T. advanced to second."
"03/25/2022","Andover, Mass.",NA,"4","top","2-1","Sacred Heart","Merrimack","Jordan, J. struck out swinging."
"03/25/2022","Andover, Mass.",NA,"4","top","2-1","Sacred Heart","Merrimack","H: 1 LOB: 2"
"03/25/2022","Andover, Mass.",NA,"4","bot","2-1","Merrimack","Sacred Heart","Emerson, J. to 3b."
"03/25/2022","Andover, Mass.",NA,"4","bot","2-1","Merrimack","Sacred Heart","McGuire, T. to 2b."
"03/25/2022","Andover, Mass.",NA,"4","bot","2-1","Merrimack","Sacred Heart","Crowley, T grounded out to 3b."
"03/25/2022","Andover, Mass.",NA,"4","bot","2-1","Merrimack","Sacred Heart","Dolbashian flied out to cf."
"03/25/2022","Andover, Mass.",NA,"4","bot","2-1","Merrimack","Sacred Heart","Stadnicki, K struck out swinging."
"03/25/2022","Andover, Mass.",NA,"5","top","2-1","Sacred Heart","Merrimack","Mongelli, S. grounded out to 3b."
"03/25/2022","Andover, Mass.",NA,"5","top","2-1","Sacred Heart","Merrimack","Donnelly, R. walked."
"03/25/2022","Andover, Mass.",NA,"5","top","2-1","Sacred Heart","Merrimack","Donnelly, R. stole second."
"03/25/2022","Andover, Mass.",NA,"5","top","2-1","Sacred Heart","Merrimack","Emerson, J. grounded out to 2b3a Donnelly, R. advanced to third."
"03/25/2022","Andover, Mass.",NA,"5","top","2-1","Sacred Heart","Merrimack","Sutherland flied out to 1b."
"03/25/2022","Andover, Mass.",NA,"5","top","2-1","Sacred Heart","Merrimack","LOB: 1"
"03/25/2022","Andover, Mass.",NA,"5","bot","2-1","Merrimack","Sacred Heart","Elliott, S grounded out to 3b."
"03/25/2022","Andover, Mass.",NA,"5","bot","2-1","Merrimack","Sacred Heart","Haba, A walked."
"03/25/2022","Andover, Mass.",NA,"5","bot","2-1","Merrimack","Sacred Heart","Haba, A picked off, out at second p to 1b to 2b."
"03/25/2022","Andover, Mass.",NA,"5","bot","2-1","Merrimack","Sacred Heart","Nelson, B doubled to left field."
"03/25/2022","Andover, Mass.",NA,"5","bot","2-1","Merrimack","Sacred Heart","Golankiewicz grounded out to 1b unassisted."
"03/25/2022","Andover, Mass.",NA,"5","top","2-1","Sacred Heart","Merrimack","H: 1 LOB: 1"
"03/25/2022","Andover, Mass.",NA,"6","top","2-1","Sacred Heart","Merrimack","Farruggio, R struck out swinging."
"03/25/2022","Andover, Mass.",NA,"6","top","2-1","Sacred Heart","Merrimack","McGuire, T. flied out to lf."
"03/25/2022","Andover, Mass.",NA,"6","top","2-1","Sacred Heart","Merrimack","Schoen, S. grounded out to ss."
"03/25/2022","Andover, Mass.",NA,"6","bot","2-1","Merrimack","Sacred Heart","Skurbe, B grounded out to ss."
"03/25/2022","Andover, Mass.",NA,"6","bot","2-1","Merrimack","Sacred Heart","Santarpia, S struck out swinging."
"03/25/2022","Andover, Mass.",NA,"6","bot","2-1","Merrimack","Sacred Heart","Crowley, T reached on an error by 1b."
"03/25/2022","Andover, Mass.",NA,"6","bot","2-2","Merrimack","Sacred Heart","Dolbashian tripled to right field3a Crowley, T scored, unearned."
"03/25/2022","Andover, Mass.",NA,"6","bot","2-4","Merrimack","Sacred Heart","Stadnicki, K homered to right field, 2 RBI, unearned3a Dolbashian scored, unearned."
"03/25/2022","Andover, Mass.",NA,"6","bot","2-4","Merrimack","Sacred Heart","Elliott, S struck out swinging."
"03/25/2022","Andover, Mass.",NA,"6","bot","2-4","Merrimack","Sacred Heart","R: 3 H: 2 E: 1"
"03/25/2022","Andover, Mass.",NA,"7","top","2-4","Sacred Heart","Merrimack","Fagan, T. hit by pitch."
"03/25/2022","Andover, Mass.",NA,"7","top","2-4","Sacred Heart","Merrimack","Fagan, T. advanced to second."
"03/25/2022","Andover, Mass.",NA,"7","top","2-4","Sacred Heart","Merrimack","Jordan, J. singled to shortstop3a Fagan, T. advanced to third."
"03/25/2022","Andover, Mass.",NA,"7","top","3-4","Sacred Heart","Merrimack","Mongelli, S. flied out to cf, SAC, RBI3a Fagan, T. scored."
"03/25/2022","Andover, Mass.",NA,"7","top","3-4","Sacred Heart","Merrimack","Donnelly, R. doubled to right field3a Jordan, J. advanced to third."
"03/25/2022","Andover, Mass.",NA,"7","top","3-4","Sacred Heart","Merrimack","Howrigan, B to p for Villella, W."
"03/25/2022","Andover, Mass.",NA,"7","top","3-4","Sacred Heart","Merrimack","Emerson, J. walked."
"03/25/2022","Andover, Mass.",NA,"7","top","3-4","Sacred Heart","Merrimack","Collins, J to p for Howrigan, B."
"03/25/2022","Andover, Mass.",NA,"7","top","4-4","Sacred Heart","Merrimack","Sutherland walked, RBI3a Emerson, J. advanced to second3a Donnelly, R. advanced to third3a Jordan, J. scored."
"03/25/2022","Andover, Mass.",NA,"7","top","4-4","Sacred Heart","Merrimack","Pare, L to p for Collins, J."
"03/25/2022","Andover, Mass.",NA,"7","top","5-4","Sacred Heart","Merrimack","Farruggio, R reached on an error by ss, RBI3a Sutherland advanced to second3a Emerson, J. advanced to third3a Donnelly, R. scored."
"03/25/2022","Andover, Mass.",NA,"7","top","5-4","Sacred Heart","Merrimack","McGuire, T. hit into double play 2b to ss to 1b3a Farruggio, R out on the play."
"03/25/2022","Andover, Mass.",NA,"7","bot","5-4","Merrimack","Sacred Heart","Costello, C. to p for Jeter, C.."
"03/25/2022","Andover, Mass.",NA,"7","bot","5-4","Merrimack","Sacred Heart","Levito, J. to 2b for McGuire, T.."
"03/25/2022","Andover, Mass.",NA,"7","bot","5-4","Merrimack","Sacred Heart","Haba, A walked."
"03/25/2022","Andover, Mass.",NA,"7","bot","5-4","Merrimack","Sacred Heart","Nelson, B walked3a Haba, A advanced to second."
"03/25/2022","Andover, Mass.",NA,"7","bot","5-4","Merrimack","Sacred Heart","Attonito, M. to p for Costello, C.."
"03/25/2022","Andover, Mass.",NA,"7","bot","5-4","Merrimack","Sacred Heart","Golankiewicz hit by pitch3a Nelson, B advanced to second3a Haba, A advanced to third."
"03/25/2022","Andover, Mass.",NA,"7","bot","5-5","Merrimack","Sacred Heart","Haba, A scored on an error by c, unearned."
"03/25/2022","Andover, Mass.",NA,"7","bot","5-5","Merrimack","Sacred Heart","Golankiewicz advanced to second3a Nelson, B advanced to third."
"03/25/2022","Andover, Mass.",NA,"7","bot","5-5","Merrimack","Sacred Heart","Skurbe, B hit by pitch."
"03/25/2022","Andover, Mass.",NA,"7","bot","5-5","Merrimack","Sacred Heart","Babuschak, J to p for Attonito, M.."
"03/25/2022","Andover, Mass.",NA,"7","bot","5-6","Merrimack","Sacred Heart","Santarpia, S reached on a fielder's choice, out at first 3b to 1b, RBI3a Skurbe, B advanced to second3a Golankiewicz advanced to third3a Nelson, B scored."
"03/25/2022","Andover, Mass.",NA,"7","bot","5-6","Merrimack","Sacred Heart","Gentile, A to dh for Crowley, T."
"03/25/2022","Andover, Mass.",NA,"7","bot","5-6","Merrimack","Sacred Heart","Gentile, A struck out looking."
"03/25/2022","Andover, Mass.",NA,"7","bot","5-6","Merrimack","Sacred Heart","Dolbashian struck out swinging."
"03/25/2022","Andover, Mass.",NA,"8","top","5-6","Sacred Heart","Merrimack","Schoen, S. struck out swinging."
"03/25/2022","Andover, Mass.",NA,"8","top","5-6","Sacred Heart","Merrimack","Fagan, T. grounded out to 2b."
"03/25/2022","Andover, Mass.",NA,"8","top","5-6","Sacred Heart","Merrimack","Jordan, J. singled to center field."
"03/25/2022","Andover, Mass.",NA,"8","top","5-6","Sacred Heart","Merrimack","Jordan, J. stole second."
"03/25/2022","Andover, Mass.",NA,"8","top","5-6","Sacred Heart","Merrimack","Mongelli, S. grounded out to ss."
"03/25/2022","Andover, Mass.",NA,"8","top","5-6","Sacred Heart","Merrimack","H: 1 LOB: 1"
"03/25/2022","Andover, Mass.",NA,"8","bot","5-6","Merrimack","Sacred Heart","Stadnicki, K flied out to lf."
"03/25/2022","Andover, Mass.",NA,"8","bot","5-6","Merrimack","Sacred Heart","Elliott, S grounded out to p."
"03/25/2022","Andover, Mass.",NA,"8","bot","5-6","Merrimack","Sacred Heart","Haba, A flied out to rf."
"03/25/2022","Andover, Mass.",NA,"9","top","5-6","Sacred Heart","Merrimack","Kalantzakos to p for Pare, L."
"03/25/2022","Andover, Mass.",NA,"9","top","5-6","Sacred Heart","Merrimack","Donnelly, R. struck out looking."
"03/25/2022","Andover, Mass.",NA,"9","top","5-6","Sacred Heart","Merrimack","Emerson, J. walked."
"03/25/2022","Andover, Mass.",NA,"9","top","5-6","Sacred Heart","Merrimack","Emerson, J. stole second."
"03/25/2022","Andover, Mass.",NA,"9","top","5-6","Sacred Heart","Merrimack","Sutherland struck out swinging."
"03/25/2022","Andover, Mass.",NA,"9","top","5-6","Sacred Heart","Merrimack","Farruggio, R flied out to cf."
"03/25/2022","Andover, Mass.",NA,"9","top","5-6","Sacred Heart","Merrimack","LOB: 1"
