"date","location","attendance","inning","inning_top_bot","score","batting","fielding","description"
"04/09/2022","Hammond, La.",NA,"1","top","0-0","A&M-Corpus Christi","Southeastern La.","Markotic, L. struck out swinging (2-2 BFFBFS)."
"04/09/2022","Hammond, La.",NA,"1","top","0-0","A&M-Corpus Christi","Southeastern La.","Petkoff, B. struck out looking (1-2 KKBK)."
"04/09/2022","Hammond, La.",NA,"1","top","0-0","A&M-Corpus Christi","Southeastern La.","Caraway, J. struck out swinging (2-2 KFBBFFS)."
"04/09/2022","Hammond, La.",NA,"1","bot","0-0","Southeastern La.","A&M-Corpus Christi","Keller, E. fouled out to 1b (0-0)."
"04/09/2022","Hammond, La.",NA,"1","bot","0-0","Southeastern La.","A&M-Corpus Christi","Rosevear, R. hit by pitch (0-0)."
"04/09/2022","Hammond, La.",NA,"1","bot","0-0","Southeastern La.","A&M-Corpus Christi","Finke, T. walked (3-2 BKFBFFBB); Rosevear, R. advanced to second."
"04/09/2022","Hammond, La.",NA,"1","bot","0-0","Southeastern La.","A&M-Corpus Christi","Faulkner, P. flied out to rf (0-0)."
"04/09/2022","Hammond, La.",NA,"1","bot","0-0","Southeastern La.","A&M-Corpus Christi","Finke, T. advanced to second on a wild pitch; Rosevear, R. advanced to third."
"04/09/2022","Hammond, La.",NA,"1","bot","0-2","Southeastern La.","A&M-Corpus Christi","Thomas, S. singled to center field, 2 RBI (3-2 KFBFBBF); Finke, T. scored; Rosevear, R. scored."
"04/09/2022","Hammond, La.",NA,"1","bot","0-3","Southeastern La.","A&M-Corpus Christi","Leavengood tripled to right center, RBI (0-0); Thomas, S. scored."
"04/09/2022","Hammond, La.",NA,"1","bot","0-4","Southeastern La.","A&M-Corpus Christi","Leavengood scored on a wild pitch."
"04/09/2022","Hammond, La.",NA,"1","bot","0-4","Southeastern La.","A&M-Corpus Christi","Welch, T. flied out to cf (2-0 BB)."
"04/09/2022","Hammond, La.",NA,"1","bot","0-4","Southeastern La.","A&M-Corpus Christi","R: 4 H: 2"
"04/09/2022","Hammond, La.",NA,"2","top","0-4","A&M-Corpus Christi","Southeastern La.","Jones, T. singled to second base (0-0)."
"04/09/2022","Hammond, La.",NA,"2","top","0-4","A&M-Corpus Christi","Southeastern La.","Chijin, S. doubled to right field (0-1 F); Jones, T. advanced to third."
"04/09/2022","Hammond, La.",NA,"2","top","1-4","A&M-Corpus Christi","Southeastern La.","McEnroe, T. singled to second base, RBI (1-1 KB); Chijin, S. advanced to third; Jones, T. scored."
"04/09/2022","Hammond, La.",NA,"2","top","1-4","A&M-Corpus Christi","Southeastern La.","White, N. struck out swinging (2-2 BKBFS)."
"04/09/2022","Hammond, La.",NA,"2","top","2-4","A&M-Corpus Christi","Southeastern La.","Linneweber,T singled through the left side, RBI (0-2 FF); McEnroe, T. advanced to second; Chijin, S. scored."
"04/09/2022","Hammond, La.",NA,"2","top","2-4","A&M-Corpus Christi","Southeastern La.","Taylor, J. grounded into double play 3b to 2b to 1b (1-2 FBF); Linneweber,T out on the play."
"04/09/2022","Hammond, La.",NA,"2","bot","2-4","Southeastern La.","A&M-Corpus Christi","Garcia, C. hit by pitch (2-2 BBKF)."
"04/09/2022","Hammond, La.",NA,"2","bot","2-4","Southeastern La.","A&M-Corpus Christi","Grizzaffi, B popped up to 2b (2-2 KKBB)."
"04/09/2022","Hammond, La.",NA,"2","bot","2-4","Southeastern La.","A&M-Corpus Christi","Keller, E. singled to right center (1-1 BK); Garcia, C. advanced to third."
"04/09/2022","Hammond, La.",NA,"2","bot","2-5","Southeastern La.","A&M-Corpus Christi","Rosevear, R. out at first 1b to 2b, SAC, RBI (0-1 F); Keller, E. advanced to second; Garcia, C. scored."
"04/09/2022","Hammond, La.",NA,"2","bot","2-5","Southeastern La.","A&M-Corpus Christi","Finke, T. hit by pitch (3-2 FBBFBFF)."
"04/09/2022","Hammond, La.",NA,"2","bot","2-5","Southeastern La.","A&M-Corpus Christi","Miller, T. to p for Thomas, H.."
"04/09/2022","Hammond, La.",NA,"2","bot","2-5","Southeastern La.","A&M-Corpus Christi","Faulkner, P. walked (3-2 BBKSFBFB); Finke, T. advanced to second; Keller, E. advanced to third."
"04/09/2022","Hammond, La.",NA,"2","bot","2-5","Southeastern La.","A&M-Corpus Christi","Thomas, S. flied out to rf (0-1 K)."
"04/09/2022","Hammond, La.",NA,"3","top","2-5","A&M-Corpus Christi","Southeastern La.","Markotic, L. struck out swinging (0-2 FSS)."
"04/09/2022","Hammond, La.",NA,"3","top","2-5","A&M-Corpus Christi","Southeastern La.","Petkoff, B. flied out to rf (1-1 BF)."
"04/09/2022","Hammond, La.",NA,"3","top","2-5","A&M-Corpus Christi","Southeastern La.","Caraway, J. flied out to lf (0-1 S)."
"04/09/2022","Hammond, La.",NA,"3","bot","2-6","Southeastern La.","A&M-Corpus Christi","Leavengood homered to right field, RBI (1-0 B)."
"04/09/2022","Hammond, La.",NA,"3","bot","2-6","Southeastern La.","A&M-Corpus Christi","Welch, T. struck out looking (2-2 KSBFFBK)."
"04/09/2022","Hammond, La.",NA,"3","bot","2-6","Southeastern La.","A&M-Corpus Christi","Garcia, C. singled to shortstop (0-2 KFF)."
"04/09/2022","Hammond, La.",NA,"3","bot","2-6","Southeastern La.","A&M-Corpus Christi","Grizzaffi, B popped up to 2b (0-1 K)."
"04/09/2022","Hammond, La.",NA,"3","bot","2-6","Southeastern La.","A&M-Corpus Christi","Garcia, C. stole second."
"04/09/2022","Hammond, La.",NA,"3","bot","2-6","Southeastern La.","A&M-Corpus Christi","Garcia, C. out at second c to 3b to 2b."
"04/09/2022","Hammond, La.",NA,"3","bot","2-6","Southeastern La.","A&M-Corpus Christi","R: 1 H: 2"
"04/09/2022","Hammond, La.",NA,"4","top","2-6","A&M-Corpus Christi","Southeastern La.","Jones, T. walked (3-2 BBFBSB)."
"04/09/2022","Hammond, La.",NA,"4","top","2-6","A&M-Corpus Christi","Southeastern La.","Jones, T. advanced to second on a balk."
"04/09/2022","Hammond, La.",NA,"4","top","2-6","A&M-Corpus Christi","Southeastern La.","Chijin, S. singled through the left side, advanced to second on the throw (1-0 B); Jones, T. advanced to third."
"04/09/2022","Hammond, La.",NA,"4","top","2-6","A&M-Corpus Christi","Southeastern La.","McEnroe, T. struck out swinging (2-2 BFFBFS)."
"04/09/2022","Hammond, La.",NA,"4","top","4-6","A&M-Corpus Christi","Southeastern La.","White, N. singled to left center, 2 RBI (0-1 S); Chijin, S. scored; Jones, T. scored."
"04/09/2022","Hammond, La.",NA,"4","top","4-6","A&M-Corpus Christi","Southeastern La.","Linneweber,T popped up to 2b (0-0)."
"04/09/2022","Hammond, La.",NA,"4","top","4-6","A&M-Corpus Christi","Southeastern La.","Taylor, J. singled to shortstop (1-2 SSB); White, N. advanced to second."
"04/09/2022","Hammond, La.",NA,"4","top","4-6","A&M-Corpus Christi","Southeastern La.","Markotic, L. struck out swinging (3-2 SBBBKS)."
"04/09/2022","Hammond, La.",NA,"4","bot","4-6","Southeastern La.","A&M-Corpus Christi","Keller, E. flied out to lf (1-2 FKB)."
"04/09/2022","Hammond, La.",NA,"4","bot","4-6","Southeastern La.","A&M-Corpus Christi","Rosevear, R. singled to right center (1-2 KKBF)."
"04/09/2022","Hammond, La.",NA,"4","bot","4-6","Southeastern La.","A&M-Corpus Christi","Finke, T. singled to left field (0-2 KKFF); Rosevear, R. advanced to second."
"04/09/2022","Hammond, La.",NA,"4","bot","4-9","Southeastern La.","A&M-Corpus Christi","Faulkner, P. homered to left field, 3 RBI (0-2 FFF); Finke, T. scored; Rosevear, R. scored."
"04/09/2022","Hammond, La.",NA,"4","bot","4-9","Southeastern La.","A&M-Corpus Christi","Thomas, S. doubled down the lf line (1-1 FB)."
"04/09/2022","Hammond, La.",NA,"4","bot","4-9","Southeastern La.","A&M-Corpus Christi","Leavengood lined out to 1b (1-1 BS)."
"04/09/2022","Hammond, La.",NA,"4","bot","4-9","Southeastern La.","A&M-Corpus Christi","Welch, T. grounded out to p unassisted (1-0 B)."
"04/09/2022","Hammond, La.",NA,"5","top","4-9","A&M-Corpus Christi","Southeastern La.","Dugas, D. to p for Guth, A.."
"04/09/2022","Hammond, La.",NA,"5","top","4-9","A&M-Corpus Christi","Southeastern La.","Petkoff, B. grounded out to ss (0-0)."
"04/09/2022","Hammond, La.",NA,"5","top","4-9","A&M-Corpus Christi","Southeastern La.","Caraway, J. hit by pitch (3-2 BBKBF)."
"04/09/2022","Hammond, La.",NA,"5","top","6-9","A&M-Corpus Christi","Southeastern La.","Jones, T. homered to center field, 2 RBI (2-2 KBSFBFF); Caraway, J. scored."
"04/09/2022","Hammond, La.",NA,"5","top","6-9","A&M-Corpus Christi","Southeastern La.","Chijin, S. walked (3-1 BBBKB)."
"04/09/2022","Hammond, La.",NA,"5","top","6-9","A&M-Corpus Christi","Southeastern La.","McEnroe, T. struck out looking (3-2 BKBBKFFK)."
"04/09/2022","Hammond, La.",NA,"5","top","6-9","A&M-Corpus Christi","Southeastern La.","Puls, M. pinch hit for White, N.."
"04/09/2022","Hammond, La.",NA,"5","top","6-9","A&M-Corpus Christi","Southeastern La.","Puls, M. walked (3-0 BBBB); Chijin, S. advanced to second."
"04/09/2022","Hammond, La.",NA,"5","top","8-9","A&M-Corpus Christi","Southeastern La.","Linneweber,T tripled to right field, 2 RBI (2-1 BBK); Puls, M. scored; Chijin, S. scored."
"04/09/2022","Hammond, La.",NA,"5","top","8-9","A&M-Corpus Christi","Southeastern La.","Landry, A. to p for Dugas, D.."
"04/09/2022","Hammond, La.",NA,"5","top","8-9","A&M-Corpus Christi","Southeastern La.","Taylor, J. grounded out to 3b (0-0)."
"04/09/2022","Hammond, La.",NA,"5","bot","8-9","Southeastern La.","A&M-Corpus Christi","Chijin, S. to 3b."
"04/09/2022","Hammond, La.",NA,"5","bot","8-9","Southeastern La.","A&M-Corpus Christi","Puls, M. to 1b."
"04/09/2022","Hammond, La.",NA,"5","bot","8-9","Southeastern La.","A&M-Corpus Christi","Garcia, C. walked (3-0 BBBB)."
"04/09/2022","Hammond, La.",NA,"5","bot","8-9","Southeastern La.","A&M-Corpus Christi","Grizzaffi, B grounded out to 3b, SAC, bunt (1-1 BK); Garcia, C. advanced to second."
"04/09/2022","Hammond, La.",NA,"5","bot","8-9","Southeastern La.","A&M-Corpus Christi","Garcia, C. out at third ss to 3b."
"04/09/2022","Hammond, La.",NA,"5","bot","8-9","Southeastern La.","A&M-Corpus Christi","Keller, E. walked (3-2 KBKBFBB)."
"04/09/2022","Hammond, La.",NA,"5","bot","8-9","Southeastern La.","A&M-Corpus Christi","Purcell, C. to p for Miller, T.."
"04/09/2022","Hammond, La.",NA,"5","bot","8-9","Southeastern La.","A&M-Corpus Christi","Keller, E. advanced to second on an error by p, failed pickoff attempt, advanced to third."
"04/09/2022","Hammond, La.",NA,"5","bot","8-9","Southeastern La.","A&M-Corpus Christi","Rosevear, R. walked (3-2 KBBKBB)."
"04/09/2022","Hammond, La.",NA,"5","bot","8-9","Southeastern La.","A&M-Corpus Christi","Rosevear, R. stole second."
"04/09/2022","Hammond, La.",NA,"5","bot","8-9","Southeastern La.","A&M-Corpus Christi","Finke, T. flied out to rf (3-2 BSKBBF)."
"04/09/2022","Hammond, La.",NA,"6","top","8-9","A&M-Corpus Christi","Southeastern La.","Markotic, L. grounded out to ss (3-2 BBBKFFF)."
"04/09/2022","Hammond, La.",NA,"6","top","9-9","A&M-Corpus Christi","Southeastern La.","Petkoff, B. homered to right center, RBI (1-0 B)."
"04/09/2022","Hammond, La.",NA,"6","top","9-9","A&M-Corpus Christi","Southeastern La.","Caraway, J. struck out looking (2-2 BSBFK)."
"04/09/2022","Hammond, La.",NA,"6","top","9-9","A&M-Corpus Christi","Southeastern La.","Jones, T. walked (3-1 BBKBB)."
"04/09/2022","Hammond, La.",NA,"6","top","9-9","A&M-Corpus Christi","Southeastern La.","Chijin, S. flied out to cf (1-1 BK)."
"04/09/2022","Hammond, La.",NA,"6","bot","9-9","Southeastern La.","A&M-Corpus Christi","Faulkner, P. singled to center field (3-2 BBSFB)."
"04/09/2022","Hammond, La.",NA,"6","bot","9-9","Southeastern La.","A&M-Corpus Christi","Thomas, S. singled to left center (1-0 B); Faulkner, P. advanced to second."
"04/09/2022","Hammond, La.",NA,"6","bot","9-9","Southeastern La.","A&M-Corpus Christi","Leavengood grounded out to p (1-0 B); Thomas, S. advanced to second; Faulkner, P. advanced to third."
"04/09/2022","Hammond, La.",NA,"6","bot","9-9","Southeastern La.","A&M-Corpus Christi","Welch, T. walked (3-2 BBKBFFFFB)."
"04/09/2022","Hammond, La.",NA,"6","bot","9-10","Southeastern La.","A&M-Corpus Christi","Garcia, C. grounded out to 1b unassisted, RBI (3-1 SBBB); Welch, T. advanced to second; Thomas, S. advanced to third; Faulkner, P. scored."
"04/09/2022","Hammond, La.",NA,"6","bot","9-10","Southeastern La.","A&M-Corpus Christi","Grizzaffi, B flied out to cf (3-2 BBSKBF)."
"04/09/2022","Hammond, La.",NA,"7","top","9-10","A&M-Corpus Christi","Southeastern La.","Robb, H. to p for Landry, A.."
"04/09/2022","Hammond, La.",NA,"7","top","9-10","A&M-Corpus Christi","Southeastern La.","McEnroe, T. struck out looking (0-2 KKK)."
"04/09/2022","Hammond, La.",NA,"7","top","9-10","A&M-Corpus Christi","Southeastern La.","Puls, M. flied out to cf (2-0 BB)."
"04/09/2022","Hammond, La.",NA,"7","top","9-10","A&M-Corpus Christi","Southeastern La.","Linneweber,T singled to left field (2-2 BBKKFFF)."
"04/09/2022","Hammond, La.",NA,"7","top","9-10","A&M-Corpus Christi","Southeastern La.","Taylor, J. walked (3-1 BBKBB); Linneweber,T advanced to second."
"04/09/2022","Hammond, La.",NA,"7","top","9-10","A&M-Corpus Christi","Southeastern La.","Markotic, L. walked (3-1 BKBBB); Taylor, J. advanced to second; Linneweber,T advanced to third."
"04/09/2022","Hammond, La.",NA,"7","top","9-10","A&M-Corpus Christi","Southeastern La.","Petkoff, B. grounded out to 1b unassisted (1-2 KBK)."
"04/09/2022","Hammond, La.",NA,"7","top","9-10","A&M-Corpus Christi","Southeastern La.","H: 1 LOB: 3"
"04/09/2022","Hammond, La.",NA,"7","bot","9-10","Southeastern La.","A&M-Corpus Christi","Shy, C. to p for Purcell, C.."
"04/09/2022","Hammond, La.",NA,"7","bot","9-10","Southeastern La.","A&M-Corpus Christi","Keller, E. reached on a fielding error by 1b (1-1 KB)."
"04/09/2022","Hammond, La.",NA,"7","bot","9-10","Southeastern La.","A&M-Corpus Christi","Rosevear, R. reached on a fielder's choice (0-1 K); Keller, E. out at second 2b to ss."
"04/09/2022","Hammond, La.",NA,"7","bot","9-10","Southeastern La.","A&M-Corpus Christi","Finke, T. grounded out to p, SAC, bunt (0-0); Rosevear, R. advanced to second."
"04/09/2022","Hammond, La.",NA,"7","bot","9-10","Southeastern La.","A&M-Corpus Christi","Faulkner, P. intentionally walked."
"04/09/2022","Hammond, La.",NA,"7","bot","9-10","Southeastern La.","A&M-Corpus Christi","Thomas, S. reached on a fielder's choice (0-1 S); Faulkner, P. out at second ss to 2b."
"04/09/2022","Hammond, La.",NA,"7","top","9-10","A&M-Corpus Christi","Southeastern La.","E: 1 LOB: 2"
"04/09/2022","Hammond, La.",NA,"8","top","9-10","A&M-Corpus Christi","Southeastern La.","Trahan, G. to p for Robb, H.."
"04/09/2022","Hammond, La.",NA,"8","top","9-10","A&M-Corpus Christi","Southeastern La.","Salvaggio, T to 2b for Rosevear, R.."
"04/09/2022","Hammond, La.",NA,"8","top","9-10","A&M-Corpus Christi","Southeastern La.","Caraway, J. struck out looking (3-2 BBBKKFK)."
"04/09/2022","Hammond, La.",NA,"8","top","9-10","A&M-Corpus Christi","Southeastern La.","Jones, T. struck out swinging (2-2 BKSBS)."
"04/09/2022","Hammond, La.",NA,"8","top","9-10","A&M-Corpus Christi","Southeastern La.","Chijin, S. hit by pitch (0-0)."
"04/09/2022","Hammond, La.",NA,"8","top","9-10","A&M-Corpus Christi","Southeastern La.","McEnroe, T. grounded out to 3b (1-2 KBKF)."
"04/09/2022","Hammond, La.",NA,"8","top","9-12","A&M-Corpus Christi","Southeastern La.","LOB: 1"
"04/09/2022","Hammond, La.",NA,"8","bot","9-10","Southeastern La.","A&M-Corpus Christi","Leavengood out at first 1b to p (0-2 FK)."
"04/09/2022","Hammond, La.",NA,"8","bot","9-10","Southeastern La.","A&M-Corpus Christi","Welch, T. out at first 1b to p (0-0)."
"04/09/2022","Hammond, La.",NA,"8","bot","9-10","Southeastern La.","A&M-Corpus Christi","Garcia, C. walked (3-1 BBKBB)."
"04/09/2022","Hammond, La.",NA,"8","bot","9-11","Southeastern La.","A&M-Corpus Christi","Grizzaffi, B doubled to left center, RBI (0-1 K); Garcia, C. scored."
"04/09/2022","Hammond, La.",NA,"8","bot","9-11","Southeastern La.","A&M-Corpus Christi","Grizzaffi, B advanced to third on a wild pitch."
"04/09/2022","Hammond, La.",NA,"8","bot","9-11","Southeastern La.","A&M-Corpus Christi","Keller, E. walked (3-1 KBBBB)."
"04/09/2022","Hammond, La.",NA,"8","bot","9-11","Southeastern La.","A&M-Corpus Christi","Moeller, JT. to p for Shy, C.."
"04/09/2022","Hammond, La.",NA,"8","bot","9-12","Southeastern La.","A&M-Corpus Christi","Keller, E. stole second; Grizzaffi, B stole home."
"04/09/2022","Hammond, La.",NA,"8","bot","9-12","Southeastern La.","A&M-Corpus Christi","Salvaggio, T struck out swinging (3-2 KKBBFFBFS)."
"04/09/2022","Hammond, La.",NA,"8","top","9-12","A&M-Corpus Christi","Southeastern La.","R: 2 H: 1 LOB: 1"
"04/09/2022","Hammond, La.",NA,"9","top","9-12","A&M-Corpus Christi","Southeastern La.","Puls, M. hit by pitch (2-2 SSBFBF)."
"04/09/2022","Hammond, La.",NA,"9","top","9-12","A&M-Corpus Christi","Southeastern La.","Linneweber,T struck out looking (2-2 KFBFBK)."
"04/09/2022","Hammond, La.",NA,"9","top","9-12","A&M-Corpus Christi","Southeastern La.","Modgling, C. pinch hit for Taylor, J.."
"04/09/2022","Hammond, La.",NA,"9","top","9-12","A&M-Corpus Christi","Southeastern La.","Modgling, C. flied out to rf (0-1 K)."
"04/09/2022","Hammond, La.",NA,"9","top","9-12","A&M-Corpus Christi","Southeastern La.","Puls, M. advanced to second on a wild pitch."
"04/09/2022","Hammond, La.",NA,"9","top","9-12","A&M-Corpus Christi","Southeastern La.","Markotic, L. grounded out to 1b unassisted (2-2 KBBS)."
"04/09/2022","Hammond, La.",NA,"9","top","9-12","A&M-Corpus Christi","Southeastern La.","LOB: 1"
