"date","location","attendance","inning","inning_top_bot","score","batting","fielding","description"
"04/19/2022","Auburn, Ala.",NA,"1","top","0-0","Alabama St.","Auburn","King, C. struck out looking (2-2 FBSFFFBK)."
"04/19/2022","Auburn, Ala.",NA,"1","top","0-0","Alabama St.","Auburn","Espinal, D. struck out looking (2-2 BSSBFK)."
"04/19/2022","Auburn, Ala.",NA,"1","top","0-0","Alabama St.","Auburn","DeGuzman, C. struck out swinging (0-2 KKS)."
"04/19/2022","Auburn, Ala.",NA,"1","bot","0-0","Auburn","Alabama St.","Rambusch, B. struck out swinging (2-2 BKFBS)."
"04/19/2022","Auburn, Ala.",NA,"1","bot","0-0","Auburn","Alabama St.","Howell, K. hit by pitch (0-0)."
"04/19/2022","Auburn, Ala.",NA,"1","bot","0-1","Auburn","Alabama St.","DiChiara, S. doubled to left center, RBI (0-1 K); Howell, K. scored."
"04/19/2022","Auburn, Ala.",NA,"1","bot","0-1","Auburn","Alabama St.","Carlson, B. flied out to rf (0-1 K); DiChiara, S. advanced to third."
"04/19/2022","Auburn, Ala.",NA,"1","bot","0-1","Auburn","Alabama St.","Moore, B. grounded out to ss (2-0 BB)."
"04/19/2022","Auburn, Ala.",NA,"1","bot","0-1","Auburn","Alabama St.","R: 1 H: 1 LOB: 1"
"04/19/2022","Auburn, Ala.",NA,"2","top","0-1","Alabama St.","Auburn","May, H. struck out swinging (1-2 BKKS)."
"04/19/2022","Auburn, Ala.",NA,"2","top","0-1","Alabama St.","Auburn","Lopez, C. grounded out to 2b (2-1 KBB)."
"04/19/2022","Auburn, Ala.",NA,"2","top","0-1","Alabama St.","Auburn","Jamison, T. grounded out to 3b (1-1 BF)."
"04/19/2022","Auburn, Ala.",NA,"2","bot","0-1","Auburn","Alabama St.","Peirce, B. walked (3-0 BBBB)."
"04/19/2022","Auburn, Ala.",NA,"2","bot","0-1","Auburn","Alabama St.","Dyal, R. popped up to 2b (0-1 S)."
"04/19/2022","Auburn, Ala.",NA,"2","bot","0-1","Auburn","Alabama St.","Peirce, B. advanced to second on a wild pitch."
"04/19/2022","Auburn, Ala.",NA,"2","bot","0-1","Auburn","Alabama St.","Ware, B. reached on a fielder's choice (1-1 BS); Peirce, B. out at second 3b to 2b."
"04/19/2022","Auburn, Ala.",NA,"2","bot","0-1","Auburn","Alabama St.","Farquhar, G. struck out swinging (3-2 BBKFBS)."
"04/19/2022","Auburn, Ala.",NA,"2","bot","0-1","Auburn","Alabama St.","LOB: 1"
"04/19/2022","Auburn, Ala.",NA,"3","top","0-1","Alabama St.","Auburn","Lewis, C. struck out swinging (0-2 KFS)."
"04/19/2022","Auburn, Ala.",NA,"3","top","0-1","Alabama St.","Auburn","Williams, J. grounded out to p (0-2 FS)."
"04/19/2022","Auburn, Ala.",NA,"3","top","0-1","Alabama St.","Auburn","McIntosh, K. grounded out to ss (0-2 FK)."
"04/19/2022","Auburn, Ala.",NA,"3","bot","0-1","Auburn","Alabama St.","Rambusch, B. walked (3-1 BKBBB)."
"04/19/2022","Auburn, Ala.",NA,"3","bot","0-1","Auburn","Alabama St.","Rambusch, B. advanced to second on a wild pitch."
"04/19/2022","Auburn, Ala.",NA,"3","bot","0-1","Auburn","Alabama St.","Rambusch, B. advanced to third on a wild pitch."
"04/19/2022","Auburn, Ala.",NA,"3","bot","0-1","Auburn","Alabama St.","Howell, K. walked (3-2 FBSBBFB)."
"04/19/2022","Auburn, Ala.",NA,"3","bot","0-1","Auburn","Alabama St.","DiChiara, S. walked (3-2 BBBKSFFB); Howell, K. advanced to second."
"04/19/2022","Auburn, Ala.",NA,"3","bot","0-1","Auburn","Alabama St.","Carlson, B. struck out swinging (0-2 KKFS)."
"04/19/2022","Auburn, Ala.",NA,"3","bot","0-1","Auburn","Alabama St.","Moore, B. struck out swinging (2-2 FBBFS)."
"04/19/2022","Auburn, Ala.",NA,"3","bot","0-1","Auburn","Alabama St.","Peirce, B. popped up to ss (1-1 SB)."
"04/19/2022","Auburn, Ala.",NA,"3","bot","0-1","Auburn","Alabama St.","LOB: 3"
"04/19/2022","Auburn, Ala.",NA,"4","top","0-1","Alabama St.","Auburn","King, C. singled to pitcher (0-1 F)."
"04/19/2022","Auburn, Ala.",NA,"4","top","0-1","Alabama St.","Auburn","Espinal, D. singled to right field (0-1 F); King, C. advanced to third."
"04/19/2022","Auburn, Ala.",NA,"4","top","1-1","Alabama St.","Auburn","DeGuzman, C. grounded into double play 2b to ss to 1b (1-1 KB); Espinal, D. out on the play; King, C. scored."
"04/19/2022","Auburn, Ala.",NA,"4","top","1-1","Alabama St.","Auburn","May, H. struck out swinging (3-2 KBBFBFS)."
"04/19/2022","Auburn, Ala.",NA,"4","bot","1-1","Auburn","Alabama St.","Dyal, R. flied out to lf to left center (2-1 BBF)."
"04/19/2022","Auburn, Ala.",NA,"4","bot","1-1","Auburn","Alabama St.","Ware, B. walked (3-2 BKKBBFB)."
"04/19/2022","Auburn, Ala.",NA,"4","bot","1-1","Auburn","Alabama St.","Farquhar, G. reached on a fielder's choice (2-2 BKSB); Ware, B. advanced to second on an error by 2b."
"04/19/2022","Auburn, Ala.",NA,"4","bot","1-1","Auburn","Alabama St.","Rambusch, B. struck out looking (1-2 BFKK)."
"04/19/2022","Auburn, Ala.",NA,"4","bot","1-1","Auburn","Alabama St.","Howell, K. walked (3-1 FBBBB); Farquhar, G. advanced to second; Ware, B. advanced to third."
"04/19/2022","Auburn, Ala.",NA,"4","bot","1-1","Auburn","Alabama St.","DiChiara, S. struck out swinging (2-2 BBSSS)."
"04/19/2022","Auburn, Ala.",NA,"5","top","1-1","Alabama St.","Auburn","Lopez, C. struck out swinging (2-2 BBFFFS)."
"04/19/2022","Auburn, Ala.",NA,"5","top","1-1","Alabama St.","Auburn","Jamison, T. struck out swinging (1-2 SBKS)."
"04/19/2022","Auburn, Ala.",NA,"5","top","1-1","Alabama St.","Auburn","Lewis, C. doubled to left center (0-1 F)."
"04/19/2022","Auburn, Ala.",NA,"5","top","1-1","Alabama St.","Auburn","Williams, J. flied out to cf (2-2 BKBK)."
"04/19/2022","Auburn, Ala.",NA,"5","top","1-4","Alabama St.","Auburn","H: 1 LOB: 1"
"04/19/2022","Auburn, Ala.",NA,"5","bot","1-1","Auburn","Alabama St.","Carlson, B. singled to left field (1-1 BF)."
"04/19/2022","Auburn, Ala.",NA,"5","bot","1-1","Auburn","Alabama St.","Harris, P. to p for Colon, Sh.."
"04/19/2022","Auburn, Ala.",NA,"5","bot","1-1","Auburn","Alabama St.","Moore, B. flied out to rf to right center (1-0 B)."
"04/19/2022","Auburn, Ala.",NA,"5","bot","1-2","Auburn","Alabama St.","Peirce, B. tripled to right center, RBI (1-1 BK); Carlson, B. scored."
"04/19/2022","Auburn, Ala.",NA,"5","bot","1-2","Auburn","Alabama St.","Dyal, R. walked (3-2 KBBSBB)."
"04/19/2022","Auburn, Ala.",NA,"5","bot","1-2","Auburn","Alabama St.","Ware, B. struck out looking (1-2 FKBK)."
"04/19/2022","Auburn, Ala.",NA,"5","bot","1-2","Auburn","Alabama St.","Farquhar, G. hit by pitch (1-0 B); Dyal, R. advanced to second."
"04/19/2022","Auburn, Ala.",NA,"5","bot","1-4","Auburn","Alabama St.","Rambusch, B. singled through the left side, 2 RBI (2-2 BKBKF); Farquhar, G. advanced to second; Dyal, R. scored; Peirce, B. scored."
"04/19/2022","Auburn, Ala.",NA,"5","bot","1-4","Auburn","Alabama St.","Howell, K. reached on a fielder's choice (2-1 BFB); Rambusch, B. out at second ss to 2b."
"04/19/2022","Auburn, Ala.",NA,"5","top","1-4","Alabama St.","Auburn","R: 3 H: 3 LOB: 2"
"04/19/2022","Auburn, Ala.",NA,"6","top","1-4","Alabama St.","Auburn","Armstrong to p for Barnett, M.."
"04/19/2022","Auburn, Ala.",NA,"6","top","1-4","Alabama St.","Auburn","McIntosh, K. grounded out to 3b (1-0 B)."
"04/19/2022","Auburn, Ala.",NA,"6","top","1-4","Alabama St.","Auburn","King, C. reached on an error by p (1-1 BF)."
"04/19/2022","Auburn, Ala.",NA,"6","top","1-4","Alabama St.","Auburn","Espinal, D. walked (3-2 BBBKSB); King, C. advanced to second."
"04/19/2022","Auburn, Ala.",NA,"6","top","1-4","Alabama St.","Auburn","DeGuzman, C. walked (3-2 BSFBFBB); Espinal, D. advanced to second; King, C. advanced to third."
"04/19/2022","Auburn, Ala.",NA,"6","top","2-4","Alabama St.","Auburn","May, H. walked, RBI (3-0 BBBB); DeGuzman, C. advanced to second; Espinal, D. advanced to third; King, C. scored, unearned."
"04/19/2022","Auburn, Ala.",NA,"6","top","3-4","Alabama St.","Auburn","Lopez, C. walked, RBI (3-2 SBSBFBFB); May, H. advanced to second; DeGuzman, C. advanced to third; Espinal, D. scored."
"04/19/2022","Auburn, Ala.",NA,"6","top","3-4","Alabama St.","Auburn","Allsup, C. to p for Armstrong."
"04/19/2022","Auburn, Ala.",NA,"6","top","4-4","Alabama St.","Auburn","Jamison, T. walked, RBI (3-0 BBBB); Lopez, C. advanced to second; May, H. advanced to third; DeGuzman, C. scored."
"04/19/2022","Auburn, Ala.",NA,"6","top","4-4","Alabama St.","Auburn","Lewis, C. infield fly to ss (0-1 S)."
"04/19/2022","Auburn, Ala.",NA,"6","top","5-4","Alabama St.","Auburn","Williams, J. walked, RBI (3-1 FBBBB); Jamison, T. advanced to second; Lopez, C. advanced to third; May, H. scored, unearned."
"04/19/2022","Auburn, Ala.",NA,"6","top","5-4","Alabama St.","Auburn","McIntosh, K. flied out to rf (2-1 SBB)."
"04/19/2022","Auburn, Ala.",NA,"6","bot","5-4","Auburn","Alabama St.","DiChiara, S. doubled down the lf line (1-0 B)."
"04/19/2022","Auburn, Ala.",NA,"6","bot","5-4","Auburn","Alabama St.","Carlson, B. struck out looking (0-2 KKK)."
"04/19/2022","Auburn, Ala.",NA,"6","bot","5-4","Auburn","Alabama St.","Moore, B. popped up to 2b (0-0)."
"04/19/2022","Auburn, Ala.",NA,"6","bot","5-4","Auburn","Alabama St.","DiChiara, S. advanced to third on a wild pitch."
"04/19/2022","Auburn, Ala.",NA,"6","bot","5-4","Auburn","Alabama St.","Peirce, B. struck out swinging (3-2 BSBBSFS)."
"04/19/2022","Auburn, Ala.",NA,"7","top","5-4","Alabama St.","Auburn","Skipper, C. to p for Allsup, C.."
"04/19/2022","Auburn, Ala.",NA,"7","top","5-4","Alabama St.","Auburn","King, C. flied out to cf to left center (0-0)."
"04/19/2022","Auburn, Ala.",NA,"7","top","5-4","Alabama St.","Auburn","Espinal, D. flied out to cf (0-1 K)."
"04/19/2022","Auburn, Ala.",NA,"7","top","5-4","Alabama St.","Auburn","DeGuzman, C. singled to left center (1-1 BK)."
"04/19/2022","Auburn, Ala.",NA,"7","top","5-4","Alabama St.","Auburn","DeGuzman, C. advanced to second on a wild pitch."
"04/19/2022","Auburn, Ala.",NA,"7","top","5-4","Alabama St.","Auburn","May, H. struck out swinging (3-2 KBBFBS)."
"04/19/2022","Auburn, Ala.",NA,"7","top","5-4","Alabama St.","Auburn","H: 1 LOB: 1"
"04/19/2022","Auburn, Ala.",NA,"7","bot","5-4","Auburn","Alabama St.","Dyal, R. grounded out to 1b unassisted (0-1 K)."
"04/19/2022","Auburn, Ala.",NA,"7","bot","5-4","Auburn","Alabama St.","Ware, B. walked (3-2 SSBBBB)."
"04/19/2022","Auburn, Ala.",NA,"7","bot","5-4","Auburn","Alabama St.","Ware, B. stole second."
"04/19/2022","Auburn, Ala.",NA,"7","bot","5-4","Auburn","Alabama St.","Farquhar, G. grounded out to 2b (2-1 BFB); Ware, B. advanced to third."
"04/19/2022","Auburn, Ala.",NA,"7","bot","5-4","Auburn","Alabama St.","Rambusch, B. out at first p to 2b to 1b (1-2 KFB)."
"04/19/2022","Auburn, Ala.",NA,"7","top","5-4","Alabama St.","Auburn","LOB: 1"
"04/19/2022","Auburn, Ala.",NA,"8","top","5-4","Alabama St.","Auburn","Lopez, C. grounded out to ss (1-2 KBFF)."
"04/19/2022","Auburn, Ala.",NA,"8","top","5-4","Alabama St.","Auburn","Jamison, T. struck out swinging (0-2 FKS)."
"04/19/2022","Auburn, Ala.",NA,"8","top","5-4","Alabama St.","Auburn","Lewis, C. struck out swinging (1-2 FKFBS)."
"04/19/2022","Auburn, Ala.",NA,"8","bot","5-4","Auburn","Alabama St.","Howell, K. grounded out to ss (3-2 BBBKF)."
"04/19/2022","Auburn, Ala.",NA,"8","bot","5-4","Auburn","Alabama St.","DiChiara, S. walked (3-1 BKBBB)."
"04/19/2022","Auburn, Ala.",NA,"8","bot","5-4","Auburn","Alabama St.","Land, M. pinch ran for DiChiara, S.."
"04/19/2022","Auburn, Ala.",NA,"8","bot","5-4","Auburn","Alabama St.","Carlson, B. grounded into double play 2b to ss to 1b (0-0); Land, M. out on the play."
"04/19/2022","Auburn, Ala.",NA,"9","top","5-4","Alabama St.","Auburn","Burk, L. to 1b for Land, M.."
"04/19/2022","Auburn, Ala.",NA,"9","top","5-4","Alabama St.","Auburn","Burkhalter to p for Skipper, C.."
"04/19/2022","Auburn, Ala.",NA,"9","top","5-4","Alabama St.","Auburn","Williams, J. singled up the middle (0-0)."
"04/19/2022","Auburn, Ala.",NA,"9","top","5-4","Alabama St.","Auburn","McIntosh, K. struck out swinging (1-2 FSBS)."
"04/19/2022","Auburn, Ala.",NA,"9","top","5-4","Alabama St.","Auburn","King, C. struck out swinging, grounded out to c unassisted (2-2 SFBBFFS); Williams, J. advanced to second on a wild pitch."
"04/19/2022","Auburn, Ala.",NA,"9","top","5-4","Alabama St.","Auburn","Espinal, D. struck out swinging (1-2 KSBS)."
"04/19/2022","Auburn, Ala.",NA,"9","top","5-5","Alabama St.","Auburn","H: 1 LOB: 1"
"04/19/2022","Auburn, Ala.",NA,"9","bot","5-4","Auburn","Alabama St.","Pooler, B. to p for Harris, P.."
"04/19/2022","Auburn, Ala.",NA,"9","bot","5-4","Auburn","Alabama St.","Moore, B. grounded out to 2b (0-1 K)."
"04/19/2022","Auburn, Ala.",NA,"9","bot","5-4","Auburn","Alabama St.","Peirce, B. singled up the middle (3-2 BBFFB)."
"04/19/2022","Auburn, Ala.",NA,"9","bot","5-4","Auburn","Alabama St.","Hill, C. pinch hit for Dyal, R.."
"04/19/2022","Auburn, Ala.",NA,"9","bot","5-4","Auburn","Alabama St.","Hill, C. singled to right field (2-1 BSB); Peirce, B. advanced to second."
"04/19/2022","Auburn, Ala.",NA,"9","bot","5-4","Auburn","Alabama St.","Foster, C. pinch hit for Ware, B.."
"04/19/2022","Auburn, Ala.",NA,"9","bot","5-4","Auburn","Alabama St.","Foster, C. struck out swinging (2-2 BSBFS)."
"04/19/2022","Auburn, Ala.",NA,"9","bot","5-4","Auburn","Alabama St.","Bello, M. pinch hit for Farquhar, G.."
"04/19/2022","Auburn, Ala.",NA,"9","bot","5-4","Auburn","Alabama St.","Peirce, B. stole third."
"04/19/2022","Auburn, Ala.",NA,"9","bot","5-4","Auburn","Alabama St.","Bello, M. walked (3-2 KKBBFBB); Hill, C. advanced to second."
"04/19/2022","Auburn, Ala.",NA,"9","bot","5-4","Auburn","Alabama St.","Moss, B. pinch ran for Hill, C.."
"04/19/2022","Auburn, Ala.",NA,"9","bot","5-5","Auburn","Alabama St.","Rambusch, B. singled to pitcher, RBI (1-2 BKFF); Bello, M. advanced to second; Moss, B. advanced to third; Peirce, B. scored."
"04/19/2022","Auburn, Ala.",NA,"9","bot","5-5","Auburn","Alabama St.","Howell, K. struck out swinging (1-2 FBKS)."
"04/19/2022","Auburn, Ala.",NA,"9","top","5-5","Alabama St.","Auburn","R: 1 H: 3 LOB: 3"
"04/19/2022","Auburn, Ala.",NA,"10","top","5-5","Alabama St.","Auburn","LaRue, N. to c for Moss, B.."
"04/19/2022","Auburn, Ala.",NA,"10","top","5-5","Alabama St.","Auburn","Foster, C. to 2b."
"04/19/2022","Auburn, Ala.",NA,"10","top","5-5","Alabama St.","Auburn","Bello, M. to lf."
"04/19/2022","Auburn, Ala.",NA,"10","top","5-5","Alabama St.","Auburn","DeGuzman, C. flied out to cf (2-1 BFB)."
"04/19/2022","Auburn, Ala.",NA,"10","top","5-5","Alabama St.","Auburn","May, H. struck out looking (1-2 SSBK)."
"04/19/2022","Auburn, Ala.",NA,"10","top","5-5","Alabama St.","Auburn","Lopez, C. struck out swinging (1-2 BSSFS)."
"04/19/2022","Auburn, Ala.",NA,"10","bot","5-5","Auburn","Alabama St.","Colon, Seb. to p for Pooler, B.."
"04/19/2022","Auburn, Ala.",NA,"10","bot","5-5","Auburn","Alabama St.","Burk, L. flied out to cf (2-2 BKFB)."
"04/19/2022","Auburn, Ala.",NA,"10","bot","5-5","Auburn","Alabama St.","Carlson, B. singled through the right side (0-2 KK)."
"04/19/2022","Auburn, Ala.",NA,"10","bot","5-5","Auburn","Alabama St.","Moore, B. reached on an error by 3b (0-0); Carlson, B. advanced to second."
"04/19/2022","Auburn, Ala.",NA,"10","bot","5-5","Auburn","Alabama St.","Peirce, B. struck out swinging (0-2 KSS)."
"04/19/2022","Auburn, Ala.",NA,"10","bot","5-6","Auburn","Alabama St.","LaRue, N. singled to left field, RBI (0-1 F); Moore, B. advanced to second; Carlson, B. scored, unearned."
"04/19/2022","Auburn, Ala.",NA,"10","bot","5-6","Auburn","Alabama St.","R: 1 H: 2 E: 1 LOB: 2"
