"date","location","attendance","inning","inning_top_bot","score","batting","fielding","description"
"05/06/2022","Brighton, Mass.",NA,"1","top","0-0","Florida St.","Boston College","CARRION, J. singled up the middle (1-2)."
"05/06/2022","Brighton, Mass.",NA,"1","top","0-0","Florida St.","Boston College","CARRION, J. stole second."
"05/06/2022","Brighton, Mass.",NA,"1","top","0-0","Florida St.","Boston College","ROBERTS, B. flied out to lf (1-1)3a CARRION, J. no advance."
"05/06/2022","Brighton, Mass.",NA,"1","top","1-0","Florida St.","Boston College","TIBBS, J. singled to left center, RBI (2-1)3a CARRION, J. scored."
"05/06/2022","Brighton, Mass.",NA,"1","top","1-0","Florida St.","Boston College","FERRER, J. doubled to left field (1-2)3a TIBBS, J. advanced to third."
"05/06/2022","Brighton, Mass.",NA,"1","top","2-0","Florida St.","Boston College","ALBERT, R. singled to right field, RBI (1-2)3a FERRER, J. advanced to third3a TIBBS, J. scored."
"05/06/2022","Brighton, Mass.",NA,"1","top","2-0","Florida St.","Boston College","GREENE, J. struck out looking (1-2)."
"05/06/2022","Brighton, Mass.",NA,"1","top","2-0","Florida St.","Boston College","FERRER, J. out at home c to 3b to c."
"05/06/2022","Brighton, Mass.",NA,"1","bot","2-0","Boston College","Florida St.","Honeyman, T. grounded out to ss (1-0)."
"05/06/2022","Brighton, Mass.",NA,"1","bot","2-0","Boston College","Florida St.","Leary, C. struck out looking (2-2)."
"05/06/2022","Brighton, Mass.",NA,"1","bot","2-0","Boston College","Florida St.","Gold, L. flied out to rf (2-2)."
"05/06/2022","Brighton, Mass.",NA,"2","top","2-0","Florida St.","Boston College","TORAL, A. popped up to 2b (1-2)."
"05/06/2022","Brighton, Mass.",NA,"2","top","2-0","Florida St.","Boston College","LACEY, L. grounded out to 3b (0-0)."
"05/06/2022","Brighton, Mass.",NA,"2","top","2-0","Florida St.","Boston College","VINCENT, C. lined out to cf (2-2)."
"05/06/2022","Brighton, Mass.",NA,"2","bot","2-0","Boston College","Florida St.","Vetrano, J. hit by pitch (0-1)."
"05/06/2022","Brighton, Mass.",NA,"2","bot","2-0","Boston College","Florida St.","Landwehr, P. struck out swinging (1-2)."
"05/06/2022","Brighton, Mass.",NA,"2","bot","2-0","Boston College","Florida St.","Walsh, B. doubled to left field (2-1)3a Vetrano, J. advanced to third."
"05/06/2022","Brighton, Mass.",NA,"2","bot","2-1","Boston College","Florida St.","Baruch, D. grounded out to 1b unassisted, RBI (0-2)3a Walsh, B. advanced to third3a Vetrano, J. scored."
"05/06/2022","Brighton, Mass.",NA,"2","bot","2-1","Boston College","Florida St.","McNulty, S. struck out swinging (1-2)."
"05/06/2022","Brighton, Mass.",NA,"2","bot","2-1","Boston College","Florida St.","R: 1 H: 1 LOB: 1"
"05/06/2022","Brighton, Mass.",NA,"3","top","2-1","Florida St.","Boston College","CARRION, J. grounded out to 2b (1-2)."
"05/06/2022","Brighton, Mass.",NA,"3","top","2-1","Florida St.","Boston College","ROBERTS, B. flied out to cf (2-2)."
"05/06/2022","Brighton, Mass.",NA,"3","top","2-1","Florida St.","Boston College","TIBBS, J. struck out swinging (1-2)."
"05/06/2022","Brighton, Mass.",NA,"3","bot","2-1","Boston College","Florida St.","Harrington,A flied out to rf (2-0)."
"05/06/2022","Brighton, Mass.",NA,"3","bot","2-1","Boston College","Florida St.","Honeyman, T. struck out swinging (0-2)."
"05/06/2022","Brighton, Mass.",NA,"3","bot","2-1","Boston College","Florida St.","Leary, C. struck out swinging (1-2)."
"05/06/2022","Brighton, Mass.",NA,"4","top","2-1","Florida St.","Boston College","FERRER, J. flied out to rf (2-2)."
"05/06/2022","Brighton, Mass.",NA,"4","top","2-1","Florida St.","Boston College","ALBERT, R. flied out to rf (1-0)."
"05/06/2022","Brighton, Mass.",NA,"4","top","2-1","Florida St.","Boston College","GREENE, J. struck out swinging (1-2)."
"05/06/2022","Brighton, Mass.",NA,"4","bot","2-1","Boston College","Florida St.","Gold, L. flied out to cf (0-1)."
"05/06/2022","Brighton, Mass.",NA,"4","bot","2-1","Boston College","Florida St.","Vetrano, J. struck out looking (1-2)."
"05/06/2022","Brighton, Mass.",NA,"4","bot","2-1","Boston College","Florida St.","Landwehr, P. flied out to rf (1-2)."
"05/06/2022","Brighton, Mass.",NA,"5","top","2-1","Florida St.","Boston College","TORAL, A. fouled out to lf (1-0)."
"05/06/2022","Brighton, Mass.",NA,"5","top","2-1","Florida St.","Boston College","LACEY, L. fouled out to 1b (1-0)."
"05/06/2022","Brighton, Mass.",NA,"5","top","2-1","Florida St.","Boston College","VINCENT, C. grounded out to 2b (1-2)."
"05/06/2022","Brighton, Mass.",NA,"5","bot","2-1","Boston College","Florida St.","Walsh, B. flied out to cf (1-1)."
"05/06/2022","Brighton, Mass.",NA,"5","bot","2-1","Boston College","Florida St.","Baruch, D. doubled to center field (1-0)."
"05/06/2022","Brighton, Mass.",NA,"5","bot","2-1","Boston College","Florida St.","McNulty, S. grounded out to ss (1-1)3a Baruch, D. advanced to third."
"05/06/2022","Brighton, Mass.",NA,"5","bot","2-2","Boston College","Florida St.","Harrington,A singled to first base, RBI (2-2)3a Baruch, D. scored."
"05/06/2022","Brighton, Mass.",NA,"5","bot","2-2","Boston College","Florida St.","Honeyman, T. flied out to lf (0-1)."
"05/06/2022","Brighton, Mass.",NA,"5","bot","2-2","Boston College","Florida St.","R: 1 H: 2 LOB: 1"
"05/06/2022","Brighton, Mass.",NA,"6","top","2-2","Florida St.","Boston College","CARRION, J. grounded out to ss (1-1)."
"05/06/2022","Brighton, Mass.",NA,"6","top","2-2","Florida St.","Boston College","ROBERTS, B. flied out to rf (0-1)."
"05/06/2022","Brighton, Mass.",NA,"6","top","2-2","Florida St.","Boston College","TIBBS, J. popped up to 2b (0-2)."
"05/06/2022","Brighton, Mass.",NA,"6","bot","2-2","Boston College","Florida St.","Leary, C. struck out swinging (1-2)."
"05/06/2022","Brighton, Mass.",NA,"6","bot","2-2","Boston College","Florida St.","Gold, L. popped up to 2b (0-2)."
"05/06/2022","Brighton, Mass.",NA,"6","bot","2-2","Boston College","Florida St.","Vetrano, J. struck out swinging (1-2)."
"05/06/2022","Brighton, Mass.",NA,"7","top","2-2","Florida St.","Boston College","FERRER, J. grounded out to p, bunt (0-0)."
"05/06/2022","Brighton, Mass.",NA,"7","top","2-2","Florida St.","Boston College","ALBERT, R. struck out swinging (2-2)."
"05/06/2022","Brighton, Mass.",NA,"7","top","2-2","Florida St.","Boston College","GREENE, J. flied out to lf (0-2)."
"05/06/2022","Brighton, Mass.",NA,"7","bot","2-2","Boston College","Florida St.","Landwehr, P. struck out swinging (2-2)."
"05/06/2022","Brighton, Mass.",NA,"7","bot","2-2","Boston College","Florida St.","Walsh, B. struck out swinging (2-2)."
"05/06/2022","Brighton, Mass.",NA,"7","bot","2-2","Boston College","Florida St.","Baruch, D. doubled to right center (3-1)."
"05/06/2022","Brighton, Mass.",NA,"7","bot","2-2","Boston College","Florida St.","Baruch, D. advanced to third on a wild pitch."
"05/06/2022","Brighton, Mass.",NA,"7","bot","2-2","Boston College","Florida St.","McNulty, S. struck out swinging (2-2)."
"05/06/2022","Brighton, Mass.",NA,"7","bot","2-2","Boston College","Florida St.","H: 1 LOB: 1"
"05/06/2022","Brighton, Mass.",NA,"8","top","2-2","Florida St.","Boston College","TORAL, A. flied out to cf (2-2)."
"05/06/2022","Brighton, Mass.",NA,"8","top","2-2","Florida St.","Boston College","LACEY, L. flied out to cf (1-1)."
"05/06/2022","Brighton, Mass.",NA,"8","top","2-2","Florida St.","Boston College","VINCENT, C. flied out to rf (0-2)."
"05/06/2022","Brighton, Mass.",NA,"8","bot","2-2","Boston College","Florida St.","Harrington,A struck out swinging (2-2)."
"05/06/2022","Brighton, Mass.",NA,"8","bot","2-2","Boston College","Florida St.","Honeyman, T. singled to shortstop (0-0)."
"05/06/2022","Brighton, Mass.",NA,"8","bot","2-2","Boston College","Florida St.","Leary, C. grounded into double play 1b to ss to 1b (1-0)3a Honeyman, T. out on the play."
"05/06/2022","Brighton, Mass.",NA,"8","bot","2-2","Boston College","Florida St.","H: 1"
"05/06/2022","Brighton, Mass.",NA,"9","top","2-2","Florida St.","Boston College","CARRION, J. flied out to rf (0-1)."
"05/06/2022","Brighton, Mass.",NA,"9","top","2-2","Florida St.","Boston College","ROBERTS, B. singled to center field (0-1)."
"05/06/2022","Brighton, Mass.",NA,"9","top","2-2","Florida St.","Boston College","TIBBS, J. flied out to lf (1-1)3a ROBERTS, B. no advance."
"05/06/2022","Brighton, Mass.",NA,"9","top","2-2","Florida St.","Boston College","FERRER, J. flied out to cf (0-0)."
"05/06/2022","Brighton, Mass.",NA,"9","top","2-3","Florida St.","Boston College","H: 1 LOB: 1"
"05/06/2022","Brighton, Mass.",NA,"9","bot","2-2","Boston College","Florida St.","WHITTAKER, C to p for MESSICK, P.."
"05/06/2022","Brighton, Mass.",NA,"9","bot","2-2","Boston College","Florida St.","RANK, T. to 3b for LACEY, L.."
"05/06/2022","Brighton, Mass.",NA,"9","bot","2-2","Boston College","Florida St.","Gold, L. hit by pitch (3-2)."
"05/06/2022","Brighton, Mass.",NA,"9","bot","2-2","Boston College","Florida St.","SCOLARO, J. to p for WHITTAKER, C."
"05/06/2022","Brighton, Mass.",NA,"9","bot","2-2","Boston College","Florida St.","SHAVER, A. to lf for TIBBS, J.."
"05/06/2022","Brighton, Mass.",NA,"9","bot","2-2","Boston College","Florida St.","Vetrano, J. singled to left field (1-1)3a Gold, L. advanced to second."
"05/06/2022","Brighton, Mass.",NA,"9","bot","2-2","Boston College","Florida St.","Landwehr, P. walked (3-2)3a Vetrano, J. advanced to second3a Gold, L. advanced to third."
"05/06/2022","Brighton, Mass.",NA,"9","bot","2-2","Boston College","Florida St.","HARE, D. to p for SCOLARO, J.."
"05/06/2022","Brighton, Mass.",NA,"9","bot","2-2","Boston College","Florida St.","Walsh, B. struck out swinging (0-2)."
"05/06/2022","Brighton, Mass.",NA,"9","bot","2-3","Boston College","Florida St.","Baruch, D. walked, RBI (3-2)3a Landwehr, P. advanced to second3a Vetrano, J. advanced to third3a Gold, L. scored."
"05/06/2022","Brighton, Mass.",NA,"9","top","2-3","Florida St.","Boston College","R: 1 H: 1 LOB: 3"
