"date","location","attendance","inning","inning_top_bot","score","batting","fielding","description"
"03/23/2019","Towson, Md.",NA,"1","top","0-0","UNCW","Towson","Meadows, J. walked (3-1 BFBBB)."
"03/23/2019","Towson, Md.",NA,"1","top","0-0","UNCW","Towson","Meadows, J. out at second c to 2b, caught stealing."
"03/23/2019","Towson, Md.",NA,"1","top","0-0","UNCW","Towson","Angeli struck out swinging (3-2 BBKBKS)."
"03/23/2019","Towson, Md.",NA,"1","top","0-0","UNCW","Towson","Weiss popped up to ss (0-2 KK)."
"03/23/2019","Towson, Md.",NA,"1","bot","0-0","Towson","UNCW","FIELDS,J. walked (3-0 BBBB)."
"03/23/2019","Towson, Md.",NA,"1","bot","0-0","Towson","UNCW","FIELDS,J. advanced to second on a throwing error by p."
"03/23/2019","Towson, Md.",NA,"1","bot","0-0","Towson","UNCW","CONROY,C. singled through the right side (1-1 KB)3a FIELDS,J. advanced to third."
"03/23/2019","Towson, Md.",NA,"1","bot","0-1","Towson","UNCW","POWERS,B. reached on an error by 1b, RBI (3-0 BBB)3a CONROY,C. advanced to second3a FIELDS,J. scored."
"03/23/2019","Towson, Md.",NA,"1","bot","0-1","Towson","UNCW","PIAZZA,Z. grounded out to c, bunt, SAC (0-1 K)3a POWERS,B. advanced to second3a CONROY,C. advanced to third."
"03/23/2019","Towson, Md.",NA,"1","bot","0-2","Towson","UNCW","MILLER,R. grounded out to 2b, RBI (2-0 BB)3a POWERS,B. advanced to third3a CONROY,C. scored, unearned."
"03/23/2019","Towson, Md.",NA,"1","bot","0-2","Towson","UNCW","BROWN,N. struck out swinging (1-2 BFSS)."
"03/23/2019","Towson, Md.",NA,"2","top","0-2","UNCW","Towson","Baldwin, B. flied out to rf (0-0)."
"03/23/2019","Towson, Md.",NA,"2","top","0-2","UNCW","Towson","Jones, G. grounded out to 2b (1-0 B)."
"03/23/2019","Towson, Md.",NA,"2","top","0-2","UNCW","Towson","Zayicek flied out to rf (1-0 B)."
"03/23/2019","Towson, Md.",NA,"2","bot","0-2","Towson","UNCW","FLACCO,T. grounded out to ss (1-1 BF)."
"03/23/2019","Towson, Md.",NA,"2","bot","0-2","Towson","UNCW","GAST-WOODARD struck out swinging (1-2 KKBS)."
"03/23/2019","Towson, Md.",NA,"2","bot","0-2","Towson","UNCW","MASTERS,D. grounded out to p (1-1 BK)."
"03/23/2019","Towson, Md.",NA,"3","top","0-2","UNCW","Towson","Brown, K. flied out to cf (3-1 BBBK)."
"03/23/2019","Towson, Md.",NA,"3","top","0-2","UNCW","Towson","Oxendine, L. singled through the left side (1-1 KB)."
"03/23/2019","Towson, Md.",NA,"3","top","0-2","UNCW","Towson","Bridges, N. reached on a fielders choice (0-2 SS)3a Oxendine, L. out at second 1b to ss."
"03/23/2019","Towson, Md.",NA,"3","top","0-2","UNCW","Towson","Bridges, N. stole second."
"03/23/2019","Towson, Md.",NA,"3","top","0-2","UNCW","Towson","Meadows, J. grounded out to ss (2-2 KBBF)."
"03/23/2019","Towson, Md.",NA,"3","bot","0-2","Towson","UNCW","FIELDS,J. struck out looking (0-2 FFK)."
"03/23/2019","Towson, Md.",NA,"3","bot","0-2","Towson","UNCW","CONROY,C. grounded out to ss (1-2 BFKF)."
"03/23/2019","Towson, Md.",NA,"3","bot","0-2","Towson","UNCW","POWERS,B. popped up to 2b (0-1 F)."
"03/23/2019","Towson, Md.",NA,"4","top","0-2","UNCW","Towson","Angeli struck out looking (0-2 KFFK)."
"03/23/2019","Towson, Md.",NA,"4","top","0-2","UNCW","Towson","Weiss walked (3-2 BSKBBB)."
"03/23/2019","Towson, Md.",NA,"4","top","0-2","UNCW","Towson","Baldwin, B. hit into double play 2b to ss to 1b (0-0)3a Weiss out on the play."
"03/23/2019","Towson, Md.",NA,"4","bot","0-2","Towson","UNCW","PIAZZA,Z. grounded out to ss (0-2 KS)."
"03/23/2019","Towson, Md.",NA,"4","bot","0-2","Towson","UNCW","MILLER,R. flied out to rf (3-1 BBFB)."
"03/23/2019","Towson, Md.",NA,"4","bot","0-2","Towson","UNCW","BROWN,N. struck out looking (0-2 KSK)."
"03/23/2019","Towson, Md.",NA,"5","top","0-2","UNCW","Towson","Jones, G. walked (3-1 BBBKB)."
"03/23/2019","Towson, Md.",NA,"5","top","0-2","UNCW","Towson","Zayicek doubled to center field (3-1 FBBB)3a Jones, G. advanced to third."
"03/23/2019","Towson, Md.",NA,"5","top","0-2","UNCW","Towson","Brown, K. struck out swinging (0-2 SSFS)."
"03/23/2019","Towson, Md.",NA,"5","top","0-2","UNCW","Towson","Oxendine, L. struck out swinging (1-2 BSSFS)."
"03/23/2019","Towson, Md.",NA,"5","top","2-2","UNCW","Towson","Bridges, N. singled to center field, 2 RBI (2-2 FBKFFB)3a Zayicek scored3a Jones, G. scored."
"03/23/2019","Towson, Md.",NA,"5","top","2-2","UNCW","Towson","Meadows, J. singled to left field (0-1 F)3a Bridges, N. advanced to second."
"03/23/2019","Towson, Md.",NA,"5","top","3-2","UNCW","Towson","Angeli singled to center field, RBI (2-1 BBK)3a Meadows, J. advanced to second3a Bridges, N. scored."
"03/23/2019","Towson, Md.",NA,"5","top","3-2","UNCW","Towson","WEBER,A. to p for WEYMAN,G,."
"03/23/2019","Towson, Md.",NA,"5","top","3-2","UNCW","Towson","Weiss grounded out to 2b (3-2 KBBBKF)."
"03/23/2019","Towson, Md.",NA,"5","bot","3-2","Towson","UNCW","FLACCO,T. grounded out to p (2-2 BKFB)."
"03/23/2019","Towson, Md.",NA,"5","bot","3-2","Towson","UNCW","GAST-WOODARD flied out to rf (0-1 K)."
"03/23/2019","Towson, Md.",NA,"5","bot","3-2","Towson","UNCW","MASTERS,D. grounded out to 2b (1-0 B)."
"03/23/2019","Towson, Md.",NA,"6","top","3-2","UNCW","Towson","Baldwin, B. singled to catcher, bunt (0-0)."
"03/23/2019","Towson, Md.",NA,"6","top","3-2","UNCW","Towson","Jones, G. walked (3-2 BKBSBB)3a Baldwin, B. advanced to second."
"03/23/2019","Towson, Md.",NA,"6","top","3-2","UNCW","Towson","Zayicek reached on a fielders choice (1-2 BFF)3a Jones, G. out at second 2b to ss3a Baldwin, B. advanced to third."
"03/23/2019","Towson, Md.",NA,"6","top","3-2","UNCW","Towson","REESER,K. to p for WEBER,A.."
"03/23/2019","Towson, Md.",NA,"6","top","3-2","UNCW","Towson","Brown, K. hit into double play p to ss to 1b (0-1 K)3a Zayicek out on the play."
"03/23/2019","Towson, Md.",NA,"6","bot","3-2","Towson","UNCW","FIELDS,J. struck out swinging (0-2 KFFS)."
"03/23/2019","Towson, Md.",NA,"6","bot","3-2","Towson","UNCW","CONROY,C. struck out swinging (0-2 KFS)."
"03/23/2019","Towson, Md.",NA,"6","bot","3-2","Towson","UNCW","POWERS,B. flied out to rf (0-2 SF)."
"03/23/2019","Towson, Md.",NA,"7","top","3-2","UNCW","Towson","Oxendine, L. walked (3-2 BBKBFB)."
"03/23/2019","Towson, Md.",NA,"7","top","3-2","UNCW","Towson","Bridges, N. grounded out to p, bunt, SAC (0-0)3a Oxendine, L. advanced to second."
"03/23/2019","Towson, Md.",NA,"7","top","3-2","UNCW","Towson","Meadows, J. grounded out to ss (0-1 K)."
"03/23/2019","Towson, Md.",NA,"7","top","3-2","UNCW","Towson","Angeli reached on a fielders choice (1-1 BK)3a Oxendine, L. out at third ss to 3b."
"03/23/2019","Towson, Md.",NA,"7","bot","3-2","Towson","UNCW","PIAZZA,Z. singled to center field (0-2 KS)."
"03/23/2019","Towson, Md.",NA,"7","bot","3-2","Towson","UNCW","MILLER,R. grounded out to 3b, bunt, SAC (0-0)3a PIAZZA,Z. advanced to second."
"03/23/2019","Towson, Md.",NA,"7","bot","3-2","Towson","UNCW","BROWN,N. grounded out to ss (2-2 BFFFB)3a PIAZZA,Z. advanced to third."
"03/23/2019","Towson, Md.",NA,"7","bot","3-2","Towson","UNCW","FLACCO,T. grounded out to p (1-2 BFK)."
"03/23/2019","Towson, Md.",NA,"8","top","3-2","UNCW","Towson","Weiss struck out looking (1-2 KKBK)."
"03/23/2019","Towson, Md.",NA,"8","top","3-2","UNCW","Towson","Baldwin, B. grounded out to 2b (0-0)."
"03/23/2019","Towson, Md.",NA,"8","top","3-2","UNCW","Towson","Jones, G. singled up the middle (2-1 KBB)."
"03/23/2019","Towson, Md.",NA,"8","top","3-2","UNCW","Towson","Zayicek singled up the middle (2-0 BB)3a Jones, G. advanced to third."
"03/23/2019","Towson, Md.",NA,"8","top","4-2","UNCW","Towson","Brown, K. singled to left field, RBI (3-2 BBSFFFB)3a Zayicek advanced to third3a Jones, G. scored."
"03/23/2019","Towson, Md.",NA,"8","top","5-2","UNCW","Towson","Oxendine, L. singled to left field, RBI (1-0 B)3a Brown, K. advanced to second3a Zayicek scored."
"03/23/2019","Towson, Md.",NA,"8","top","5-2","UNCW","Towson","WATTERS,M. to p for REESER,K.."
"03/23/2019","Towson, Md.",NA,"8","top","6-2","UNCW","Towson","Bridges, N. singled to left field, RBI (3-2 BFBFB)3a Oxendine, L. advanced to third3a Brown, K. scored."
"03/23/2019","Towson, Md.",NA,"8","top","7-2","UNCW","Towson","Meadows, J. singled to third base, bunt, RBI (0-0)3a Bridges, N. advanced to second3a Oxendine, L. scored."
"03/23/2019","Towson, Md.",NA,"8","top","7-2","UNCW","Towson","CABRERA,N. to 2b for CONROY,C.."
"03/23/2019","Towson, Md.",NA,"8","top","7-2","UNCW","Towson","Angeli struck out swinging (3-2 KBKBBFFS)."
"03/23/2019","Towson, Md.",NA,"8","bot","7-2","Towson","UNCW","GAST-WOODARD walked (3-1 BBBKB)."
"03/23/2019","Towson, Md.",NA,"8","bot","7-2","Towson","UNCW","MASTERS,D. struck out looking (1-2 BKFFK)."
"03/23/2019","Towson, Md.",NA,"8","bot","7-2","Towson","UNCW","FIELDS,J. reached on a fielders choice (1-2 BKF)3a GAST-WOODARD advanced to third on an error by c."
"03/23/2019","Towson, Md.",NA,"8","bot","7-2","Towson","UNCW","Crump to p for Lawson, B.."
"03/23/2019","Towson, Md.",NA,"8","bot","7-2","Towson","UNCW","CABRERA,N. hit by pitch (0-0)3a FIELDS,J. advanced to second."
"03/23/2019","Towson, Md.",NA,"8","bot","7-3","Towson","UNCW","CABRERA,N. advanced to second3a FIELDS,J. advanced to third3a GAST-WOODARD scored on a wild pitch."
"03/23/2019","Towson, Md.",NA,"8","bot","7-3","Towson","UNCW","POWERS,B. struck out swinging (1-2 BSSS)."
"03/23/2019","Towson, Md.",NA,"8","bot","7-3","Towson","UNCW","PIAZZA,Z. struck out swinging (2-2 BKBKFS)."
"03/23/2019","Towson, Md.",NA,"9","top","7-3","UNCW","Towson","ENEA,J. to p for WATTERS,M.."
"03/23/2019","Towson, Md.",NA,"9","top","7-3","UNCW","Towson","Weiss grounded out to ss (0-1 F)."
"03/23/2019","Towson, Md.",NA,"9","top","7-3","UNCW","Towson","Baldwin, B. singled to center field (0-0)."
"03/23/2019","Towson, Md.",NA,"9","top","7-3","UNCW","Towson","Jones, G. singled through the right side (3-2 KBBKB)3a Baldwin, B. advanced to third."
"03/23/2019","Towson, Md.",NA,"9","top","8-3","UNCW","Towson","Zayicek flied out to cf, SF, RBI (0-1 K)3a Baldwin, B. scored."
"03/23/2019","Towson, Md.",NA,"9","top","8-3","UNCW","Towson","Jones, G. stole second."
"03/23/2019","Towson, Md.",NA,"9","top","8-3","UNCW","Towson","Brown, K. grounded out to 3b (2-1 BBK)."
"03/23/2019","Towson, Md.",NA,"9","bot","8-3","Towson","UNCW","Roberson, B. to lf for Zayicek."
"03/23/2019","Towson, Md.",NA,"9","bot","8-3","Towson","UNCW","Morgan, B. to p for Crump."
"03/23/2019","Towson, Md.",NA,"9","bot","8-3","Towson","UNCW","SANFORD,J. pinch hit for MILLER,R.."
"03/23/2019","Towson, Md.",NA,"9","bot","8-3","Towson","UNCW","SANFORD,J. reached on an error by 2b (0-2 SS)."
"03/23/2019","Towson, Md.",NA,"9","bot","8-3","Towson","UNCW","BROWN,N. grounded out to 1b unassisted (1-2 SKB)3a SANFORD,J. advanced to second."
"03/23/2019","Towson, Md.",NA,"9","bot","8-3","Towson","UNCW","WINIKUR,I. pinch hit for FLACCO,T.."
"03/23/2019","Towson, Md.",NA,"9","bot","8-3","Towson","UNCW","WINIKUR,I. struck out looking (1-2 KBSFK)."
"03/23/2019","Towson, Md.",NA,"9","bot","8-3","Towson","UNCW","SANFORD,J. advanced to third on a passed ball."
"03/23/2019","Towson, Md.",NA,"9","bot","8-4","Towson","UNCW","GAST-WOODARD doubled to left field, RBI (3-2 BKBBS)3a SANFORD,J. scored, unearned."
"03/23/2019","Towson, Md.",NA,"9","bot","8-4","Towson","UNCW","MASTERS,D. struck out swinging, out at first c to 1b (1-2 BKKS)."
