"date","location","attendance","inning","inning_top_bot","score","batting","fielding","description"
"05/19/2019","Berkeley, CA",NA,"1","top","0-0","Arizona St.","California","Torkelson,S grounded out to 2b (1-1 KB)."
"05/19/2019","Berkeley, CA",NA,"1","top","0-0","Arizona St.","California","Hauver,T flied out to cf (3-2 BFKFFBB)."
"05/19/2019","Berkeley, CA",NA,"1","top","0-0","Arizona St.","California","Bishop,H flied out to lf (0-2 KK)."
"05/19/2019","Berkeley, CA",NA,"1","bot","0-0","California","Arizona St.","Eden singled to left field (2-2 KFBB)."
"05/19/2019","Berkeley, CA",NA,"1","bot","0-0","California","Arizona St.","Selma lined out to rf (1-1 FB)."
"05/19/2019","Berkeley, CA",NA,"1","bot","0-0","California","Arizona St.","Vaughn singled to shortstop (0-2 FK)3a Eden advanced to second."
"05/19/2019","Berkeley, CA",NA,"1","bot","0-0","California","Arizona St.","Lee singled to right field (1-2 KFFB)3a Vaughn advanced to second3a Eden advanced to third."
"05/19/2019","Berkeley, CA",NA,"1","bot","0-0","California","Arizona St.","Flower grounded into double play ss to 1b (1-1 BK)3a Lee out on the play."
"05/19/2019","Berkeley, CA",NA,"2","top","0-0","Arizona St.","California","Williams,A grounded out to ss (0-0)."
"05/19/2019","Berkeley, CA",NA,"2","top","0-0","Arizona St.","California","Lin,L grounded out to ss (1-0 B)."
"05/19/2019","Berkeley, CA",NA,"2","top","0-0","Arizona St.","California","Workman,G struck out looking (3-2 KSBBBFK)."
"05/19/2019","Berkeley, CA",NA,"2","bot","0-0","California","Arizona St.","Baker walked (3-2 KFBBBB)."
"05/19/2019","Berkeley, CA",NA,"2","bot","0-0","California","Arizona St.","Baker stole second."
"05/19/2019","Berkeley, CA",NA,"2","bot","0-0","California","Arizona St.","Wezniak struck out looking (3-2 BFFBBK)."
"05/19/2019","Berkeley, CA",NA,"2","bot","0-0","California","Arizona St.","Holman grounded out to ss (2-2 KBFFFB)."
"05/19/2019","Berkeley, CA",NA,"2","bot","0-0","California","Arizona St.","Mack flied out to cf (0-0)."
"05/19/2019","Berkeley, CA",NA,"3","top","0-0","Arizona St.","California","Aldrete,C struck out swinging (2-2 KBBKFS)."
"05/19/2019","Berkeley, CA",NA,"3","top","0-0","Arizona St.","California","Austin, C. struck out swinging (0-2 KKS)."
"05/19/2019","Berkeley, CA",NA,"3","top","0-0","Arizona St.","California","Swift,D struck out swinging, out at first c to 1b (0-2 KKFFF)."
"05/19/2019","Berkeley, CA",NA,"3","bot","0-0","California","Arizona St.","Eden singled through the left side (0-0)."
"05/19/2019","Berkeley, CA",NA,"3","bot","0-0","California","Arizona St.","Selma hit by pitch (0-0)3a Eden advanced to second."
"05/19/2019","Berkeley, CA",NA,"3","bot","0-1","California","Arizona St.","Vaughn singled through the left side, RBI (0-0)3a Selma advanced to second3a Eden scored."
"05/19/2019","Berkeley, CA",NA,"3","bot","0-2","California","Arizona St.","Lee singled to left field, RBI (0-1 K)3a Vaughn advanced to second3a Selma scored."
"05/19/2019","Berkeley, CA",NA,"3","bot","0-2","California","Arizona St.","Flower grounded into double play 3b to 1b (2-2 FFBB)3a Lee advanced to second3a Vaughn out on the play."
"05/19/2019","Berkeley, CA",NA,"3","bot","0-2","California","Arizona St.","Baker grounded out to 2b (0-1 K)."
"05/19/2019","Berkeley, CA",NA,"4","top","1-2","Arizona St.","California","Torkelson,S homered to left center, RBI (3-1 BBBK)."
"05/19/2019","Berkeley, CA",NA,"4","top","1-2","Arizona St.","California","Hauver,T flied out to rf (0-1 F)."
"05/19/2019","Berkeley, CA",NA,"4","top","1-2","Arizona St.","California","Bishop,H grounded out to 2b (2-0 BB)."
"05/19/2019","Berkeley, CA",NA,"4","top","1-2","Arizona St.","California","Williams,A grounded out to ss (2-0 BB)."
"05/19/2019","Berkeley, CA",NA,"4","bot","1-2","California","Arizona St.","Wezniak struck out swinging (2-2 BKFBFS)."
"05/19/2019","Berkeley, CA",NA,"4","bot","1-2","California","Arizona St.","Holman grounded out to 3b (1-1 BF)."
"05/19/2019","Berkeley, CA",NA,"4","bot","1-2","California","Arizona St.","Mack hit by pitch (1-2 FSB)."
"05/19/2019","Berkeley, CA",NA,"4","bot","1-2","California","Arizona St.","Mack advanced to second on an error by 1b, advanced to third."
"05/19/2019","Berkeley, CA",NA,"4","bot","1-2","California","Arizona St.","Eden struck out swinging (0-2 KSS)."
"05/19/2019","Berkeley, CA",NA,"5","top","1-2","Arizona St.","California","Lin,L grounded out to ss (0-0)."
"05/19/2019","Berkeley, CA",NA,"5","top","1-2","Arizona St.","California","Workman,G struck out swinging (0-2 KSS)."
"05/19/2019","Berkeley, CA",NA,"5","top","1-2","Arizona St.","California","Aldrete,C grounded out to 3b (0-0)."
"05/19/2019","Berkeley, CA",NA,"5","bot","1-2","California","Arizona St.","Selma doubled down the rf line (2-2 SBFB)."
"05/19/2019","Berkeley, CA",NA,"5","bot","1-2","California","Arizona St.","Vaughn intentionally walked (2-0 BB)."
"05/19/2019","Berkeley, CA",NA,"5","bot","1-2","California","Arizona St.","Lee reached on a fielders choice (3-1 KBBB)3a Vaughn out at second 2b to ss3a Selma advanced to third."
"05/19/2019","Berkeley, CA",NA,"5","bot","1-2","California","Arizona St.","Flower popped up to ss (0-2 FK)."
"05/19/2019","Berkeley, CA",NA,"5","bot","1-2","California","Arizona St.","Baker reached on a fielders choice (2-1 BKB)3a Lee out at second ss to 2b."
"05/19/2019","Berkeley, CA",NA,"6","top","1-2","Arizona St.","California","Austin, C. singled up the middle (0-1 F)."
"05/19/2019","Berkeley, CA",NA,"6","top","1-2","Arizona St.","California","Swift,D singled to pitcher, bunt (1-0 B)3a Austin, C. advanced to second."
"05/19/2019","Berkeley, CA",NA,"6","top","1-2","Arizona St.","California","Torkelson,S lined out to lf (1-2 KSBF)."
"05/19/2019","Berkeley, CA",NA,"6","top","1-2","Arizona St.","California","Hauver,T grounded out to 3b (1-2 KFB)3a Swift,D advanced to second3a Austin, C. advanced to third."
"05/19/2019","Berkeley, CA",NA,"6","top","1-2","Arizona St.","California","Bishop,H intentionally walked (3-0 BBB)."
"05/19/2019","Berkeley, CA",NA,"6","top","1-2","Arizona St.","California","Williams,A grounded out to 3b (1-0 B)."
"05/19/2019","Berkeley, CA",NA,"6","bot","1-2","California","Arizona St.","Wezniak singled up the middle (2-1 BBK)."
"05/19/2019","Berkeley, CA",NA,"6","bot","1-2","California","Arizona St.","Holman grounded out to 3b (0-1 K)3a Wezniak advanced to second."
"05/19/2019","Berkeley, CA",NA,"6","bot","1-2","California","Arizona St.","Mack struck out swinging (1-2 KFBS)."
"05/19/2019","Berkeley, CA",NA,"6","bot","1-3","California","Arizona St.","Eden singled through the left side, RBI (0-0)3a Wezniak scored."
"05/19/2019","Berkeley, CA",NA,"6","bot","1-3","California","Arizona St.","Eden stole second, advanced to third on an error by c."
"05/19/2019","Berkeley, CA",NA,"6","bot","1-3","California","Arizona St.","Selma popped up to ss (1-1 BF)."
"05/19/2019","Berkeley, CA",NA,"7","top","1-3","Arizona St.","California","Lin,L struck out swinging (1-2 KBFS)."
"05/19/2019","Berkeley, CA",NA,"7","top","1-3","Arizona St.","California","Workman,G grounded out to 1b unassisted (1-2 KBF)."
"05/19/2019","Berkeley, CA",NA,"7","top","2-3","Arizona St.","California","Aldrete,C homered to right field, RBI (2-1 BKB)."
"05/19/2019","Berkeley, CA",NA,"7","top","2-3","Arizona St.","California","rain delay in effect in top of 7, 2 outs, Cal ahead 3-2. 2 pm."
"05/19/2019","Berkeley, CA",NA,"7","top","2-3","Arizona St.","California","Austin, C. struck out looking (0-2 KKK)."
"05/19/2019","Berkeley, CA",NA,"7","bot","2-3","California","Arizona St.","Corrigan,B to p for Vander Kooi."
"05/19/2019","Berkeley, CA",NA,"7","bot","2-3","California","Arizona St.","Vaughn walked (3-2 BFBKBB)."
"05/19/2019","Berkeley, CA",NA,"7","bot","2-3","California","Arizona St.","Lee walked (3-2 SBBKBB)3a Vaughn advanced to second."
"05/19/2019","Berkeley, CA",NA,"7","bot","2-3","California","Arizona St.","Burzell,B to p for Corrigan,B."
"05/19/2019","Berkeley, CA",NA,"7","bot","2-3","California","Arizona St.","Flower flied out to rf (1-1 FB)."
"05/19/2019","Berkeley, CA",NA,"7","bot","2-3","California","Arizona St.","Baker grounded out to c, SAC, bunt (0-0)3a Lee advanced to second3a Vaughn advanced to third."
"05/19/2019","Berkeley, CA",NA,"7","bot","2-3","California","Arizona St.","Wezniak grounded out to p (2-1 KBB)."
"05/19/2019","Berkeley, CA",NA,"8","top","2-3","Arizona St.","California","Tolman,E pinch hit for Swift,D."
"05/19/2019","Berkeley, CA",NA,"8","top","2-3","Arizona St.","California","Tolman,E grounded out to 2b (2-1 KBB)."
"05/19/2019","Berkeley, CA",NA,"8","top","2-3","Arizona St.","California","Torkelson,S walked (3-0 BBBB)."
"05/19/2019","Berkeley, CA",NA,"8","top","2-3","Arizona St.","California","Hauver,T fouled out to 3b (2-2 BFBK)."
"05/19/2019","Berkeley, CA",NA,"8","top","2-3","Arizona St.","California","Bishop,H reached on a fielders choice (0-0)3a Torkelson,S out at second ss unassisted."
"05/19/2019","Berkeley, CA",NA,"8","bot","2-3","California","Arizona St.","Aldrete,C to 2b."
"05/19/2019","Berkeley, CA",NA,"8","bot","2-3","California","Arizona St.","Tolman,E to rf."
"05/19/2019","Berkeley, CA",NA,"8","bot","2-3","California","Arizona St.","Holman flied out to rf (0-0)."
"05/19/2019","Berkeley, CA",NA,"8","bot","2-3","California","Arizona St.","Mack grounded out to 3b (0-2 FF)."
"05/19/2019","Berkeley, CA",NA,"8","bot","2-3","California","Arizona St.","Eden struck out swinging (2-2 KFBBS)."
"05/19/2019","Berkeley, CA",NA,"9","top","2-3","Arizona St.","California","Williams,A grounded out to ss (1-1 FB)."
"05/19/2019","Berkeley, CA",NA,"9","top","2-3","Arizona St.","California","Lin,L struck out swinging (0-2 KSS)."
"05/19/2019","Berkeley, CA",NA,"9","top","2-3","Arizona St.","California","Workman,G tripled to center field (3-2 FBSBB)."
"05/19/2019","Berkeley, CA",NA,"9","top","2-3","Arizona St.","California","Aldrete,C struck out swinging (0-2 KFS)."
