"date","location","attendance","inning","inning_top_bot","score","batting","fielding","description"
"05/18/2019","Omaha, Neb.",NA,"1","top","0-0","Oral Roberts","Omaha","J. McMurray walked (3-0)."
"05/18/2019","Omaha, Neb.",NA,"1","top","0-0","Oral Roberts","Omaha","H. Wilson flied out to lf (2-2)."
"05/18/2019","Omaha, Neb.",NA,"1","top","2-0","Oral Roberts","Omaha","S. Henson homered to left field, 2 RBI (0-2)3a J. McMurray scored."
"05/18/2019","Omaha, Neb.",NA,"1","top","2-0","Oral Roberts","Omaha","R. Keizor flied out to rf (0-0)."
"05/18/2019","Omaha, Neb.",NA,"1","top","2-0","Oral Roberts","Omaha","A. Pace walked (3-2)."
"05/18/2019","Omaha, Neb.",NA,"1","top","2-0","Oral Roberts","Omaha","I. Coffey walked (3-2)3a A. Pace advanced to second."
"05/18/2019","Omaha, Neb.",NA,"1","top","2-0","Oral Roberts","Omaha","H. Swift struck out looking (2-2)."
"05/18/2019","Omaha, Neb.",NA,"1","bot","2-0","Omaha","Oral Roberts","Krumwiede,K. flied out to cf (3-2)."
"05/18/2019","Omaha, Neb.",NA,"1","bot","2-0","Omaha","Oral Roberts","Smejkal,P. walked (3-0)."
"05/18/2019","Omaha, Neb.",NA,"1","bot","2-0","Omaha","Oral Roberts","Bonar,B. grounded out to p (0-2)3a Smejkal,P. advanced to second."
"05/18/2019","Omaha, Neb.",NA,"1","bot","2-0","Omaha","Oral Roberts","Palensky,B. struck out swinging (1-2)."
"05/18/2019","Omaha, Neb.",NA,"2","top","2-0","Oral Roberts","Omaha","B. Hall flied out to rf (2-0)."
"05/18/2019","Omaha, Neb.",NA,"2","top","2-0","Oral Roberts","Omaha","A. Martinez walked (3-1)."
"05/18/2019","Omaha, Neb.",NA,"2","top","3-0","Oral Roberts","Omaha","J. McMurray doubled to right center, RBI (2-1)3a A. Martinez scored."
"05/18/2019","Omaha, Neb.",NA,"2","top","3-0","Oral Roberts","Omaha","Daugherty,T. to p for Koelewyn,S.."
"05/18/2019","Omaha, Neb.",NA,"2","top","3-0","Oral Roberts","Omaha","H. Wilson grounded out to 2b (1-1)3a J. McMurray advanced to third."
"05/18/2019","Omaha, Neb.",NA,"2","top","3-0","Oral Roberts","Omaha","S. Henson walked (3-0)."
"05/18/2019","Omaha, Neb.",NA,"2","top","5-0","Oral Roberts","Omaha","R. Keizor doubled to right center, 2 RBI (0-1)3a S. Henson scored3a J. McMurray scored."
"05/18/2019","Omaha, Neb.",NA,"2","top","5-0","Oral Roberts","Omaha","A. Pace flied out to lf (1-0)."
"05/18/2019","Omaha, Neb.",NA,"2","bot","5-0","Omaha","Oral Roberts","Suponchick,G grounded out to 3b (1-0)."
"05/18/2019","Omaha, Neb.",NA,"2","bot","5-0","Omaha","Oral Roberts","Rogers,B. flied out to cf (2-0)."
"05/18/2019","Omaha, Neb.",NA,"2","bot","5-0","Omaha","Oral Roberts","DeBonville,T singled to third base (0-1)."
"05/18/2019","Omaha, Neb.",NA,"2","bot","5-0","Omaha","Oral Roberts","DeBonville,T stole second."
"05/18/2019","Omaha, Neb.",NA,"2","bot","5-0","Omaha","Oral Roberts","Eckhout,B. walked (3-0)."
"05/18/2019","Omaha, Neb.",NA,"2","bot","5-1","Omaha","Oral Roberts","Lombardi,J. singled to right center, RBI (3-2)3a Eckhout,B. advanced to third3a DeBonville,T scored."
"05/18/2019","Omaha, Neb.",NA,"2","bot","5-3","Omaha","Oral Roberts","Krumwiede,K. singled to left center, 2 RBI (3-2)3a Lombardi,J. scored3a Eckhout,B. scored."
"05/18/2019","Omaha, Neb.",NA,"2","bot","5-3","Omaha","Oral Roberts","Smejkal,P. flied out to rf (0-1)."
"05/18/2019","Omaha, Neb.",NA,"3","top","5-3","Oral Roberts","Omaha","I. Coffey struck out swinging (1-2)."
"05/18/2019","Omaha, Neb.",NA,"3","top","5-3","Oral Roberts","Omaha","H. Swift grounded out to 2b (3-2)."
"05/18/2019","Omaha, Neb.",NA,"3","top","5-3","Oral Roberts","Omaha","B. Hall hit by pitch (0-0)."
"05/18/2019","Omaha, Neb.",NA,"3","top","5-3","Oral Roberts","Omaha","A. Martinez fouled out to c (1-0)."
"05/18/2019","Omaha, Neb.",NA,"3","bot","5-3","Omaha","Oral Roberts","I. Coffey to dh."
"05/18/2019","Omaha, Neb.",NA,"3","bot","5-3","Omaha","Oral Roberts","S. Rainwater to p."
"05/18/2019","Omaha, Neb.",NA,"3","bot","5-3","Omaha","Oral Roberts","Bonar,B. grounded out to ss (1-1)."
"05/18/2019","Omaha, Neb.",NA,"3","bot","5-3","Omaha","Oral Roberts","Palensky,B. walked (3-1)."
"05/18/2019","Omaha, Neb.",NA,"3","bot","5-3","Omaha","Oral Roberts","Suponchick,G singled to left field (1-2)3a Palensky,B. advanced to second."
"05/18/2019","Omaha, Neb.",NA,"3","bot","5-3","Omaha","Oral Roberts","Rogers,B. flied out to cf (1-1)3a Palensky,B. advanced to third."
"05/18/2019","Omaha, Neb.",NA,"3","bot","5-4","Omaha","Oral Roberts","DeBonville,T singled to left field, RBI (1-0)3a Suponchick,G advanced to second3a Palensky,B. scored."
"05/18/2019","Omaha, Neb.",NA,"3","bot","5-4","Omaha","Oral Roberts","Eckhout,B. flied out to cf (0-0)."
"05/18/2019","Omaha, Neb.",NA,"4","top","5-4","Oral Roberts","Omaha","Suponchick,G to p."
"05/18/2019","Omaha, Neb.",NA,"4","top","5-4","Oral Roberts","Omaha","for Daugherty,T.."
"05/18/2019","Omaha, Neb.",NA,"4","top","5-4","Oral Roberts","Omaha","J. McMurray walked (3-2)."
"05/18/2019","Omaha, Neb.",NA,"4","top","5-4","Oral Roberts","Omaha","H. Wilson walked (3-1)3a J. McMurray advanced to second."
"05/18/2019","Omaha, Neb.",NA,"4","top","5-4","Oral Roberts","Omaha","S. Henson popped up to cf (1-2)."
"05/18/2019","Omaha, Neb.",NA,"4","top","5-4","Oral Roberts","Omaha","R. Keizor walked (3-2)3a H. Wilson advanced to second3a J. McMurray advanced to third."
"05/18/2019","Omaha, Neb.",NA,"4","top","6-4","Oral Roberts","Omaha","A. Pace flied out to cf, SF, RBI (0-1)3a H. Wilson advanced to third3a J. McMurray scored."
"05/18/2019","Omaha, Neb.",NA,"4","top","6-4","Oral Roberts","Omaha","T. McCutchin pinch hit for I. Coffey."
"05/18/2019","Omaha, Neb.",NA,"4","top","6-4","Oral Roberts","Omaha","T. McCutchin flied out to lf (1-0)."
"05/18/2019","Omaha, Neb.",NA,"4","bot","6-4","Omaha","Oral Roberts","Lombardi,J. flied out to rf (0-2)."
"05/18/2019","Omaha, Neb.",NA,"4","bot","6-4","Omaha","Oral Roberts","Krumwiede,K. flied out to cf (2-2)."
"05/18/2019","Omaha, Neb.",NA,"4","bot","6-4","Omaha","Oral Roberts","Smejkal,P. struck out swinging (0-2)."
"05/18/2019","Omaha, Neb.",NA,"5","top","6-4","Oral Roberts","Omaha","H. Swift lined out to 3b (2-1)."
"05/18/2019","Omaha, Neb.",NA,"5","top","6-4","Oral Roberts","Omaha","B. Hall fouled out to 1b (1-0)."
"05/18/2019","Omaha, Neb.",NA,"5","top","6-4","Oral Roberts","Omaha","A. Martinez popped up to ss (0-0)."
"05/18/2019","Omaha, Neb.",NA,"5","bot","6-4","Omaha","Oral Roberts","Bonar,B. fouled out to 3b (0-1)."
"05/18/2019","Omaha, Neb.",NA,"5","bot","6-4","Omaha","Oral Roberts","Palensky,B. reached on an error by 3b (2-1)."
"05/18/2019","Omaha, Neb.",NA,"5","bot","6-6","Omaha","Oral Roberts","Suponchick,G homered to left field, 2 RBI (1-1)3a Palensky,B. scored, unearned."
"05/18/2019","Omaha, Neb.",NA,"5","bot","6-6","Omaha","Oral Roberts","Rogers,B. singled to left field (1-2)."
"05/18/2019","Omaha, Neb.",NA,"5","bot","6-6","Omaha","Oral Roberts","Rogers,B. stole second."
"05/18/2019","Omaha, Neb.",NA,"5","bot","6-7","Omaha","Oral Roberts","DeBonville,T singled to shortstop (2-2)3a Rogers,B. advanced to third, scored on a throwing error by ss, unearned."
"05/18/2019","Omaha, Neb.",NA,"5","bot","6-7","Omaha","Oral Roberts","Eckhout,B. grounded into double play ss to 2b to 1b (2-2)3a DeBonville,T out on the play."
"05/18/2019","Omaha, Neb.",NA,"6","top","6-7","Oral Roberts","Omaha","T. McCutchin to dh."
"05/18/2019","Omaha, Neb.",NA,"6","top","6-7","Oral Roberts","Omaha","J. McMurray struck out swinging (1-2)."
"05/18/2019","Omaha, Neb.",NA,"6","top","6-7","Oral Roberts","Omaha","H. Wilson singled to right center (1-0)."
"05/18/2019","Omaha, Neb.",NA,"6","top","6-7","Oral Roberts","Omaha","S. Henson singled to left field (1-2)3a H. Wilson advanced to third."
"05/18/2019","Omaha, Neb.",NA,"6","top","7-7","Oral Roberts","Omaha","R. Keizor singled to right field, RBI (0-0)3a S. Henson advanced to second3a H. Wilson scored."
"05/18/2019","Omaha, Neb.",NA,"6","top","7-7","Oral Roberts","Omaha","Suponchick,G to dh."
"05/18/2019","Omaha, Neb.",NA,"6","top","7-7","Oral Roberts","Omaha","Hehnke,C. to p."
"05/18/2019","Omaha, Neb.",NA,"6","top","7-7","Oral Roberts","Omaha","A. Pace walked (3-1)3a R. Keizor advanced to second3a S. Henson advanced to third."
"05/18/2019","Omaha, Neb.",NA,"6","top","9-7","Oral Roberts","Omaha","T. McCutchin singled to right field, 2 RBI (0-1)3a A. Pace advanced to third3a R. Keizor scored3a S. Henson scored."
"05/18/2019","Omaha, Neb.",NA,"6","top","10-7","Oral Roberts","Omaha","H. Swift singled to right field, RBI (2-2)3a T. McCutchin advanced to third3a A. Pace scored."
"05/18/2019","Omaha, Neb.",NA,"6","top","11-7","Oral Roberts","Omaha","B. Hall flied out to cf, SF, RBI (0-0)3a T. McCutchin scored."
"05/18/2019","Omaha, Neb.",NA,"6","top","11-7","Oral Roberts","Omaha","H. Swift stole second."
"05/18/2019","Omaha, Neb.",NA,"6","top","11-7","Oral Roberts","Omaha","A. Martinez flied out to 2b (2-1)."
"05/18/2019","Omaha, Neb.",NA,"6","bot","11-7","Omaha","Oral Roberts","T. McCutchin to rf."
"05/18/2019","Omaha, Neb.",NA,"6","bot","11-7","Omaha","Oral Roberts","H. Swift to p."
"05/18/2019","Omaha, Neb.",NA,"6","bot","11-7","Omaha","Oral Roberts","for S. Rainwater."
"05/18/2019","Omaha, Neb.",NA,"6","bot","11-7","Omaha","Oral Roberts","Lombardi,J. flied out to cf (3-2)."
"05/18/2019","Omaha, Neb.",NA,"6","bot","11-7","Omaha","Oral Roberts","Krumwiede,K. grounded out to p (1-0)."
"05/18/2019","Omaha, Neb.",NA,"6","bot","11-8","Omaha","Oral Roberts","Smejkal,P. homered to center field, RBI (3-2)."
"05/18/2019","Omaha, Neb.",NA,"6","bot","11-8","Omaha","Oral Roberts","Bonar,B. flied out to rf (2-2)."
"05/18/2019","Omaha, Neb.",NA,"7","top","11-8","Oral Roberts","Omaha","J. McMurray singled to left field (1-0)."
"05/18/2019","Omaha, Neb.",NA,"7","top","11-8","Oral Roberts","Omaha","H. Wilson singled to center field (1-0)3a J. McMurray advanced to second."
"05/18/2019","Omaha, Neb.",NA,"7","top","11-8","Oral Roberts","Omaha","S. Henson struck out swinging (3-2)."
"05/18/2019","Omaha, Neb.",NA,"7","top","11-8","Oral Roberts","Omaha","R. Keizor struck out swinging (3-2)."
"05/18/2019","Omaha, Neb.",NA,"7","top","11-8","Oral Roberts","Omaha","H. Wilson advanced to second on a wild pitch3a J. McMurray advanced to third on a wild pitch."
"05/18/2019","Omaha, Neb.",NA,"7","top","11-8","Oral Roberts","Omaha","A. Pace flied out to lf (3-2)."
"05/18/2019","Omaha, Neb.",NA,"7","bot","11-8","Omaha","Oral Roberts","Palensky,B. walked (3-2)."
"05/18/2019","Omaha, Neb.",NA,"7","bot","11-8","Omaha","Oral Roberts","Suponchick,G grounded into double play ss to 2b to 1b (1-0)3a Palensky,B. out on the play."
"05/18/2019","Omaha, Neb.",NA,"7","bot","11-8","Omaha","Oral Roberts","Rogers,B. struck out looking (2-2)."
"05/18/2019","Omaha, Neb.",NA,"8","top","11-8","Oral Roberts","Omaha","Mohler,J. to p for Hehnke,C.."
"05/18/2019","Omaha, Neb.",NA,"8","top","11-8","Oral Roberts","Omaha","T. McCutchin struck out looking (2-2)."
"05/18/2019","Omaha, Neb.",NA,"8","top","11-8","Oral Roberts","Omaha","H. Swift flied out to lf (0-0)."
"05/18/2019","Omaha, Neb.",NA,"8","top","11-8","Oral Roberts","Omaha","B. Hall lined out to lf (1-1)."
"05/18/2019","Omaha, Neb.",NA,"8","bot","11-8","Omaha","Oral Roberts","DeBonville,T doubled to right center (0-1)."
"05/18/2019","Omaha, Neb.",NA,"8","bot","11-8","Omaha","Oral Roberts","Eckhout,B. walked (3-2)."
"05/18/2019","Omaha, Neb.",NA,"8","bot","11-8","Omaha","Oral Roberts","Lombardi,J. flied out to rf (2-0)."
"05/18/2019","Omaha, Neb.",NA,"8","bot","11-9","Omaha","Oral Roberts","Krumwiede,K. singled to left field, RBI (2-2)3a Eckhout,B. advanced to second3a DeBonville,T scored."
"05/18/2019","Omaha, Neb.",NA,"8","bot","11-9","Omaha","Oral Roberts","Smejkal,P. struck out looking (1-2)."
"05/18/2019","Omaha, Neb.",NA,"8","bot","11-9","Omaha","Oral Roberts","Bonar,B. grounded out to 2b (0-1)."
"05/18/2019","Omaha, Neb.",NA,"9","top","11-9","Oral Roberts","Omaha","A. Martinez walked (3-0)."
"05/18/2019","Omaha, Neb.",NA,"9","top","11-9","Oral Roberts","Omaha","A. Martinez advanced to second on a wild pitch."
"05/18/2019","Omaha, Neb.",NA,"9","top","11-9","Oral Roberts","Omaha","J. McMurray walked (3-0)."
"05/18/2019","Omaha, Neb.",NA,"9","top","11-9","Oral Roberts","Omaha","H. Wilson struck out swinging (0-2)."
"05/18/2019","Omaha, Neb.",NA,"9","top","12-9","Oral Roberts","Omaha","S. Henson singled to shortstop (2-1)3a J. McMurray advanced to second, advanced to third on an error by ss3a A. Martinez scored, unearned."
"05/18/2019","Omaha, Neb.",NA,"9","top","13-9","Oral Roberts","Omaha","R. Keizor reached on a fielders choice, RBI (1-2)3a S. Henson out at second 2b to ss3a J. McMurray scored, unearned."
"05/18/2019","Omaha, Neb.",NA,"9","top","13-9","Oral Roberts","Omaha","A. Pace singled to left field (0-0)3a R. Keizor advanced to second."
"05/18/2019","Omaha, Neb.",NA,"9","top","13-9","Oral Roberts","Omaha","T. McCutchin struck out looking (2-2)."
"05/18/2019","Omaha, Neb.",NA,"9","bot","13-9","Omaha","Oral Roberts","Palensky,B. popped up to cf (3-2)."
"05/18/2019","Omaha, Neb.",NA,"9","bot","13-9","Omaha","Oral Roberts","Suponchick,G walked (3-1)."
"05/18/2019","Omaha, Neb.",NA,"9","bot","13-9","Omaha","Oral Roberts","Bondarchuk,M pinch ran for Suponchick,G."
"05/18/2019","Omaha, Neb.",NA,"9","bot","13-9","Omaha","Oral Roberts","Rogers,B. flied out to cf (1-0)."
"05/18/2019","Omaha, Neb.",NA,"9","bot","13-9","Omaha","Oral Roberts","DeBonville,T grounded out to p (0-1)."
