"date","location","attendance","inning","inning_top_bot","score","batting","fielding","description"
"02/28/2020","Jacksonville, Fla.",NA,"1","top","0-0","Hartford","North Florida","J. Thrasher singled up the middle (0-0)."
"02/28/2020","Jacksonville, Fla.",NA,"1","top","0-0","Hartford","North Florida","Z. Ardito singled to right center (1-1 KB)3a J. Thrasher advanced to third."
"02/28/2020","Jacksonville, Fla.",NA,"1","top","0-0","Hartford","North Florida","J. Olson struck out swinging (2-2 KBKBS)."
"02/28/2020","Jacksonville, Fla.",NA,"1","top","1-0","Hartford","North Florida","Z. Ardito out at second c to ss, caught stealing3a J. Thrasher scored."
"02/28/2020","Jacksonville, Fla.",NA,"1","top","1-0","Hartford","North Florida","D. DeMartino struck out swinging (0-2 KKS)."
"02/28/2020","Jacksonville, Fla.",NA,"1","bot","1-0","North Florida","Hartford","MAY, T. struck out swinging (1-2 KSBS)."
"02/28/2020","Jacksonville, Fla.",NA,"1","bot","1-0","North Florida","Hartford","GRODI, G. singled down the lf line (0-1 K)."
"02/28/2020","Jacksonville, Fla.",NA,"1","bot","1-0","North Florida","Hartford","LIBUNAO, R. struck out looking (3-2 BFBSBK)."
"02/28/2020","Jacksonville, Fla.",NA,"1","bot","1-0","North Florida","Hartford","GRODI, G. stole second."
"02/28/2020","Jacksonville, Fla.",NA,"1","bot","1-0","North Florida","Hartford","MATTHIAS, C. fouled out to 3b (1-2 SBS)."
"02/28/2020","Jacksonville, Fla.",NA,"2","top","1-0","Hartford","North Florida","T. Coppo doubled to right center (2-2 KFBBF)."
"02/28/2020","Jacksonville, Fla.",NA,"2","top","1-0","Hartford","North Florida","N. Pagan singled to left field (3-2 BKBBKF)3a T. Coppo advanced to third."
"02/28/2020","Jacksonville, Fla.",NA,"2","top","2-0","Hartford","North Florida","D. Kellogg grounded into double play 2b to ss to 1b (3-2 BFFBB)3a N. Pagan out on the play3a T. Coppo scored."
"02/28/2020","Jacksonville, Fla.",NA,"2","top","2-0","Hartford","North Florida","R. Carmody singled through the right side (0-0)."
"02/28/2020","Jacksonville, Fla.",NA,"2","top","2-0","Hartford","North Florida","K. Hawes grounded out to p (2-2 KBFBF)."
"02/28/2020","Jacksonville, Fla.",NA,"2","bot","2-0","North Florida","Hartford","MARABELL, B. grounded out to 2b (2-2 BKFFB)."
"02/28/2020","Jacksonville, Fla.",NA,"2","bot","2-0","North Florida","Hartford","S. WILLIAMS grounded out to 2b (1-0 B)."
"02/28/2020","Jacksonville, Fla.",NA,"2","bot","2-0","North Florida","Hartford","WHITEHEAD, J flied out to cf to right center (2-0 BB)."
"02/28/2020","Jacksonville, Fla.",NA,"3","top","2-0","Hartford","North Florida","J. Thrasher popped up to 2b (1-1 KB)."
"02/28/2020","Jacksonville, Fla.",NA,"3","top","2-0","Hartford","North Florida","Z. Ardito grounded out to ss (0-0)."
"02/28/2020","Jacksonville, Fla.",NA,"3","top","2-0","Hartford","North Florida","J. Olson out at first 1b to p (0-1 F)."
"02/28/2020","Jacksonville, Fla.",NA,"3","bot","2-0","North Florida","Hartford","HURWITZ, A. flied out to lf (1-0 B)."
"02/28/2020","Jacksonville, Fla.",NA,"3","bot","2-0","North Florida","Hartford","REICH, C. reached on a throwing error by ss (2-1 SBB)."
"02/28/2020","Jacksonville, Fla.",NA,"3","bot","2-0","North Florida","Hartford","MAY, T. lined out to cf (0-0)."
"02/28/2020","Jacksonville, Fla.",NA,"3","bot","2-0","North Florida","Hartford","REICH, C. stole second."
"02/28/2020","Jacksonville, Fla.",NA,"3","bot","2-0","North Florida","Hartford","GRODI, G. walked (3-2 BFBBFFFB)."
"02/28/2020","Jacksonville, Fla.",NA,"3","bot","2-0","North Florida","Hartford","LIBUNAO, R. hit by pitch (2-2 BSFBF)3a GRODI, G. advanced to second3a REICH, C. advanced to third."
"02/28/2020","Jacksonville, Fla.",NA,"3","bot","2-0","North Florida","Hartford","MATTHIAS, C. flied out to rf (0-2 SSF)."
"02/28/2020","Jacksonville, Fla.",NA,"4","top","3-0","Hartford","North Florida","D. DeMartino homered to right center, RBI (0-0)."
"02/28/2020","Jacksonville, Fla.",NA,"4","top","3-0","Hartford","North Florida","T. Coppo flied out to rf (2-2 BBFF)."
"02/28/2020","Jacksonville, Fla.",NA,"4","top","3-0","Hartford","North Florida","N. Pagan singled to right field (2-0 BB)."
"02/28/2020","Jacksonville, Fla.",NA,"4","top","3-0","Hartford","North Florida","N. Pagan out at second c to 2b, caught stealing."
"02/28/2020","Jacksonville, Fla.",NA,"4","top","3-0","Hartford","North Florida","D. Kellogg singled up the middle (3-2 SSBBB)."
"02/28/2020","Jacksonville, Fla.",NA,"4","top","3-0","Hartford","North Florida","R. Carmody grounded out to 3b (1-0 B)."
"02/28/2020","Jacksonville, Fla.",NA,"4","bot","3-0","North Florida","Hartford","MARABELL, B. flied out to cf to left center (1-0 B)."
"02/28/2020","Jacksonville, Fla.",NA,"4","bot","3-0","North Florida","Hartford","S. WILLIAMS flied out to rf (0-0)."
"02/28/2020","Jacksonville, Fla.",NA,"4","bot","3-0","North Florida","Hartford","WHITEHEAD, J struck out swinging (3-2 BBBKKS)."
"02/28/2020","Jacksonville, Fla.",NA,"5","top","3-0","Hartford","North Florida","K. Hawes singled to center field (1-2 KSB)."
"02/28/2020","Jacksonville, Fla.",NA,"5","top","3-0","Hartford","North Florida","J. Thrasher singled through the left side (2-2 FBKB)3a K. Hawes advanced to second."
"02/28/2020","Jacksonville, Fla.",NA,"5","top","4-0","Hartford","North Florida","J. Thrasher stole second, advanced to third on a fielding error by 3b3a K. Hawes stole third, scored on the error."
"02/28/2020","Jacksonville, Fla.",NA,"5","top","5-0","Hartford","North Florida","Z. Ardito singled, RBI (3-2 KKBBBF)3a J. Thrasher scored."
"02/28/2020","Jacksonville, Fla.",NA,"5","top","5-0","Hartford","North Florida","MADONNA, D. to p for REITZ, B.."
"02/28/2020","Jacksonville, Fla.",NA,"5","top","5-0","Hartford","North Florida","J. Olson singled up the middle (1-2 KFB)3a Z. Ardito advanced to second."
"02/28/2020","Jacksonville, Fla.",NA,"5","top","5-0","Hartford","North Florida","D. DeMartino walked (3-2 BBBKSFB)3a J. Olson advanced to second3a Z. Ardito advanced to third."
"02/28/2020","Jacksonville, Fla.",NA,"5","top","5-0","Hartford","North Florida","T. Coppo struck out swinging (1-2 BSSFS)."
"02/28/2020","Jacksonville, Fla.",NA,"5","top","5-0","Hartford","North Florida","N. Pagan struck out swinging (1-2 BKKS)."
"02/28/2020","Jacksonville, Fla.",NA,"5","top","5-0","Hartford","North Florida","D. Kellogg flied out to rf (2-1 BFB)."
"02/28/2020","Jacksonville, Fla.",NA,"5","bot","5-0","North Florida","Hartford","HURWITZ, A. grounded out to 1b unassisted (2-2 BKFBFF)."
"02/28/2020","Jacksonville, Fla.",NA,"5","bot","5-0","North Florida","Hartford","REICH, C. struck out swinging (2-2 FBBSS)."
"02/28/2020","Jacksonville, Fla.",NA,"5","bot","5-0","North Florida","Hartford","MAY, T. flied out to rf (1-2 FBF)."
"02/28/2020","Jacksonville, Fla.",NA,"6","top","5-0","Hartford","North Florida","R. Carmody lined out to cf to left center (1-0 B)."
"02/28/2020","Jacksonville, Fla.",NA,"6","top","5-0","Hartford","North Florida","K. Hawes struck out looking (0-2 SKK)."
"02/28/2020","Jacksonville, Fla.",NA,"6","top","5-0","Hartford","North Florida","J. Thrasher flied out to rf to right center (1-0 B)."
"02/28/2020","Jacksonville, Fla.",NA,"6","bot","5-0","North Florida","Hartford","GRODI, G. grounded out to p (1-2 KBK)."
"02/28/2020","Jacksonville, Fla.",NA,"6","bot","5-0","North Florida","Hartford","LIBUNAO, R. grounded out to 3b (0-0)."
"02/28/2020","Jacksonville, Fla.",NA,"6","bot","5-0","North Florida","Hartford","MATTHIAS, C. struck out swinging (1-2 KSBS)."
"02/28/2020","Jacksonville, Fla.",NA,"7","top","5-0","Hartford","North Florida","Z. Ardito lined out to 2b (2-1 BBF)."
"02/28/2020","Jacksonville, Fla.",NA,"7","top","5-0","Hartford","North Florida","J. Olson singled up the middle (2-1 BBK)."
"02/28/2020","Jacksonville, Fla.",NA,"7","top","5-0","Hartford","North Florida","D. DeMartino struck out swinging (2-2 BBSKS)."
"02/28/2020","Jacksonville, Fla.",NA,"7","top","5-0","Hartford","North Florida","J. Olson stole second."
"02/28/2020","Jacksonville, Fla.",NA,"7","top","6-0","Hartford","North Florida","T. Coppo doubled to right center, RBI (2-1 BKB)3a J. Olson scored."
"02/28/2020","Jacksonville, Fla.",NA,"7","top","6-0","Hartford","North Florida","SANTOS, R. to p for MADONNA, D.."
"02/28/2020","Jacksonville, Fla.",NA,"7","top","6-0","Hartford","North Florida","B. Walker pinch hit for N. Pagan."
"02/28/2020","Jacksonville, Fla.",NA,"7","top","6-0","Hartford","North Florida","B. Walker hit by pitch (2-2 BKFB)."
"02/28/2020","Jacksonville, Fla.",NA,"7","top","6-0","Hartford","North Florida","D. Kellogg struck out looking (3-2 BFBBFFK)."
"02/28/2020","Jacksonville, Fla.",NA,"7","bot","6-0","North Florida","Hartford","T. Dickson to lf for D. Kellogg."
"02/28/2020","Jacksonville, Fla.",NA,"7","bot","6-0","North Florida","Hartford","MARABELL, B. flied out to rf (1-0 B)."
"02/28/2020","Jacksonville, Fla.",NA,"7","bot","6-1","North Florida","Hartford","S. WILLIAMS homered to right field, RBI (1-0 B)."
"02/28/2020","Jacksonville, Fla.",NA,"7","bot","6-1","North Florida","Hartford","WHITEHEAD, J grounded out to 2b (0-0)."
"02/28/2020","Jacksonville, Fla.",NA,"7","bot","6-1","North Florida","Hartford","HURWITZ, A. struck out swinging (3-2 BBBKKS)."
"02/28/2020","Jacksonville, Fla.",NA,"8","top","6-1","Hartford","North Florida","R. Carmody grounded out to 1b unassisted (3-2 BFBBF)."
"02/28/2020","Jacksonville, Fla.",NA,"8","top","6-1","Hartford","North Florida","K. Hawes flied out to rf (2-0 BB)."
"02/28/2020","Jacksonville, Fla.",NA,"8","top","6-1","Hartford","North Florida","J. Thrasher popped up to 1b (2-1 KBB)."
"02/28/2020","Jacksonville, Fla.",NA,"8","bot","6-1","North Florida","Hartford","P. Myers to p for N. Dombkowsk."
"02/28/2020","Jacksonville, Fla.",NA,"8","bot","6-1","North Florida","Hartford","GEIS, J. pinch hit for REICH, C.."
"02/28/2020","Jacksonville, Fla.",NA,"8","bot","6-1","North Florida","Hartford","GEIS, J. struck out looking (1-2 BKFK)."
"02/28/2020","Jacksonville, Fla.",NA,"8","bot","6-1","North Florida","Hartford","MAY, T. struck out swinging (3-2 BSBBFS)."
"02/28/2020","Jacksonville, Fla.",NA,"8","bot","6-2","North Florida","Hartford","GRODI, G. homered to right field, RBI (2-2 FBKB)."
"02/28/2020","Jacksonville, Fla.",NA,"8","bot","6-2","North Florida","Hartford","LIBUNAO, R. singled up the middle (0-0)."
"02/28/2020","Jacksonville, Fla.",NA,"8","bot","6-2","North Florida","Hartford","CHAPPELL, Z. pinch hit for MATTHIAS, C.."
"02/28/2020","Jacksonville, Fla.",NA,"8","bot","6-2","North Florida","Hartford","CHAPPELL, Z. struck out swinging (3-2 KFBBFBS)."
"02/28/2020","Jacksonville, Fla.",NA,"9","top","6-2","Hartford","North Florida","PRESNO, R. to 3b for WHITEHEAD, J."
"02/28/2020","Jacksonville, Fla.",NA,"9","top","6-2","Hartford","North Florida","GEIS, J. to lf."
"02/28/2020","Jacksonville, Fla.",NA,"9","top","6-2","Hartford","North Florida","Z. Ardito reached on a fielding error by 3b (2-1 KBB)."
"02/28/2020","Jacksonville, Fla.",NA,"9","top","6-2","Hartford","North Florida","J. Olson reached on a fielders choice to third base (1-2 SBF)3a Z. Ardito out at second 3b to 2b."
"02/28/2020","Jacksonville, Fla.",NA,"9","top","6-2","Hartford","North Florida","J. Olson picked off, out at second p to 1b to ss."
"02/28/2020","Jacksonville, Fla.",NA,"9","top","6-2","Hartford","North Florida","D. DeMartino doubled down the lf line (3-1 BBKB)."
"02/28/2020","Jacksonville, Fla.",NA,"9","top","6-2","Hartford","North Florida","T. Coppo grounded out to 3b (0-0)."
"02/28/2020","Jacksonville, Fla.",NA,"9","bot","6-2","North Florida","Hartford","MARABELL, B. lined out to ss (3-2 SFBBFFB)."
"02/28/2020","Jacksonville, Fla.",NA,"9","bot","6-2","North Florida","Hartford","S. WILLIAMS popped up to ss (0-1 S)."
"02/28/2020","Jacksonville, Fla.",NA,"9","bot","6-2","North Florida","Hartford","PRESNO, R. lined out to 2b (1-2 KSB)."
