"date","location","attendance","inning","inning_top_bot","score","batting","fielding","description"
"04/16/2021","Greensboro, N.C.",NA,"1","top","0-0","Florida A&M","N.C. A&T","Moyer, O. struck out looking."
"04/16/2021","Greensboro, N.C.",NA,"1","top","0-0","Florida A&M","N.C. A&T","Watson, M. struck out swinging, out at first c to 1b."
"04/16/2021","Greensboro, N.C.",NA,"1","top","0-0","Florida A&M","N.C. A&T","Weber, J. grounded out to 3b."
"04/16/2021","Greensboro, N.C.",NA,"1","bot","0-0","N.C. A&T","Florida A&M","Mack, T. flied out to lf."
"04/16/2021","Greensboro, N.C.",NA,"1","bot","0-0","N.C. A&T","Florida A&M","Brantley, C. popped up to ss."
"04/16/2021","Greensboro, N.C.",NA,"1","bot","0-0","N.C. A&T","Florida A&M","Rodriguez, J struck out swinging."
"04/16/2021","Greensboro, N.C.",NA,"2","top","0-0","Florida A&M","N.C. A&T","Bryant, L. struck out swinging."
"04/16/2021","Greensboro, N.C.",NA,"2","top","0-0","Florida A&M","N.C. A&T","Rayburn, T. walked."
"04/16/2021","Greensboro, N.C.",NA,"2","top","0-0","Florida A&M","N.C. A&T","Lawrence, S. singled to left center3a Rayburn, T. advanced to second."
"04/16/2021","Greensboro, N.C.",NA,"2","top","0-0","Florida A&M","N.C. A&T","Johnson, E. flied out to cf3a Rayburn, T. advanced to third."
"04/16/2021","Greensboro, N.C.",NA,"2","top","0-0","Florida A&M","N.C. A&T","Tease, J struck out looking."
"04/16/2021","Greensboro, N.C.",NA,"2","top","0-0","Florida A&M","N.C. A&T","H: 1 LOB: 2"
"04/16/2021","Greensboro, N.C.",NA,"2","bot","0-0","N.C. A&T","Florida A&M","Williams, J. popped up to c."
"04/16/2021","Greensboro, N.C.",NA,"2","bot","0-0","N.C. A&T","Florida A&M","Baber, D. struck out swinging, out at first c to 1b."
"04/16/2021","Greensboro, N.C.",NA,"2","bot","0-0","N.C. A&T","Florida A&M","Williamson, singled to left center."
"04/16/2021","Greensboro, N.C.",NA,"2","bot","0-0","N.C. A&T","Florida A&M","McLean, Z. grounded out to 2b."
"04/16/2021","Greensboro, N.C.",NA,"2","top","0-0","Florida A&M","N.C. A&T","H: 1 LOB: 1"
"04/16/2021","Greensboro, N.C.",NA,"3","top","0-0","Florida A&M","N.C. A&T","Haidermota, doubled to center field."
"04/16/2021","Greensboro, N.C.",NA,"3","top","0-0","Florida A&M","N.C. A&T","Moyer, O. lined out to cf3a Haidermota, advanced to third."
"04/16/2021","Greensboro, N.C.",NA,"3","top","0-0","Florida A&M","N.C. A&T","Watson, M. walked."
"04/16/2021","Greensboro, N.C.",NA,"3","top","1-0","Florida A&M","N.C. A&T","Weber, J. flied out to rf, SF, RBI3a Watson, M. advanced to second3a Haidermota, scored."
"04/16/2021","Greensboro, N.C.",NA,"3","top","2-0","Florida A&M","N.C. A&T","Bryant, L. singled through the right side, RBI3a Watson, M. scored."
"04/16/2021","Greensboro, N.C.",NA,"3","top","2-0","Florida A&M","N.C. A&T","Rayburn, T. struck out swinging."
"04/16/2021","Greensboro, N.C.",NA,"3","bot","2-0","N.C. A&T","Florida A&M","Faulk, S. lined out to lf."
"04/16/2021","Greensboro, N.C.",NA,"3","bot","2-0","N.C. A&T","Florida A&M","Stanley, R. grounded out to ss."
"04/16/2021","Greensboro, N.C.",NA,"3","bot","2-0","N.C. A&T","Florida A&M","Mack, T. grounded out to p."
"04/16/2021","Greensboro, N.C.",NA,"4","top","2-0","Florida A&M","N.C. A&T","Lawrence, S. grounded out to 3b."
"04/16/2021","Greensboro, N.C.",NA,"4","top","2-0","Florida A&M","N.C. A&T","Johnson, E. struck out swinging."
"04/16/2021","Greensboro, N.C.",NA,"4","top","2-0","Florida A&M","N.C. A&T","Tease, J struck out looking."
"04/16/2021","Greensboro, N.C.",NA,"4","bot","2-1","N.C. A&T","Florida A&M","Brantley, C. homered to right field, RBI."
"04/16/2021","Greensboro, N.C.",NA,"4","bot","2-1","N.C. A&T","Florida A&M","Rodriguez, J struck out swinging, out at first c to 1b."
"04/16/2021","Greensboro, N.C.",NA,"4","bot","2-1","N.C. A&T","Florida A&M","Williams, J. singled up the middle."
"04/16/2021","Greensboro, N.C.",NA,"4","bot","2-1","N.C. A&T","Florida A&M","Williams, J. advanced to second on a passed ball."
"04/16/2021","Greensboro, N.C.",NA,"4","bot","2-2","N.C. A&T","Florida A&M","Baber, D. singled to right center, RBI3a Williams, J. scored."
"04/16/2021","Greensboro, N.C.",NA,"4","bot","2-3","N.C. A&T","Florida A&M","Williamson, tripled to right field, RBI, grounded out to c unassisted3a Baber, D. scored."
"04/16/2021","Greensboro, N.C.",NA,"4","bot","2-3","N.C. A&T","Florida A&M","McLean, Z. singled through the left side."
"04/16/2021","Greensboro, N.C.",NA,"4","bot","2-3","N.C. A&T","Florida A&M","Faulk, S. walked3a McLean, Z. advanced to second."
"04/16/2021","Greensboro, N.C.",NA,"4","bot","2-3","N.C. A&T","Florida A&M","Stanley, R. walked3a Faulk, S. advanced to second3a McLean, Z. advanced to third."
"04/16/2021","Greensboro, N.C.",NA,"4","bot","2-3","N.C. A&T","Florida A&M","Mack, T. flied out to lf."
"04/16/2021","Greensboro, N.C.",NA,"4","bot","2-3","N.C. A&T","Florida A&M","R: 3 H: 5 LOB: 3"
"04/16/2021","Greensboro, N.C.",NA,"5","top","2-3","Florida A&M","N.C. A&T","Haidermota, grounded out to 2b."
"04/16/2021","Greensboro, N.C.",NA,"5","top","2-3","Florida A&M","N.C. A&T","Moyer, O. popped up to ss."
"04/16/2021","Greensboro, N.C.",NA,"5","top","2-3","Florida A&M","N.C. A&T","Watson, M. struck out looking."
"04/16/2021","Greensboro, N.C.",NA,"5","bot","2-4","N.C. A&T","Florida A&M","Brantley, C. homered to right field, RBI."
"04/16/2021","Greensboro, N.C.",NA,"5","bot","2-4","N.C. A&T","Florida A&M","Rodriguez, J singled through the left side."
"04/16/2021","Greensboro, N.C.",NA,"5","bot","2-4","N.C. A&T","Florida A&M","Williams, J. singled to third base, bunt3a Rodriguez, J advanced to second."
"04/16/2021","Greensboro, N.C.",NA,"5","bot","2-4","N.C. A&T","Florida A&M","Williams, J. advanced to second on a passed ball3a Rodriguez, J advanced to third."
"04/16/2021","Greensboro, N.C.",NA,"5","bot","2-5","N.C. A&T","Florida A&M","Baber, D. singled to right field, RBI3a Williams, J. advanced to third3a Rodriguez, J scored."
"04/16/2021","Greensboro, N.C.",NA,"5","bot","2-6","N.C. A&T","Florida A&M","Williamson, reached on a fielders choice to second base, RBI3a Baber, D. out at second 2b to ss3a Williams, J. scored."
"04/16/2021","Greensboro, N.C.",NA,"5","bot","2-6","N.C. A&T","Florida A&M","McLean, Z. singled up the middle3a Williamson, advanced to second."
"04/16/2021","Greensboro, N.C.",NA,"5","bot","2-6","N.C. A&T","Florida A&M","Faulk, S. singled through the left side3a McLean, Z. advanced to second3a Williamson, advanced to third."
"04/16/2021","Greensboro, N.C.",NA,"5","bot","2-6","N.C. A&T","Florida A&M","Morea, Z. to p for Hancock,J.."
"04/16/2021","Greensboro, N.C.",NA,"5","bot","2-6","N.C. A&T","Florida A&M","Stanley, R. struck out looking."
"04/16/2021","Greensboro, N.C.",NA,"5","bot","2-8","N.C. A&T","Florida A&M","Mack, T. doubled down the rf line, 2 RBI3a Faulk, S. advanced to third3a McLean, Z. scored3a Williamson, scored."
"04/16/2021","Greensboro, N.C.",NA,"5","bot","2-8","N.C. A&T","Florida A&M","Brantley, C. struck out looking."
"04/16/2021","Greensboro, N.C.",NA,"5","bot","2-8","N.C. A&T","Florida A&M","R: 5 H: 7 LOB: 2"
"04/16/2021","Greensboro, N.C.",NA,"6","top","2-8","Florida A&M","N.C. A&T","Weber, J. struck out looking."
"04/16/2021","Greensboro, N.C.",NA,"6","top","2-8","Florida A&M","N.C. A&T","Bryant, L. popped up to 2b."
"04/16/2021","Greensboro, N.C.",NA,"6","top","2-8","Florida A&M","N.C. A&T","Rayburn, T. struck out swinging."
"04/16/2021","Greensboro, N.C.",NA,"6","bot","2-8","N.C. A&T","Florida A&M","Rodriguez, J grounded out to 1b unassisted."
"04/16/2021","Greensboro, N.C.",NA,"6","bot","2-8","N.C. A&T","Florida A&M","Williams, J. struck out swinging."
"04/16/2021","Greensboro, N.C.",NA,"6","bot","2-8","N.C. A&T","Florida A&M","Slentz, C. to p for Morea, Z.."
"04/16/2021","Greensboro, N.C.",NA,"6","bot","2-8","N.C. A&T","Florida A&M","Baber, D. struck out swinging."
"04/16/2021","Greensboro, N.C.",NA,"7","top","2-8","Florida A&M","N.C. A&T","Lawrence, S. walked."
"04/16/2021","Greensboro, N.C.",NA,"7","top","2-8","Florida A&M","N.C. A&T","Johnson, E. walked3a Lawrence, S. advanced to second."
"04/16/2021","Greensboro, N.C.",NA,"7","top","2-8","Florida A&M","N.C. A&T","Davidson, L. to p for Parks, C.."
"04/16/2021","Greensboro, N.C.",NA,"7","top","2-8","Florida A&M","N.C. A&T","Tease, J struck out looking."
"04/16/2021","Greensboro, N.C.",NA,"7","top","2-8","Florida A&M","N.C. A&T","Johnson, E. out at second c to ss, caught stealing."
"04/16/2021","Greensboro, N.C.",NA,"7","top","2-8","Florida A&M","N.C. A&T","Lawrence, S. stole third."
"04/16/2021","Greensboro, N.C.",NA,"7","top","2-8","Florida A&M","N.C. A&T","Haidermota, grounded out to 2b."
"04/16/2021","Greensboro, N.C.",NA,"7","top","2-8","Florida A&M","N.C. A&T","LOB: 1"
"04/16/2021","Greensboro, N.C.",NA,"7","bot","2-8","N.C. A&T","Florida A&M","Williamson, fouled out to c."
"04/16/2021","Greensboro, N.C.",NA,"7","bot","2-8","N.C. A&T","Florida A&M","McLean, Z. grounded out to p."
"04/16/2021","Greensboro, N.C.",NA,"7","bot","2-8","N.C. A&T","Florida A&M","Faulk, S. grounded out to 1b unassisted."
"04/16/2021","Greensboro, N.C.",NA,"8","top","2-8","Florida A&M","N.C. A&T","Moyer, O. flied out to rf."
"04/16/2021","Greensboro, N.C.",NA,"8","top","2-8","Florida A&M","N.C. A&T","Winebarger, to p for Davidson, L.."
"04/16/2021","Greensboro, N.C.",NA,"8","top","2-8","Florida A&M","N.C. A&T","Jenkins, E. pinch hit for Watson, M.."
"04/16/2021","Greensboro, N.C.",NA,"8","top","2-8","Florida A&M","N.C. A&T","Jenkins, E. fouled out to 1b."
"04/16/2021","Greensboro, N.C.",NA,"8","top","2-8","Florida A&M","N.C. A&T","Weber, J. struck out swinging."
"04/16/2021","Greensboro, N.C.",NA,"8","bot","2-8","N.C. A&T","Florida A&M","Jenkins, E. to dh."
"04/16/2021","Greensboro, N.C.",NA,"8","bot","2-8","N.C. A&T","Florida A&M","Stanley, R. doubled to left center."
"04/16/2021","Greensboro, N.C.",NA,"8","bot","2-8","N.C. A&T","Florida A&M","Host, S. to p for Slentz, C.."
"04/16/2021","Greensboro, N.C.",NA,"8","bot","2-8","N.C. A&T","Florida A&M","Mack, T. grounded out to p."
"04/16/2021","Greensboro, N.C.",NA,"8","bot","2-8","N.C. A&T","Florida A&M","Brantley, C. walked."
"04/16/2021","Greensboro, N.C.",NA,"8","bot","2-8","N.C. A&T","Florida A&M","Rodriguez, J lined out to lf."
"04/16/2021","Greensboro, N.C.",NA,"8","bot","2-8","N.C. A&T","Florida A&M","Williams, J. lined out to lf."
"04/16/2021","Greensboro, N.C.",NA,"8","bot","2-8","N.C. A&T","Florida A&M","H: 1 LOB: 2"
"04/16/2021","Greensboro, N.C.",NA,"9","top","2-8","Florida A&M","N.C. A&T","Bryant, L. struck out swinging."
"04/16/2021","Greensboro, N.C.",NA,"9","top","2-8","Florida A&M","N.C. A&T","Bourque, A. pinch hit for Rayburn, T.."
"04/16/2021","Greensboro, N.C.",NA,"9","top","2-8","Florida A&M","N.C. A&T","Bourque, A. struck out swinging."
"04/16/2021","Greensboro, N.C.",NA,"9","top","2-8","Florida A&M","N.C. A&T","Lawrence, S. struck out swinging."
