"date","location","attendance","inning","inning_top_bot","score","batting","fielding","description"
"05/02/2021","Stony Brook, N.Y.",NA,"1","top","0-0","Binghamton","Stony Brook","Reifler singled through the right side (1-2 BKK)."
"05/02/2021","Stony Brook, N.Y.",NA,"1","top","0-0","Binghamton","Stony Brook","Franchi struck out swinging, hit into double play c to ss (0-2 FSFS)3a Reifler out on the play."
"05/02/2021","Stony Brook, N.Y.",NA,"1","top","0-0","Binghamton","Stony Brook","Baratta struck out swinging (1-2 BKKS)."
"05/02/2021","Stony Brook, N.Y.",NA,"1","top","0-0","Binghamton","Stony Brook","H: 1"
"05/02/2021","Stony Brook, N.Y.",NA,"1","bot","0-0","Stony Brook","Binghamton","E Giordano popped up to 1b (1-0 B)."
"05/02/2021","Stony Brook, N.Y.",NA,"1","bot","0-0","Stony Brook","Binghamton","C Hamilton singled to right center (1-1 BS)."
"05/02/2021","Stony Brook, N.Y.",NA,"1","bot","0-0","Stony Brook","Binghamton","S Paradine popped up to 2b to right field (2-0 BB)."
"05/02/2021","Stony Brook, N.Y.",NA,"1","bot","0-0","Stony Brook","Binghamton","J Tuccillo grounded out to ss (2-2 BFKB)."
"05/02/2021","Stony Brook, N.Y.",NA,"1","top","0-0","Binghamton","Stony Brook","H: 1 LOB: 1"
"05/02/2021","Stony Brook, N.Y.",NA,"2","top","0-0","Binghamton","Stony Brook","Drpich grounded out to p (0-1 S)."
"05/02/2021","Stony Brook, N.Y.",NA,"2","top","0-0","Binghamton","Stony Brook","Gsell struck out swinging, out at first c to 1b (2-2 SBSBFS)."
"05/02/2021","Stony Brook, N.Y.",NA,"2","top","0-0","Binghamton","Stony Brook","Marshall grounded out to ss (0-0)."
"05/02/2021","Stony Brook, N.Y.",NA,"2","bot","0-0","Stony Brook","Binghamton","J LaRocca doubled down the lf line (2-2 BFBK)."
"05/02/2021","Stony Brook, N.Y.",NA,"2","bot","0-0","Stony Brook","Binghamton","E Fox grounded out to 3b (1-2 KKFBF)3a J LaRocca advanced to third."
"05/02/2021","Stony Brook, N.Y.",NA,"2","bot","0-1","Stony Brook","Binghamton","S Leuthner singled up the middle, RBI (0-0)3a J LaRocca scored."
"05/02/2021","Stony Brook, N.Y.",NA,"2","bot","0-1","Stony Brook","Binghamton","C Durkan singled to right field (0-1 F)3a S Leuthner advanced to second."
"05/02/2021","Stony Brook, N.Y.",NA,"2","bot","0-1","Stony Brook","Binghamton","C Durkan advanced to second on a wild pitch3a S Leuthner advanced to third on a wild pitch."
"05/02/2021","Stony Brook, N.Y.",NA,"2","bot","0-1","Stony Brook","Binghamton","B Short walked (3-2 FBFBFBB)."
"05/02/2021","Stony Brook, N.Y.",NA,"2","bot","0-2","Stony Brook","Binghamton","E Giordano grounded out to 3b, RBI (1-0 B)3a B Short advanced to second3a C Durkan advanced to third3a S Leuthner scored."
"05/02/2021","Stony Brook, N.Y.",NA,"2","bot","0-4","Stony Brook","Binghamton","C Hamilton doubled to center field, ground-rule, 2 RBI (1-1 KB)3a B Short scored3a C Durkan scored."
"05/02/2021","Stony Brook, N.Y.",NA,"2","bot","0-4","Stony Brook","Binghamton","S Paradine singled to third base (0-0)3a C Hamilton advanced to third."
"05/02/2021","Stony Brook, N.Y.",NA,"2","bot","0-4","Stony Brook","Binghamton","J Tuccillo grounded out to ss (0-0)."
"05/02/2021","Stony Brook, N.Y.",NA,"2","bot","0-4","Stony Brook","Binghamton","R: 4 H: 5 LOB: 2"
"05/02/2021","Stony Brook, N.Y.",NA,"3","top","0-4","Binghamton","Stony Brook","Reilly struck out swinging (0-2 FKS)."
"05/02/2021","Stony Brook, N.Y.",NA,"3","top","0-4","Binghamton","Stony Brook","Evans reached on a fielding error by ss (1-2 SBSFF)."
"05/02/2021","Stony Brook, N.Y.",NA,"3","top","0-4","Binghamton","Stony Brook","Taylor singled up the middle (2-1 BBK)3a Evans advanced to second."
"05/02/2021","Stony Brook, N.Y.",NA,"3","top","0-4","Binghamton","Stony Brook","Reifler flied out to cf to left center (0-1 K)."
"05/02/2021","Stony Brook, N.Y.",NA,"3","top","0-4","Binghamton","Stony Brook","Franchi reached on a fielders choice (0-2 KSF)3a Taylor out at second 3b to 2b."
"05/02/2021","Stony Brook, N.Y.",NA,"3","top","0-4","Binghamton","Stony Brook","H: 1 E: 1 LOB: 2"
"05/02/2021","Stony Brook, N.Y.",NA,"3","bot","0-4","Stony Brook","Binghamton","Eskildsen to p for Goodwin."
"05/02/2021","Stony Brook, N.Y.",NA,"3","bot","0-4","Stony Brook","Binghamton","J LaRocca hit by pitch (2-2 BFBFF)."
"05/02/2021","Stony Brook, N.Y.",NA,"3","bot","0-4","Stony Brook","Binghamton","E Fox grounded out to 2b (0-1 S)3a J LaRocca advanced to second."
"05/02/2021","Stony Brook, N.Y.",NA,"3","bot","0-4","Stony Brook","Binghamton","S Leuthner grounded out to p (0-0)3a J LaRocca advanced to third."
"05/02/2021","Stony Brook, N.Y.",NA,"3","bot","0-4","Stony Brook","Binghamton","C Durkan hit by pitch (3-0 BBB)."
"05/02/2021","Stony Brook, N.Y.",NA,"3","bot","0-4","Stony Brook","Binghamton","C Durkan stole second."
"05/02/2021","Stony Brook, N.Y.",NA,"3","bot","0-4","Stony Brook","Binghamton","B Short grounded out to 2b (0-2 KFF)."
"05/02/2021","Stony Brook, N.Y.",NA,"3","top","0-4","Binghamton","Stony Brook","LOB: 2"
"05/02/2021","Stony Brook, N.Y.",NA,"4","top","0-4","Binghamton","Stony Brook","Baratta struck out swinging, interference (0-2 FS)."
"05/02/2021","Stony Brook, N.Y.",NA,"4","top","0-4","Binghamton","Stony Brook","Drpich walked (3-2 SSBBFBFB)."
"05/02/2021","Stony Brook, N.Y.",NA,"4","top","0-4","Binghamton","Stony Brook","Gsell struck out swinging (2-2 KKBBS)."
"05/02/2021","Stony Brook, N.Y.",NA,"4","top","0-4","Binghamton","Stony Brook","Marshall struck out swinging (2-2 KBSBS)."
"05/02/2021","Stony Brook, N.Y.",NA,"4","top","0-5","Binghamton","Stony Brook","LOB: 1"
"05/02/2021","Stony Brook, N.Y.",NA,"4","bot","0-4","Stony Brook","Binghamton","E Giordano walked (3-2 KBKBFB)."
"05/02/2021","Stony Brook, N.Y.",NA,"4","bot","0-4","Stony Brook","Binghamton","E Giordano failed pickoff attempt, advanced to second on a throwing error by p."
"05/02/2021","Stony Brook, N.Y.",NA,"4","bot","0-5","Stony Brook","Binghamton","C Hamilton doubled to center field, RBI (0-0)3a E Giordano scored."
"05/02/2021","Stony Brook, N.Y.",NA,"4","bot","0-5","Stony Brook","Binghamton","S Paradine flied out to cf to left center (2-2 BKFB)."
"05/02/2021","Stony Brook, N.Y.",NA,"4","bot","0-5","Stony Brook","Binghamton","C Hamilton out at third p to 3b, caught stealing."
"05/02/2021","Stony Brook, N.Y.",NA,"4","bot","0-5","Stony Brook","Binghamton","J Tuccillo walked (3-1 FBBBB)."
"05/02/2021","Stony Brook, N.Y.",NA,"4","bot","0-5","Stony Brook","Binghamton","J LaRocca singled through the right side (1-0 B)3a J Tuccillo advanced to third."
"05/02/2021","Stony Brook, N.Y.",NA,"4","bot","0-5","Stony Brook","Binghamton","J LaRocca stole second."
"05/02/2021","Stony Brook, N.Y.",NA,"4","bot","0-5","Stony Brook","Binghamton","E Fox flied out to lf (2-1 FBB)."
"05/02/2021","Stony Brook, N.Y.",NA,"4","top","0-5","Binghamton","Stony Brook","R: 1 H: 2 E: 1 LOB: 2"
"05/02/2021","Stony Brook, N.Y.",NA,"5","top","0-5","Binghamton","Stony Brook","Reilly walked (3-0 BBBB)."
"05/02/2021","Stony Brook, N.Y.",NA,"5","top","0-5","Binghamton","Stony Brook","Evans walked (3-2 FSBBFFBFFB)3a Reilly advanced to second."
"05/02/2021","Stony Brook, N.Y.",NA,"5","top","0-5","Binghamton","Stony Brook","Taylor hit into double play ss to 2b to 1b (1-2 FBF)3a Evans out on the play3a Reilly advanced to third."
"05/02/2021","Stony Brook, N.Y.",NA,"5","top","0-5","Binghamton","Stony Brook","Reifler grounded out to ss (0-2 FK)."
"05/02/2021","Stony Brook, N.Y.",NA,"5","top","0-5","Binghamton","Stony Brook","LOB: 1"
"05/02/2021","Stony Brook, N.Y.",NA,"5","bot","0-5","Stony Brook","Binghamton","Beang to p for Eskildsen."
"05/02/2021","Stony Brook, N.Y.",NA,"5","bot","0-5","Stony Brook","Binghamton","S Leuthner doubled down the lf line (0-0)."
"05/02/2021","Stony Brook, N.Y.",NA,"5","bot","0-5","Stony Brook","Binghamton","C Durkan popped up to 2b to right field (2-0 BB)."
"05/02/2021","Stony Brook, N.Y.",NA,"5","bot","0-5","Stony Brook","Binghamton","B Short walked (3-1 FBBBB)."
"05/02/2021","Stony Brook, N.Y.",NA,"5","bot","0-5","Stony Brook","Binghamton","E Giordano hit into double play 3b to 2b to 1b (0-0)3a B Short out on the play."
"05/02/2021","Stony Brook, N.Y.",NA,"5","top","0-5","Binghamton","Stony Brook","H: 1 LOB: 1"
"05/02/2021","Stony Brook, N.Y.",NA,"6","top","0-5","Binghamton","Stony Brook","Franchi flied out to rf (2-0 BB)."
"05/02/2021","Stony Brook, N.Y.",NA,"6","top","0-5","Binghamton","Stony Brook","Baratta singled to left center (3-2 FFFBBBF)."
"05/02/2021","Stony Brook, N.Y.",NA,"6","top","0-5","Binghamton","Stony Brook","Drpich singled to left field (0-0)3a Baratta advanced to second."
"05/02/2021","Stony Brook, N.Y.",NA,"6","top","0-5","Binghamton","Stony Brook","Gsell lined out to rf to right center (0-0)."
"05/02/2021","Stony Brook, N.Y.",NA,"6","top","0-5","Binghamton","Stony Brook","Marshall reached on a fielders choice (0-1 S)3a Drpich out at second ss to 2b."
"05/02/2021","Stony Brook, N.Y.",NA,"6","top","0-5","Binghamton","Stony Brook","H: 2 LOB: 2"
"05/02/2021","Stony Brook, N.Y.",NA,"6","bot","0-5","Stony Brook","Binghamton","C Hamilton out at first 1b to p (0-1 F)."
"05/02/2021","Stony Brook, N.Y.",NA,"6","bot","0-5","Stony Brook","Binghamton","S Paradine fouled out to 3b (2-0 BB)."
"05/02/2021","Stony Brook, N.Y.",NA,"6","bot","0-5","Stony Brook","Binghamton","J Tuccillo lined out to lf to left center (0-0)."
"05/02/2021","Stony Brook, N.Y.",NA,"7","top","0-5","Binghamton","Stony Brook","M Alday to p for N DeGennaro."
"05/02/2021","Stony Brook, N.Y.",NA,"7","top","0-5","Binghamton","Stony Brook","Reilly grounded out to ss (1-0 B)."
"05/02/2021","Stony Brook, N.Y.",NA,"7","top","0-5","Binghamton","Stony Brook","Evans walked (3-1 BBBKB)."
"05/02/2021","Stony Brook, N.Y.",NA,"7","top","0-5","Binghamton","Stony Brook","Taylor flied out to rf to right center (0-1 K)."
"05/02/2021","Stony Brook, N.Y.",NA,"7","top","0-5","Binghamton","Stony Brook","Reifler hit by pitch (0-0)3a Evans advanced to second."
"05/02/2021","Stony Brook, N.Y.",NA,"7","top","0-5","Binghamton","Stony Brook","Franchi walked (3-0 BBBB)3a Reifler advanced to second3a Evans advanced to third."
"05/02/2021","Stony Brook, N.Y.",NA,"7","top","1-5","Binghamton","Stony Brook","Baratta walked, RBI (3-1 BKBBB)3a Franchi advanced to second3a Reifler advanced to third3a Evans scored."
"05/02/2021","Stony Brook, N.Y.",NA,"7","top","1-5","Binghamton","Stony Brook","Drpich struck out swinging (3-2 KBBSBS)."
"05/02/2021","Stony Brook, N.Y.",NA,"7","bot","1-5","Stony Brook","Binghamton","J LaRocca flied out to cf (3-1 BBFB)."
"05/02/2021","Stony Brook, N.Y.",NA,"7","bot","1-5","Stony Brook","Binghamton","E Fox walked (3-0 BBBB)."
"05/02/2021","Stony Brook, N.Y.",NA,"7","bot","1-5","Stony Brook","Binghamton","E Fox stole second, advanced to third on a throwing error by c."
"05/02/2021","Stony Brook, N.Y.",NA,"7","bot","1-5","Stony Brook","Binghamton","S Leuthner walked (3-1 BBBKB)."
"05/02/2021","Stony Brook, N.Y.",NA,"7","bot","1-5","Stony Brook","Binghamton","S Leuthner stole second."
"05/02/2021","Stony Brook, N.Y.",NA,"7","bot","1-5","Stony Brook","Binghamton","C Durkan struck out looking (0-2 KFK)."
"05/02/2021","Stony Brook, N.Y.",NA,"7","bot","1-5","Stony Brook","Binghamton","B Short hit by pitch (0-0)."
"05/02/2021","Stony Brook, N.Y.",NA,"7","bot","1-5","Stony Brook","Binghamton","E Giordano reached on a fielders choice (2-2 BFKFB)3a B Short out at second ss to 2b."
"05/02/2021","Stony Brook, N.Y.",NA,"8","top","1-5","Binghamton","Stony Brook","A Ledbetter to p for M Alday."
"05/02/2021","Stony Brook, N.Y.",NA,"8","top","1-5","Binghamton","Stony Brook","Gsell grounded out to 2b (2-2 BKFB)."
"05/02/2021","Stony Brook, N.Y.",NA,"8","top","1-5","Binghamton","Stony Brook","Marshall walked (3-1 BBSBB)."
"05/02/2021","Stony Brook, N.Y.",NA,"8","top","1-5","Binghamton","Stony Brook","Reilly walked (3-2 KBBBFB)3a Marshall advanced to second."
"05/02/2021","Stony Brook, N.Y.",NA,"8","top","1-5","Binghamton","Stony Brook","Evans struck out swinging (2-2 BKSBFS)."
"05/02/2021","Stony Brook, N.Y.",NA,"8","top","1-5","Binghamton","Stony Brook","Reilly advanced to second on a wild pitch3a Marshall advanced to third on a wild pitch."
"05/02/2021","Stony Brook, N.Y.",NA,"8","top","1-5","Binghamton","Stony Brook","Taylor walked (3-2 BFBFBB)."
"05/02/2021","Stony Brook, N.Y.",NA,"8","top","1-5","Binghamton","Stony Brook","Reifler out at first 1b to p (2-2 BBKK)."
"05/02/2021","Stony Brook, N.Y.",NA,"8","top","1-5","Binghamton","Stony Brook","LOB: 3"
"05/02/2021","Stony Brook, N.Y.",NA,"8","bot","1-5","Stony Brook","Binghamton","Driscoll to p for Beang."
"05/02/2021","Stony Brook, N.Y.",NA,"8","bot","1-5","Stony Brook","Binghamton","C Hamilton grounded out to 2b (0-0)."
"05/02/2021","Stony Brook, N.Y.",NA,"8","bot","1-5","Stony Brook","Binghamton","S Paradine walked (3-2 KKBFBFFFBB)."
"05/02/2021","Stony Brook, N.Y.",NA,"8","bot","1-5","Stony Brook","Binghamton","J Tuccillo singled to left center (2-1 BBK)3a S Paradine advanced to second."
"05/02/2021","Stony Brook, N.Y.",NA,"8","bot","1-5","Stony Brook","Binghamton","J LaRocca hit by pitch (1-1 BK)3a J Tuccillo advanced to second3a S Paradine advanced to third."
"05/02/2021","Stony Brook, N.Y.",NA,"8","bot","1-5","Stony Brook","Binghamton","E Fox hit into double play 2b to ss to 1b (2-1 BBK)3a J LaRocca out on the play."
"05/02/2021","Stony Brook, N.Y.",NA,"8","top","1-5","Binghamton","Stony Brook","H: 1 LOB: 2"
"05/02/2021","Stony Brook, N.Y.",NA,"9","top","1-5","Binghamton","Stony Brook","B Morrisey to p for A Ledbetter."
"05/02/2021","Stony Brook, N.Y.",NA,"9","top","1-5","Binghamton","Stony Brook","Franchi doubled to left field (3-2 KSBBB)."
"05/02/2021","Stony Brook, N.Y.",NA,"9","top","1-5","Binghamton","Stony Brook","Baratta grounded out to ss (3-1 BBBK)."
"05/02/2021","Stony Brook, N.Y.",NA,"9","top","1-5","Binghamton","Stony Brook","Drpich flied out to cf (3-2 BKBKB)3a Franchi advanced to third."
"05/02/2021","Stony Brook, N.Y.",NA,"9","top","1-5","Binghamton","Stony Brook","Gsell popped up to 2b (1-1 KB)."
"05/02/2021","Stony Brook, N.Y.",NA,"9","top","1-5","Binghamton","Stony Brook","H: 1 LOB: 1"
