"date","location","attendance","inning","inning_top_bot","score","batting","fielding","description"
"05/01/2021","Bakersfield, Calif.",NA,"1","top","0-0","CSUN","CSU Bakersfield","Bullard singled to right field (1-1)."
"05/01/2021","Bakersfield, Calif.",NA,"1","top","0-0","CSUN","CSU Bakersfield","Vanhille hit by pitch (0-0) Bullard advanced to second."
"05/01/2021","Bakersfield, Calif.",NA,"1","top","0-0","CSUN","CSU Bakersfield","Moody flied out to rf (0-0) Vanhille no advance Bullard advanced to third."
"05/01/2021","Bakersfield, Calif.",NA,"1","top","0-0","CSUN","CSU Bakersfield","Newman struck out swinging (1-2)."
"05/01/2021","Bakersfield, Calif.",NA,"1","top","0-0","CSUN","CSU Bakersfield","Clarke walked (3-0) Vanhille advanced to second."
"05/01/2021","Bakersfield, Calif.",NA,"1","top","0-0","CSUN","CSU Bakersfield","Skelly popped up to cf (2-2)."
"05/01/2021","Bakersfield, Calif.",NA,"1","top","0-1","CSUN","CSU Bakersfield","H: 1 LOB: 3"
"05/01/2021","Bakersfield, Calif.",NA,"1","bot","0-0","CSU Bakersfield","CSUN","Salas singled up the middle (0-1)."
"05/01/2021","Bakersfield, Calif.",NA,"1","bot","0-0","CSU Bakersfield","CSUN","Charles, E singled through the right side (0-2) Salas advanced to third."
"05/01/2021","Bakersfield, Calif.",NA,"1","bot","0-0","CSU Bakersfield","CSUN","Roberson struck out swinging (2-2)."
"05/01/2021","Bakersfield, Calif.",NA,"1","bot","0-1","CSU Bakersfield","CSUN","Berkey flied out to lf, SF, RBI (1-2) Charles, E no advance Salas scored."
"05/01/2021","Bakersfield, Calif.",NA,"1","bot","0-1","CSU Bakersfield","CSUN","Jorgensen reached on a fielders choice (0-1) Charles, E out at second 2b unassisted."
"05/01/2021","Bakersfield, Calif.",NA,"1","top","0-1","CSUN","CSU Bakersfield","R: 1 H: 2 LOB: 1"
"05/01/2021","Bakersfield, Calif.",NA,"2","top","0-1","CSUN","CSU Bakersfield","Arellano singled to third base, bunt (0-0)."
"05/01/2021","Bakersfield, Calif.",NA,"2","top","0-1","CSUN","CSU Bakersfield","Bohning walked (3-0) Arellano advanced to second."
"05/01/2021","Bakersfield, Calif.",NA,"2","top","0-1","CSUN","CSU Bakersfield","Ajamian grounded out to 3b, SAC, bunt (0-0) Bohning advanced to second Arellano advanced to third."
"05/01/2021","Bakersfield, Calif.",NA,"2","top","0-1","CSUN","CSU Bakersfield","Bullard walked (3-1)."
"05/01/2021","Bakersfield, Calif.",NA,"2","top","3-1","CSUN","CSU Bakersfield","Vanhille singled, advanced to second on a throwing error by rf, advanced to third, 2 RBI (0-1) Bullard scored Bohning scored Arellano scored."
"05/01/2021","Bakersfield, Calif.",NA,"2","top","4-1","CSUN","CSU Bakersfield","Moody flied out to lf, SF, RBI (0-0) Vanhille scored."
"05/01/2021","Bakersfield, Calif.",NA,"2","top","5-1","CSUN","CSU Bakersfield","Newman homered to right field, RBI (0-0)."
"05/01/2021","Bakersfield, Calif.",NA,"2","top","5-1","CSUN","CSU Bakersfield","Acosta to p for Joven."
"05/01/2021","Bakersfield, Calif.",NA,"2","top","5-1","CSUN","CSU Bakersfield","Clarke singled to right center (3-0)."
"05/01/2021","Bakersfield, Calif.",NA,"2","top","5-1","CSUN","CSU Bakersfield","Skelly reached on a fielders choice (1-1) Clarke out at second ss to 2b."
"05/01/2021","Bakersfield, Calif.",NA,"2","bot","5-1","CSU Bakersfield","CSUN","Grossman grounded out to p (0-0)."
"05/01/2021","Bakersfield, Calif.",NA,"2","bot","5-1","CSU Bakersfield","CSUN","Morrissey walked (3-2)."
"05/01/2021","Bakersfield, Calif.",NA,"2","bot","5-1","CSU Bakersfield","CSUN","Morrissey picked off, out at second p to 1b to ss."
"05/01/2021","Bakersfield, Calif.",NA,"2","bot","5-1","CSU Bakersfield","CSUN","Casillas flied out to rf down the rf line (0-2)."
"05/01/2021","Bakersfield, Calif.",NA,"3","top","5-1","CSUN","CSU Bakersfield","Arellano singled to right field (0-0)."
"05/01/2021","Bakersfield, Calif.",NA,"3","top","5-1","CSUN","CSU Bakersfield","Bohning struck out swinging (1-2) Arellano stole second."
"05/01/2021","Bakersfield, Calif.",NA,"3","top","6-1","CSUN","CSU Bakersfield","Ajamian singled to right field, RBI (0-0) Arellano scored."
"05/01/2021","Bakersfield, Calif.",NA,"3","top","6-1","CSUN","CSU Bakersfield","Bullard walked (3-1) Ajamian advanced to second."
"05/01/2021","Bakersfield, Calif.",NA,"3","top","6-1","CSUN","CSU Bakersfield","Vanhille reached on a fielders choice (1-2) Bullard advanced to second Ajamian out at third 3b unassisted."
"05/01/2021","Bakersfield, Calif.",NA,"3","top","6-1","CSUN","CSU Bakersfield","Moody walked (3-1) Vanhille advanced to second Bullard advanced to third."
"05/01/2021","Bakersfield, Calif.",NA,"3","top","6-1","CSUN","CSU Bakersfield","Newman grounded out to 2b (0-1)."
"05/01/2021","Bakersfield, Calif.",NA,"3","bot","6-1","CSU Bakersfield","CSUN","Saldivar grounded out to ss (0-1)."
"05/01/2021","Bakersfield, Calif.",NA,"3","bot","6-1","CSU Bakersfield","CSUN","Salas grounded out to ss (1-2)."
"05/01/2021","Bakersfield, Calif.",NA,"3","bot","6-1","CSU Bakersfield","CSUN","Charles, E grounded out to 2b (0-0)."
"05/01/2021","Bakersfield, Calif.",NA,"4","top","6-1","CSUN","CSU Bakersfield","Clarke hit by pitch (0-0)."
"05/01/2021","Bakersfield, Calif.",NA,"4","top","6-1","CSUN","CSU Bakersfield","Skelly singled through the right side (1-2) Clarke advanced to third."
"05/01/2021","Bakersfield, Calif.",NA,"4","top","6-1","CSUN","CSU Bakersfield","Arellano reached on a fielders choice, advanced to second Skelly advanced to third Clarke out at home p to c to 3b to p."
"05/01/2021","Bakersfield, Calif.",NA,"4","top","7-1","CSUN","CSU Bakersfield","Bohning singled through the left side, RBI (1-1) Arellano advanced to third Skelly scored."
"05/01/2021","Bakersfield, Calif.",NA,"4","top","8-1","CSUN","CSU Bakersfield","Ajamian flied out to rf, SF, RBI (1-1) Bohning no advance Arellano scored."
"05/01/2021","Bakersfield, Calif.",NA,"4","top","8-1","CSUN","CSU Bakersfield","Bohning advanced to second on a wild pitch."
"05/01/2021","Bakersfield, Calif.",NA,"4","top","8-1","CSUN","CSU Bakersfield","Bullard flied out to lf (0-0)."
"05/01/2021","Bakersfield, Calif.",NA,"4","bot","8-1","CSU Bakersfield","CSUN","Roberson grounded out to 2b (3-1)."
"05/01/2021","Bakersfield, Calif.",NA,"4","bot","8-1","CSU Bakersfield","CSUN","Berkey flied out to rf (0-0)."
"05/01/2021","Bakersfield, Calif.",NA,"4","bot","8-1","CSU Bakersfield","CSUN","Jorgensen singled up the middle (3-2)."
"05/01/2021","Bakersfield, Calif.",NA,"4","bot","8-1","CSU Bakersfield","CSUN","Grossman struck out swinging (2-2)."
"05/01/2021","Bakersfield, Calif.",NA,"5","top","8-1","CSUN","CSU Bakersfield","Ciandro to p for Acosta."
"05/01/2021","Bakersfield, Calif.",NA,"5","top","8-1","CSUN","CSU Bakersfield","Vanhille flied out to rf (1-0)."
"05/01/2021","Bakersfield, Calif.",NA,"5","top","8-1","CSUN","CSU Bakersfield","Moody grounded out to ss (1-1)."
"05/01/2021","Bakersfield, Calif.",NA,"5","top","8-1","CSUN","CSU Bakersfield","Newman walked (3-2)."
"05/01/2021","Bakersfield, Calif.",NA,"5","top","8-1","CSUN","CSU Bakersfield","Clarke doubled to left center (0-1) Newman advanced to third, out at home lf to ss to c."
"05/01/2021","Bakersfield, Calif.",NA,"5","top","8-1","CSUN","CSU Bakersfield","H: 1 LOB: 1"
"05/01/2021","Bakersfield, Calif.",NA,"5","bot","8-1","CSU Bakersfield","CSUN","Carrizosa pinch hit for Morrissey."
"05/01/2021","Bakersfield, Calif.",NA,"5","bot","8-1","CSU Bakersfield","CSUN","Carrizosa grounded out to ss (0-1)."
"05/01/2021","Bakersfield, Calif.",NA,"5","bot","8-1","CSU Bakersfield","CSUN","Casillas flied out to lf (1-2)."
"05/01/2021","Bakersfield, Calif.",NA,"5","bot","8-1","CSU Bakersfield","CSUN","Saldivar flied out to lf to left center (0-0)."
"05/01/2021","Bakersfield, Calif.",NA,"6","top","8-1","CSUN","CSU Bakersfield","Carrizosa to 2b."
"05/01/2021","Bakersfield, Calif.",NA,"6","top","8-1","CSUN","CSU Bakersfield","Skelly singled to left center (1-2)."
"05/01/2021","Bakersfield, Calif.",NA,"6","top","8-1","CSUN","CSU Bakersfield","Arellano grounded into double play 3b to ss to 1b (3-2) Skelly out on the play."
"05/01/2021","Bakersfield, Calif.",NA,"6","top","9-1","CSUN","CSU Bakersfield","Bohning homered to left center, RBI (2-0)."
"05/01/2021","Bakersfield, Calif.",NA,"6","top","9-1","CSUN","CSU Bakersfield","Ajamian struck out looking (2-2)."
"05/01/2021","Bakersfield, Calif.",NA,"6","bot","9-1","CSU Bakersfield","CSUN","Doremus to rf for Bullard."
"05/01/2021","Bakersfield, Calif.",NA,"6","bot","9-1","CSU Bakersfield","CSUN","Salas grounded out to p (0-0)."
"05/01/2021","Bakersfield, Calif.",NA,"6","bot","9-1","CSU Bakersfield","CSUN","Charles, E reached on an error by 2b (3-2)."
"05/01/2021","Bakersfield, Calif.",NA,"6","bot","9-1","CSU Bakersfield","CSUN","Roberson struck out swinging (2-2)."
"05/01/2021","Bakersfield, Calif.",NA,"6","bot","9-1","CSU Bakersfield","CSUN","Berkey lined out to ss (2-2)."
"05/01/2021","Bakersfield, Calif.",NA,"7","top","9-1","CSUN","CSU Bakersfield","Doremus grounded out to 1b unassisted (0-1)."
"05/01/2021","Bakersfield, Calif.",NA,"7","top","9-1","CSUN","CSU Bakersfield","Vanhille walked (3-1)."
"05/01/2021","Bakersfield, Calif.",NA,"7","top","9-1","CSUN","CSU Bakersfield","Barraza pinch hit for Moody."
"05/01/2021","Bakersfield, Calif.",NA,"7","top","9-1","CSUN","CSU Bakersfield","Barraza struck out swinging (2-2)."
"05/01/2021","Bakersfield, Calif.",NA,"7","top","9-1","CSUN","CSU Bakersfield","Newman grounded out to ss (1-1)."
"05/01/2021","Bakersfield, Calif.",NA,"7","top","9-1","CSUN","CSU Bakersfield","LOB: 1"
"05/01/2021","Bakersfield, Calif.",NA,"7","bot","9-1","CSU Bakersfield","CSUN","Silvis to 2b for Barraza."
"05/01/2021","Bakersfield, Calif.",NA,"7","bot","9-1","CSU Bakersfield","CSUN","Jauregui to p for Hassel."
"05/01/2021","Bakersfield, Calif.",NA,"7","bot","9-1","CSU Bakersfield","CSUN","Jorgensen walked (3-2)."
"05/01/2021","Bakersfield, Calif.",NA,"7","bot","9-1","CSU Bakersfield","CSUN","Grossman grounded into double play p to ss to 1b (2-2) Jorgensen out on the play."
"05/01/2021","Bakersfield, Calif.",NA,"7","bot","9-1","CSU Bakersfield","CSUN","Carrizosa hit by pitch (0-0)."
"05/01/2021","Bakersfield, Calif.",NA,"7","bot","9-1","CSU Bakersfield","CSUN","Casillas singled to left field (2-1) Carrizosa advanced to second."
"05/01/2021","Bakersfield, Calif.",NA,"7","bot","9-1","CSU Bakersfield","CSUN","Saldivar flied out to cf (0-0)."
"05/01/2021","Bakersfield, Calif.",NA,"7","top","9-1","CSUN","CSU Bakersfield","H: 1 LOB: 2"
"05/01/2021","Bakersfield, Calif.",NA,"8","top","9-1","CSUN","CSU Bakersfield","Clarke singled to right center (2-2)."
"05/01/2021","Bakersfield, Calif.",NA,"8","top","9-1","CSUN","CSU Bakersfield","Kuck to p for Ciandro."
"05/01/2021","Bakersfield, Calif.",NA,"8","top","9-1","CSUN","CSU Bakersfield","Clarke stole second."
"05/01/2021","Bakersfield, Calif.",NA,"8","top","9-1","CSUN","CSU Bakersfield","Clarke advanced to third on a passed ball."
"05/01/2021","Bakersfield, Calif.",NA,"8","top","10-1","CSUN","CSU Bakersfield","Skelly flied out to lf, SF, RBI (3-1) Clarke scored, unearned."
"05/01/2021","Bakersfield, Calif.",NA,"8","top","10-1","CSUN","CSU Bakersfield","Arellano flied out to rf (0-0)."
"05/01/2021","Bakersfield, Calif.",NA,"8","top","10-1","CSUN","CSU Bakersfield","Bohning lined out to lf."
"05/01/2021","Bakersfield, Calif.",NA,"8","bot","10-1","CSU Bakersfield","CSUN","Doremus to cf."
"05/01/2021","Bakersfield, Calif.",NA,"8","bot","10-1","CSU Bakersfield","CSUN","Powell to rf for Clarke."
"05/01/2021","Bakersfield, Calif.",NA,"8","bot","10-1","CSU Bakersfield","CSUN","Hoskins to p for Jauregui."
"05/01/2021","Bakersfield, Calif.",NA,"8","bot","10-1","CSU Bakersfield","CSUN","Salas grounded out to ss (0-2)."
"05/01/2021","Bakersfield, Calif.",NA,"8","bot","10-1","CSU Bakersfield","CSUN","Charles, E singled down the lf line (0-0)."
"05/01/2021","Bakersfield, Calif.",NA,"8","bot","10-1","CSU Bakersfield","CSUN","Roberson flied out to rf (0-0) Charles, E no advance."
"05/01/2021","Bakersfield, Calif.",NA,"8","bot","10-1","CSU Bakersfield","CSUN","Berkey singled down the lf line (0-1) Charles, E advanced to second."
"05/01/2021","Bakersfield, Calif.",NA,"8","bot","10-1","CSU Bakersfield","CSUN","Jorgensen flied out to lf (1-1)."
"05/01/2021","Bakersfield, Calif.",NA,"9","top","10-1","CSUN","CSU Bakersfield","Ajamian flied out to cf (1-2)."
"05/01/2021","Bakersfield, Calif.",NA,"9","top","10-1","CSUN","CSU Bakersfield","Doremus struck out swinging (1-2)."
"05/01/2021","Bakersfield, Calif.",NA,"9","top","10-1","CSUN","CSU Bakersfield","Vanhille grounded out to 3b (0-0)."
"05/01/2021","Bakersfield, Calif.",NA,"9","bot","10-1","CSU Bakersfield","CSUN","Kinkade pinch hit for Grossman."
"05/01/2021","Bakersfield, Calif.",NA,"9","bot","10-1","CSU Bakersfield","CSUN","Kinkade lined out to 2b (1-1)."
"05/01/2021","Bakersfield, Calif.",NA,"9","bot","10-1","CSU Bakersfield","CSUN","Carrizosa singled to pitcher (0-0)."
"05/01/2021","Bakersfield, Calif.",NA,"9","bot","10-1","CSU Bakersfield","CSUN","Ianniciello pinch hit for Casillas."
"05/01/2021","Bakersfield, Calif.",NA,"9","bot","10-1","CSU Bakersfield","CSUN","Carrizosa advanced to second."
"05/01/2021","Bakersfield, Calif.",NA,"9","bot","10-1","CSU Bakersfield","CSUN","Carrizosa advanced to third."
"05/01/2021","Bakersfield, Calif.",NA,"9","bot","10-1","CSU Bakersfield","CSUN","Ianniciello walked (3-1)."
"05/01/2021","Bakersfield, Calif.",NA,"9","bot","10-2","CSU Bakersfield","CSUN","Saldivar flied out to rf, SF, RBI (1-2) Ianniciello no advance Carrizosa scored."
"05/01/2021","Bakersfield, Calif.",NA,"9","bot","10-2","CSU Bakersfield","CSUN","Salas struck out looking (0-2)."
"05/01/2021","Bakersfield, Calif.",NA,"9","bot","10-2","CSU Bakersfield","CSUN","R: 1 H: 1 LOB: 1"
