"date","location","attendance","inning","inning_top_bot","score","batting","fielding","description"
"05/16/2021","Morgantown, W.Va.",NA,"1","top","0-0","Dayton","West Virginia","RICCIARDI struck out swinging (1-2 KSFBFS)."
"05/16/2021","Morgantown, W.Va.",NA,"1","top","0-0","Dayton","West Virginia","BLACKWELL struck out swinging (1-2 KKBS)."
"05/16/2021","Morgantown, W.Va.",NA,"1","top","0-0","Dayton","West Virginia","PUJOLS doubled down the rf line (2-1 BFB)."
"05/16/2021","Morgantown, W.Va.",NA,"1","top","0-0","Dayton","West Virginia","TIROTTA lined out to cf (1-1 BK)."
"05/16/2021","Morgantown, W.Va.",NA,"1","top","0-0","Dayton","West Virginia","H: 1 LOB: 1"
"05/16/2021","Morgantown, W.Va.",NA,"1","bot","0-0","West Virginia","Dayton","Davis, A. grounded out to 3b (3-2 FBBBK)."
"05/16/2021","Morgantown, W.Va.",NA,"1","bot","0-0","West Virginia","Dayton","McCormick, M out at first 1b to p (1-1 BF)."
"05/16/2021","Morgantown, W.Va.",NA,"1","bot","0-0","West Virginia","Dayton","McIntosh, P. hit by pitch (0-0)."
"05/16/2021","Morgantown, W.Va.",NA,"1","bot","0-0","West Virginia","Dayton","Burns, A. struck out swinging, out at first c to 1b (1-2 SSBS)."
"05/16/2021","Morgantown, W.Va.",NA,"1","top","0-0","Dayton","West Virginia","LOB: 1"
"05/16/2021","Morgantown, W.Va.",NA,"2","top","0-0","Dayton","West Virginia","CABRERA walked (3-2 FKBBBB)."
"05/16/2021","Morgantown, W.Va.",NA,"2","top","0-0","Dayton","West Virginia","BRICKMAN walked (3-2 BSBBFB) CABRERA advanced to second."
"05/16/2021","Morgantown, W.Va.",NA,"2","top","0-0","Dayton","West Virginia","PURSINGER fouled out to lf (3-2 BSBBS)."
"05/16/2021","Morgantown, W.Va.",NA,"2","top","0-0","Dayton","West Virginia","MELNICK walked (3-2 SBBBKFB) BRICKMAN advanced to second CABRERA advanced to third."
"05/16/2021","Morgantown, W.Va.",NA,"2","top","0-0","Dayton","West Virginia","GARRITY struck out swinging (0-2 KFS)."
"05/16/2021","Morgantown, W.Va.",NA,"2","top","2-0","Dayton","West Virginia","RICCIARDI singled to left center, advanced to second on the throw, 2 RBI (1-2 SFBF) MELNICK advanced to second, advanced to third on a fielding error by p BRICKMAN scored CABRERA scored."
"05/16/2021","Morgantown, W.Va.",NA,"2","top","2-0","Dayton","West Virginia","BLACKWELL walked (3-0 BBBB)."
"05/16/2021","Morgantown, W.Va.",NA,"2","top","2-0","Dayton","West Virginia","No play."
"05/16/2021","Morgantown, W.Va.",NA,"2","top","2-0","Dayton","West Virginia","Short, N. to p for Ouderkirk, D."
"05/16/2021","Morgantown, W.Va.",NA,"2","top","2-0","Dayton","West Virginia","PUJOLS struck out swinging (1-2 SBKFS)."
"05/16/2021","Morgantown, W.Va.",NA,"2","bot","2-0","West Virginia","Dayton","Blasick, N. grounded out to 2b (2-1 SBB)."
"05/16/2021","Morgantown, W.Va.",NA,"2","bot","2-0","West Virginia","Dayton","Scott, V. singled through the right side (2-0 BB)."
"05/16/2021","Morgantown, W.Va.",NA,"2","bot","2-0","West Virginia","Dayton","Scott, V. stole second."
"05/16/2021","Morgantown, W.Va.",NA,"2","bot","2-0","West Virginia","Dayton","Ippoliti, V. walked (3-0 BBBB)."
"05/16/2021","Morgantown, W.Va.",NA,"2","bot","2-0","West Virginia","Dayton","Ippoliti, V. stole second Scott, V. stole third."
"05/16/2021","Morgantown, W.Va.",NA,"2","bot","2-0","West Virginia","Dayton","Brophy, K. walked (3-2 BKBBSB)."
"05/16/2021","Morgantown, W.Va.",NA,"2","bot","2-2","West Virginia","Dayton","Doanes, T. doubled to left center, advanced to third on the throw, 2 RBI (0-0) Brophy, K. advanced to third, out at home lf to ss to c Ippoliti, V. scored Scott, V. scored."
"05/16/2021","Morgantown, W.Va.",NA,"2","bot","2-2","West Virginia","Dayton","No play."
"05/16/2021","Morgantown, W.Va.",NA,"2","bot","2-2","West Virginia","Dayton","HATTRUP to p for OLSON."
"05/16/2021","Morgantown, W.Va.",NA,"2","bot","2-3","West Virginia","Dayton","Davis, A. singled to right field, RBI (2-2 BKBF) Doanes, T. scored."
"05/16/2021","Morgantown, W.Va.",NA,"2","bot","2-3","West Virginia","Dayton","Davis, A. stole second."
"05/16/2021","Morgantown, W.Va.",NA,"2","bot","2-3","West Virginia","Dayton","McCormick, M grounded out to ss (1-2 BKSF)."
"05/16/2021","Morgantown, W.Va.",NA,"3","top","2-3","Dayton","West Virginia","TIROTTA singled to left field (0-0)."
"05/16/2021","Morgantown, W.Va.",NA,"3","top","2-3","Dayton","West Virginia","CABRERA singled through the right side (2-2 KBKB) TIROTTA advanced to second."
"05/16/2021","Morgantown, W.Va.",NA,"3","top","2-3","Dayton","West Virginia","BRICKMAN reached on catchers interference (3-1 BSBB) CABRERA advanced to second TIROTTA advanced to third."
"05/16/2021","Morgantown, W.Va.",NA,"3","top","2-3","Dayton","West Virginia","PURSINGER struck out swinging (1-2 SSBS)."
"05/16/2021","Morgantown, W.Va.",NA,"3","top","2-3","Dayton","West Virginia","CLEARY pinch hit for MELNICK."
"05/16/2021","Morgantown, W.Va.",NA,"3","top","3-3","Dayton","West Virginia","CLEARY walked, RBI (3-1 BBBKB) BRICKMAN advanced to second CABRERA advanced to third TIROTTA scored."
"05/16/2021","Morgantown, W.Va.",NA,"3","top","3-3","Dayton","West Virginia","Lowery, B. to p for Short, N.."
"05/16/2021","Morgantown, W.Va.",NA,"3","top","4-3","Dayton","West Virginia","GARRITY flied out to cf, SF, RBI (0-0) CABRERA scored, unearned."
"05/16/2021","Morgantown, W.Va.",NA,"3","top","4-3","Dayton","West Virginia","RICCIARDI fouled out to ss (1-1 BK)."
"05/16/2021","Morgantown, W.Va.",NA,"3","bot","4-3","West Virginia","Dayton","CURTIS to c for CLEARY."
"05/16/2021","Morgantown, W.Va.",NA,"3","bot","4-3","West Virginia","Dayton","McIntosh, P. popped up to 2b (2-2 FBBF)."
"05/16/2021","Morgantown, W.Va.",NA,"3","bot","4-3","West Virginia","Dayton","Burns, A. hit by pitch (0-0)."
"05/16/2021","Morgantown, W.Va.",NA,"3","bot","4-3","West Virginia","Dayton","Blasick, N. grounded out to 2b (0-1 K) Burns, A. advanced to second."
"05/16/2021","Morgantown, W.Va.",NA,"3","bot","4-3","West Virginia","Dayton","Scott, V. flied out to lf (3-2 KBBKFB)."
"05/16/2021","Morgantown, W.Va.",NA,"4","top","4-3","Dayton","West Virginia","BLACKWELL flied out to cf (1-1 BK)."
"05/16/2021","Morgantown, W.Va.",NA,"4","top","4-3","Dayton","West Virginia","PUJOLS struck out looking (3-2 SSBFBBFFK)."
"05/16/2021","Morgantown, W.Va.",NA,"4","top","4-3","Dayton","West Virginia","Abernathy, B to p for Lowery, B.."
"05/16/2021","Morgantown, W.Va.",NA,"4","top","4-3","Dayton","West Virginia","TIROTTA struck out swinging (1-2 KFBS)."
"05/16/2021","Morgantown, W.Va.",NA,"4","bot","4-3","West Virginia","Dayton","Ippoliti, V. singled to shortstop (1-0 B)."
"05/16/2021","Morgantown, W.Va.",NA,"4","bot","4-3","West Virginia","Dayton","Brophy, K. doubled to right center (1-1 FB) Ippoliti, V. advanced to third."
"05/16/2021","Morgantown, W.Va.",NA,"4","bot","4-3","West Virginia","Dayton","PETSCHKE to p for HATTRUP."
"05/16/2021","Morgantown, W.Va.",NA,"4","bot","4-3","West Virginia","Dayton","Doanes, T. walked (3-1 BKBBB)."
"05/16/2021","Morgantown, W.Va.",NA,"4","bot","4-3","West Virginia","Dayton","Davis, A. infield fly to ss (0-0)."
"05/16/2021","Morgantown, W.Va.",NA,"4","bot","4-4","West Virginia","Dayton","McCormick, M hit by pitch, RBI (3-2 BBKKB) Doanes, T. advanced to second Brophy, K. advanced to third Ippoliti, V. scored."
"05/16/2021","Morgantown, W.Va.",NA,"4","bot","4-5","West Virginia","Dayton","McIntosh, P. hit by pitch, RBI (1-2 BKKF) McCormick, M advanced to second Doanes, T. advanced to third Brophy, K. scored."
"05/16/2021","Morgantown, W.Va.",NA,"4","bot","4-5","West Virginia","Dayton","LONGBRAKE to p for PETSCHKE."
"05/16/2021","Morgantown, W.Va.",NA,"4","bot","4-5","West Virginia","Dayton","Burns, A. grounded into double play ss to 1b (0-1 S) McIntosh, P. out on the play."
"05/16/2021","Morgantown, W.Va.",NA,"4","bot","4-5","West Virginia","Dayton","R: 2 H: 2 LOB: 2"
"05/16/2021","Morgantown, W.Va.",NA,"5","top","4-5","Dayton","West Virginia","CABRERA flied out to cf (0-0)."
"05/16/2021","Morgantown, W.Va.",NA,"5","top","4-5","Dayton","West Virginia","BRICKMAN grounded out to 2b (0-1 K)."
"05/16/2021","Morgantown, W.Va.",NA,"5","top","4-5","Dayton","West Virginia","PURSINGER struck out looking (1-2 KSBK)."
"05/16/2021","Morgantown, W.Va.",NA,"5","bot","4-5","West Virginia","Dayton","Blasick, N. walked (3-0 BBBB)."
"05/16/2021","Morgantown, W.Va.",NA,"5","bot","4-5","West Virginia","Dayton","Scott, V. singled through the right side (2-2 SBKB) Blasick, N. advanced to third."
"05/16/2021","Morgantown, W.Va.",NA,"5","bot","4-5","West Virginia","Dayton","Scott, V. stole second."
"05/16/2021","Morgantown, W.Va.",NA,"5","bot","4-6","West Virginia","Dayton","Ippoliti, V. flied out to cf, SF, RBI (2-0 BB) Scott, V. advanced to third Blasick, N. scored."
"05/16/2021","Morgantown, W.Va.",NA,"5","bot","4-6","West Virginia","Dayton","BRUS to p for LONGBRAKE."
"05/16/2021","Morgantown, W.Va.",NA,"5","bot","4-6","West Virginia","Dayton","Brophy, K. reached on a fielders choice (3-1 BBKB) Scott, V. out at home p to c."
"05/16/2021","Morgantown, W.Va.",NA,"5","bot","4-6","West Virginia","Dayton","Brophy, K. advanced to second on a wild pitch."
"05/16/2021","Morgantown, W.Va.",NA,"5","bot","4-6","West Virginia","Dayton","Doanes, T. walked (3-2 BKFBBB)."
"05/16/2021","Morgantown, W.Va.",NA,"5","bot","4-6","West Virginia","Dayton","WISSMAN to p for BRUS."
"05/16/2021","Morgantown, W.Va.",NA,"5","bot","4-8","West Virginia","Dayton","Davis, A. doubled to left field, 2 RBI (0-1 K) Doanes, T. scored Brophy, K. scored."
"05/16/2021","Morgantown, W.Va.",NA,"5","bot","4-8","West Virginia","Dayton","MAJICK to p for WISSMAN."
"05/16/2021","Morgantown, W.Va.",NA,"5","bot","4-8","West Virginia","Dayton","Davis, A. stole third."
"05/16/2021","Morgantown, W.Va.",NA,"5","bot","4-8","West Virginia","Dayton","McCormick, M walked (3-1 BFBBB)."
"05/16/2021","Morgantown, W.Va.",NA,"5","bot","4-8","West Virginia","Dayton","PLETKA to p for MAJICK."
"05/16/2021","Morgantown, W.Va.",NA,"5","bot","4-8","West Virginia","Dayton","Ragazzo, D. pinch ran for McCormick, M."
"05/16/2021","Morgantown, W.Va.",NA,"5","bot","4-8","West Virginia","Dayton","Ragazzo, D. stole second."
"05/16/2021","Morgantown, W.Va.",NA,"5","bot","4-8","West Virginia","Dayton","McIntosh, P. popped up to 1b (1-2 BKF)."
"05/16/2021","Morgantown, W.Va.",NA,"5","bot","4-8","West Virginia","Dayton","R: 3 H: 2 LOB: 2"
"05/16/2021","Morgantown, W.Va.",NA,"6","top","4-8","Dayton","West Virginia","Bean, W. to 3b for Burns, A.."
"05/16/2021","Morgantown, W.Va.",NA,"6","top","4-8","Dayton","West Virginia","CURTIS flied out to lf (1-0 B)."
"05/16/2021","Morgantown, W.Va.",NA,"6","top","4-8","Dayton","West Virginia","GARRITY struck out swinging (2-2 KBBSS)."
"05/16/2021","Morgantown, W.Va.",NA,"6","top","4-8","Dayton","West Virginia","RICCIARDI flied out to cf (2-0 BB)."
"05/16/2021","Morgantown, W.Va.",NA,"6","bot","4-8","West Virginia","Dayton","Bean, W. walked (3-1 FBBBB)."
"05/16/2021","Morgantown, W.Va.",NA,"6","bot","4-10","West Virginia","Dayton","Blasick, N. homered to right field, 2 RBI (2-0 BB) Bean, W. scored."
"05/16/2021","Morgantown, W.Va.",NA,"6","bot","4-10","West Virginia","Dayton","Scott, V. walked (3-2 BBKBKB)."
"05/16/2021","Morgantown, W.Va.",NA,"6","bot","4-10","West Virginia","Dayton","SILVERSTEIN to p for PLETKA."
"05/16/2021","Morgantown, W.Va.",NA,"6","bot","4-10","West Virginia","Dayton","Scott, V. stole second."
"05/16/2021","Morgantown, W.Va.",NA,"6","bot","4-11","West Virginia","Dayton","Ippoliti, V. doubled down the lf line, RBI (3-1 BKBB) Scott, V. scored."
"05/16/2021","Morgantown, W.Va.",NA,"6","bot","4-11","West Virginia","Dayton","Brophy, K. flied out to lf (3-2 BFBBS) Ippoliti, V. advanced to third."
"05/16/2021","Morgantown, W.Va.",NA,"6","bot","4-12","West Virginia","Dayton","Doanes, T. grounded out to 3b, RBI (0-0) Ippoliti, V. scored."
"05/16/2021","Morgantown, W.Va.",NA,"6","bot","4-12","West Virginia","Dayton","Davis, A. grounded out to 2b (0-2 SK)."
"05/16/2021","Morgantown, W.Va.",NA,"6","bot","4-12","West Virginia","Dayton","R: 4 H: 2"
"05/16/2021","Morgantown, W.Va.",NA,"7","top","4-12","Dayton","West Virginia","Watters, J. to p for Abernathy, B."
"05/16/2021","Morgantown, W.Va.",NA,"7","top","4-12","Dayton","West Virginia","SUELTZ pinch hit for BLACKWELL."
"05/16/2021","Morgantown, W.Va.",NA,"7","top","4-12","Dayton","West Virginia","SUELTZ walked (3-1 BBBFB)."
"05/16/2021","Morgantown, W.Va.",NA,"7","top","4-12","Dayton","West Virginia","STEINHARDT pinch hit for PUJOLS."
"05/16/2021","Morgantown, W.Va.",NA,"7","top","4-12","Dayton","West Virginia","STEINHARDT struck out swinging (3-2 BBBKSS)."
"05/16/2021","Morgantown, W.Va.",NA,"7","top","4-12","Dayton","West Virginia","TIROTTA doubled down the lf line (1-2 KFB) SUELTZ advanced to third."
"05/16/2021","Morgantown, W.Va.",NA,"7","top","5-12","Dayton","West Virginia","CABRERA grounded out to ss, RBI (0-1 K) TIROTTA advanced to third SUELTZ scored."
"05/16/2021","Morgantown, W.Va.",NA,"7","top","5-12","Dayton","West Virginia","BRICKMAN walked (3-0 BBBB)."
"05/16/2021","Morgantown, W.Va.",NA,"7","top","6-12","Dayton","West Virginia","BRICKMAN advanced to second on a wild pitch TIROTTA scored on a wild pitch."
"05/16/2021","Morgantown, W.Va.",NA,"7","top","6-12","Dayton","West Virginia","PURSINGER walked (3-1 BBBKB)."
"05/16/2021","Morgantown, W.Va.",NA,"7","top","6-12","Dayton","West Virginia","Lyles, C. to p for Watters, J.."
"05/16/2021","Morgantown, W.Va.",NA,"7","top","6-12","Dayton","West Virginia","CURTIS singled to first base (2-2 KBBK) PURSINGER advanced to second BRICKMAN advanced to third."
"05/16/2021","Morgantown, W.Va.",NA,"7","top","6-12","Dayton","West Virginia","GARRITY grounded out to 1b unassisted (0-0)."
