"date","location","attendance","inning","inning_top_bot","score","batting","fielding","description"
"02/20/2022","Beaumont, Texas",NA,"1","top","0-0","Binghamton","Lamar University","Matheny walked."
"02/20/2022","Beaumont, Texas",NA,"1","top","0-0","Binghamton","Lamar University","Tully walked3a Matheny advanced to second."
"02/20/2022","Beaumont, Texas",NA,"1","top","0-0","Binghamton","Lamar University","Aoki singled to center field3a Tully advanced to second3a Matheny advanced to third."
"02/20/2022","Beaumont, Texas",NA,"1","top","2-0","Binghamton","Lamar University","Gsell doubled down the lf line, 2 RBI3a Aoki advanced to third3a Tully scored3a Matheny scored."
"02/20/2022","Beaumont, Texas",NA,"1","top","3-0","Binghamton","Lamar University","Sullivan flied out to rf, SF, RBI3a Gsell advanced to third3a Aoki scored."
"02/20/2022","Beaumont, Texas",NA,"1","top","3-0","Binghamton","Lamar University","Bade walked."
"02/20/2022","Beaumont, Texas",NA,"1","top","4-0","Binghamton","Lamar University","Di Vietro flied out to lf, SF, RBI3a Bade advanced to second on an error by lf3a Gsell scored."
"02/20/2022","Beaumont, Texas",NA,"1","top","5-0","Binghamton","Lamar University","Evans singled to center field, out at second cf to 2b, RBI3a Bade scored, unearned."
"02/20/2022","Beaumont, Texas",NA,"1","bot","5-0","Lamar University","Binghamton","MacNaughton grounded out to 3b."
"02/20/2022","Beaumont, Texas",NA,"1","bot","5-0","Lamar University","Binghamton","Bermudez, K. grounded out to ss."
"02/20/2022","Beaumont, Texas",NA,"1","bot","5-0","Lamar University","Binghamton","Durand, R. singled to second base."
"02/20/2022","Beaumont, Texas",NA,"1","bot","5-0","Lamar University","Binghamton","Kemp, C. grounded out to 2b."
"02/20/2022","Beaumont, Texas",NA,"2","top","5-0","Binghamton","Lamar University","Mize, M. to p for Ekness, J.."
"02/20/2022","Beaumont, Texas",NA,"2","top","5-0","Binghamton","Lamar University","Reifler singled to right field."
"02/20/2022","Beaumont, Texas",NA,"2","top","6-0","Binghamton","Lamar University","Matheny doubled to right center, RBI3a Reifler scored."
"02/20/2022","Beaumont, Texas",NA,"2","top","6-0","Binghamton","Lamar University","Tully struck out looking."
"02/20/2022","Beaumont, Texas",NA,"2","top","6-0","Binghamton","Lamar University","Aoki struck out swinging."
"02/20/2022","Beaumont, Texas",NA,"2","top","6-0","Binghamton","Lamar University","Gsell grounded out to 3b."
"02/20/2022","Beaumont, Texas",NA,"2","bot","6-0","Lamar University","Binghamton","Snell, R. flied out to lf."
"02/20/2022","Beaumont, Texas",NA,"2","bot","6-0","Lamar University","Binghamton","Weyler, K. singled to center field."
"02/20/2022","Beaumont, Texas",NA,"2","bot","6-0","Lamar University","Binghamton","Blankenship flied out to rf."
"02/20/2022","Beaumont, Texas",NA,"2","bot","6-0","Lamar University","Binghamton","McDonald, M. struck out swinging."
"02/20/2022","Beaumont, Texas",NA,"3","top","6-0","Binghamton","Lamar University","Sullivan singled to center field."
"02/20/2022","Beaumont, Texas",NA,"3","top","6-0","Binghamton","Lamar University","Bade flied out to cf."
"02/20/2022","Beaumont, Texas",NA,"3","top","6-0","Binghamton","Lamar University","Di Vietro singled to left field3a Sullivan advanced to second."
"02/20/2022","Beaumont, Texas",NA,"3","top","7-0","Binghamton","Lamar University","Evans singled to center field, RBI3a Di Vietro advanced to third3a Sullivan scored."
"02/20/2022","Beaumont, Texas",NA,"3","top","7-0","Binghamton","Lamar University","Reifler reached on a fielder's choice, bunt3a Evans advanced to second3a Di Vietro out at home c to p."
"02/20/2022","Beaumont, Texas",NA,"3","top","7-0","Binghamton","Lamar University","Buckendorff to p for Mize, M.."
"02/20/2022","Beaumont, Texas",NA,"3","top","7-0","Binghamton","Lamar University","Matheny out at first 1b to p."
"02/20/2022","Beaumont, Texas",NA,"3","bot","7-0","Lamar University","Binghamton","Ruiz, E. grounded out to ss."
"02/20/2022","Beaumont, Texas",NA,"3","bot","7-0","Lamar University","Binghamton","MacNaughton singled to center field."
"02/20/2022","Beaumont, Texas",NA,"3","bot","7-0","Lamar University","Binghamton","Bermudez, K. grounded out to 3b3a MacNaughton advanced to second."
"02/20/2022","Beaumont, Texas",NA,"3","bot","7-0","Lamar University","Binghamton","Durand, R. flied out to lf."
"02/20/2022","Beaumont, Texas",NA,"4","top","7-0","Binghamton","Lamar University","Tully struck out looking."
"02/20/2022","Beaumont, Texas",NA,"4","top","7-0","Binghamton","Lamar University","Aoki flied out to cf."
"02/20/2022","Beaumont, Texas",NA,"4","top","7-0","Binghamton","Lamar University","Gsell flied out to rf."
"02/20/2022","Beaumont, Texas",NA,"4","bot","7-0","Lamar University","Binghamton","Kemp, C. struck out looking."
"02/20/2022","Beaumont, Texas",NA,"4","bot","7-0","Lamar University","Binghamton","Snell, R. lined out to 3b."
"02/20/2022","Beaumont, Texas",NA,"4","bot","7-0","Lamar University","Binghamton","Weyler, K. walked."
"02/20/2022","Beaumont, Texas",NA,"4","bot","7-0","Lamar University","Binghamton","Blankenship singled up the middle3a Weyler, K. advanced to second."
"02/20/2022","Beaumont, Texas",NA,"4","bot","7-0","Lamar University","Binghamton","McDonald, M. grounded out to c unassisted."
"02/20/2022","Beaumont, Texas",NA,"4","bot","7-0","Lamar University","Binghamton","H: 1 LOB: 2"
"02/20/2022","Beaumont, Texas",NA,"5","top","7-0","Binghamton","Lamar University","Ellis, J. to p for Buckendorff."
"02/20/2022","Beaumont, Texas",NA,"5","top","7-0","Binghamton","Lamar University","Sullivan struck out swinging."
"02/20/2022","Beaumont, Texas",NA,"5","top","7-0","Binghamton","Lamar University","Bade grounded out to ss."
"02/20/2022","Beaumont, Texas",NA,"5","top","7-0","Binghamton","Lamar University","Di Vietro lined out to 3b."
"02/20/2022","Beaumont, Texas",NA,"5","bot","7-0","Lamar University","Binghamton","Ruiz, E. hit by pitch."
"02/20/2022","Beaumont, Texas",NA,"5","bot","7-0","Lamar University","Binghamton","Ruiz, E. advanced to second on a wild pitch."
"02/20/2022","Beaumont, Texas",NA,"5","bot","7-0","Lamar University","Binghamton","MacNaughton reached on an error by 3b."
"02/20/2022","Beaumont, Texas",NA,"5","bot","7-0","Lamar University","Binghamton","Bermudez, K. walked3a MacNaughton advanced to second3a Ruiz, E. advanced to third."
"02/20/2022","Beaumont, Texas",NA,"5","bot","7-1","Lamar University","Binghamton","Durand, R. singled to right field, RBI3a Bermudez, K. advanced to second3a MacNaughton advanced to third3a Ruiz, E. scored."
"02/20/2022","Beaumont, Texas",NA,"5","bot","7-2","Lamar University","Binghamton","Kemp, C. grounded out to 2b, RBI3a Durand, R. advanced to second3a Bermudez, K. advanced to third3a MacNaughton scored, unearned."
"02/20/2022","Beaumont, Texas",NA,"5","bot","7-2","Lamar University","Binghamton","Snell, R. struck out looking."
"02/20/2022","Beaumont, Texas",NA,"5","bot","7-2","Lamar University","Binghamton","Weyler, K. popped up to 2b."
"02/20/2022","Beaumont, Texas",NA,"5","bot","7-2","Lamar University","Binghamton","R: 2 H: 1 E: 1 LOB: 2"
"02/20/2022","Beaumont, Texas",NA,"6","top","7-2","Binghamton","Lamar University","Odom, L. to p for Ellis, J.."
"02/20/2022","Beaumont, Texas",NA,"6","top","7-2","Binghamton","Lamar University","Evans grounded out to 3b."
"02/20/2022","Beaumont, Texas",NA,"6","top","7-2","Binghamton","Lamar University","Reifler struck out swinging."
"02/20/2022","Beaumont, Texas",NA,"6","top","7-2","Binghamton","Lamar University","Matheny reached on an error by ss, advanced to second."
"02/20/2022","Beaumont, Texas",NA,"6","top","7-2","Binghamton","Lamar University","Tully struck out swinging."
"02/20/2022","Beaumont, Texas",NA,"6","top","7-2","Binghamton","Lamar University","E: 1 LOB: 1"
"02/20/2022","Beaumont, Texas",NA,"6","bot","7-2","Lamar University","Binghamton","Eskildsen to p for Bryggman."
"02/20/2022","Beaumont, Texas",NA,"6","bot","7-2","Lamar University","Binghamton","Blankenship doubled to center field."
"02/20/2022","Beaumont, Texas",NA,"6","bot","7-2","Lamar University","Binghamton","McDonald, M. struck out looking."
"02/20/2022","Beaumont, Texas",NA,"6","bot","7-2","Lamar University","Binghamton","LaMontagne pinch hit for Ruiz, E.."
"02/20/2022","Beaumont, Texas",NA,"6","bot","7-2","Lamar University","Binghamton","LaMontagne out at first 1b to p3a Blankenship advanced to third."
"02/20/2022","Beaumont, Texas",NA,"6","bot","7-2","Lamar University","Binghamton","MacNaughton flied out to rf."
"02/20/2022","Beaumont, Texas",NA,"6","top","7-2","Binghamton","Lamar University","H: 1 LOB: 1"
"02/20/2022","Beaumont, Texas",NA,"7","top","7-2","Binghamton","Lamar University","LaMontagne to 3b."
"02/20/2022","Beaumont, Texas",NA,"7","top","7-2","Binghamton","Lamar University","Barta, M. to p for Odom, L.."
"02/20/2022","Beaumont, Texas",NA,"7","top","7-2","Binghamton","Lamar University","Aoki singled to left field."
"02/20/2022","Beaumont, Texas",NA,"7","top","7-2","Binghamton","Lamar University","Gsell doubled to left center3a Aoki advanced to third."
"02/20/2022","Beaumont, Texas",NA,"7","top","7-2","Binghamton","Lamar University","Sullivan grounded out to p."
"02/20/2022","Beaumont, Texas",NA,"7","top","7-2","Binghamton","Lamar University","Tompkins, T. to p for Barta, M.."
"02/20/2022","Beaumont, Texas",NA,"7","top","8-2","Binghamton","Lamar University","Bade singled to right field, RBI3a Gsell advanced to third3a Aoki scored."
"02/20/2022","Beaumont, Texas",NA,"7","top","9-2","Binghamton","Lamar University","Di Vietro flied out to lf, SAC, RBI3a Gsell scored."
"02/20/2022","Beaumont, Texas",NA,"7","top","9-2","Binghamton","Lamar University","Evans reached on a fielder's choice3a Bade out at second ss to 2b."
"02/20/2022","Beaumont, Texas",NA,"7","bot","9-2","Lamar University","Binghamton","Bermudez, K. flied out to rf."
"02/20/2022","Beaumont, Texas",NA,"7","bot","9-2","Lamar University","Binghamton","Durand, R. flied out to cf."
"02/20/2022","Beaumont, Texas",NA,"7","bot","9-2","Lamar University","Binghamton","Kemp, C. grounded out to 1b unassisted."
"02/20/2022","Beaumont, Texas",NA,"8","top","9-2","Binghamton","Lamar University","Morse, T. to p for Tompkins, T.."
"02/20/2022","Beaumont, Texas",NA,"8","top","9-2","Binghamton","Lamar University","Reifler out at first 1b to p."
"02/20/2022","Beaumont, Texas",NA,"8","top","9-2","Binghamton","Lamar University","Matheny struck out swinging."
"02/20/2022","Beaumont, Texas",NA,"8","top","9-2","Binghamton","Lamar University","Tully grounded out to 2b."
"02/20/2022","Beaumont, Texas",NA,"8","bot","9-2","Lamar University","Binghamton","Parliament to p for Eskildsen."
"02/20/2022","Beaumont, Texas",NA,"8","bot","9-2","Lamar University","Binghamton","Snell, R. doubled to right center."
"02/20/2022","Beaumont, Texas",NA,"8","bot","9-2","Lamar University","Binghamton","Weyler, K. grounded out to 2b3a Snell, R. advanced to third."
"02/20/2022","Beaumont, Texas",NA,"8","bot","9-3","Lamar University","Binghamton","Blankenship singled to center field, RBI3a Snell, R. scored."
"02/20/2022","Beaumont, Texas",NA,"8","bot","9-3","Lamar University","Binghamton","Schell, J. pinch hit for McDonald, M.."
"02/20/2022","Beaumont, Texas",NA,"8","bot","9-3","Lamar University","Binghamton","Schell, J. singled to pitcher, bunt3a Blankenship advanced to second."
"02/20/2022","Beaumont, Texas",NA,"8","bot","9-4","Lamar University","Binghamton","LaMontagne singled to second base, RBI3a Schell, J. advanced to third3a Blankenship scored."
"02/20/2022","Beaumont, Texas",NA,"8","bot","9-5","Lamar University","Binghamton","MacNaughton reached on a fielder's choice, RBI3a LaMontagne out at second 2b to ss3a Schell, J. scored."
"02/20/2022","Beaumont, Texas",NA,"8","bot","9-5","Lamar University","Binghamton","Bermudez, K. walked3a MacNaughton advanced to second."
"02/20/2022","Beaumont, Texas",NA,"8","bot","9-5","Lamar University","Binghamton","Collins to p for Parliament."
"02/20/2022","Beaumont, Texas",NA,"8","bot","9-5","Lamar University","Binghamton","Durand, R. flied out to cf."
"02/20/2022","Beaumont, Texas",NA,"8","bot","9-5","Lamar University","Binghamton","R: 3 H: 4 LOB: 2"
"02/20/2022","Beaumont, Texas",NA,"9","top","9-5","Binghamton","Lamar University","Schell, J. to rf."
"02/20/2022","Beaumont, Texas",NA,"9","top","9-5","Binghamton","Lamar University","Davis, A. to p for Morse, T.."
"02/20/2022","Beaumont, Texas",NA,"9","top","9-5","Binghamton","Lamar University","Aoki struck out looking."
"02/20/2022","Beaumont, Texas",NA,"9","top","9-5","Binghamton","Lamar University","Gsell flied out to rf."
"02/20/2022","Beaumont, Texas",NA,"9","top","9-5","Binghamton","Lamar University","Sullivan struck out swinging."
"02/20/2022","Beaumont, Texas",NA,"9","bot","9-5","Lamar University","Binghamton","Kemp, C. lined out to 1b."
"02/20/2022","Beaumont, Texas",NA,"9","bot","9-5","Lamar University","Binghamton","Snell, R. flied out to cf."
"02/20/2022","Beaumont, Texas",NA,"9","bot","9-5","Lamar University","Binghamton","Weyler, K. flied out to rf."
