"date","location","attendance","inning","inning_top_bot","score","batting","fielding","description"
"03/01/2022","Iowa City, Iowa",NA,"1","top","0-0","Loras","Iowa","Church walked (3-1)."
"03/01/2022","Iowa City, Iowa",NA,"1","top","0-0","Loras","Iowa","Fennelly singled through the left side (1-2); Church advanced to second."
"03/01/2022","Iowa City, Iowa",NA,"1","top","0-0","Loras","Iowa","Cullen flied out to rf (0-0); Church advanced to third."
"03/01/2022","Iowa City, Iowa",NA,"1","top","0-0","Loras","Iowa","Fennelly stole second."
"03/01/2022","Iowa City, Iowa",NA,"1","top","0-0","Loras","Iowa","Pardoe struck out swinging (3-2)."
"03/01/2022","Iowa City, Iowa",NA,"1","top","1-0","Loras","Iowa","Rogers singled to shortstop, RBI (1-2); Fennelly advanced to third; Church scored."
"03/01/2022","Iowa City, Iowa",NA,"1","top","1-0","Loras","Iowa","Rogers stole second."
"03/01/2022","Iowa City, Iowa",NA,"1","top","1-0","Loras","Iowa","Wohlers struck out swinging (1-2)."
"03/01/2022","Iowa City, Iowa",NA,"1","bot","1-0","Iowa","Loras","Seegers struck out swinging (3-2)."
"03/01/2022","Iowa City, Iowa",NA,"1","bot","1-0","Iowa","Loras","Hojnar flied out to cf (0-0)."
"03/01/2022","Iowa City, Iowa",NA,"1","bot","1-0","Iowa","Loras","Williams walked (3-1)."
"03/01/2022","Iowa City, Iowa",NA,"1","bot","1-0","Iowa","Loras","Anthony singled to right field (2-2); Williams advanced to third."
"03/01/2022","Iowa City, Iowa",NA,"1","bot","1-0","Iowa","Loras","Snep grounded out to 2b (1-0)."
"03/01/2022","Iowa City, Iowa",NA,"2","top","1-0","Loras","Iowa","Costantino popped up to 2b (0-0)."
"03/01/2022","Iowa City, Iowa",NA,"2","top","1-0","Loras","Iowa","Enright struck out swinging (0-2)."
"03/01/2022","Iowa City, Iowa",NA,"2","top","1-0","Loras","Iowa","Egan out at first 1b to p (1-2)."
"03/01/2022","Iowa City, Iowa",NA,"2","bot","1-0","Iowa","Loras","Sher singled to center field (0-1)."
"03/01/2022","Iowa City, Iowa",NA,"2","bot","1-0","Iowa","Loras","Petersen grounded out to p, SAC, bunt (0-0); Sher advanced to second."
"03/01/2022","Iowa City, Iowa",NA,"2","bot","1-0","Iowa","Loras","McCleary grounded out to ss (1-2); Sher advanced to third."
"03/01/2022","Iowa City, Iowa",NA,"2","bot","1-0","Iowa","Loras","Huckstorf grounded out to ss (1-0)."
"03/01/2022","Iowa City, Iowa",NA,"2","bot","1-0","Iowa","Loras","H: 1 LOB: 1"
"03/01/2022","Iowa City, Iowa",NA,"3","top","1-0","Loras","Iowa","Church singled to center field (0-1)."
"03/01/2022","Iowa City, Iowa",NA,"3","top","1-0","Loras","Iowa","Church advanced to second on a throwing error by c, advanced to third."
"03/01/2022","Iowa City, Iowa",NA,"3","top","1-0","Loras","Iowa","Fennelly popped up to 2b (2-0)."
"03/01/2022","Iowa City, Iowa",NA,"3","top","2-0","Loras","Iowa","Cullen doubled to left center, RBI (1-0); Church scored."
"03/01/2022","Iowa City, Iowa",NA,"3","top","3-0","Loras","Iowa","Pardoe singled to center field, advanced to second on the throw (1-0); Cullen advanced to third, scored on a throwing error by cf, unearned."
"03/01/2022","Iowa City, Iowa",NA,"3","top","3-0","Loras","Iowa","Rogers popped up to ss (1-2)."
"03/01/2022","Iowa City, Iowa",NA,"3","top","3-0","Loras","Iowa","Wohlers struck out looking (0-2)."
"03/01/2022","Iowa City, Iowa",NA,"3","bot","3-0","Iowa","Loras","Seegers singled to third base (3-2)."
"03/01/2022","Iowa City, Iowa",NA,"3","bot","3-0","Iowa","Loras","Hojnar reached on a fielder's choice (2-2); Seegers out at second 2b to ss."
"03/01/2022","Iowa City, Iowa",NA,"3","bot","3-0","Iowa","Loras","Williams struck out swinging (2-2)."
"03/01/2022","Iowa City, Iowa",NA,"3","bot","3-0","Iowa","Loras","Anthony hit by pitch (0-0); Hojnar advanced to second."
"03/01/2022","Iowa City, Iowa",NA,"3","bot","3-0","Iowa","Loras","Snep lined out to ss (1-0)."
"03/01/2022","Iowa City, Iowa",NA,"4","top","3-0","Loras","Iowa","Llewellyn to p for Simpson."
"03/01/2022","Iowa City, Iowa",NA,"4","top","3-0","Loras","Iowa","Costantino singled down the rf line (0-2)."
"03/01/2022","Iowa City, Iowa",NA,"4","top","3-0","Loras","Iowa","DiBenedetto pinch hit for Enright."
"03/01/2022","Iowa City, Iowa",NA,"4","top","3-0","Loras","Iowa","DiBenedetto reached on a fielder's choice (3-2); Costantino out at second p to 2b."
"03/01/2022","Iowa City, Iowa",NA,"4","top","3-0","Loras","Iowa","Egan flied out to rf (0-0)."
"03/01/2022","Iowa City, Iowa",NA,"4","top","3-0","Loras","Iowa","DiBenedetto stole second."
"03/01/2022","Iowa City, Iowa",NA,"4","top","3-0","Loras","Iowa","Church flied out to rf (2-1)."
"03/01/2022","Iowa City, Iowa",NA,"4","top","3-0","Loras","Iowa","H: 1 LOB: 1"
"03/01/2022","Iowa City, Iowa",NA,"4","bot","3-0","Iowa","Loras","DiBenedetto to rf."
"03/01/2022","Iowa City, Iowa",NA,"4","bot","3-0","Iowa","Loras","Sher walked (3-0)."
"03/01/2022","Iowa City, Iowa",NA,"4","bot","3-0","Iowa","Loras","Petersen lined out to ss (0-0)."
"03/01/2022","Iowa City, Iowa",NA,"4","bot","3-0","Iowa","Loras","McCleary grounded out to p (0-1); Sher advanced to second."
"03/01/2022","Iowa City, Iowa",NA,"4","bot","3-0","Iowa","Loras","Huckstorf flied out to rf (0-0)."
"03/01/2022","Iowa City, Iowa",NA,"4","top","3-0","Loras","Iowa","LOB: 1"
"03/01/2022","Iowa City, Iowa",NA,"5","top","3-0","Loras","Iowa","Fennelly fouled out to rf (1-0)."
"03/01/2022","Iowa City, Iowa",NA,"5","top","3-0","Loras","Iowa","Cullen hit by pitch (1-1)."
"03/01/2022","Iowa City, Iowa",NA,"5","top","3-0","Loras","Iowa","Pardoe flied out to cf (1-2)."
"03/01/2022","Iowa City, Iowa",NA,"5","top","3-0","Loras","Iowa","Rogers walked (3-0); Cullen advanced to second."
"03/01/2022","Iowa City, Iowa",NA,"5","top","3-0","Loras","Iowa","Wohlers flied out to rf (3-1)."
"03/01/2022","Iowa City, Iowa",NA,"5","top","3-0","Loras","Iowa","LOB: 2"
"03/01/2022","Iowa City, Iowa",NA,"5","bot","3-0","Iowa","Loras","Seegers grounded out to ss (2-2)."
"03/01/2022","Iowa City, Iowa",NA,"5","bot","3-0","Iowa","Loras","Hojnar flied out to lf (1-2)."
"03/01/2022","Iowa City, Iowa",NA,"5","bot","3-0","Iowa","Loras","Williams reached on a throwing error by 2b (3-1)."
"03/01/2022","Iowa City, Iowa",NA,"5","bot","3-0","Iowa","Loras","Anthony reached on a fielder's choice (1-2); Williams out at second ss unassisted."
"03/01/2022","Iowa City, Iowa",NA,"5","top","3-0","Loras","Iowa","E: 1 LOB: 1"
"03/01/2022","Iowa City, Iowa",NA,"6","top","3-0","Loras","Iowa","Beutel to p for Llewellyn."
"03/01/2022","Iowa City, Iowa",NA,"6","top","3-0","Loras","Iowa","Costantino struck out swinging (0-2)."
"03/01/2022","Iowa City, Iowa",NA,"6","top","3-0","Loras","Iowa","DiBenedetto grounded out to ss (2-1)."
"03/01/2022","Iowa City, Iowa",NA,"6","top","3-0","Loras","Iowa","Egan struck out looking (0-2)."
"03/01/2022","Iowa City, Iowa",NA,"6","bot","3-0","Iowa","Loras","Link pinch hit for Snep."
"03/01/2022","Iowa City, Iowa",NA,"6","bot","3-0","Iowa","Loras","Link grounded out to 2b (0-1)."
"03/01/2022","Iowa City, Iowa",NA,"6","bot","3-0","Iowa","Loras","Sher grounded out to 2b (0-1)."
"03/01/2022","Iowa City, Iowa",NA,"6","bot","3-0","Iowa","Loras","Petersen flied out to cf (2-1)."
"03/01/2022","Iowa City, Iowa",NA,"7","top","3-0","Loras","Iowa","Church doubled to left field (3-2)."
"03/01/2022","Iowa City, Iowa",NA,"7","top","3-0","Loras","Iowa","Fennelly struck out swinging, out at first c to 1b (2-2)."
"03/01/2022","Iowa City, Iowa",NA,"7","top","3-0","Loras","Iowa","Cullen struck out swinging (3-2)."
"03/01/2022","Iowa City, Iowa",NA,"7","top","3-0","Loras","Iowa","Pardoe intentionally walked (1-0)."
"03/01/2022","Iowa City, Iowa",NA,"7","top","3-0","Loras","Iowa","Rogers grounded out to ss (1-2)."
"03/01/2022","Iowa City, Iowa",NA,"7","top","3-0","Loras","Iowa","H: 1 LOB: 2"
"03/01/2022","Iowa City, Iowa",NA,"7","bot","3-0","Iowa","Loras","Mangano pinch hit for McCleary."
"03/01/2022","Iowa City, Iowa",NA,"7","bot","3-0","Iowa","Loras","Mangano struck out looking (3-2)."
"03/01/2022","Iowa City, Iowa",NA,"7","bot","3-0","Iowa","Loras","Huckstorf singled through the left side (0-1)."
"03/01/2022","Iowa City, Iowa",NA,"7","bot","3-0","Iowa","Loras","Seegers flied out to cf (1-1)."
"03/01/2022","Iowa City, Iowa",NA,"7","bot","3-0","Iowa","Loras","Hojnar singled to center field (1-1); Huckstorf advanced to third."
"03/01/2022","Iowa City, Iowa",NA,"7","bot","3-0","Iowa","Loras","Peters to p for Pasco."
"03/01/2022","Iowa City, Iowa",NA,"7","bot","3-0","Iowa","Loras","Williams grounded out to 1b unassisted (3-2)."
"03/01/2022","Iowa City, Iowa",NA,"7","top","3-0","Loras","Iowa","H: 2 LOB: 2"
"03/01/2022","Iowa City, Iowa",NA,"8","top","3-0","Loras","Iowa","Tallman to c for Mangano."
"03/01/2022","Iowa City, Iowa",NA,"8","top","3-0","Loras","Iowa","Henderson to p for Beutel."
"03/01/2022","Iowa City, Iowa",NA,"8","top","3-0","Loras","Iowa","Wohlers struck out looking (3-2)."
"03/01/2022","Iowa City, Iowa",NA,"8","top","3-0","Loras","Iowa","Costantino struck out swinging (1-2)."
"03/01/2022","Iowa City, Iowa",NA,"8","top","3-0","Loras","Iowa","DiBenedetto struck out swinging, out at first c to 1b (1-2)."
"03/01/2022","Iowa City, Iowa",NA,"8","bot","3-0","Iowa","Loras","Anthony singled to left field (3-1)."
"03/01/2022","Iowa City, Iowa",NA,"8","bot","3-0","Iowa","Loras","Link to dh."
"03/01/2022","Iowa City, Iowa",NA,"8","bot","3-0","Iowa","Loras","Link flied out to cf (0-2)."
"03/01/2022","Iowa City, Iowa",NA,"8","bot","3-0","Iowa","Loras","Sher walked (3-2); Anthony advanced to second."
"03/01/2022","Iowa City, Iowa",NA,"8","bot","3-0","Iowa","Loras","Petersen singled to left field, out at second lf to ss to 2b to 3b to 2b to 1b to cf (3-1); Sher advanced to second; Anthony advanced to third."
"03/01/2022","Iowa City, Iowa",NA,"8","bot","3-0","Iowa","Loras","Frazier pinch hit for Tallman."
"03/01/2022","Iowa City, Iowa",NA,"8","bot","3-0","Iowa","Loras","Frazier walked (3-2)."
"03/01/2022","Iowa City, Iowa",NA,"8","bot","3-0","Iowa","Loras","Huckstorf struck out swinging (2-2)."
"03/01/2022","Iowa City, Iowa",NA,"8","bot","3-0","Iowa","Loras","H: 2 LOB: 3"
"03/01/2022","Iowa City, Iowa",NA,"9","top","3-0","Loras","Iowa","Moss to c for Frazier."
"03/01/2022","Iowa City, Iowa",NA,"9","top","3-0","Loras","Iowa","Day to p for Henderson."
"03/01/2022","Iowa City, Iowa",NA,"9","top","3-0","Loras","Iowa","Egan out at first 2b to p (0-0)."
"03/01/2022","Iowa City, Iowa",NA,"9","top","3-0","Loras","Iowa","Church grounded out to ss (1-2)."
"03/01/2022","Iowa City, Iowa",NA,"9","top","3-0","Loras","Iowa","Fennelly struck out swinging (2-2)."
"03/01/2022","Iowa City, Iowa",NA,"9","bot","3-0","Iowa","Loras","Nelson pinch hit for Seegers."
"03/01/2022","Iowa City, Iowa",NA,"9","bot","3-0","Iowa","Loras","Nelson singled, bunt (0-0)."
"03/01/2022","Iowa City, Iowa",NA,"9","bot","3-0","Iowa","Loras","Nelson advanced to second on a wild pitch."
"03/01/2022","Iowa City, Iowa",NA,"9","bot","3-0","Iowa","Loras","Hojnar grounded out to p (1-2); Nelson advanced to third."
"03/01/2022","Iowa City, Iowa",NA,"9","bot","3-1","Iowa","Loras","Williams singled to shortstop, RBI (2-2); Nelson scored."
"03/01/2022","Iowa City, Iowa",NA,"9","bot","3-1","Iowa","Loras","Anthony struck out looking (0-2)."
"03/01/2022","Iowa City, Iowa",NA,"9","bot","3-1","Iowa","Loras","Williams stole second."
"03/01/2022","Iowa City, Iowa",NA,"9","bot","3-1","Iowa","Loras","Link struck out swinging (1-2)."
"03/01/2022","Iowa City, Iowa",NA,"9","bot","3-1","Iowa","Loras","R: 1 H: 2 LOB: 1"
