"date","location","attendance","inning","inning_top_bot","score","batting","fielding","description"
"03/04/2022","Morehead, Ky",NA,"1","top","0-0","Eastern Mich.","Morehead St.","HOPKINS singled to right field (1-2)."
"03/04/2022","Morehead, Ky",NA,"1","top","1-0","Eastern Mich.","Morehead St.","HUEBBE doubled to left center, RBI (2-1)3a HOPKINS scored."
"03/04/2022","Morehead, Ky",NA,"1","top","1-0","Eastern Mich.","Morehead St.","KIRK struck out looking."
"03/04/2022","Morehead, Ky",NA,"1","top","1-0","Eastern Mich.","Morehead St.","EASTER grounded out to 3b3a HUEBBE advanced to third."
"03/04/2022","Morehead, Ky",NA,"1","top","2-0","Eastern Mich.","Morehead St.","BAULT singled to center field, RBI3a HUEBBE scored."
"03/04/2022","Morehead, Ky",NA,"1","top","2-0","Eastern Mich.","Morehead St.","DENTON grounded out to 3b."
"03/04/2022","Morehead, Ky",NA,"1","bot","2-0","Morehead St.","Eastern Mich.","PREECE, R. flied out to ss."
"03/04/2022","Morehead, Ky",NA,"1","bot","2-0","Morehead St.","Eastern Mich.","FELTNER, J. singled to center field."
"03/04/2022","Morehead, Ky",NA,"1","bot","2-0","Morehead St.","Eastern Mich.","KUNTZ, R. singled to right field3a FELTNER, J. advanced to third."
"03/04/2022","Morehead, Ky",NA,"1","bot","2-1","Morehead St.","Eastern Mich.","JACOBS, A. flied out to lf, SF, RBI3a FELTNER, J. scored."
"03/04/2022","Morehead, Ky",NA,"1","bot","2-1","Morehead St.","Eastern Mich.","GOODEN, N. grounded out to 2b."
"03/04/2022","Morehead, Ky",NA,"2","top","2-1","Eastern Mich.","Morehead St.","GORA singled to second base (3-2)."
"03/04/2022","Morehead, Ky",NA,"2","top","2-1","Eastern Mich.","Morehead St.","RUBNER singled to left field (1-1)3a GORA advanced to second."
"03/04/2022","Morehead, Ky",NA,"2","top","2-1","Eastern Mich.","Morehead St.","TAYLOR, C. struck out looking (1-2)."
"03/04/2022","Morehead, Ky",NA,"2","top","2-1","Eastern Mich.","Morehead St.","GORA out at second c to 2b, picked off."
"03/04/2022","Morehead, Ky",NA,"2","top","2-1","Eastern Mich.","Morehead St.","RUBNER stole second."
"03/04/2022","Morehead, Ky",NA,"2","top","2-1","Eastern Mich.","Morehead St.","HOPKINS struck out swinging (1-2)."
"03/04/2022","Morehead, Ky",NA,"2","top","2-1","Eastern Mich.","Morehead St.","H: 2 LOB: 1"
"03/04/2022","Morehead, Ky",NA,"2","bot","2-1","Morehead St.","Eastern Mich.","ROY, A. walked (3-2)."
"03/04/2022","Morehead, Ky",NA,"2","bot","2-1","Morehead St.","Eastern Mich.","FERRY, J. singled to third base3a ROY, A. advanced to second."
"03/04/2022","Morehead, Ky",NA,"2","bot","2-1","Morehead St.","Eastern Mich.","SHOUPE, B. out at first p to 2b, SAC (1-0)3a FERRY, J. advanced to second3a ROY, A. advanced to third."
"03/04/2022","Morehead, Ky",NA,"2","bot","2-1","Morehead St.","Eastern Mich.","BECKER, C. struck out swinging (1-2)."
"03/04/2022","Morehead, Ky",NA,"2","bot","2-1","Morehead St.","Eastern Mich.","PREECE, R. walked (3-2)."
"03/04/2022","Morehead, Ky",NA,"2","bot","2-1","Morehead St.","Eastern Mich.","FELTNER, J. flied out to 2b (1-0)."
"03/04/2022","Morehead, Ky",NA,"2","top","2-1","Eastern Mich.","Morehead St.","H: 1 LOB: 3"
"03/04/2022","Morehead, Ky",NA,"3","top","2-1","Eastern Mich.","Morehead St.","HUEBBE grounded out to 3b (1-2)."
"03/04/2022","Morehead, Ky",NA,"3","top","2-1","Eastern Mich.","Morehead St.","KIRK grounded out to 1b unassisted (2-2)."
"03/04/2022","Morehead, Ky",NA,"3","top","2-1","Eastern Mich.","Morehead St.","EASTER hit by pitch (2-1)."
"03/04/2022","Morehead, Ky",NA,"3","top","2-1","Eastern Mich.","Morehead St.","BAULT struck out looking (2-2)."
"03/04/2022","Morehead, Ky",NA,"3","top","2-1","Eastern Mich.","Morehead St.","LOB: 1"
"03/04/2022","Morehead, Ky",NA,"3","bot","2-1","Morehead St.","Eastern Mich.","KUNTZ, R. lined out to lf (1-2)."
"03/04/2022","Morehead, Ky",NA,"3","bot","2-1","Morehead St.","Eastern Mich.","JACOBS, A. grounded out to 2b (1-2)."
"03/04/2022","Morehead, Ky",NA,"3","bot","2-1","Morehead St.","Eastern Mich.","GOODEN, N. grounded out to 2b (3-2)."
"03/04/2022","Morehead, Ky",NA,"4","top","2-1","Eastern Mich.","Morehead St.","DENTON grounded out to ss (1-1)."
"03/04/2022","Morehead, Ky",NA,"4","top","2-1","Eastern Mich.","Morehead St.","GORA singled to shortstop (0-0)."
"03/04/2022","Morehead, Ky",NA,"4","top","2-1","Eastern Mich.","Morehead St.","RUBNER reached on a fielder's choice to shortstop3a GORA out at second ss to 2b."
"03/04/2022","Morehead, Ky",NA,"4","top","2-1","Eastern Mich.","Morehead St.","TAYLOR, C. reached on a fielder's choice to shortstop3a RUBNER out at second ss to 2b."
"03/04/2022","Morehead, Ky",NA,"4","top","2-1","Eastern Mich.","Morehead St.","H: 1 LOB: 1"
"03/04/2022","Morehead, Ky",NA,"4","bot","2-1","Morehead St.","Eastern Mich.","ROY, A. grounded out to 1b unassisted (1-2)."
"03/04/2022","Morehead, Ky",NA,"4","bot","2-1","Morehead St.","Eastern Mich.","FERRY, J. flied out to 3b (1-1)."
"03/04/2022","Morehead, Ky",NA,"4","bot","2-1","Morehead St.","Eastern Mich.","SHOUPE, B. grounded out to 3b."
"03/04/2022","Morehead, Ky",NA,"5","top","2-1","Eastern Mich.","Morehead St.","HOPKINS walked (3-2)."
"03/04/2022","Morehead, Ky",NA,"5","top","2-1","Eastern Mich.","Morehead St.","HUEBBE grounded out to 1b unassisted (0-2)3a HOPKINS advanced to second."
"03/04/2022","Morehead, Ky",NA,"5","top","3-1","Eastern Mich.","Morehead St.","KIRK doubled to left field, RBI (0-0)3a HOPKINS scored."
"03/04/2022","Morehead, Ky",NA,"5","top","3-1","Eastern Mich.","Morehead St.","MILLER, J. to p for HELTON, L.."
"03/04/2022","Morehead, Ky",NA,"5","top","3-1","Eastern Mich.","Morehead St.","EASTER singled to second base (0-2)3a KIRK advanced to third."
"03/04/2022","Morehead, Ky",NA,"5","top","3-1","Eastern Mich.","Morehead St.","BAULT popped up to ss (1-0)."
"03/04/2022","Morehead, Ky",NA,"5","top","3-1","Eastern Mich.","Morehead St.","DENTON hit by pitch (1-1)3a EASTER advanced to second."
"03/04/2022","Morehead, Ky",NA,"5","top","3-1","Eastern Mich.","Morehead St.","GORA struck out looking (2-2)."
"03/04/2022","Morehead, Ky",NA,"5","bot","3-1","Morehead St.","Eastern Mich.","BECKER, C. doubled to left field (0-1)."
"03/04/2022","Morehead, Ky",NA,"5","bot","3-1","Morehead St.","Eastern Mich.","PREECE, R. grounded out to 3b, SAC3a BECKER, C. advanced to third."
"03/04/2022","Morehead, Ky",NA,"5","bot","3-2","Morehead St.","Eastern Mich.","FELTNER, J. doubled to center field, RBI (0-2)3a BECKER, C. scored."
"03/04/2022","Morehead, Ky",NA,"5","bot","3-2","Morehead St.","Eastern Mich.","KUNTZ, R. singled to right field (0-2)3a FELTNER, J. advanced to third."
"03/04/2022","Morehead, Ky",NA,"5","bot","3-3","Morehead St.","Eastern Mich.","JACOBS, A. flied out to cf, SF, RBI (2-1)3a FELTNER, J. scored."
"03/04/2022","Morehead, Ky",NA,"5","bot","3-3","Morehead St.","Eastern Mich.","GOODEN, N. grounded out to 3b (0-2)."
"03/04/2022","Morehead, Ky",NA,"6","top","3-3","Eastern Mich.","Morehead St.","SHERMAN, J. to p for MILLER, J.."
"03/04/2022","Morehead, Ky",NA,"6","top","3-3","Eastern Mich.","Morehead St.","RUBNER grounded out to p (0-1)."
"03/04/2022","Morehead, Ky",NA,"6","top","3-3","Eastern Mich.","Morehead St.","TAYLOR, C. singled to center field (0-0)."
"03/04/2022","Morehead, Ky",NA,"6","top","3-3","Eastern Mich.","Morehead St.","HOPKINS flied out to lf (1-1)."
"03/04/2022","Morehead, Ky",NA,"6","top","3-3","Eastern Mich.","Morehead St.","HUEBBE flied out to cf (1-0)."
"03/04/2022","Morehead, Ky",NA,"6","top","3-3","Eastern Mich.","Morehead St.","H: 1 LOB: 1"
"03/04/2022","Morehead, Ky",NA,"6","bot","3-3","Morehead St.","Eastern Mich.","REINKALL to p for FRUIT."
"03/04/2022","Morehead, Ky",NA,"6","bot","3-3","Morehead St.","Eastern Mich.","ROY, A. flied out to rf (2-2)."
"03/04/2022","Morehead, Ky",NA,"6","bot","3-3","Morehead St.","Eastern Mich.","FERRY, J. flied out to lf."
"03/04/2022","Morehead, Ky",NA,"6","bot","3-3","Morehead St.","Eastern Mich.","SHOUPE, B. reached on a fielding error by 1b (2-2)."
"03/04/2022","Morehead, Ky",NA,"6","bot","3-3","Morehead St.","Eastern Mich.","BECKER, C. struck out swinging (1-2)."
"03/04/2022","Morehead, Ky",NA,"6","top","3-3","Eastern Mich.","Morehead St.","E: 1 LOB: 1"
"03/04/2022","Morehead, Ky",NA,"7","top","3-3","Eastern Mich.","Morehead St.","KIRK flied out to lf (2-2)."
"03/04/2022","Morehead, Ky",NA,"7","top","3-3","Eastern Mich.","Morehead St.","EASTER singled to right field (0-1)."
"03/04/2022","Morehead, Ky",NA,"7","top","3-3","Eastern Mich.","Morehead St.","BAULT singled down the lf line3a EASTER advanced to third."
"03/04/2022","Morehead, Ky",NA,"7","top","4-3","Eastern Mich.","Morehead St.","BAULT advanced to second3a EASTER scored on a wild pitch."
"03/04/2022","Morehead, Ky",NA,"7","top","4-3","Eastern Mich.","Morehead St.","DENTON walked (3-0)."
"03/04/2022","Morehead, Ky",NA,"7","top","4-3","Eastern Mich.","Morehead St.","GORA reached on a fielder's choice to shortstop (0-1)3a DENTON out at second ss to 2b3a BAULT advanced to third."
"03/04/2022","Morehead, Ky",NA,"7","top","4-3","Eastern Mich.","Morehead St.","RUBNER out at first 1b to p (1-2)3a GORA advanced to second."
"03/04/2022","Morehead, Ky",NA,"7","bot","4-3","Morehead St.","Eastern Mich.","ANDERSON, D. to p for REINKALL."
"03/04/2022","Morehead, Ky",NA,"7","bot","4-3","Morehead St.","Eastern Mich.","PREECE, R. grounded out to 1b unassisted (1-0)."
"03/04/2022","Morehead, Ky",NA,"7","bot","4-3","Morehead St.","Eastern Mich.","FELTNER, J. grounded out to 3b (1-0)."
"03/04/2022","Morehead, Ky",NA,"7","bot","4-3","Morehead St.","Eastern Mich.","KUNTZ, R. struck out, out at first c to 1b (2-2)."
"03/04/2022","Morehead, Ky",NA,"8","top","4-3","Eastern Mich.","Morehead St.","TAYLOR, C. grounded out to 3b (1-2)."
"03/04/2022","Morehead, Ky",NA,"8","top","4-3","Eastern Mich.","Morehead St.","HOPKINS walked (3-1)."
"03/04/2022","Morehead, Ky",NA,"8","top","4-3","Eastern Mich.","Morehead St.","HUEBBE singled to right field (1-1)3a HOPKINS advanced to third."
"03/04/2022","Morehead, Ky",NA,"8","top","4-3","Eastern Mich.","Morehead St.","YOUNG, E. to p for SHERMAN, J.."
"03/04/2022","Morehead, Ky",NA,"8","top","5-3","Eastern Mich.","Morehead St.","KIRK singled to right field, RBI3a HUEBBE advanced to third3a HOPKINS scored."
"03/04/2022","Morehead, Ky",NA,"8","top","6-3","Eastern Mich.","Morehead St.","EASTER out at first p to 2b, SAC, RBI3a KIRK advanced to second3a HUEBBE scored."
"03/04/2022","Morehead, Ky",NA,"8","top","6-3","Eastern Mich.","Morehead St.","BAULT struck out swinging (2-2)."
"03/04/2022","Morehead, Ky",NA,"8","bot","6-3","Morehead St.","Eastern Mich.","JACOBS, A. walked (3-1)."
"03/04/2022","Morehead, Ky",NA,"8","bot","6-3","Morehead St.","Eastern Mich.","GOODEN, N. reached on a fielder's choice to third base (0-1)3a JACOBS, A. out at second 3b to ss."
"03/04/2022","Morehead, Ky",NA,"8","bot","6-3","Morehead St.","Eastern Mich.","GOODNIGHT, L pinch hit for ROY, A.."
"03/04/2022","Morehead, Ky",NA,"8","bot","6-3","Morehead St.","Eastern Mich.","GOODNIGHT, L hit into double play ss to 2b to 1b (2-2)3a GOODEN, N. out on the play."
"03/04/2022","Morehead, Ky",NA,"9","top","6-3","Eastern Mich.","Morehead St.","GOODEN, N. to 2b."
"03/04/2022","Morehead, Ky",NA,"9","top","6-3","Eastern Mich.","Morehead St.","GOODNIGHT, L to 3b."
"03/04/2022","Morehead, Ky",NA,"9","top","6-3","Eastern Mich.","Morehead St.","DENTON struck out swinging (1-2)."
"03/04/2022","Morehead, Ky",NA,"9","top","6-3","Eastern Mich.","Morehead St.","GORA walked (3-0)."
"03/04/2022","Morehead, Ky",NA,"9","top","6-3","Eastern Mich.","Morehead St.","RUBNER struck out swinging (1-2)."
"03/04/2022","Morehead, Ky",NA,"9","top","6-3","Eastern Mich.","Morehead St.","TAYLOR, C. singled to right field3a GORA advanced to third."
"03/04/2022","Morehead, Ky",NA,"9","top","6-3","Eastern Mich.","Morehead St.","CALLAHAN, T. to p for YOUNG, E.."
"03/04/2022","Morehead, Ky",NA,"9","top","6-3","Eastern Mich.","Morehead St.","HOPKINS flied out to cf (1-2)."
"03/04/2022","Morehead, Ky",NA,"9","top","6-4","Eastern Mich.","Morehead St.","H: 1 LOB: 2"
"03/04/2022","Morehead, Ky",NA,"9","bot","6-3","Morehead St.","Eastern Mich.","FERRY, J. struck out swinging (2-2)."
"03/04/2022","Morehead, Ky",NA,"9","bot","6-3","Morehead St.","Eastern Mich.","SHOUPE, B. flied out to cf (1-2)."
"03/04/2022","Morehead, Ky",NA,"9","bot","6-3","Morehead St.","Eastern Mich.","BECKER, C. doubled down the lf line (0-1)."
"03/04/2022","Morehead, Ky",NA,"9","bot","6-4","Morehead St.","Eastern Mich.","PREECE, R. singled down the lf line, RBI (2-2)3a BECKER, C. scored."
"03/04/2022","Morehead, Ky",NA,"9","bot","6-4","Morehead St.","Eastern Mich.","FELTNER, J. flied out to cf (0-0)."
"03/04/2022","Morehead, Ky",NA,"9","top","6-4","Eastern Mich.","Morehead St.","R: 1 H: 2 LOB: 1"
