"date","location","attendance","inning","inning_top_bot","score","batting","fielding","description"
"03/19/2022","Teaneck, N.J.",NA,"1","top","0-0","Massachusetts","Fairleigh Dickinson","Shapiro, C walked."
"03/19/2022","Teaneck, N.J.",NA,"1","top","0-0","Massachusetts","Fairleigh Dickinson","Shapiro, C advanced to second on a wild pitch."
"03/19/2022","Teaneck, N.J.",NA,"1","top","0-0","Massachusetts","Fairleigh Dickinson","Skagerlind grounded out to 2b, SAC; Shapiro, C advanced to third."
"03/19/2022","Teaneck, N.J.",NA,"1","top","0-0","Massachusetts","Fairleigh Dickinson","Gervasi, M grounded out to 3b."
"03/19/2022","Teaneck, N.J.",NA,"1","top","0-0","Massachusetts","Fairleigh Dickinson","DeMartino, D grounded out to ss."
"03/19/2022","Teaneck, N.J.",NA,"1","top","0-0","Massachusetts","Fairleigh Dickinson","LOB: 1"
"03/19/2022","Teaneck, N.J.",NA,"1","bot","0-0","Fairleigh Dickinson","Massachusetts","T. Werner struck out swinging."
"03/19/2022","Teaneck, N.J.",NA,"1","bot","0-0","Fairleigh Dickinson","Massachusetts","Z. Will singled to left field."
"03/19/2022","Teaneck, N.J.",NA,"1","bot","0-0","Fairleigh Dickinson","Massachusetts","J. Sosa grounded into double play ss to 1b to 2b; Z. Will out on the play."
"03/19/2022","Teaneck, N.J.",NA,"1","top","0-0","Massachusetts","Fairleigh Dickinson","H: 1"
"03/19/2022","Teaneck, N.J.",NA,"2","top","0-0","Massachusetts","Fairleigh Dickinson","Luttazi, S grounded out to ss."
"03/19/2022","Teaneck, N.J.",NA,"2","top","0-0","Massachusetts","Fairleigh Dickinson","Judd, D lined out to 2b."
"03/19/2022","Teaneck, N.J.",NA,"2","top","1-0","Massachusetts","Fairleigh Dickinson","Wilde, A homered, RBI."
"03/19/2022","Teaneck, N.J.",NA,"2","top","1-0","Massachusetts","Fairleigh Dickinson","MacLean, W lined out to rf."
"03/19/2022","Teaneck, N.J.",NA,"2","bot","1-0","Fairleigh Dickinson","Massachusetts","J. Sierra hit by pitch."
"03/19/2022","Teaneck, N.J.",NA,"2","bot","1-0","Fairleigh Dickinson","Massachusetts","T. Ruscitti flied out to lf."
"03/19/2022","Teaneck, N.J.",NA,"2","bot","1-0","Fairleigh Dickinson","Massachusetts","M. Puello struck out swinging, hit into double play c unassisted; J. Sierra out on the play, interference."
"03/19/2022","Teaneck, N.J.",NA,"3","top","1-0","Massachusetts","Fairleigh Dickinson","Hebble, C popped up to 3b."
"03/19/2022","Teaneck, N.J.",NA,"3","top","1-0","Massachusetts","Fairleigh Dickinson","Shapiro, C lined out to cf."
"03/19/2022","Teaneck, N.J.",NA,"3","top","1-0","Massachusetts","Fairleigh Dickinson","Skagerlind grounded out to ss."
"03/19/2022","Teaneck, N.J.",NA,"3","bot","1-0","Fairleigh Dickinson","Massachusetts","G. Rosales flied out to rf."
"03/19/2022","Teaneck, N.J.",NA,"3","bot","1-0","Fairleigh Dickinson","Massachusetts","L. Cantwell hit by pitch."
"03/19/2022","Teaneck, N.J.",NA,"3","bot","1-0","Fairleigh Dickinson","Massachusetts","J. Giovenco hit by pitch; L. Cantwell advanced to second."
"03/19/2022","Teaneck, N.J.",NA,"3","bot","1-0","Fairleigh Dickinson","Massachusetts","T. Werner struck out swinging."
"03/19/2022","Teaneck, N.J.",NA,"3","bot","1-0","Fairleigh Dickinson","Massachusetts","Z. Will reached on a fielder's choice; J. Giovenco out at second ss to 2b."
"03/19/2022","Teaneck, N.J.",NA,"3","bot","1-0","Fairleigh Dickinson","Massachusetts","LOB: 2"
"03/19/2022","Teaneck, N.J.",NA,"4","top","1-0","Massachusetts","Fairleigh Dickinson","Gervasi, M singled to center field."
"03/19/2022","Teaneck, N.J.",NA,"4","top","1-0","Massachusetts","Fairleigh Dickinson","DeMartino, D grounded into double play ss to 2b to 1b; Gervasi, M out on the play."
"03/19/2022","Teaneck, N.J.",NA,"4","top","1-0","Massachusetts","Fairleigh Dickinson","Luttazi, S flied out to cf."
"03/19/2022","Teaneck, N.J.",NA,"4","top","1-1","Massachusetts","Fairleigh Dickinson","H: 1"
"03/19/2022","Teaneck, N.J.",NA,"4","bot","1-0","Fairleigh Dickinson","Massachusetts","J. Sosa singled to center field."
"03/19/2022","Teaneck, N.J.",NA,"4","bot","1-0","Fairleigh Dickinson","Massachusetts","J. Sierra doubled down the lf line; J. Sosa advanced to third."
"03/19/2022","Teaneck, N.J.",NA,"4","bot","1-1","Fairleigh Dickinson","Massachusetts","T. Ruscitti lined out to cf, SAC, RBI; J. Sierra advanced to third; J. Sosa scored."
"03/19/2022","Teaneck, N.J.",NA,"4","bot","1-1","Fairleigh Dickinson","Massachusetts","M. Puello reached on a fielder's choice; J. Sierra out at home p to c."
"03/19/2022","Teaneck, N.J.",NA,"4","bot","1-1","Fairleigh Dickinson","Massachusetts","G. Rosales struck out swinging."
"03/19/2022","Teaneck, N.J.",NA,"4","top","1-1","Massachusetts","Fairleigh Dickinson","R: 1 H: 2 LOB: 1"
"03/19/2022","Teaneck, N.J.",NA,"5","top","1-1","Massachusetts","Fairleigh Dickinson","Judd, D walked."
"03/19/2022","Teaneck, N.J.",NA,"5","top","1-1","Massachusetts","Fairleigh Dickinson","Wilde, A reached on an error by 3b; Judd, D advanced to second."
"03/19/2022","Teaneck, N.J.",NA,"5","top","1-1","Massachusetts","Fairleigh Dickinson","Wilde, A advanced to second on a wild pitch; Judd, D advanced to third on a wild pitch."
"03/19/2022","Teaneck, N.J.",NA,"5","top","2-1","Massachusetts","Fairleigh Dickinson","MacLean, W flied out to rf, SAC, RBI; Wilde, A advanced to third; Judd, D scored."
"03/19/2022","Teaneck, N.J.",NA,"5","top","2-1","Massachusetts","Fairleigh Dickinson","J. Simon to p for J. Baxt."
"03/19/2022","Teaneck, N.J.",NA,"5","top","4-1","Massachusetts","Fairleigh Dickinson","Hebble, C homered, 2 RBI; Wilde, A scored, unearned."
"03/19/2022","Teaneck, N.J.",NA,"5","top","4-1","Massachusetts","Fairleigh Dickinson","Shapiro, C flied out to lf."
"03/19/2022","Teaneck, N.J.",NA,"5","top","4-1","Massachusetts","Fairleigh Dickinson","Skagerlind flied out to cf."
"03/19/2022","Teaneck, N.J.",NA,"5","bot","4-1","Fairleigh Dickinson","Massachusetts","L. Cantwell walked."
"03/19/2022","Teaneck, N.J.",NA,"5","bot","4-1","Fairleigh Dickinson","Massachusetts","J. Giovenco struck out swinging."
"03/19/2022","Teaneck, N.J.",NA,"5","bot","4-1","Fairleigh Dickinson","Massachusetts","B. Harden pinch hit for T. Werner."
"03/19/2022","Teaneck, N.J.",NA,"5","bot","4-1","Fairleigh Dickinson","Massachusetts","B. Harden grounded into double play 3b to 2b to 1b; L. Cantwell out on the play."
"03/19/2022","Teaneck, N.J.",NA,"6","top","4-1","Massachusetts","Fairleigh Dickinson","B. Harden to 2b."
"03/19/2022","Teaneck, N.J.",NA,"6","top","4-1","Massachusetts","Fairleigh Dickinson","Gervasi, M walked."
"03/19/2022","Teaneck, N.J.",NA,"6","top","4-1","Massachusetts","Fairleigh Dickinson","DeMartino, D grounded into double play ss to 1b; Gervasi, M out on the play."
"03/19/2022","Teaneck, N.J.",NA,"6","top","5-1","Massachusetts","Fairleigh Dickinson","Luttazi, S homered, RBI."
"03/19/2022","Teaneck, N.J.",NA,"6","top","5-1","Massachusetts","Fairleigh Dickinson","Judd, D singled to left field."
"03/19/2022","Teaneck, N.J.",NA,"6","top","5-1","Massachusetts","Fairleigh Dickinson","C. Symmons to p for J. Simon."
"03/19/2022","Teaneck, N.J.",NA,"6","top","5-1","Massachusetts","Fairleigh Dickinson","Judd, D out at second p to 2b, caught stealing."
"03/19/2022","Teaneck, N.J.",NA,"6","bot","5-1","Fairleigh Dickinson","Massachusetts","Z. Will flied out to lf."
"03/19/2022","Teaneck, N.J.",NA,"6","bot","5-1","Fairleigh Dickinson","Massachusetts","J. Sosa singled to left field."
"03/19/2022","Teaneck, N.J.",NA,"6","bot","5-1","Fairleigh Dickinson","Massachusetts","J. Sierra doubled to center field; J. Sosa advanced to third, out at home cf to ss to c."
"03/19/2022","Teaneck, N.J.",NA,"6","bot","5-1","Fairleigh Dickinson","Massachusetts","Given, Z to p for Livnat, D."
"03/19/2022","Teaneck, N.J.",NA,"6","bot","5-1","Fairleigh Dickinson","Massachusetts","T. Ruscitti popped up to 2b."
"03/19/2022","Teaneck, N.J.",NA,"7","top","5-1","Massachusetts","Fairleigh Dickinson","Wilde, A flied out to lf."
"03/19/2022","Teaneck, N.J.",NA,"7","top","5-1","Massachusetts","Fairleigh Dickinson","MacLean, W singled to second base."
"03/19/2022","Teaneck, N.J.",NA,"7","top","5-1","Massachusetts","Fairleigh Dickinson","Coleman, R pinch ran for MacLean, W."
"03/19/2022","Teaneck, N.J.",NA,"7","top","6-1","Massachusetts","Fairleigh Dickinson","Hebble, C doubled to left field, RBI; Coleman, R scored."
"03/19/2022","Teaneck, N.J.",NA,"7","top","6-1","Massachusetts","Fairleigh Dickinson","M. Dimartino to p for C. Symmons."
"03/19/2022","Teaneck, N.J.",NA,"7","top","6-1","Massachusetts","Fairleigh Dickinson","Shapiro, C walked."
"03/19/2022","Teaneck, N.J.",NA,"7","top","6-1","Massachusetts","Fairleigh Dickinson","Skagerlind flied out to lf."
"03/19/2022","Teaneck, N.J.",NA,"7","top","6-1","Massachusetts","Fairleigh Dickinson","Shapiro, C stole second; Hebble, C stole third."
"03/19/2022","Teaneck, N.J.",NA,"7","top","7-1","Massachusetts","Fairleigh Dickinson","Shapiro, C advanced to third; Hebble, C scored on a muffed throw by 3b, unearned."
"03/19/2022","Teaneck, N.J.",NA,"7","top","7-1","Massachusetts","Fairleigh Dickinson","Gervasi, M grounded out to 2b."
"03/19/2022","Teaneck, N.J.",NA,"7","bot","7-1","Fairleigh Dickinson","Massachusetts","Skagerlind to rf."
"03/19/2022","Teaneck, N.J.",NA,"7","bot","7-1","Fairleigh Dickinson","Massachusetts","Coleman, R to cf."
"03/19/2022","Teaneck, N.J.",NA,"7","bot","7-1","Fairleigh Dickinson","Massachusetts","T. Verga pinch hit for M. Puello."
"03/19/2022","Teaneck, N.J.",NA,"7","bot","7-1","Fairleigh Dickinson","Massachusetts","T. Verga struck out swinging."
"03/19/2022","Teaneck, N.J.",NA,"7","bot","7-1","Fairleigh Dickinson","Massachusetts","G. Rosales popped up to 1b."
"03/19/2022","Teaneck, N.J.",NA,"7","bot","7-1","Fairleigh Dickinson","Massachusetts","L. Cantwell singled to center field."
"03/19/2022","Teaneck, N.J.",NA,"7","bot","7-1","Fairleigh Dickinson","Massachusetts","J. Giovenco reached on a fielder's choice; L. Cantwell out at second 2b unassisted."
"03/19/2022","Teaneck, N.J.",NA,"8","top","7-1","Massachusetts","Fairleigh Dickinson","T. Verga to lf."
"03/19/2022","Teaneck, N.J.",NA,"8","top","7-1","Massachusetts","Fairleigh Dickinson","R. Racobaldo to p for M. Dimartino."
"03/19/2022","Teaneck, N.J.",NA,"8","top","7-1","Massachusetts","Fairleigh Dickinson","E. Novoa to c for G. Rosales."
"03/19/2022","Teaneck, N.J.",NA,"8","top","7-1","Massachusetts","Fairleigh Dickinson","DeMartino, D grounded out to ss."
"03/19/2022","Teaneck, N.J.",NA,"8","top","7-1","Massachusetts","Fairleigh Dickinson","Luttazi, S grounded out to 2b."
"03/19/2022","Teaneck, N.J.",NA,"8","top","7-1","Massachusetts","Fairleigh Dickinson","Judd, D grounded out to 2b."
"03/19/2022","Teaneck, N.J.",NA,"8","bot","7-1","Fairleigh Dickinson","Massachusetts","Walsh, C to 1b for Luttazi, S."
"03/19/2022","Teaneck, N.J.",NA,"8","bot","7-1","Fairleigh Dickinson","Massachusetts","B. Harden walked."
"03/19/2022","Teaneck, N.J.",NA,"8","bot","7-1","Fairleigh Dickinson","Massachusetts","H. D'Amato pinch hit for Z. Will."
"03/19/2022","Teaneck, N.J.",NA,"8","bot","7-1","Fairleigh Dickinson","Massachusetts","H. D'Amato doubled to center field; B. Harden advanced to third."
"03/19/2022","Teaneck, N.J.",NA,"8","bot","7-1","Fairleigh Dickinson","Massachusetts","J. Sosa grounded out to 3b."
"03/19/2022","Teaneck, N.J.",NA,"8","bot","7-2","Fairleigh Dickinson","Massachusetts","J. Sierra grounded out to 3b, SAC, RBI; B. Harden scored."
"03/19/2022","Teaneck, N.J.",NA,"8","bot","7-2","Fairleigh Dickinson","Massachusetts","T. Ruscitti grounded out to 2b."
"03/19/2022","Teaneck, N.J.",NA,"8","bot","7-2","Fairleigh Dickinson","Massachusetts","R: 1 H: 1 LOB: 1"
"03/19/2022","Teaneck, N.J.",NA,"9","top","7-2","Massachusetts","Fairleigh Dickinson","H. D'Amato to 3b."
"03/19/2022","Teaneck, N.J.",NA,"9","top","7-2","Massachusetts","Fairleigh Dickinson","Wilde, A flied out to rf."
"03/19/2022","Teaneck, N.J.",NA,"9","top","7-2","Massachusetts","Fairleigh Dickinson","Coleman, R grounded out to p, bunt."
"03/19/2022","Teaneck, N.J.",NA,"9","top","7-2","Massachusetts","Fairleigh Dickinson","Pearsons, C pinch hit for Hebble, C."
"03/19/2022","Teaneck, N.J.",NA,"9","top","7-2","Massachusetts","Fairleigh Dickinson","Pearsons, C singled to right field."
"03/19/2022","Teaneck, N.J.",NA,"9","top","7-2","Massachusetts","Fairleigh Dickinson","Hanson, C pinch hit for Shapiro, C."
"03/19/2022","Teaneck, N.J.",NA,"9","top","7-2","Massachusetts","Fairleigh Dickinson","Hanson, C struck out looking."
"03/19/2022","Teaneck, N.J.",NA,"9","top","7-2","Massachusetts","Fairleigh Dickinson","H: 1 LOB: 1"
"03/19/2022","Teaneck, N.J.",NA,"9","bot","7-2","Fairleigh Dickinson","Massachusetts","Hanson, C to lf."
"03/19/2022","Teaneck, N.J.",NA,"9","bot","7-2","Fairleigh Dickinson","Massachusetts","Pearsons, C to ss."
"03/19/2022","Teaneck, N.J.",NA,"9","bot","7-2","Fairleigh Dickinson","Massachusetts","T. Verga singled to center field."
"03/19/2022","Teaneck, N.J.",NA,"9","bot","7-2","Fairleigh Dickinson","Massachusetts","E. Novoa struck out swinging."
"03/19/2022","Teaneck, N.J.",NA,"9","bot","7-2","Fairleigh Dickinson","Massachusetts","L. Cantwell grounded into double play 2b to 1b; T. Verga out on the play."
"03/19/2022","Teaneck, N.J.",NA,"9","top","7-2","Massachusetts","Fairleigh Dickinson","H: 1"
