"date","location","attendance","inning","inning_top_bot","score","batting","fielding","description"
"04/01/2022","Birmingham, Ala.",NA,"1","top","0-0","Missouri St.","Samford","Nivens,S. flied out to cf."
"04/01/2022","Birmingham, Ala.",NA,"1","top","0-0","Missouri St.","Samford","Hull,M. struck out swinging."
"04/01/2022","Birmingham, Ala.",NA,"1","top","0-0","Missouri St.","Samford","Baldwin,D. flied out to cf."
"04/01/2022","Birmingham, Ala.",NA,"1","bot","0-0","Samford","Missouri St.","Howe grounded out to 2b."
"04/01/2022","Birmingham, Ala.",NA,"1","bot","0-0","Samford","Missouri St.","David flied out to cf."
"04/01/2022","Birmingham, Ala.",NA,"1","bot","0-0","Samford","Missouri St.","Ledbetter grounded out to 2b."
"04/01/2022","Birmingham, Ala.",NA,"2","top","0-0","Missouri St.","Samford","Kotowski,D. walked."
"04/01/2022","Birmingham, Ala.",NA,"2","top","0-0","Missouri St.","Samford","Cratic,C. fouled out to 3b."
"04/01/2022","Birmingham, Ala.",NA,"2","top","0-0","Missouri St.","Samford","Greer,M. singled through the right side3a Kotowski,D. advanced to third."
"04/01/2022","Birmingham, Ala.",NA,"2","top","0-0","Missouri St.","Samford","Duff,W. struck out looking."
"04/01/2022","Birmingham, Ala.",NA,"2","top","0-0","Missouri St.","Samford","Rolffs,J. grounded out to p."
"04/01/2022","Birmingham, Ala.",NA,"2","top","0-0","Missouri St.","Samford","H: 1 LOB: 2"
"04/01/2022","Birmingham, Ala.",NA,"2","bot","0-0","Samford","Missouri St.","Klein flied out to lf."
"04/01/2022","Birmingham, Ala.",NA,"2","bot","0-0","Samford","Missouri St.","King flied out to lf."
"04/01/2022","Birmingham, Ala.",NA,"2","bot","0-0","Samford","Missouri St.","Dreier popped up to 2b."
"04/01/2022","Birmingham, Ala.",NA,"3","top","0-0","Missouri St.","Samford","Wood,G. grounded out to 3b."
"04/01/2022","Birmingham, Ala.",NA,"3","top","0-0","Missouri St.","Samford","Nivens,S. grounded out to ss."
"04/01/2022","Birmingham, Ala.",NA,"3","top","0-0","Missouri St.","Samford","Hull,M. struck out swinging."
"04/01/2022","Birmingham, Ala.",NA,"3","bot","0-0","Samford","Missouri St.","A. Bennett struck out swinging."
"04/01/2022","Birmingham, Ala.",NA,"3","bot","0-0","Samford","Missouri St.","Garner grounded out to ss."
"04/01/2022","Birmingham, Ala.",NA,"3","bot","0-0","Samford","Missouri St.","Staton struck out swinging."
"04/01/2022","Birmingham, Ala.",NA,"4","top","0-0","Missouri St.","Samford","Baldwin,D. singled through the right side."
"04/01/2022","Birmingham, Ala.",NA,"4","top","0-0","Missouri St.","Samford","Kotowski,D. struck out swinging."
"04/01/2022","Birmingham, Ala.",NA,"4","top","0-0","Missouri St.","Samford","Cratic,C. fouled out to lf."
"04/01/2022","Birmingham, Ala.",NA,"4","top","0-0","Missouri St.","Samford","Greer,M. popped up to 3b."
"04/01/2022","Birmingham, Ala.",NA,"4","top","0-1","Missouri St.","Samford","H: 1 LOB: 1"
"04/01/2022","Birmingham, Ala.",NA,"4","bot","0-0","Samford","Missouri St.","Howe singled to right field."
"04/01/2022","Birmingham, Ala.",NA,"4","bot","0-0","Samford","Missouri St.","David singled to right center3a Howe advanced to third."
"04/01/2022","Birmingham, Ala.",NA,"4","bot","0-1","Samford","Missouri St.","Ledbetter grounded into double play 2b to ss to 1b3a David out on the play3a Howe scored."
"04/01/2022","Birmingham, Ala.",NA,"4","bot","0-1","Samford","Missouri St.","Klein grounded out to 2b."
"04/01/2022","Birmingham, Ala.",NA,"4","top","0-1","Missouri St.","Samford","R: 1 H: 2"
"04/01/2022","Birmingham, Ala.",NA,"5","top","0-1","Missouri St.","Samford","Duff,W. flied out to rf."
"04/01/2022","Birmingham, Ala.",NA,"5","top","0-1","Missouri St.","Samford","Rolffs,J. singled to center field."
"04/01/2022","Birmingham, Ala.",NA,"5","top","0-1","Missouri St.","Samford","Rolffs,J. advanced to second on a balk."
"04/01/2022","Birmingham, Ala.",NA,"5","top","0-1","Missouri St.","Samford","Wood,G. struck out swinging."
"04/01/2022","Birmingham, Ala.",NA,"5","top","0-1","Missouri St.","Samford","Nivens,S. struck out swinging."
"04/01/2022","Birmingham, Ala.",NA,"5","top","0-3","Missouri St.","Samford","H: 1 LOB: 1"
"04/01/2022","Birmingham, Ala.",NA,"5","bot","0-1","Samford","Missouri St.","Jenkins,W. to ss for Hull,M.."
"04/01/2022","Birmingham, Ala.",NA,"5","bot","0-1","Samford","Missouri St.","Wood,G. to 2b."
"04/01/2022","Birmingham, Ala.",NA,"5","bot","0-1","Samford","Missouri St.","King grounded out to 1b unassisted."
"04/01/2022","Birmingham, Ala.",NA,"5","bot","0-1","Samford","Missouri St.","Dreier reached on a fielding error by 3b."
"04/01/2022","Birmingham, Ala.",NA,"5","bot","0-1","Samford","Missouri St.","A. Bennett reached on a fielder's choice3a Dreier out at second ss to 2b."
"04/01/2022","Birmingham, Ala.",NA,"5","bot","0-1","Samford","Missouri St.","Garner singled to center field3a A. Bennett advanced to second."
"04/01/2022","Birmingham, Ala.",NA,"5","bot","0-1","Samford","Missouri St.","Staton hit by pitch3a Garner advanced to second3a A. Bennett advanced to third."
"04/01/2022","Birmingham, Ala.",NA,"5","bot","0-3","Samford","Missouri St.","Howe singled to right field, 2 RBI3a Staton advanced to third3a Garner scored, unearned3a A. Bennett scored, unearned."
"04/01/2022","Birmingham, Ala.",NA,"5","bot","0-3","Samford","Missouri St.","David grounded out to 3b."
"04/01/2022","Birmingham, Ala.",NA,"5","top","0-3","Missouri St.","Samford","R: 2 H: 2 E: 1 LOB: 2"
"04/01/2022","Birmingham, Ala.",NA,"6","top","0-3","Missouri St.","Samford","Jenkins,W. singled to shortstop."
"04/01/2022","Birmingham, Ala.",NA,"6","top","0-3","Missouri St.","Samford","Baldwin,D. hit by pitch3a Jenkins,W. advanced to second."
"04/01/2022","Birmingham, Ala.",NA,"6","top","0-3","Missouri St.","Samford","Kotowski,D. struck out swinging."
"04/01/2022","Birmingham, Ala.",NA,"6","top","0-3","Missouri St.","Samford","Cratic,C. grounded out to 2b3a Baldwin,D. advanced to second3a Jenkins,W. advanced to third."
"04/01/2022","Birmingham, Ala.",NA,"6","top","2-3","Missouri St.","Samford","Greer,M. singled up the middle, 2 RBI3a Baldwin,D. scored3a Jenkins,W. scored."
"04/01/2022","Birmingham, Ala.",NA,"6","top","2-3","Missouri St.","Samford","Duff,W. hit by pitch3a Greer,M. advanced to second."
"04/01/2022","Birmingham, Ala.",NA,"6","top","2-3","Missouri St.","Samford","Rolffs,J. struck out swinging."
"04/01/2022","Birmingham, Ala.",NA,"6","bot","2-3","Samford","Missouri St.","Ledbetter flied out to lf."
"04/01/2022","Birmingham, Ala.",NA,"6","bot","2-3","Samford","Missouri St.","Klein grounded out to 1b unassisted."
"04/01/2022","Birmingham, Ala.",NA,"6","bot","2-3","Samford","Missouri St.","King grounded out to ss."
"04/01/2022","Birmingham, Ala.",NA,"7","top","2-3","Missouri St.","Samford","Wood,G. walked."
"04/01/2022","Birmingham, Ala.",NA,"7","top","2-3","Missouri St.","Samford","Goff to p for Cravey."
"04/01/2022","Birmingham, Ala.",NA,"7","top","2-3","Missouri St.","Samford","Wood,G. advanced to second on a wild pitch."
"04/01/2022","Birmingham, Ala.",NA,"7","top","2-3","Missouri St.","Samford","Nivens,S. flied out to rf3a Wood,G. advanced to third."
"04/01/2022","Birmingham, Ala.",NA,"7","top","2-3","Missouri St.","Samford","Jenkins,W. walked."
"04/01/2022","Birmingham, Ala.",NA,"7","top","3-3","Missouri St.","Samford","Baldwin,D. flied out to lf, SF, RBI3a Wood,G. scored."
"04/01/2022","Birmingham, Ala.",NA,"7","top","3-3","Missouri St.","Samford","Jenkins,W. stole second."
"04/01/2022","Birmingham, Ala.",NA,"7","top","3-3","Missouri St.","Samford","Kotowski,D. struck out swinging."
"04/01/2022","Birmingham, Ala.",NA,"7","bot","3-3","Samford","Missouri St.","Dreier flied out to rf."
"04/01/2022","Birmingham, Ala.",NA,"7","bot","3-3","Samford","Missouri St.","A. Bennett singled up the middle."
"04/01/2022","Birmingham, Ala.",NA,"7","bot","3-3","Samford","Missouri St.","Garner struck out swinging."
"04/01/2022","Birmingham, Ala.",NA,"7","bot","3-3","Samford","Missouri St.","A. Bennett stole second."
"04/01/2022","Birmingham, Ala.",NA,"7","bot","3-3","Samford","Missouri St.","Staton flied out to rf."
"04/01/2022","Birmingham, Ala.",NA,"8","top","3-3","Missouri St.","Samford","Cratic,C. grounded out to 2b."
"04/01/2022","Birmingham, Ala.",NA,"8","top","3-3","Missouri St.","Samford","Greer,M. grounded out to 3b."
"04/01/2022","Birmingham, Ala.",NA,"8","top","3-3","Missouri St.","Samford","Duff,W. hit by pitch."
"04/01/2022","Birmingham, Ala.",NA,"8","top","3-3","Missouri St.","Samford","Rolffs,J. reached on a throwing error by 3b, advanced to second3a Duff,W. advanced to third."
"04/01/2022","Birmingham, Ala.",NA,"8","top","3-3","Missouri St.","Samford","Wood,G. struck out swinging."
"04/01/2022","Birmingham, Ala.",NA,"8","top","3-3","Missouri St.","Samford","E: 1 LOB: 2"
"04/01/2022","Birmingham, Ala.",NA,"8","bot","3-3","Samford","Missouri St.","Ziegenbein,T to p for Link,A.."
"04/01/2022","Birmingham, Ala.",NA,"8","bot","3-3","Samford","Missouri St.","Howe struck out swinging."
"04/01/2022","Birmingham, Ala.",NA,"8","bot","3-3","Samford","Missouri St.","David grounded out to 2b."
"04/01/2022","Birmingham, Ala.",NA,"8","bot","3-3","Samford","Missouri St.","Ledbetter grounded out to 2b."
"04/01/2022","Birmingham, Ala.",NA,"9","top","3-3","Missouri St.","Samford","Hobbs to p for Goff."
"04/01/2022","Birmingham, Ala.",NA,"9","top","3-3","Missouri St.","Samford","Nivens,S. singled through the right side."
"04/01/2022","Birmingham, Ala.",NA,"9","top","3-3","Missouri St.","Samford","Nivens,S. advanced to second on a wild pitch."
"04/01/2022","Birmingham, Ala.",NA,"9","top","3-3","Missouri St.","Samford","Jenkins,W. grounded out to p, SAC, bunt3a Nivens,S. advanced to third."
"04/01/2022","Birmingham, Ala.",NA,"9","top","4-3","Missouri St.","Samford","Baldwin,D. flied out to lf, SF, RBI3a Nivens,S. scored."
"04/01/2022","Birmingham, Ala.",NA,"9","top","4-3","Missouri St.","Samford","Kotowski,D. struck out swinging."
"04/01/2022","Birmingham, Ala.",NA,"9","bot","4-3","Samford","Missouri St.","Klein struck out looking."
"04/01/2022","Birmingham, Ala.",NA,"9","bot","4-3","Samford","Missouri St.","King struck out looking."
"04/01/2022","Birmingham, Ala.",NA,"9","bot","4-3","Samford","Missouri St.","Dreier walked."
"04/01/2022","Birmingham, Ala.",NA,"9","bot","4-3","Samford","Missouri St.","Bortak pinch ran for Dreier."
"04/01/2022","Birmingham, Ala.",NA,"9","bot","4-3","Samford","Missouri St.","A. Bennett hit by pitch3a Bortak advanced to second."
"04/01/2022","Birmingham, Ala.",NA,"9","bot","4-3","Samford","Missouri St.","Hampton pinch ran for A. Bennett."
"04/01/2022","Birmingham, Ala.",NA,"9","bot","4-3","Samford","Missouri St.","Garner flied out to lf."
