"date","location","attendance","inning","inning_top_bot","score","batting","fielding","description"
"04/19/2022","Reno, Nev.",NA,"1","top","0-0","Saint Mary's (CA)","Nevada","NAPIER hit by pitch (3-2 KKBFBB)."
"04/19/2022","Reno, Nev.",NA,"1","top","0-0","Saint Mary's (CA)","Nevada","VELAZQUEZ flied out to cf (2-1 BBK)."
"04/19/2022","Reno, Nev.",NA,"1","top","0-0","Saint Mary's (CA)","Nevada","SANTIAGO flied out to 2b (0-1 K)."
"04/19/2022","Reno, Nev.",NA,"1","top","0-0","Saint Mary's (CA)","Nevada","MCDONALD struck out looking (3-2 KBBBSK)."
"04/19/2022","Reno, Nev.",NA,"1","top","0-0","Saint Mary's (CA)","Nevada","LOB: 1"
"04/19/2022","Reno, Nev.",NA,"1","bot","0-0","Nevada","Saint Mary's (CA)","CAULFIELD, P flied out to cf (1-1 FB)."
"04/19/2022","Reno, Nev.",NA,"1","bot","0-0","Nevada","Saint Mary's (CA)","STINSON, J. popped up to ss (1-1 BK)."
"04/19/2022","Reno, Nev.",NA,"1","bot","0-0","Nevada","Saint Mary's (CA)","ZAMORA, J. singled to right center (0-0)."
"04/19/2022","Reno, Nev.",NA,"1","bot","0-0","Nevada","Saint Mary's (CA)","FLORES, A. walked (3-2 BBKBFB)3a ZAMORA, J. advanced to second."
"04/19/2022","Reno, Nev.",NA,"1","bot","0-0","Nevada","Saint Mary's (CA)","BOSETTI, T. popped up to ss (0-0)."
"04/19/2022","Reno, Nev.",NA,"1","top","0-0","Saint Mary's (CA)","Nevada","H: 1 LOB: 2"
"04/19/2022","Reno, Nev.",NA,"2","top","0-0","Saint Mary's (CA)","Nevada","MISTONE struck out swinging (2-2 BKBFS)."
"04/19/2022","Reno, Nev.",NA,"2","top","0-0","Saint Mary's (CA)","Nevada","SCHMIDT struck out swinging (1-2 SFFBS)."
"04/19/2022","Reno, Nev.",NA,"2","top","0-0","Saint Mary's (CA)","Nevada","MASHORE struck out swinging (0-2 KFS)."
"04/19/2022","Reno, Nev.",NA,"2","bot","0-0","Nevada","Saint Mary's (CA)","MARTIN, D. doubled to left center (1-0 B)."
"04/19/2022","Reno, Nev.",NA,"2","bot","0-0","Nevada","Saint Mary's (CA)","CLAYTON, M. flied out to rf (0-0)3a MARTIN, D. advanced to third."
"04/19/2022","Reno, Nev.",NA,"2","bot","0-1","Nevada","Saint Mary's (CA)","GOMEZ, D. doubled down the lf line, RBI (0-0)3a MARTIN, D. scored."
"04/19/2022","Reno, Nev.",NA,"2","bot","0-1","Nevada","Saint Mary's (CA)","MENDAZONA, P singled to right center (0-1 K)3a GOMEZ, D. advanced to third."
"04/19/2022","Reno, Nev.",NA,"2","bot","0-4","Nevada","Saint Mary's (CA)","CAULFIELD, P homered to left field, 3 RBI (1-1 BK)3a MENDAZONA, P scored3a GOMEZ, D. scored."
"04/19/2022","Reno, Nev.",NA,"2","bot","0-4","Nevada","Saint Mary's (CA)","STINSON, J. flied out to cf (3-1 FBBB)."
"04/19/2022","Reno, Nev.",NA,"2","bot","0-4","Nevada","Saint Mary's (CA)","ZAMORA, J. singled up the middle (1-2 FBK)."
"04/19/2022","Reno, Nev.",NA,"2","bot","0-4","Nevada","Saint Mary's (CA)","ZAMORA, J. advanced to second on a wild pitch."
"04/19/2022","Reno, Nev.",NA,"2","bot","0-4","Nevada","Saint Mary's (CA)","FLORES, A. hit by pitch (2-1 BFB)."
"04/19/2022","Reno, Nev.",NA,"2","bot","0-4","Nevada","Saint Mary's (CA)","BOSETTI, T. walked (3-2 BBFBKB)3a FLORES, A. advanced to second3a ZAMORA, J. advanced to third."
"04/19/2022","Reno, Nev.",NA,"2","bot","0-4","Nevada","Saint Mary's (CA)","HOWEY to p for DAUGHERTY."
"04/19/2022","Reno, Nev.",NA,"2","bot","0-4","Nevada","Saint Mary's (CA)","MARTIN, D. grounded out to ss (3-2 KBBKBF)."
"04/19/2022","Reno, Nev.",NA,"2","bot","0-4","Nevada","Saint Mary's (CA)","R: 4 H: 5 LOB: 3"
"04/19/2022","Reno, Nev.",NA,"3","top","0-4","Saint Mary's (CA)","Nevada","NAGER walked (3-1 BKBBB)."
"04/19/2022","Reno, Nev.",NA,"3","top","0-4","Saint Mary's (CA)","Nevada","GOULART struck out swinging (2-2 BKBSS)."
"04/19/2022","Reno, Nev.",NA,"3","top","0-4","Saint Mary's (CA)","Nevada","NAPIER reached on a fielder's choice to third base (1-1 BK)3a NAGER out at second 3b to 2b."
"04/19/2022","Reno, Nev.",NA,"3","top","0-4","Saint Mary's (CA)","Nevada","VELAZQUEZ reached on a fielding error by 3b (0-0)3a NAPIER advanced to third."
"04/19/2022","Reno, Nev.",NA,"3","top","0-4","Saint Mary's (CA)","Nevada","SANTIAGO grounded out to 3b (0-2 KFF)."
"04/19/2022","Reno, Nev.",NA,"3","top","0-4","Saint Mary's (CA)","Nevada","E: 1 LOB: 2"
"04/19/2022","Reno, Nev.",NA,"3","bot","0-4","Nevada","Saint Mary's (CA)","CLAYTON, M. singled to left field (0-0)."
"04/19/2022","Reno, Nev.",NA,"3","bot","0-4","Nevada","Saint Mary's (CA)","GOMEZ, D. popped up to ss (1-0 B)."
"04/19/2022","Reno, Nev.",NA,"3","bot","0-4","Nevada","Saint Mary's (CA)","MENDAZONA, P hit by pitch (0-1 F)3a CLAYTON, M. advanced to second."
"04/19/2022","Reno, Nev.",NA,"3","bot","0-4","Nevada","Saint Mary's (CA)","CAULFIELD, P flied out to cf (0-0)."
"04/19/2022","Reno, Nev.",NA,"3","bot","0-4","Nevada","Saint Mary's (CA)","STINSON, J. hit by pitch (2-2 KBFB)3a MENDAZONA, P advanced to second3a CLAYTON, M. advanced to third."
"04/19/2022","Reno, Nev.",NA,"3","bot","0-4","Nevada","Saint Mary's (CA)","ZAMORA, J. popped up to 2b (0-2 FKF)."
"04/19/2022","Reno, Nev.",NA,"3","top","0-4","Saint Mary's (CA)","Nevada","H: 1 LOB: 3"
"04/19/2022","Reno, Nev.",NA,"4","top","0-4","Saint Mary's (CA)","Nevada","FAY. B. to p for BIESTERFELD."
"04/19/2022","Reno, Nev.",NA,"4","top","0-4","Saint Mary's (CA)","Nevada","MCDONALD grounded out to 3b (0-0)."
"04/19/2022","Reno, Nev.",NA,"4","top","0-4","Saint Mary's (CA)","Nevada","MISTONE popped up to 2b (0-0)."
"04/19/2022","Reno, Nev.",NA,"4","top","0-4","Saint Mary's (CA)","Nevada","SCHMIDT struck out swinging (2-2 BSFBS)."
"04/19/2022","Reno, Nev.",NA,"4","bot","0-4","Nevada","Saint Mary's (CA)","FLORES, A. flied out to lf (1-2 FBS)."
"04/19/2022","Reno, Nev.",NA,"4","bot","0-4","Nevada","Saint Mary's (CA)","BOSETTI, T. grounded out to 2b (0-0)."
"04/19/2022","Reno, Nev.",NA,"4","bot","0-4","Nevada","Saint Mary's (CA)","MARTIN, D. flied out to cf (0-2 FF)."
"04/19/2022","Reno, Nev.",NA,"5","top","0-4","Saint Mary's (CA)","Nevada","MASHORE walked (3-1 KBBBB)."
"04/19/2022","Reno, Nev.",NA,"5","top","0-4","Saint Mary's (CA)","Nevada","MASHORE stole second."
"04/19/2022","Reno, Nev.",NA,"5","top","0-4","Saint Mary's (CA)","Nevada","NAGER hit by pitch (2-2 KKBB)."
"04/19/2022","Reno, Nev.",NA,"5","top","0-4","Saint Mary's (CA)","Nevada","NAGER stole second3a MASHORE stole third."
"04/19/2022","Reno, Nev.",NA,"5","top","0-4","Saint Mary's (CA)","Nevada","GOULART struck out looking (2-2 KBSFFBK)."
"04/19/2022","Reno, Nev.",NA,"5","top","1-4","Saint Mary's (CA)","Nevada","NAPIER grounded out to 2b, RBI (0-0)3a NAGER advanced to third3a MASHORE scored."
"04/19/2022","Reno, Nev.",NA,"5","top","1-4","Saint Mary's (CA)","Nevada","VELAZQUEZ grounded out to 2b (0-2 FF)."
"04/19/2022","Reno, Nev.",NA,"5","bot","1-4","Nevada","Saint Mary's (CA)","CLAYTON, M. popped up to c (3-1 KBBB)."
"04/19/2022","Reno, Nev.",NA,"5","bot","1-4","Nevada","Saint Mary's (CA)","GOMEZ, D. singled through the left side (0-0)."
"04/19/2022","Reno, Nev.",NA,"5","bot","1-4","Nevada","Saint Mary's (CA)","MENDAZONA, P fouled out to 1b (2-2 KSBBF)."
"04/19/2022","Reno, Nev.",NA,"5","bot","1-4","Nevada","Saint Mary's (CA)","GOMEZ, D. stole second."
"04/19/2022","Reno, Nev.",NA,"5","bot","1-4","Nevada","Saint Mary's (CA)","CAULFIELD, P walked (3-1 BFBBB)3a GOMEZ, D. advanced to third on a wild pitch."
"04/19/2022","Reno, Nev.",NA,"5","bot","1-5","Nevada","Saint Mary's (CA)","CAULFIELD, P advanced to second on the error3a GOMEZ, D. scored on a throwing error by c, failed pickoff attempt, unearned."
"04/19/2022","Reno, Nev.",NA,"5","bot","1-5","Nevada","Saint Mary's (CA)","STINSON, J. grounded out to ss (2-1 KBB)."
"04/19/2022","Reno, Nev.",NA,"6","top","1-5","Saint Mary's (CA)","Nevada","SANTIAGO grounded out to 3b (1-1 BK)."
"04/19/2022","Reno, Nev.",NA,"6","top","1-5","Saint Mary's (CA)","Nevada","MCDONALD grounded out to 3b (0-0)."
"04/19/2022","Reno, Nev.",NA,"6","top","1-5","Saint Mary's (CA)","Nevada","MISTONE singled to right field (1-1 KB)."
"04/19/2022","Reno, Nev.",NA,"6","top","1-5","Saint Mary's (CA)","Nevada","SCHMIDT doubled to left field (3-1 BSBB)3a MISTONE advanced to third."
"04/19/2022","Reno, Nev.",NA,"6","top","1-5","Saint Mary's (CA)","Nevada","MASHORE flied out to lf (1-1 BK)."
"04/19/2022","Reno, Nev.",NA,"6","top","1-10","Saint Mary's (CA)","Nevada","H: 2 LOB: 2"
"04/19/2022","Reno, Nev.",NA,"6","bot","1-5","Nevada","Saint Mary's (CA)","ZAMORA, J. singled up the middle (0-2 KF)."
"04/19/2022","Reno, Nev.",NA,"6","bot","1-5","Nevada","Saint Mary's (CA)","FLORES, A. singled to left center (1-0 B)3a ZAMORA, J. advanced to second."
"04/19/2022","Reno, Nev.",NA,"6","bot","1-5","Nevada","Saint Mary's (CA)","BOSETTI, T. singled to right field (0-0)3a FLORES, A. advanced to second3a ZAMORA, J. advanced to third."
"04/19/2022","Reno, Nev.",NA,"6","bot","1-5","Nevada","Saint Mary's (CA)","SCHNEIDER to p for HOWEY."
"04/19/2022","Reno, Nev.",NA,"6","bot","1-6","Nevada","Saint Mary's (CA)","MARTIN, D. hit by pitch, RBI (2-0 BB)3a BOSETTI, T. advanced to second3a FLORES, A. advanced to third3a ZAMORA, J. scored."
"04/19/2022","Reno, Nev.",NA,"6","bot","1-8","Nevada","Saint Mary's (CA)","CLAYTON, M. doubled to left field, 2 RBI (0-0)3a MARTIN, D. advanced to third3a BOSETTI, T. scored3a FLORES, A. scored."
"04/19/2022","Reno, Nev.",NA,"6","bot","1-10","Nevada","Saint Mary's (CA)","GOMEZ, D. doubled to center field, 2 RBI (0-1 K)3a CLAYTON, M. scored3a MARTIN, D. scored."
"04/19/2022","Reno, Nev.",NA,"6","bot","1-10","Nevada","Saint Mary's (CA)","MENDAZONA, P struck out swinging (0-2 KSS)."
"04/19/2022","Reno, Nev.",NA,"6","bot","1-10","Nevada","Saint Mary's (CA)","CAULFIELD, P struck out swinging (0-2 FSS)."
"04/19/2022","Reno, Nev.",NA,"6","bot","1-10","Nevada","Saint Mary's (CA)","STINSON, J. grounded out to 1b unassisted (0-0)."
"04/19/2022","Reno, Nev.",NA,"6","top","1-10","Saint Mary's (CA)","Nevada","R: 5 H: 5 LOB: 1"
"04/19/2022","Reno, Nev.",NA,"7","top","1-10","Saint Mary's (CA)","Nevada","GEBB, J. to p for FAY. B.."
"04/19/2022","Reno, Nev.",NA,"7","top","1-10","Saint Mary's (CA)","Nevada","NAGER walked (3-2 BBKKBB)."
"04/19/2022","Reno, Nev.",NA,"7","top","1-10","Saint Mary's (CA)","Nevada","COCHRAN, T. to p for GEBB, J.."
"04/19/2022","Reno, Nev.",NA,"7","top","1-10","Saint Mary's (CA)","Nevada","LAMB pinch hit for GOULART."
"04/19/2022","Reno, Nev.",NA,"7","top","1-10","Saint Mary's (CA)","Nevada","LAMB singled to right center (0-0)3a NAGER advanced to second."
"04/19/2022","Reno, Nev.",NA,"7","top","1-10","Saint Mary's (CA)","Nevada","NAPIER reached on a fielder's choice to third base (3-2 KFBFFBBFF)3a LAMB out at second 3b to 2b3a NAGER advanced to third."
"04/19/2022","Reno, Nev.",NA,"7","top","2-10","Saint Mary's (CA)","Nevada","VELAZQUEZ flied out to rf, SF, RBI (2-1 BBS)3a NAGER scored."
"04/19/2022","Reno, Nev.",NA,"7","top","2-10","Saint Mary's (CA)","Nevada","SANTIAGO reached on a fielder's choice to third base (0-0)3a NAPIER out at second 3b to 2b."
"04/19/2022","Reno, Nev.",NA,"7","bot","2-10","Nevada","Saint Mary's (CA)","DRIGGS to c for LAMB."
"04/19/2022","Reno, Nev.",NA,"7","bot","2-10","Nevada","Saint Mary's (CA)","TAUREK to p for SCHNEIDER."
"04/19/2022","Reno, Nev.",NA,"7","bot","2-10","Nevada","Saint Mary's (CA)","ZAMORA, J. grounded out to 3b (2-2 BBFK)."
"04/19/2022","Reno, Nev.",NA,"7","bot","2-10","Nevada","Saint Mary's (CA)","FLORES, A. singled up the middle (2-2 KKBB)."
"04/19/2022","Reno, Nev.",NA,"7","bot","2-10","Nevada","Saint Mary's (CA)","BOSETTI, T. flied out to cf (2-1 FBB)."
"04/19/2022","Reno, Nev.",NA,"7","bot","2-10","Nevada","Saint Mary's (CA)","MARTIN, D. reached on a fielder's choice to shortstop (1-1 BF)3a FLORES, A. out at second ss to 2b."
"04/19/2022","Reno, Nev.",NA,"8","top","2-10","Saint Mary's (CA)","Nevada","MCDONALD struck out looking (0-2 KKK)."
"04/19/2022","Reno, Nev.",NA,"8","top","2-10","Saint Mary's (CA)","Nevada","MISTONE grounded out to 3b (1-0 B)."
"04/19/2022","Reno, Nev.",NA,"8","top","2-10","Saint Mary's (CA)","Nevada","SCHMIDT singled through the left side (1-2 KBS)."
"04/19/2022","Reno, Nev.",NA,"8","top","2-10","Saint Mary's (CA)","Nevada","WINGET pinch hit for MASHORE."
"04/19/2022","Reno, Nev.",NA,"8","top","2-10","Saint Mary's (CA)","Nevada","WINGET struck out looking (2-2 KBFBK)."
"04/19/2022","Reno, Nev.",NA,"8","top","2-13","Saint Mary's (CA)","Nevada","H: 1 LOB: 1"
"04/19/2022","Reno, Nev.",NA,"8","bot","2-10","Nevada","Saint Mary's (CA)","WINGET to rf."
"04/19/2022","Reno, Nev.",NA,"8","bot","2-10","Nevada","Saint Mary's (CA)","CLAYTON, M. singled to left center (1-2 BSS)."
"04/19/2022","Reno, Nev.",NA,"8","bot","2-10","Nevada","Saint Mary's (CA)","GOMEZ, D. singled through the left side (0-0)3a CLAYTON, M. advanced to second."
"04/19/2022","Reno, Nev.",NA,"8","bot","2-10","Nevada","Saint Mary's (CA)","GOMEZ, D. advanced to second3a CLAYTON, M. advanced to third on a wild pitch."
"04/19/2022","Reno, Nev.",NA,"8","bot","2-11","Nevada","Saint Mary's (CA)","MENDAZONA, P grounded out to ss, RBI (3-2 BBBKF)3a CLAYTON, M. scored."
"04/19/2022","Reno, Nev.",NA,"8","bot","2-11","Nevada","Saint Mary's (CA)","HULETT to p for TAUREK."
"04/19/2022","Reno, Nev.",NA,"8","bot","2-11","Nevada","Saint Mary's (CA)","CAULFIELD, P hit by pitch (0-0)."
"04/19/2022","Reno, Nev.",NA,"8","bot","2-11","Nevada","Saint Mary's (CA)","STINSON, J. struck out looking (1-2 BKSFFFK)."
"04/19/2022","Reno, Nev.",NA,"8","bot","2-13","Nevada","Saint Mary's (CA)","ZAMORA, J. doubled to right center, 2 RBI (1-1 BF)3a CAULFIELD, P scored3a GOMEZ, D. scored."
"04/19/2022","Reno, Nev.",NA,"8","bot","2-13","Nevada","Saint Mary's (CA)","FLORES, A. lined out to 2b (3-2 KSFFBBBFF)."
"04/19/2022","Reno, Nev.",NA,"8","top","2-13","Saint Mary's (CA)","Nevada","R: 3 H: 3 LOB: 1"
"04/19/2022","Reno, Nev.",NA,"9","top","2-13","Saint Mary's (CA)","Nevada","NAGER walked (3-2 BSBKBB)."
"04/19/2022","Reno, Nev.",NA,"9","top","2-13","Saint Mary's (CA)","Nevada","NAGER advanced to second."
"04/19/2022","Reno, Nev.",NA,"9","top","2-13","Saint Mary's (CA)","Nevada","DRIGGS flied out to cf (1-1 KB)3a NAGER advanced to third."
"04/19/2022","Reno, Nev.",NA,"9","top","2-13","Saint Mary's (CA)","Nevada","ESPINOZA pinch hit for NAPIER."
"04/19/2022","Reno, Nev.",NA,"9","top","3-13","Saint Mary's (CA)","Nevada","ESPINOZA grounded out to 2b, RBI (2-1 BBK)3a NAGER scored."
"04/19/2022","Reno, Nev.",NA,"9","top","3-13","Saint Mary's (CA)","Nevada","HIRAYAMA pinch hit for VELAZQUEZ."
"04/19/2022","Reno, Nev.",NA,"9","top","3-13","Saint Mary's (CA)","Nevada","HIRAYAMA struck out swinging (1-2 KBKS)."
