"date","location","attendance","inning","inning_top_bot","score","batting","fielding","description"
"05/01/2022","Vestal, N.Y.",NA,"1","top","0-0","UMBC","Binghamton","Nicholson grounded out to c (2-2 KBBF)."
"05/01/2022","Vestal, N.Y.",NA,"1","top","0-0","UMBC","Binghamton","Diaz flied out to lf (2-2 KSBB)."
"05/01/2022","Vestal, N.Y.",NA,"1","top","0-0","UMBC","Binghamton","Taylor grounded out to 3b (1-2 KKFB)."
"05/01/2022","Vestal, N.Y.",NA,"1","bot","0-0","Binghamton","UMBC","Tully struck out looking (2-2 FBFBK)."
"05/01/2022","Vestal, N.Y.",NA,"1","bot","0-0","Binghamton","UMBC","Haskell struck out swinging (1-2 KFBS)."
"05/01/2022","Vestal, N.Y.",NA,"1","bot","0-0","Binghamton","UMBC","Aoki grounded out to ss (3-2 KKBBBFF)."
"05/01/2022","Vestal, N.Y.",NA,"2","top","0-0","UMBC","Binghamton","Krueger singled through the right side (1-0 B)."
"05/01/2022","Vestal, N.Y.",NA,"2","top","0-0","UMBC","Binghamton","Doran walked (3-1 KBBBB)3a Krueger advanced to second."
"05/01/2022","Vestal, N.Y.",NA,"2","top","0-0","UMBC","Binghamton","Trythall singled to center field (0-2 FF)3a Doran advanced to second3a Krueger advanced to third."
"05/01/2022","Vestal, N.Y.",NA,"2","top","2-0","UMBC","Binghamton","M. Ryan doubled to left center, 2 RBI (3-1 FBBB)3a Trythall advanced to third3a Doran scored3a Krueger scored."
"05/01/2022","Vestal, N.Y.",NA,"2","top","2-0","UMBC","Binghamton","Roberts popped up to 1b (1-1 KB)."
"05/01/2022","Vestal, N.Y.",NA,"2","top","2-0","UMBC","Binghamton","Shertel popped up to 2b (0-0)."
"05/01/2022","Vestal, N.Y.",NA,"2","top","3-0","UMBC","Binghamton","M. Ryan advanced to third3a Trythall scored on a wild pitch."
"05/01/2022","Vestal, N.Y.",NA,"2","top","3-0","UMBC","Binghamton","Nicholson grounded out to p (1-2 FBFF)."
"05/01/2022","Vestal, N.Y.",NA,"2","bot","3-0","Binghamton","UMBC","Sullivan reached on a fielding error by 1b (0-0)."
"05/01/2022","Vestal, N.Y.",NA,"2","bot","3-0","Binghamton","UMBC","Roselli walked (3-1 BBBKB)3a Sullivan advanced to second."
"05/01/2022","Vestal, N.Y.",NA,"2","bot","3-0","Binghamton","UMBC","Parliament reached on a fielder's choice (0-1 K)3a Roselli out at second ss to 2b3a Sullivan advanced to third."
"05/01/2022","Vestal, N.Y.",NA,"2","bot","3-0","Binghamton","UMBC","Bade struck out swinging (1-2 SFBS)."
"05/01/2022","Vestal, N.Y.",NA,"2","bot","3-0","Binghamton","UMBC","Evans singled through the right side (0-0)3a Parliament out at first 1b unassisted."
"05/01/2022","Vestal, N.Y.",NA,"3","top","3-0","UMBC","Binghamton","Diaz walked (3-1 KBBBB)."
"05/01/2022","Vestal, N.Y.",NA,"3","top","4-0","UMBC","Binghamton","Taylor doubled down the lf line, RBI (3-2 BBBKK)3a Diaz scored."
"05/01/2022","Vestal, N.Y.",NA,"3","top","4-0","UMBC","Binghamton","Krueger singled to left center (0-1 F)3a Taylor advanced to third."
"05/01/2022","Vestal, N.Y.",NA,"3","top","4-0","UMBC","Binghamton","Doran flied out to cf (1-0 B)."
"05/01/2022","Vestal, N.Y.",NA,"3","top","5-0","UMBC","Binghamton","Trythall flied out to rf, SF, RBI (1-0 B)3a Taylor scored."
"05/01/2022","Vestal, N.Y.",NA,"3","top","5-0","UMBC","Binghamton","Krueger out at second c to 2b, caught stealing."
"05/01/2022","Vestal, N.Y.",NA,"3","bot","5-0","Binghamton","UMBC","Mason struck out looking (2-2 BKSBFK)."
"05/01/2022","Vestal, N.Y.",NA,"3","bot","5-0","Binghamton","UMBC","Tully tripled to left center (2-1 BKB)."
"05/01/2022","Vestal, N.Y.",NA,"3","bot","5-0","Binghamton","UMBC","Haskell popped up to ss (2-0 BB)."
"05/01/2022","Vestal, N.Y.",NA,"3","bot","5-0","Binghamton","UMBC","Aoki fouled out to 1b (3-2 FBBBK)."
"05/01/2022","Vestal, N.Y.",NA,"4","top","5-0","UMBC","Binghamton","M. Ryan walked (3-1 KBBBB)."
"05/01/2022","Vestal, N.Y.",NA,"4","top","5-0","UMBC","Binghamton","Roberts reached on a fielder's choice, advanced to second on a throwing error by 2b, out at third 1b to 3b (0-1 K)3a M. Ryan out at second ss to 2b."
"05/01/2022","Vestal, N.Y.",NA,"4","top","5-0","UMBC","Binghamton","Shertel singled to center field (3-2 BFSBB)."
"05/01/2022","Vestal, N.Y.",NA,"4","top","5-0","UMBC","Binghamton","Nicholson singled to center field (0-0)3a Shertel advanced to third."
"05/01/2022","Vestal, N.Y.",NA,"4","top","5-0","UMBC","Binghamton","Nicholson stole second."
"05/01/2022","Vestal, N.Y.",NA,"4","top","5-0","UMBC","Binghamton","Diaz struck out swinging (0-2 KKS)."
"05/01/2022","Vestal, N.Y.",NA,"4","top","5-0","UMBC","Binghamton","H: 2 E: 1 LOB: 2"
"05/01/2022","Vestal, N.Y.",NA,"4","bot","5-0","Binghamton","UMBC","Sullivan singled to right field (0-0)."
"05/01/2022","Vestal, N.Y.",NA,"4","bot","5-0","Binghamton","UMBC","Roselli flied out to cf (2-2 FBBF)."
"05/01/2022","Vestal, N.Y.",NA,"4","bot","5-0","Binghamton","UMBC","Parliament flied out to rf (0-0)."
"05/01/2022","Vestal, N.Y.",NA,"4","bot","5-0","Binghamton","UMBC","Bade struck out swinging (0-2 KFFS)."
"05/01/2022","Vestal, N.Y.",NA,"4","top","5-0","UMBC","Binghamton","H: 1 LOB: 1"
"05/01/2022","Vestal, N.Y.",NA,"5","top","5-0","UMBC","Binghamton","Eskildsen to p for Bryggman."
"05/01/2022","Vestal, N.Y.",NA,"5","top","5-0","UMBC","Binghamton","Taylor flied out to rf (2-2 SFBB)."
"05/01/2022","Vestal, N.Y.",NA,"5","top","5-0","UMBC","Binghamton","Krueger singled through the right side (1-0 B)."
"05/01/2022","Vestal, N.Y.",NA,"5","top","5-0","UMBC","Binghamton","Doran reached on a fielder's choice (1-1 BF)3a Krueger out at second 3b to 2b."
"05/01/2022","Vestal, N.Y.",NA,"5","top","5-0","UMBC","Binghamton","Doran stole second."
"05/01/2022","Vestal, N.Y.",NA,"5","top","6-0","UMBC","Binghamton","Trythall doubled to center field, RBI (1-2 FKBFF)3a Doran scored."
"05/01/2022","Vestal, N.Y.",NA,"5","top","7-0","UMBC","Binghamton","M. Ryan singled up the middle, RBI (3-2 BBBKK)3a Trythall scored."
"05/01/2022","Vestal, N.Y.",NA,"5","top","7-0","UMBC","Binghamton","M. Ryan stole second, advanced to third on a throwing error by c."
"05/01/2022","Vestal, N.Y.",NA,"5","top","8-0","UMBC","Binghamton","M. Ryan scored on a passed ball, unearned."
"05/01/2022","Vestal, N.Y.",NA,"5","top","8-0","UMBC","Binghamton","Roberts struck out swinging (2-2 SBBKS)."
"05/01/2022","Vestal, N.Y.",NA,"5","bot","8-0","Binghamton","UMBC","Evans flied out to rf (1-0 B)."
"05/01/2022","Vestal, N.Y.",NA,"5","bot","8-0","Binghamton","UMBC","Mason singled to right field (2-1 BBF)."
"05/01/2022","Vestal, N.Y.",NA,"5","bot","8-0","Binghamton","UMBC","Tully singled to right center (1-2 KBS)3a Mason advanced to third."
"05/01/2022","Vestal, N.Y.",NA,"5","bot","8-1","Binghamton","UMBC","Haskell reached on a fielder's choice, RBI (0-0)3a Tully out at second ss to 2b3a Mason scored."
"05/01/2022","Vestal, N.Y.",NA,"5","bot","8-1","Binghamton","UMBC","Aoki grounded out to 3b (3-2 BBBKK)."
"05/01/2022","Vestal, N.Y.",NA,"6","top","8-1","UMBC","Binghamton","Shertel grounded out to 2b (0-0)."
"05/01/2022","Vestal, N.Y.",NA,"6","top","8-1","UMBC","Binghamton","Nicholson grounded out to ss (2-2 BFBF)."
"05/01/2022","Vestal, N.Y.",NA,"6","top","8-1","UMBC","Binghamton","Diaz flied out to cf (1-0 B)."
"05/01/2022","Vestal, N.Y.",NA,"6","bot","8-1","Binghamton","UMBC","Sullivan flied out to rf (2-2 KFBB)."
"05/01/2022","Vestal, N.Y.",NA,"6","bot","8-1","Binghamton","UMBC","Roselli hit by pitch."
"05/01/2022","Vestal, N.Y.",NA,"6","bot","8-1","Binghamton","UMBC","Parliament flied out to rf."
"05/01/2022","Vestal, N.Y.",NA,"6","bot","8-1","Binghamton","UMBC","Bade flied out to cf."
"05/01/2022","Vestal, N.Y.",NA,"6","bot","8-1","Binghamton","UMBC","LOB: 1"
"05/01/2022","Vestal, N.Y.",NA,"7","top","8-1","UMBC","Binghamton","Taylor singled."
"05/01/2022","Vestal, N.Y.",NA,"7","top","8-1","UMBC","Binghamton","Taylor stole second."
"05/01/2022","Vestal, N.Y.",NA,"7","top","9-1","UMBC","Binghamton","Krueger singled, RBI3a Taylor scored."
"05/01/2022","Vestal, N.Y.",NA,"7","top","9-1","UMBC","Binghamton","Easley pinch ran for Krueger."
"05/01/2022","Vestal, N.Y.",NA,"7","top","9-1","UMBC","Binghamton","Easley out at second c to 2b, caught stealing."
"05/01/2022","Vestal, N.Y.",NA,"7","top","9-1","UMBC","Binghamton","Doran grounded out to c."
"05/01/2022","Vestal, N.Y.",NA,"7","top","9-1","UMBC","Binghamton","Trythall doubled."
"05/01/2022","Vestal, N.Y.",NA,"7","top","9-1","UMBC","Binghamton","M. Ryan struck out looking."
"05/01/2022","Vestal, N.Y.",NA,"7","bot","9-1","Binghamton","UMBC","Kelly pinch ran for Easley."
"05/01/2022","Vestal, N.Y.",NA,"7","bot","9-1","Binghamton","UMBC","Kelly to c."
"05/01/2022","Vestal, N.Y.",NA,"7","bot","9-1","Binghamton","UMBC","Bare to p for Johnson."
"05/01/2022","Vestal, N.Y.",NA,"7","bot","9-1","Binghamton","UMBC","Evans out at first 1b to p."
"05/01/2022","Vestal, N.Y.",NA,"7","bot","9-1","Binghamton","UMBC","Mason singled."
"05/01/2022","Vestal, N.Y.",NA,"7","bot","9-1","Binghamton","UMBC","Tully struck out swinging."
"05/01/2022","Vestal, N.Y.",NA,"7","bot","9-1","Binghamton","UMBC","Haskell grounded out to ss."
"05/01/2022","Vestal, N.Y.",NA,"8","top","9-1","UMBC","Binghamton","Roberts doubled."
"05/01/2022","Vestal, N.Y.",NA,"8","top","9-1","UMBC","Binghamton","Shertel grounded out to 2b3a Roberts advanced to third."
"05/01/2022","Vestal, N.Y.",NA,"8","top","9-1","UMBC","Binghamton","Shandler pinch hit for Nicholson."
"05/01/2022","Vestal, N.Y.",NA,"8","top","9-1","UMBC","Binghamton","Shandler struck out looking."
"05/01/2022","Vestal, N.Y.",NA,"8","top","9-1","UMBC","Binghamton","Cilio pinch hit for Diaz."
"05/01/2022","Vestal, N.Y.",NA,"8","top","10-1","UMBC","Binghamton","Cilio singled, RBI3a Roberts scored."
"05/01/2022","Vestal, N.Y.",NA,"8","top","12-1","UMBC","Binghamton","Taylor homered, 2 RBI3a Cilio scored."
"05/01/2022","Vestal, N.Y.",NA,"8","top","12-1","UMBC","Binghamton","Henderson to p for Eskildsen."
"05/01/2022","Vestal, N.Y.",NA,"8","top","12-1","UMBC","Binghamton","No play."
"05/01/2022","Vestal, N.Y.",NA,"8","top","12-1","UMBC","Binghamton","Kelly walked."
"05/01/2022","Vestal, N.Y.",NA,"8","top","12-1","UMBC","Binghamton","Dzarnowski pinch hit for Doran."
"05/01/2022","Vestal, N.Y.",NA,"8","top","12-1","UMBC","Binghamton","Dzarnowski flied out to cf."
"05/01/2022","Vestal, N.Y.",NA,"8","bot","12-1","Binghamton","UMBC","Shandler to 2b."
"05/01/2022","Vestal, N.Y.",NA,"8","bot","12-1","Binghamton","UMBC","Cilio to rf."
"05/01/2022","Vestal, N.Y.",NA,"8","bot","12-1","Binghamton","UMBC","Dzarnowski to dh."
"05/01/2022","Vestal, N.Y.",NA,"8","bot","12-1","Binghamton","UMBC","Tan to 1b for Aoki."
"05/01/2022","Vestal, N.Y.",NA,"8","bot","12-1","Binghamton","UMBC","Tan flied out to cf."
"05/01/2022","Vestal, N.Y.",NA,"8","bot","12-1","Binghamton","UMBC","Sullivan hit by pitch."
"05/01/2022","Vestal, N.Y.",NA,"8","bot","12-1","Binghamton","UMBC","Taylor pinch hit for Roselli."
"05/01/2022","Vestal, N.Y.",NA,"8","bot","12-1","Binghamton","UMBC","Taylor reached on a fielding error by 3b3a Sullivan advanced to second, advanced to third on a throwing error by 3b."
"05/01/2022","Vestal, N.Y.",NA,"8","bot","12-1","Binghamton","UMBC","Madenberg to dh for Parliament."
"05/01/2022","Vestal, N.Y.",NA,"8","bot","12-2","Binghamton","UMBC","Madenberg flied out to rf, SF, RBI3a Sullivan scored, unearned."
"05/01/2022","Vestal, N.Y.",NA,"8","bot","12-2","Binghamton","UMBC","Corry to 3b for Bade."
"05/01/2022","Vestal, N.Y.",NA,"8","bot","12-2","Binghamton","UMBC","Corry grounded out to 3b."
"05/01/2022","Vestal, N.Y.",NA,"9","top","12-2","UMBC","Binghamton","Taylor to 2b."
"05/01/2022","Vestal, N.Y.",NA,"9","top","12-2","UMBC","Binghamton","Trythall singled."
"05/01/2022","Vestal, N.Y.",NA,"9","top","12-2","UMBC","Binghamton","M. Ryan grounded into double play ss to 2b to 1b3a Trythall out on the play."
"05/01/2022","Vestal, N.Y.",NA,"9","top","12-2","UMBC","Binghamton","Roberts walked."
"05/01/2022","Vestal, N.Y.",NA,"9","top","12-2","UMBC","Binghamton","Ryan to lf for Shertel."
"05/01/2022","Vestal, N.Y.",NA,"9","top","12-2","UMBC","Binghamton","Roberts advanced to second on a passed ball."
"05/01/2022","Vestal, N.Y.",NA,"9","top","12-2","UMBC","Binghamton","Ryan grounded out to 3b."
"05/01/2022","Vestal, N.Y.",NA,"9","top","12-7","UMBC","Binghamton","H: 1 LOB: 1"
"05/01/2022","Vestal, N.Y.",NA,"9","bot","12-2","Binghamton","UMBC","Selmer to p for Bare."
"05/01/2022","Vestal, N.Y.",NA,"9","bot","12-2","Binghamton","UMBC","Evans singled."
"05/01/2022","Vestal, N.Y.",NA,"9","bot","12-2","Binghamton","UMBC","Reifler pinch hit for Mason."
"05/01/2022","Vestal, N.Y.",NA,"9","bot","12-2","Binghamton","UMBC","Reifler reached on a fielder's choice3a Evans advanced to second on a throwing error by 2b."
"05/01/2022","Vestal, N.Y.",NA,"9","bot","12-2","Binghamton","UMBC","Perez pinch hit for Tully."
"05/01/2022","Vestal, N.Y.",NA,"9","bot","12-2","Binghamton","UMBC","Perez walked3a Reifler advanced to second3a Evans advanced to third."
"05/01/2022","Vestal, N.Y.",NA,"9","bot","12-2","Binghamton","UMBC","Di Vietro pinch hit for Haskell."
"05/01/2022","Vestal, N.Y.",NA,"9","bot","12-3","Binghamton","UMBC","Di Vietro singled, RBI3a Perez advanced to second3a Reifler advanced to third3a Evans scored, unearned."
"05/01/2022","Vestal, N.Y.",NA,"9","bot","12-4","Binghamton","UMBC","Tan singled, RBI3a Di Vietro advanced to second3a Perez advanced to third3a Reifler scored."
"05/01/2022","Vestal, N.Y.",NA,"9","bot","12-4","Binghamton","UMBC","Sullivan fouled out to 1b."
"05/01/2022","Vestal, N.Y.",NA,"9","bot","12-6","Binghamton","UMBC","Taylor doubled, 2 RBI3a Tan advanced to third3a Di Vietro scored3a Perez scored."
"05/01/2022","Vestal, N.Y.",NA,"9","bot","12-7","Binghamton","UMBC","Madenberg grounded out to 2b, RBI3a Tan scored."
"05/01/2022","Vestal, N.Y.",NA,"9","bot","12-7","Binghamton","UMBC","Corry grounded out to ss."
"05/01/2022","Vestal, N.Y.",NA,"9","top","12-7","UMBC","Binghamton","R: 5 H: 4 E: 1 LOB: 1"
