"date","location","attendance","inning","inning_top_bot","score","batting","fielding","description"
"05/08/2022","Corpus Christi, TX",NA,"1","top","0-0","Nicholls","A&M-Corpus Christi","Simon, D. singled to third base (0-0)."
"05/08/2022","Corpus Christi, TX",NA,"1","top","0-0","Nicholls","A&M-Corpus Christi","Simon, D. out at second c to ss, caught stealing."
"05/08/2022","Corpus Christi, TX",NA,"1","top","0-0","Nicholls","A&M-Corpus Christi","Felix, G. struck out swinging (2-2)."
"05/08/2022","Corpus Christi, TX",NA,"1","top","0-0","Nicholls","A&M-Corpus Christi","Alvarez, E. struck out swinging (3-2)."
"05/08/2022","Corpus Christi, TX",NA,"1","top","0-1","Nicholls","A&M-Corpus Christi","H: 1"
"05/08/2022","Corpus Christi, TX",NA,"1","bot","0-0","A&M-Corpus Christi","Nicholls","Chijin, S. doubled to right field (2-1)."
"05/08/2022","Corpus Christi, TX",NA,"1","bot","0-0","A&M-Corpus Christi","Nicholls","Ryan, B. flied out to cf (2-0)3a Chijin, S. advanced to third."
"05/08/2022","Corpus Christi, TX",NA,"1","bot","0-1","A&M-Corpus Christi","Nicholls","Johnson, Di. flied out to cf, SF, RBI (2-0)3a Chijin, S. scored."
"05/08/2022","Corpus Christi, TX",NA,"1","bot","0-1","A&M-Corpus Christi","Nicholls","Jones, T. singled to right center (2-0)."
"05/08/2022","Corpus Christi, TX",NA,"1","bot","0-1","A&M-Corpus Christi","Nicholls","Jones, T. stole second."
"05/08/2022","Corpus Christi, TX",NA,"1","bot","0-1","A&M-Corpus Christi","Nicholls","Caraway, J. popped up to 1b (1-1)."
"05/08/2022","Corpus Christi, TX",NA,"1","top","0-1","Nicholls","A&M-Corpus Christi","R: 1 H: 2 LOB: 1"
"05/08/2022","Corpus Christi, TX",NA,"2","top","1-1","Nicholls","A&M-Corpus Christi","Paz, A. homered, RBI (3-1)."
"05/08/2022","Corpus Christi, TX",NA,"2","top","1-1","Nicholls","A&M-Corpus Christi","Kay, J. walked (3-2)."
"05/08/2022","Corpus Christi, TX",NA,"2","top","1-1","Nicholls","A&M-Corpus Christi","Cain, A. singled up the middle (1-1)3a Kay, J. advanced to third."
"05/08/2022","Corpus Christi, TX",NA,"2","top","1-1","Nicholls","A&M-Corpus Christi","LeBlanc, H. popped up to p (0-0)."
"05/08/2022","Corpus Christi, TX",NA,"2","top","2-1","Nicholls","A&M-Corpus Christi","Trahan, A. flied out to rf, SF, RBI (0-0)3a Kay, J. scored."
"05/08/2022","Corpus Christi, TX",NA,"2","top","2-1","Nicholls","A&M-Corpus Christi","Coddou, P. grounded out to 2b (0-1)."
"05/08/2022","Corpus Christi, TX",NA,"2","bot","2-1","A&M-Corpus Christi","Nicholls","Petkoff, B. walked (3-1)."
"05/08/2022","Corpus Christi, TX",NA,"2","bot","2-1","A&M-Corpus Christi","Nicholls","Puls, M. struck out swinging (0-2)."
"05/08/2022","Corpus Christi, TX",NA,"2","bot","2-1","A&M-Corpus Christi","Nicholls","Markotic, L. singled to second base (1-0)3a Petkoff, B. advanced to second."
"05/08/2022","Corpus Christi, TX",NA,"2","bot","2-1","A&M-Corpus Christi","Nicholls","Modgling, C. hit by pitch (2-2)3a Markotic, L. advanced to second3a Petkoff, B. advanced to third."
"05/08/2022","Corpus Christi, TX",NA,"2","bot","2-2","A&M-Corpus Christi","Nicholls","Chijin, S. hit by pitch, RBI (1-2)3a Modgling, C. advanced to second3a Markotic, L. advanced to third3a Petkoff, B. scored."
"05/08/2022","Corpus Christi, TX",NA,"2","bot","2-3","A&M-Corpus Christi","Nicholls","Ryan, B. flied out to lf, SF, RBI (0-1)3a Markotic, L. scored."
"05/08/2022","Corpus Christi, TX",NA,"2","bot","2-3","A&M-Corpus Christi","Nicholls","Johnson, Di. reached on a fielder's choice (1-1)3a Chijin, S. advanced to second3a Modgling, C. out at third 3b unassisted."
"05/08/2022","Corpus Christi, TX",NA,"3","top","2-3","Nicholls","A&M-Corpus Christi","Simon, D. walked (3-1)."
"05/08/2022","Corpus Christi, TX",NA,"3","top","2-3","Nicholls","A&M-Corpus Christi","Felix, G. struck out swinging (0-2)."
"05/08/2022","Corpus Christi, TX",NA,"3","top","2-3","Nicholls","A&M-Corpus Christi","Alvarez, E. popped up to 2b (0-0)."
"05/08/2022","Corpus Christi, TX",NA,"3","top","2-3","Nicholls","A&M-Corpus Christi","Paz, A. grounded out to ss (1-2)."
"05/08/2022","Corpus Christi, TX",NA,"3","top","2-3","Nicholls","A&M-Corpus Christi","LOB: 1"
"05/08/2022","Corpus Christi, TX",NA,"3","bot","2-3","A&M-Corpus Christi","Nicholls","Jones, T. flied out to lf (1-0)."
"05/08/2022","Corpus Christi, TX",NA,"3","bot","2-3","A&M-Corpus Christi","Nicholls","Caraway, J. flied out to cf (1-0)."
"05/08/2022","Corpus Christi, TX",NA,"3","bot","2-3","A&M-Corpus Christi","Nicholls","Petkoff, B. struck out swinging, out at first c to 1b (0-2)."
"05/08/2022","Corpus Christi, TX",NA,"4","top","2-3","Nicholls","A&M-Corpus Christi","Kay, J. grounded out to 2b (2-2)."
"05/08/2022","Corpus Christi, TX",NA,"4","top","2-3","Nicholls","A&M-Corpus Christi","Cain, A. struck out looking (2-2)."
"05/08/2022","Corpus Christi, TX",NA,"4","top","2-3","Nicholls","A&M-Corpus Christi","LeBlanc, H. popped up to 3b (0-1)."
"05/08/2022","Corpus Christi, TX",NA,"4","bot","2-3","A&M-Corpus Christi","Nicholls","Puls, M. flied out to ss (1-0)."
"05/08/2022","Corpus Christi, TX",NA,"4","bot","2-3","A&M-Corpus Christi","Nicholls","Markotic, L. flied out to rf (3-2)."
"05/08/2022","Corpus Christi, TX",NA,"4","bot","2-3","A&M-Corpus Christi","Nicholls","Modgling, C. walked (3-1)."
"05/08/2022","Corpus Christi, TX",NA,"4","bot","2-3","A&M-Corpus Christi","Nicholls","Chijin, S. flied out to lf (2-1)."
"05/08/2022","Corpus Christi, TX",NA,"4","bot","2-3","A&M-Corpus Christi","Nicholls","LOB: 1"
"05/08/2022","Corpus Christi, TX",NA,"5","top","2-3","Nicholls","A&M-Corpus Christi","Trahan, A. struck out swinging (3-2)."
"05/08/2022","Corpus Christi, TX",NA,"5","top","2-3","Nicholls","A&M-Corpus Christi","Coddou, P. doubled to left field (0-0)."
"05/08/2022","Corpus Christi, TX",NA,"5","top","2-3","Nicholls","A&M-Corpus Christi","Simon, D. lined out to ss (1-1)."
"05/08/2022","Corpus Christi, TX",NA,"5","top","3-3","Nicholls","A&M-Corpus Christi","Felix, G. singled to left field, RBI (3-1)3a Coddou, P. scored."
"05/08/2022","Corpus Christi, TX",NA,"5","top","3-3","Nicholls","A&M-Corpus Christi","Lopez, D. to p for Perez, L.."
"05/08/2022","Corpus Christi, TX",NA,"5","top","3-3","Nicholls","A&M-Corpus Christi","Felix, G. advanced to second on a throwing error by p, advanced to third."
"05/08/2022","Corpus Christi, TX",NA,"5","top","3-3","Nicholls","A&M-Corpus Christi","Alvarez, E. flied out to rf (2-2)."
"05/08/2022","Corpus Christi, TX",NA,"5","bot","3-3","A&M-Corpus Christi","Nicholls","Ryan, B. flied out to rf (0-1)."
"05/08/2022","Corpus Christi, TX",NA,"5","bot","3-3","A&M-Corpus Christi","Nicholls","Johnson, Di. struck out looking (0-2)."
"05/08/2022","Corpus Christi, TX",NA,"5","bot","3-3","A&M-Corpus Christi","Nicholls","Jones, T. struck out swinging (0-2)."
"05/08/2022","Corpus Christi, TX",NA,"6","top","3-3","Nicholls","A&M-Corpus Christi","Paz, A. singled to shortstop (1-0)."
"05/08/2022","Corpus Christi, TX",NA,"6","top","3-3","Nicholls","A&M-Corpus Christi","Nelson, D. to p for Lopez, D.."
"05/08/2022","Corpus Christi, TX",NA,"6","top","3-3","Nicholls","A&M-Corpus Christi","Kay, J. grounded out to p3a Paz, A. advanced to second."
"05/08/2022","Corpus Christi, TX",NA,"6","top","3-3","Nicholls","A&M-Corpus Christi","Cain, A. flied out to rf (0-2)3a Paz, A. advanced to third."
"05/08/2022","Corpus Christi, TX",NA,"6","top","3-3","Nicholls","A&M-Corpus Christi","Washington pinch hit for LeBlanc, H.."
"05/08/2022","Corpus Christi, TX",NA,"6","top","4-3","Nicholls","A&M-Corpus Christi","Washington reached on an error by ss (3-1)3a Paz, A. scored, unearned."
"05/08/2022","Corpus Christi, TX",NA,"6","top","4-3","Nicholls","A&M-Corpus Christi","Collura, J. pinch hit for Trahan, A.."
"05/08/2022","Corpus Christi, TX",NA,"6","top","4-3","Nicholls","A&M-Corpus Christi","Collura, J. flied out to ss (3-2)."
"05/08/2022","Corpus Christi, TX",NA,"6","bot","4-3","A&M-Corpus Christi","Nicholls","Washington to rf."
"05/08/2022","Corpus Christi, TX",NA,"6","bot","4-3","A&M-Corpus Christi","Nicholls","Collura, J. to c."
"05/08/2022","Corpus Christi, TX",NA,"6","bot","4-3","A&M-Corpus Christi","Nicholls","Caraway, J. singled to right center (1-1)."
"05/08/2022","Corpus Christi, TX",NA,"6","bot","4-3","A&M-Corpus Christi","Nicholls","Petkoff, B. singled to right field (0-0)3a Caraway, J. advanced to third."
"05/08/2022","Corpus Christi, TX",NA,"6","bot","4-4","A&M-Corpus Christi","Nicholls","Petkoff, B. advanced to second on a wild pitch3a Caraway, J. scored on a wild pitch."
"05/08/2022","Corpus Christi, TX",NA,"6","bot","4-4","A&M-Corpus Christi","Nicholls","Puls, M. struck out swinging (1-2)."
"05/08/2022","Corpus Christi, TX",NA,"6","bot","4-5","A&M-Corpus Christi","Nicholls","Markotic, L. singled to shortstop, RBI (1-0)3a Petkoff, B. scored."
"05/08/2022","Corpus Christi, TX",NA,"6","bot","4-5","A&M-Corpus Christi","Nicholls","Modgling, C. flied out to cf (3-2)."
"05/08/2022","Corpus Christi, TX",NA,"6","bot","4-5","A&M-Corpus Christi","Nicholls","Chijin, S. singled to right field (2-0)3a Markotic, L. advanced to third."
"05/08/2022","Corpus Christi, TX",NA,"6","bot","4-5","A&M-Corpus Christi","Nicholls","Vial Jr., D. to p for Saltaformagg."
"05/08/2022","Corpus Christi, TX",NA,"6","bot","4-5","A&M-Corpus Christi","Nicholls","Ryan, B. walked (3-1)3a Chijin, S. advanced to second."
"05/08/2022","Corpus Christi, TX",NA,"6","bot","4-5","A&M-Corpus Christi","Nicholls","Johnson, Di. flied out to rf (1-2)."
"05/08/2022","Corpus Christi, TX",NA,"7","top","4-5","Nicholls","A&M-Corpus Christi","Chijin, S. to 1b."
"05/08/2022","Corpus Christi, TX",NA,"7","top","4-5","Nicholls","A&M-Corpus Christi","White, N. to ss for Puls, M.."
"05/08/2022","Corpus Christi, TX",NA,"7","top","4-5","Nicholls","A&M-Corpus Christi","Ramirez Jr. to p for Nelson, D.."
"05/08/2022","Corpus Christi, TX",NA,"7","top","4-5","Nicholls","A&M-Corpus Christi","Coddou, P. tripled to right field (3-2)."
"05/08/2022","Corpus Christi, TX",NA,"7","top","5-5","Nicholls","A&M-Corpus Christi","Simon, D. reached on an error by 3b, advanced to third, RBI (0-1)3a Coddou, P. scored, unearned."
"05/08/2022","Corpus Christi, TX",NA,"7","top","5-5","Nicholls","A&M-Corpus Christi","Felix, G. struck out looking (0-2)."
"05/08/2022","Corpus Christi, TX",NA,"7","top","7-5","Nicholls","A&M-Corpus Christi","Alvarez, E. homered, 2 RBI (1-0)3a Simon, D. scored."
"05/08/2022","Corpus Christi, TX",NA,"7","top","8-5","Nicholls","A&M-Corpus Christi","Paz, A. homered, RBI (2-2)."
"05/08/2022","Corpus Christi, TX",NA,"7","top","8-5","Nicholls","A&M-Corpus Christi","Westbrook, C to p for Ramirez Jr.."
"05/08/2022","Corpus Christi, TX",NA,"7","top","8-5","Nicholls","A&M-Corpus Christi","Kay, J. singled to shortstop (0-1)."
"05/08/2022","Corpus Christi, TX",NA,"7","top","8-5","Nicholls","A&M-Corpus Christi","Cain, A. walked (3-0)3a Kay, J. advanced to second."
"05/08/2022","Corpus Christi, TX",NA,"7","top","8-5","Nicholls","A&M-Corpus Christi","Cain, A. advanced to second on a wild pitch3a Kay, J. advanced to third on a wild pitch."
"05/08/2022","Corpus Christi, TX",NA,"7","top","8-5","Nicholls","A&M-Corpus Christi","Washington walked (3-2)."
"05/08/2022","Corpus Christi, TX",NA,"7","top","8-5","Nicholls","A&M-Corpus Christi","Shy, C. to p for Westbrook, C."
"05/08/2022","Corpus Christi, TX",NA,"7","top","8-5","Nicholls","A&M-Corpus Christi","Collura, J. grounded into double play 2b to ss to 1b (1-0)3a Washington out on the play."
"05/08/2022","Corpus Christi, TX",NA,"7","bot","8-5","A&M-Corpus Christi","Nicholls","Andrews, B. to p for Vial Jr., D.."
"05/08/2022","Corpus Christi, TX",NA,"7","bot","8-6","A&M-Corpus Christi","Nicholls","Jones, T. homered to right field, RBI (3-1)."
"05/08/2022","Corpus Christi, TX",NA,"7","bot","8-6","A&M-Corpus Christi","Nicholls","Caraway, J. walked (3-2)."
"05/08/2022","Corpus Christi, TX",NA,"7","bot","8-6","A&M-Corpus Christi","Nicholls","Mancuso, J. to p for Andrews, B.."
"05/08/2022","Corpus Christi, TX",NA,"7","bot","8-6","A&M-Corpus Christi","Nicholls","Petkoff, B. walked (3-1)3a Caraway, J. advanced to second."
"05/08/2022","Corpus Christi, TX",NA,"7","bot","8-6","A&M-Corpus Christi","Nicholls","Gearing, C. to p for Mancuso, J.."
"05/08/2022","Corpus Christi, TX",NA,"7","bot","8-6","A&M-Corpus Christi","Nicholls","White, N. singled, bunt (0-0)3a Petkoff, B. advanced to second3a Caraway, J. advanced to third."
"05/08/2022","Corpus Christi, TX",NA,"7","bot","8-6","A&M-Corpus Christi","Nicholls","Markotic, L. grounded into double play 3b to c to 1b (1-1)3a White, N. advanced to second3a Petkoff, B. advanced to third3a Caraway, J. out on the play."
"05/08/2022","Corpus Christi, TX",NA,"7","bot","8-6","A&M-Corpus Christi","Nicholls","Modgling, C. flied out to rf (2-1)."
"05/08/2022","Corpus Christi, TX",NA,"8","top","8-6","Nicholls","A&M-Corpus Christi","Coddou, P. singled to center field (1-2)."
"05/08/2022","Corpus Christi, TX",NA,"8","top","8-6","Nicholls","A&M-Corpus Christi","Simon, D. reached on a fielder's choice (0-1)3a Coddou, P. out at second ss to 2b."
"05/08/2022","Corpus Christi, TX",NA,"8","top","8-6","Nicholls","A&M-Corpus Christi","Felix, G. grounded out to 2b3a Simon, D. advanced to second."
"05/08/2022","Corpus Christi, TX",NA,"8","top","8-6","Nicholls","A&M-Corpus Christi","Alvarez, E. reached on an error by 1b (2-0)3a Simon, D. advanced to third."
"05/08/2022","Corpus Christi, TX",NA,"8","top","8-6","Nicholls","A&M-Corpus Christi","Paz, A. hit by pitch3a Alvarez, E. advanced to second."
"05/08/2022","Corpus Christi, TX",NA,"8","top","8-6","Nicholls","A&M-Corpus Christi","Miller, T. to p for Shy, C.."
"05/08/2022","Corpus Christi, TX",NA,"8","top","9-6","Nicholls","A&M-Corpus Christi","Kay, J. walked, RBI (3-2)3a Paz, A. advanced to second3a Alvarez, E. advanced to third3a Simon, D. scored, unearned."
"05/08/2022","Corpus Christi, TX",NA,"8","top","10-6","Nicholls","A&M-Corpus Christi","Cain, A. hit by pitch, RBI (1-1)3a Kay, J. advanced to second3a Paz, A. advanced to third3a Alvarez, E. scored, unearned."
"05/08/2022","Corpus Christi, TX",NA,"8","top","10-6","Nicholls","A&M-Corpus Christi","Washington flied out to lf (1-2)."
"05/08/2022","Corpus Christi, TX",NA,"8","bot","10-6","A&M-Corpus Christi","Nicholls","Chijin, S. flied out to cf (1-0)."
"05/08/2022","Corpus Christi, TX",NA,"8","bot","10-6","A&M-Corpus Christi","Nicholls","Ryan, B. grounded out to 2b (2-1)."
"05/08/2022","Corpus Christi, TX",NA,"8","bot","10-6","A&M-Corpus Christi","Nicholls","Johnson, Di. struck out swinging (1-2)."
"05/08/2022","Corpus Christi, TX",NA,"9","top","10-6","Nicholls","A&M-Corpus Christi","Collura, J. grounded out to 2b (2-1)."
"05/08/2022","Corpus Christi, TX",NA,"9","top","10-6","Nicholls","A&M-Corpus Christi","Coddou, P. singled to right field, advanced to second on an error by rf (0-1)."
"05/08/2022","Corpus Christi, TX",NA,"9","top","10-6","Nicholls","A&M-Corpus Christi","Simon, D. fouled out to rf (1-2)3a Coddou, P. advanced to third."
"05/08/2022","Corpus Christi, TX",NA,"9","top","10-6","Nicholls","A&M-Corpus Christi","Felix, G. walked (3-2)."
"05/08/2022","Corpus Christi, TX",NA,"9","top","10-6","Nicholls","A&M-Corpus Christi","Sieve, S. to p for Miller, T.."
"05/08/2022","Corpus Christi, TX",NA,"9","top","10-6","Nicholls","A&M-Corpus Christi","Alvarez, E. struck out looking (2-2)."
"05/08/2022","Corpus Christi, TX",NA,"9","top","10-11","Nicholls","A&M-Corpus Christi","H: 1 E: 1 LOB: 2"
"05/08/2022","Corpus Christi, TX",NA,"9","bot","10-6","A&M-Corpus Christi","Nicholls","Jones, T. walked (3-2)."
"05/08/2022","Corpus Christi, TX",NA,"9","bot","10-6","A&M-Corpus Christi","Nicholls","Caraway, J. doubled to left center (1-1)3a Jones, T. advanced to third."
"05/08/2022","Corpus Christi, TX",NA,"9","bot","10-7","A&M-Corpus Christi","Nicholls","Petkoff, B. grounded out to 1b unassisted, RBI (0-1)3a Caraway, J. advanced to third3a Jones, T. scored."
"05/08/2022","Corpus Christi, TX",NA,"9","bot","10-8","A&M-Corpus Christi","Nicholls","White, N. singled to left field, RBI3a Caraway, J. scored."
"05/08/2022","Corpus Christi, TX",NA,"9","bot","10-8","A&M-Corpus Christi","Nicholls","Markotic, L. doubled to right field3a White, N. advanced to third."
"05/08/2022","Corpus Christi, TX",NA,"9","bot","10-8","A&M-Corpus Christi","Nicholls","Heckman, N. to p for Gearing, C.."
"05/08/2022","Corpus Christi, TX",NA,"9","bot","10-8","A&M-Corpus Christi","Nicholls","Modgling, C. struck out looking (2-2)."
"05/08/2022","Corpus Christi, TX",NA,"9","bot","10-10","A&M-Corpus Christi","Nicholls","Chijin, S. singled to center field, 2 RBI (1-0)3a Markotic, L. scored3a White, N. scored."
"05/08/2022","Corpus Christi, TX",NA,"9","bot","10-10","A&M-Corpus Christi","Nicholls","Ryan, B. singled to right field (2-1)3a Chijin, S. advanced to second."
"05/08/2022","Corpus Christi, TX",NA,"9","bot","10-11","A&M-Corpus Christi","Nicholls","Johnson, Di. singled to right center, RBI3a Ryan, B. advanced to second3a Chijin, S. scored."
"05/08/2022","Corpus Christi, TX",NA,"9","top","10-11","Nicholls","A&M-Corpus Christi","R: 5 H: 6 LOB: 2"
