"date","location","attendance","inning","inning_top_bot","score","batting","fielding","description"
"06/05/2022","Stillwater, Okla.",NA,"1","top","0-0","Oklahoma St.","Arkansas","Riggio struck out swinging (0-2 SFS)."
"06/05/2022","Stillwater, Okla.",NA,"1","top","0-0","Oklahoma St.","Arkansas","Ehrhard singled up the middle (1-0 B)."
"06/05/2022","Stillwater, Okla.",NA,"1","top","0-0","Oklahoma St.","Arkansas","Ehrhard out at second c to ss, caught stealing."
"06/05/2022","Stillwater, Okla.",NA,"1","top","0-0","Oklahoma St.","Arkansas","Thompson, J. walked (3-1 KBBBB)."
"06/05/2022","Stillwater, Okla.",NA,"1","top","0-0","Oklahoma St.","Arkansas","Doersching struck out looking (0-2 KKK)."
"06/05/2022","Stillwater, Okla.",NA,"1","top","0-0","Oklahoma St.","Arkansas","H: 1 LOB: 1"
"06/05/2022","Stillwater, Okla.",NA,"1","bot","0-0","Arkansas","Oklahoma St.","Webb doubled to left center (0-0)."
"06/05/2022","Stillwater, Okla.",NA,"1","bot","0-0","Arkansas","Oklahoma St.","Slavens singled to left field, RBI (0-0); Webb scored."
"06/05/2022","Stillwater, Okla.",NA,"1","bot","0-0","Arkansas","Oklahoma St.","Wallace grounded into double play 2b to 1b (2-1 BBS); Slavens out on the play."
"06/05/2022","Stillwater, Okla.",NA,"1","bot","0-0","Arkansas","Oklahoma St.","Turner singled to left center (1-2 KSB)."
"06/05/2022","Stillwater, Okla.",NA,"1","bot","0-0","Arkansas","Oklahoma St.","Turner stole second."
"06/05/2022","Stillwater, Okla.",NA,"1","bot","0-0","Arkansas","Oklahoma St.","Lanzilli singled to shortstop (1-0 B); Turner advanced to third."
"06/05/2022","Stillwater, Okla.",NA,"1","bot","0-0","Arkansas","Oklahoma St.","Moore flied out to rf (1-2 BFF)."
"06/05/2022","Stillwater, Okla.",NA,"1","top","0-0","Oklahoma St.","Arkansas","R: 1 H: 4 LOB: 2"
"06/05/2022","Stillwater, Okla.",NA,"2","top","0-0","Oklahoma St.","Arkansas","Mendham homered to left field, RBI (0-1 F)."
"06/05/2022","Stillwater, Okla.",NA,"2","top","0-0","Oklahoma St.","Arkansas","McLean walked (3-2 BKBFBB)."
"06/05/2022","Stillwater, Okla.",NA,"2","top","0-0","Oklahoma St.","Arkansas","Brown, M. singled to left field (3-1 FBBB); McLean advanced to second."
"06/05/2022","Stillwater, Okla.",NA,"2","top","0-0","Oklahoma St.","Arkansas","Trenkle flied out to rf (0-2 FF); McLean advanced to third."
"06/05/2022","Stillwater, Okla.",NA,"2","top","0-0","Oklahoma St.","Arkansas","Adkison singled through the left side, RBI (3-2 KBKFBBF); Brown, M. advanced to second; McLean scored."
"06/05/2022","Stillwater, Okla.",NA,"2","top","0-0","Oklahoma St.","Arkansas","McEntire to p for Wiggins."
"06/05/2022","Stillwater, Okla.",NA,"2","top","0-0","Oklahoma St.","Arkansas","Riggio singled to right field, RBI (1-1 SB); Adkison advanced to third; Brown, M. scored."
"06/05/2022","Stillwater, Okla.",NA,"2","top","0-0","Oklahoma St.","Arkansas","Ehrhard grounded into double play ss to 2b to 1b (2-2 BKFBF); Riggio out on the play."
"06/05/2022","Stillwater, Okla.",NA,"2","bot","0-0","Arkansas","Oklahoma St.","Battles singled to first base (0-2 KF)."
"06/05/2022","Stillwater, Okla.",NA,"2","bot","0-0","Arkansas","Oklahoma St.","Stovall singled up the middle (2-2 KFBB); Battles advanced to second."
"06/05/2022","Stillwater, Okla.",NA,"2","bot","0-0","Arkansas","Oklahoma St.","Gregory out at first p to 2b, SAC, bunt (0-0); Stovall advanced to second; Battles advanced to third."
"06/05/2022","Stillwater, Okla.",NA,"2","bot","0-0","Arkansas","Oklahoma St.","Webb grounded out to 2b, RBI (2-2 BSKB); Stovall advanced to third; Battles scored."
"06/05/2022","Stillwater, Okla.",NA,"2","bot","0-0","Arkansas","Oklahoma St.","Slavens flied out to cf (0-1 F)."
"06/05/2022","Stillwater, Okla.",NA,"3","top","0-0","Oklahoma St.","Arkansas","Thompson, J. grounded out to ss (0-2 KF)."
"06/05/2022","Stillwater, Okla.",NA,"3","top","0-0","Oklahoma St.","Arkansas","Doersching singled up the middle (0-0)."
"06/05/2022","Stillwater, Okla.",NA,"3","top","0-0","Oklahoma St.","Arkansas","Mendham walked (3-2 BKBSBB); Doersching advanced to second."
"06/05/2022","Stillwater, Okla.",NA,"3","top","0-0","Oklahoma St.","Arkansas","McLean flied out to 2b (0-0)."
"06/05/2022","Stillwater, Okla.",NA,"3","top","0-0","Oklahoma St.","Arkansas","Brown, M. grounded out to 2b (0-0)."
"06/05/2022","Stillwater, Okla.",NA,"3","top","0-0","Oklahoma St.","Arkansas","H: 1 LOB: 2"
"06/05/2022","Stillwater, Okla.",NA,"3","bot","0-0","Arkansas","Oklahoma St.","Wallace singled through the left side (0-0)."
"06/05/2022","Stillwater, Okla.",NA,"3","bot","0-0","Arkansas","Oklahoma St.","Turner reached on a fielder's choice (2-1 BFB); Wallace out at second ss to 2b."
"06/05/2022","Stillwater, Okla.",NA,"3","bot","0-0","Arkansas","Oklahoma St.","Lanzilli flied out to cf (0-0)."
"06/05/2022","Stillwater, Okla.",NA,"3","bot","0-0","Arkansas","Oklahoma St.","Moore struck out looking (2-2 BFBKFK)."
"06/05/2022","Stillwater, Okla.",NA,"3","top","0-0","Oklahoma St.","Arkansas","H: 1 LOB: 1"
"06/05/2022","Stillwater, Okla.",NA,"4","top","0-0","Oklahoma St.","Arkansas","Trenkle flied out to lf (0-1 K)."
"06/05/2022","Stillwater, Okla.",NA,"4","top","0-0","Oklahoma St.","Arkansas","Adkison walked (3-2 BKKBBB)."
"06/05/2022","Stillwater, Okla.",NA,"4","top","0-0","Oklahoma St.","Arkansas","Riggio homered to center field, 2 RBI (1-1 FB); Adkison scored."
"06/05/2022","Stillwater, Okla.",NA,"4","top","0-0","Oklahoma St.","Arkansas","Ehrhard walked (3-0 BBBB)."
"06/05/2022","Stillwater, Okla.",NA,"4","top","0-0","Oklahoma St.","Arkansas","Thompson, J. grounded into double play 2b to ss to 1b (0-0); Ehrhard out on the play."
"06/05/2022","Stillwater, Okla.",NA,"4","bot","0-0","Arkansas","Oklahoma St.","Battles reached on a throwing error by ss, advanced to second (0-0)."
"06/05/2022","Stillwater, Okla.",NA,"4","bot","0-0","Arkansas","Oklahoma St.","Stovall walked (3-2 BBBKKB)."
"06/05/2022","Stillwater, Okla.",NA,"4","bot","0-0","Arkansas","Oklahoma St.","Gregory struck out swinging (0-2 KKS)."
"06/05/2022","Stillwater, Okla.",NA,"4","bot","0-0","Arkansas","Oklahoma St.","Webb flied out to rf (1-1 BF); Battles advanced to third."
"06/05/2022","Stillwater, Okla.",NA,"4","bot","0-0","Arkansas","Oklahoma St.","Slavens lined out to 2b (0-0)."
"06/05/2022","Stillwater, Okla.",NA,"5","top","0-0","Oklahoma St.","Arkansas","Doersching homered to left field, RBI (3-2 KBBBS)."
"06/05/2022","Stillwater, Okla.",NA,"5","top","0-0","Oklahoma St.","Arkansas","Mendham flied out to cf (0-0)."
"06/05/2022","Stillwater, Okla.",NA,"5","top","0-0","Oklahoma St.","Arkansas","McLean walked (3-1 BKBBB)."
"06/05/2022","Stillwater, Okla.",NA,"5","top","0-0","Oklahoma St.","Arkansas","Brown, M. flied out to cf (0-1 K)."
"06/05/2022","Stillwater, Okla.",NA,"5","top","0-0","Oklahoma St.","Arkansas","Trenkle flied out to cf (1-1 KB)."
"06/05/2022","Stillwater, Okla.",NA,"5","bot","0-0","Arkansas","Oklahoma St.","Wallace homered to left center, RBI (2-1 FBB)."
"06/05/2022","Stillwater, Okla.",NA,"5","bot","0-0","Arkansas","Oklahoma St.","Turner struck out looking (1-2 KBKFK)."
"06/05/2022","Stillwater, Okla.",NA,"5","bot","0-0","Arkansas","Oklahoma St.","Lanzilli struck out swinging, out at first c to 1b (0-2 KKS)."
"06/05/2022","Stillwater, Okla.",NA,"5","bot","0-0","Arkansas","Oklahoma St.","Moore flied out to cf to left center (3-2 BBKFBF)."
"06/05/2022","Stillwater, Okla.",NA,"6","top","0-0","Oklahoma St.","Arkansas","Adkison grounded out to 2b (2-2 BBKF)."
"06/05/2022","Stillwater, Okla.",NA,"6","top","0-0","Oklahoma St.","Arkansas","Riggio flied out to lf (0-0)."
"06/05/2022","Stillwater, Okla.",NA,"6","top","0-0","Oklahoma St.","Arkansas","Ehrhard fouled out to 1b (0-0)."
"06/05/2022","Stillwater, Okla.",NA,"6","bot","0-0","Arkansas","Oklahoma St.","Battles grounded out to 2b (0-1 S)."
"06/05/2022","Stillwater, Okla.",NA,"6","bot","0-0","Arkansas","Oklahoma St.","Stovall singled through the right side (1-2 BSKF)."
"06/05/2022","Stillwater, Okla.",NA,"6","bot","0-0","Arkansas","Oklahoma St.","Gregory struck out looking (2-2 FKBBK)."
"06/05/2022","Stillwater, Okla.",NA,"6","bot","0-0","Arkansas","Oklahoma St.","Webb walked (3-2 BSBBFB); Stovall advanced to second."
"06/05/2022","Stillwater, Okla.",NA,"6","bot","0-0","Arkansas","Oklahoma St.","Slavens walked (3-2 BBKKBB); Webb advanced to second; Stovall advanced to third."
"06/05/2022","Stillwater, Okla.",NA,"6","bot","0-0","Arkansas","Oklahoma St.","Wallace singled through the left side, 2 RBI (0-0); Slavens advanced to second; Webb scored; Stovall scored."
"06/05/2022","Stillwater, Okla.",NA,"6","bot","0-0","Arkansas","Oklahoma St.","Turner struck out looking (1-2 KBSK)."
"06/05/2022","Stillwater, Okla.",NA,"6","bot","0-0","Arkansas","Oklahoma St.","R: 2 H: 2 LOB: 2"
"06/05/2022","Stillwater, Okla.",NA,"7","top","0-0","Oklahoma St.","Arkansas","Thompson, J. grounded out to 1b unassisted (1-0 B)."
"06/05/2022","Stillwater, Okla.",NA,"7","top","0-0","Oklahoma St.","Arkansas","Doersching struck out swinging (1-2 SBSS)."
"06/05/2022","Stillwater, Okla.",NA,"7","top","0-0","Oklahoma St.","Arkansas","Taylor to p for McEntire."
"06/05/2022","Stillwater, Okla.",NA,"7","top","0-0","Oklahoma St.","Arkansas","Mendham lined out to lf (0-0)."
"06/05/2022","Stillwater, Okla.",NA,"7","bot","0-0","Arkansas","Oklahoma St.","Lanzilli struck out swinging (2-2 FBFBS)."
"06/05/2022","Stillwater, Okla.",NA,"7","bot","0-0","Arkansas","Oklahoma St.","Moore singled to left center (3-2 BBBKF)."
"06/05/2022","Stillwater, Okla.",NA,"7","bot","0-0","Arkansas","Oklahoma St.","Phansalkar to p for Stone."
"06/05/2022","Stillwater, Okla.",NA,"7","bot","0-0","Arkansas","Oklahoma St.","Battles lined out to rf (0-0)."
"06/05/2022","Stillwater, Okla.",NA,"7","bot","0-0","Arkansas","Oklahoma St.","Stovall reached on catcher's interference (0-2 KF); Moore advanced to second."
"06/05/2022","Stillwater, Okla.",NA,"7","bot","0-0","Arkansas","Oklahoma St.","Gregory grounded out to 2b (3-1 BBBK)."
"06/05/2022","Stillwater, Okla.",NA,"7","bot","0-0","Arkansas","Oklahoma St.","H: 1 E: 1 LOB: 2"
"06/05/2022","Stillwater, Okla.",NA,"8","top","0-0","Oklahoma St.","Arkansas","McLean walked (3-2 BSBBFB)."
"06/05/2022","Stillwater, Okla.",NA,"8","top","0-0","Oklahoma St.","Arkansas","Brown, M. reached on a throwing error by p, SAC, bunt (0-0); McLean advanced to second."
"06/05/2022","Stillwater, Okla.",NA,"8","top","0-0","Oklahoma St.","Arkansas","Brown, M. advanced to second; McLean advanced to third on a throwing error by p."
"06/05/2022","Stillwater, Okla.",NA,"8","top","0-0","Oklahoma St.","Arkansas","Trenkle struck out swinging (3-2 BBSBKFS)."
"06/05/2022","Stillwater, Okla.",NA,"8","top","0-0","Oklahoma St.","Arkansas","Adkison flied out to cf to right center, SF, RBI (1-0 B); Brown, M. advanced to third; McLean scored, unearned."
"06/05/2022","Stillwater, Okla.",NA,"8","top","0-0","Oklahoma St.","Arkansas","Riggio struck out swinging (0-2 SKS)."
"06/05/2022","Stillwater, Okla.",NA,"8","bot","0-0","Arkansas","Oklahoma St.","Webb walked (3-2 FFBBBB)."
"06/05/2022","Stillwater, Okla.",NA,"8","bot","0-0","Arkansas","Oklahoma St.","Slavens walked (3-2 FBBKFBB); Webb advanced to second."
"06/05/2022","Stillwater, Okla.",NA,"8","bot","0-0","Arkansas","Oklahoma St.","Wallace reached on a fielder's choice (0-0); Slavens out at second ss to 2b; Webb advanced to third, scored on a throwing error by 2b."
"06/05/2022","Stillwater, Okla.",NA,"8","bot","0-0","Arkansas","Oklahoma St.","Turner homered to right field, 2 RBI (2-2 FBBS); Wallace scored."
"06/05/2022","Stillwater, Okla.",NA,"8","bot","0-0","Arkansas","Oklahoma St.","Lanzilli flied out to cf (1-2 FFFB)."
"06/05/2022","Stillwater, Okla.",NA,"8","bot","0-0","Arkansas","Oklahoma St.","Moore grounded out to 1b unassisted (0-1 F)."
"06/05/2022","Stillwater, Okla.",NA,"9","top","0-0","Oklahoma St.","Arkansas","Noland to p for Taylor."
"06/05/2022","Stillwater, Okla.",NA,"9","top","0-0","Oklahoma St.","Arkansas","Ehrhard flied out to rf (0-1 K)."
"06/05/2022","Stillwater, Okla.",NA,"9","top","0-0","Oklahoma St.","Arkansas","Thompson, J. walked (3-2 BKBKBB)."
"06/05/2022","Stillwater, Okla.",NA,"9","top","0-0","Oklahoma St.","Arkansas","Crull pinch ran for Thompson, J.."
"06/05/2022","Stillwater, Okla.",NA,"9","top","0-0","Oklahoma St.","Arkansas","Doersching walked (3-0 BBBB); Crull advanced to second."
"06/05/2022","Stillwater, Okla.",NA,"9","top","0-0","Oklahoma St.","Arkansas","Morrill pinch ran for Doersching."
"06/05/2022","Stillwater, Okla.",NA,"9","top","0-0","Oklahoma St.","Arkansas","Mendham doubled to left center, 2 RBI (2-1 BBK); Morrill scored; Crull scored."
"06/05/2022","Stillwater, Okla.",NA,"9","top","0-0","Oklahoma St.","Arkansas","McLean singled to center field (2-1 BSB); Mendham advanced to third."
"06/05/2022","Stillwater, Okla.",NA,"9","top","0-0","Oklahoma St.","Arkansas","Trest to p for Noland."
"06/05/2022","Stillwater, Okla.",NA,"9","top","0-0","Oklahoma St.","Arkansas","Brown, M. doubled down the rf line, RBI (0-0); McLean advanced to third; Mendham scored."
"06/05/2022","Stillwater, Okla.",NA,"9","top","0-0","Oklahoma St.","Arkansas","Trenkle flied out to ss (2-2 KFFFFFBB)."
"06/05/2022","Stillwater, Okla.",NA,"9","top","0-0","Oklahoma St.","Arkansas","Adkison struck out swinging (2-2 BBFKS)."
"06/05/2022","Stillwater, Okla.",NA,"9","bot","0-0","Arkansas","Oklahoma St.","Crull to lf."
"06/05/2022","Stillwater, Okla.",NA,"9","bot","0-0","Arkansas","Oklahoma St.","Meola to 3b for Morrill."
"06/05/2022","Stillwater, Okla.",NA,"9","bot","0-0","Arkansas","Oklahoma St.","McLean to p."
"06/05/2022","Stillwater, Okla.",NA,"9","bot","0-0","Arkansas","Oklahoma St.","/ for Phansalkar."
"06/05/2022","Stillwater, Okla.",NA,"9","bot","0-0","Arkansas","Oklahoma St.","Battles struck out swinging (3-2 BKBBKS)."
"06/05/2022","Stillwater, Okla.",NA,"9","bot","0-0","Arkansas","Oklahoma St.","Stovall reached on a throwing error by ss (0-1 K)."
"06/05/2022","Stillwater, Okla.",NA,"9","bot","0-0","Arkansas","Oklahoma St.","Gregory singled up the middle (1-2 BKF); Stovall advanced to second."
"06/05/2022","Stillwater, Okla.",NA,"9","bot","0-0","Arkansas","Oklahoma St.","Webb grounded out to 3b (0-1 K); Gregory advanced to second; Stovall advanced to third."
"06/05/2022","Stillwater, Okla.",NA,"9","bot","0-0","Arkansas","Oklahoma St.","Slavens singled down the rf line, 2 RBI (2-0 BB); Gregory scored, unearned; Stovall scored, unearned."
"06/05/2022","Stillwater, Okla.",NA,"9","bot","0-0","Arkansas","Oklahoma St.","Wallace struck out swinging (1-2 BKFS)."
"06/05/2022","Stillwater, Okla.",NA,"10","top","0-0","Oklahoma St.","Arkansas","Tygart to p for Trest."
"06/05/2022","Stillwater, Okla.",NA,"10","top","0-0","Oklahoma St.","Arkansas","Riggio doubled to right center, ground-rule (0-0)."
"06/05/2022","Stillwater, Okla.",NA,"10","top","0-0","Oklahoma St.","Arkansas","Ehrhard singled to left field (3-2 BKKBBF); Riggio advanced to third."
"06/05/2022","Stillwater, Okla.",NA,"10","top","0-0","Oklahoma St.","Arkansas","Ehrhard stole second."
"06/05/2022","Stillwater, Okla.",NA,"10","top","0-0","Oklahoma St.","Arkansas","Crull struck out swinging (2-2 FBFBS)."
"06/05/2022","Stillwater, Okla.",NA,"10","top","0-0","Oklahoma St.","Arkansas","Meola singled up the middle, 2 RBI (1-2 BKS); Ehrhard scored; Riggio scored."
"06/05/2022","Stillwater, Okla.",NA,"10","top","0-0","Oklahoma St.","Arkansas","Mendham struck out looking (1-2 KFBK)."
"06/05/2022","Stillwater, Okla.",NA,"10","top","0-0","Oklahoma St.","Arkansas","McLean homered down the lf line, 2 RBI (0-2 KS); Meola scored."
"06/05/2022","Stillwater, Okla.",NA,"10","top","0-0","Oklahoma St.","Arkansas","Starks to p for Tygart."
"06/05/2022","Stillwater, Okla.",NA,"10","top","0-0","Oklahoma St.","Arkansas","Brown, M. grounded out to 3b (1-2 BFS)."
"06/05/2022","Stillwater, Okla.",NA,"10","bot","0-0","Arkansas","Oklahoma St.","Turner flied out to lf to left center (2-1 BKB)."
"06/05/2022","Stillwater, Okla.",NA,"10","bot","0-0","Arkansas","Oklahoma St.","Lanzilli walked (3-1 BBKBB)."
"06/05/2022","Stillwater, Okla.",NA,"10","bot","0-0","Arkansas","Oklahoma St.","Moore flied out to rf (1-1 KB)."
"06/05/2022","Stillwater, Okla.",NA,"10","bot","0-0","Arkansas","Oklahoma St.","Battles flied out to cf (2-2 BKBS)."
